candidate_key,query_id,named_source_id,candidate_rank,pmid,doi,title,year,journal,authors,source_url,raw_path,raw_sha256
PMID:30601823,SEARCH-20260722-LINEAGE-CAUSAL-01,NS-CAUSAL-001-PROBE,1,30601823,10.1371/journal.pmed.1002719,"HIV self-testing alone or with additional interventions, including financial incentives, and linkage to care or prevention among male partners of antenatal care clinic attendees in Malawi: An adaptive multi-arm, multi-stage cluster randomised trial.",2019,PLoS medicine,Augustine T Choko; Elizabeth L Corbett; Nigel Stallard; Hendramoorthy Maheswaran; Aurelia Lepine; Cheryl C Johnson; Doreen Sakala; Thokozani Kalua; Moses Kumwenda; Richard Hayes; Katherine Fielding,https://pubmed.ncbi.nlm.nih.gov/30601823/,raw/SEARCH-20260722-LINEAGE-CAUSAL-01.efetch.000000000-000000000.xml,4f998696866b1d9acb4c045a8f8591d5352e6e097029559cb856d35eb7e8bc32
PMID:21526067,SEARCH-20260722-LINEAGE-EVIDENCE-01,NS-EVIDENCE-001-PROBE,1,21526067,,Capture-recapture method for assessing publication bias.,2010,Journal of research in medical sciences : the official journal of Isfahan University of Medical Sciences,Jalal Poorolajal; Ali Akbar Haghdoost; Mahmood Mahmoodi; Reza Majdzadeh; Siavosh Nasseri-Moghaddam; Akbar Fotouhi,https://pubmed.ncbi.nlm.nih.gov/21526067/,raw/SEARCH-20260722-LINEAGE-EVIDENCE-01.efetch.000000000-000000001.xml,562f8676c27ca35443bd761d0ac5d9315b9fb1e36a3898032f877b9b71d7c4b2
PMID:15135835,SEARCH-20260722-LINEAGE-EVIDENCE-01,NS-EVIDENCE-001-PROBE,2,15135835,10.1016/j.jclinepi.2003.09.015,Capture-recapture is a potentially useful method for assessing publication bias.,2004,Journal of clinical epidemiology,Derrick A Bennett; Nancy K Latham; Caroline Stretton; Craig S Anderson,https://pubmed.ncbi.nlm.nih.gov/15135835/,raw/SEARCH-20260722-LINEAGE-EVIDENCE-01.efetch.000000000-000000001.xml,562f8676c27ca35443bd761d0ac5d9315b9fb1e36a3898032f877b9b71d7c4b2
PMID:41555591,SEARCH-20260722-LINEAGE-FORECASTING-01,NS-FORECASTING-001-PROBE,1,41555591,10.1002/rmv.70107,Forecasting Influenza Epidemics and Pandemics in the Age of AI and Machine Learning.,2026,Reviews in medical virology,Oleksandr Kamyshnyi; Iryna Halabitska; Valentyn Oksenych; Iryna Kamyshna; Pavlo Petakh; Denis E Kainov,https://pubmed.ncbi.nlm.nih.gov/41555591/,raw/SEARCH-20260722-LINEAGE-FORECASTING-01.efetch.000000000-000000000.xml,472ee26c450551c7aa018dc3b9b1374cf719b3c22f3971e0bab345bb7177b2d0
PMID:21152004,SEARCH-20260722-LINEAGE-SIMULATION-01,NS-SIMULATION-001-PROBE,1,21152004,10.1371/journal.pcbi.1001021,Little Italy: an agent-based approach to the estimation of contact patterns- fitting predicted matrices to serological data.,2010,PLoS computational biology,Fabrizio Iozzi; Francesco Trusiano; Matteo Chinazzi; Francesco C Billari; Emilio Zagheni; Stefano Merler; Marco Ajelli; Emanuele Del Fava; Piero Manfredi,https://pubmed.ncbi.nlm.nih.gov/21152004/,raw/SEARCH-20260722-LINEAGE-SIMULATION-01.efetch.000000000-000000000.xml,7020b030f819d71de0c30c54c17cb5b33cb6242b3bb0ed848b2d544a17f0bc44
PMID:23026767,SEARCH-20260722-LINEAGE-SPATIAL-01,NS-SPATIAL-001-PROBE,1,23026767,10.1016/j.jtbi.2012.09.020,A new scale-free network model for simulating and predicting epidemics.,2013,Journal of theoretical biology,Chen-Wei Liang; Chien-Kuo Ku; Jeng-Jong Liang,https://pubmed.ncbi.nlm.nih.gov/23026767/,raw/SEARCH-20260722-LINEAGE-SPATIAL-01.efetch.000000000-000000000.xml,3e8fd85c0b5582df7914a6c6185ad06bfb4b5cd80317467c3cbdbb05805c3adc
PMID:31984365,SEARCH-20260722-LINEAGE-SURVEILLANCE-01,NS-SURVEILLANCE-001-PROBE,1,31984365,10.1093/jamiaopen/ooz030,Detecting reports of unsafe foods in consumer product reviews.,2019,JAMIA open,Adyasha Maharana; Kunlin Cai; Joseph Hellerstein; Yulin Hswen; Michael Munsell; Valentina Staneva; Miki Verma; Cynthia Vint; Derry Wijaya; Elaine O Nsoesie,https://pubmed.ncbi.nlm.nih.gov/31984365/,raw/SEARCH-20260722-LINEAGE-SURVEILLANCE-01.efetch.000000000-000000000.xml,a1bad88c8e6f4c4fe92b15fa77f2d816aa1deafd5ffc82fb20086ea6a1928a85
