candidate_key,source_row_sha256,primary_decision,primary_proposed_record_type,primary_reason_code,primary_reason,primary_reviewer,batch_id,retained_candidate_key
PMID:32029767,66f8ffbcf3cf15c3e3ae411a505d82e3f64786d6978cd26ff48e919374cb3a2e,include_applied_seed,applied_seed,I_APPLIED_TRANSFERABLE_DESIGN,"The study compares gene regions, consensus sequences, and reconstructed next-generation-sequencing haplotypes for detecting local HIV transmission clusters and drug resistance.",codex-sol-high-wave2-primary-015,W02-BATCH-015,
PMID:32035245,6e73f2401107cbf522229d6a9366bd1ff10fdd2675cf5b2f4b5461a617f2543c,include_diagnostic_or_correction_lead,diagnostic,I_DIAGNOSTIC_CORRECTION,"The study compares MLVA, whole-genome, phylogenetic, and spatial evidence and diagnoses when low pathogen diversity makes fine-scale phylodynamic transmission inference inappropriate.",codex-sol-high-wave2-primary-015,W02-BATCH-015,
PMID:32048560,ec4cba168d97d54286b3c487c050838beff05d91c5f1d57080a64644ad53ae64,include_applied_seed,applied_seed,I_APPLIED_TRANSFERABLE_DESIGN,The study applies preliminary molecular-clock and Bayesian phylogeographic analysis to early SARS-CoV-2 genomes to infer outbreak timing and geographic spread.,codex-sol-high-wave2-primary-015,W02-BATCH-015,
PMID:32049340,84d1feaebf456b75498696de4c3a2128755e9908b6434faaf53b72fc88768215,include_method_source_lead,method_source,I_METHOD_SOURCE,The paper develops a fast nonparametric test and screening algorithms for detecting hidden population structure in time-scaled pathogen phylogenies.,codex-sol-high-wave2-primary-015,W02-BATCH-015,
PMID:32069282,59507bd77cd778d0c403dfe8c1fb0fb339a12c0f50e113a4de4cef324d4f1c4c,include_simulation_or_mechanistic_lead,applied_seed,I_SIMULATION_MECHANISTIC,The study uses a mechanistic influenza phylodynamic model and empirical surveillance data to develop and test early predictions of antigenic-cluster success.,codex-sol-high-wave2-primary-015,W02-BATCH-015,
PMID:32101295,537952a4dad503bc1054c85442ecba55645a5570f2db671af8856100c318e235,include_method_source_lead,method_source,I_METHOD_SOURCE,The paper develops an online Bayesian procedure that updates BEAST phylogenetic and epidemic estimates efficiently as new pathogen sequences arrive.,codex-sol-high-wave2-primary-015,W02-BATCH-015,
