candidate_key,source_row_sha256,primary_decision,primary_proposed_record_type,primary_reason_code,primary_reason,primary_reviewer,batch_id,retained_candidate_key
PMID:37210751,ec444036577d1cb8c202d0e51ba1826a2e0a4297f9bdb5001679d6b6dfa6bc76,include_simulation_or_mechanistic_lead,applied_seed,I_SIMULATION_MECHANISTIC,A Markov microsimulation evaluates dual-stained cytology as reflex triage after high-risk HPV and cytology co-testing for cervical cancer screening.,codex-sol-high-wave2-primary-022,W02-BATCH-022,
PMID:37244962,8a05b7378f5a79f6f5ce5e12764d9fa8e03246e2829ef8cf86e70c951ed6b804,include_simulation_or_mechanistic_lead,method_source,I_SIMULATION_MECHANISTIC,The paper develops dynamic approximate-Bayesian-computation recalibration for an individual COVID-19 model and evaluates its effects on forecast accuracy and uncertainty.,codex-sol-high-wave2-primary-022,W02-BATCH-022,
PMID:37302445,2c5e33fa994aa37894bdbcdc1097b72b0c795cd1fedb2b1a10aef937d649e4ed,include_simulation_or_mechanistic_lead,applied_seed,I_SIMULATION_MECHANISTIC,A Markov microsimulation estimates the post-cure hepatitis C incidence threshold at which hepatocellular-carcinoma surveillance becomes cost-effective.,codex-sol-high-wave2-primary-022,W02-BATCH-022,
PMID:37308858,f8745e26a93364406ec40deb8da5995d69998b34d9898b7d9fcd44a66f73b6d8,include_simulation_or_mechanistic_lead,applied_seed,I_SIMULATION_MECHANISTIC,"A city-parameterized HIV microsimulation estimates how PrEP uptake speed, coverage, initiation age, and discontinuation affect incidence among Brazilian MSM.",codex-sol-high-wave2-primary-022,W02-BATCH-022,
PMID:37389788,9fe73791439cfe6c4a45c9ea94246861d0651fa87cbf84b842d7c0c84346b3da,include_method_source_lead,method_source,I_METHOD_SOURCE,"The systematic review appraises decision models of antiretroviral-adherence interventions and identifies inconsistencies in model selection, inputs, and uncertainty analysis.",codex-sol-high-wave2-primary-022,W02-BATCH-022,
PMID:37450301,cd87425f777c9b12ddae97c8c65fb59c84ce0aff93e6a853da0e45a4264b1e3a,include_simulation_or_mechanistic_lead,applied_seed,I_SIMULATION_MECHANISTIC,The study integrates multicountry longitudinal regressions with dynamic microsimulation to evaluate and forecast conditional-cash-transfer effects on infection-related childhood mortality.,codex-sol-high-wave2-primary-022,W02-BATCH-022,
PMID:37461007,fd3f10a810a6d6362d9754df1457b85bae244308364d2180cc2c3dc6a3193d4e,include_simulation_or_mechanistic_lead,method_source,I_SIMULATION_MECHANISTIC,"The authors develop, calibrate, and validate a multimorbidity infectious-disease microsimulation model.",codex-cli-task5-blind-adjudicator-019f81ed-9bec-78e3-8e45-f6ffc3186482,W02-BATCH-022,
