candidate_key,source_row_sha256,primary_decision,primary_proposed_record_type,primary_reason_code,primary_reason,primary_reviewer,batch_id,retained_candidate_key
PMID:41862854,d0558f82506bac7a9619e0a10fa5c72a47a630035ff3b1f00f0f0d50b050fb65,exclude,,X_NOT_INFECTIOUS_TRANSFERABLE,This microsimulation models depressive symptoms under hypothetical lockdowns but does not model infection outcomes or establish another concrete infectious-disease transfer route.,codex-sol-high-wave2-primary-023,W02-BATCH-023,
PMID:41992367,c4a124a6bba5446fd064a992c99ff6a3ef4b2a52ed81e2e8f841e2be5e03073d,include_method_source_lead,method_source,I_METHOD_SOURCE,"The systematic review compares distributional cost-effectiveness methods, equity indices, subgroup definitions, modeling choices, and evidence limitations.",codex-cli-task5-fix3-reader-a-019f8297-390c-79f1-afb3-aa6bb5eac671,W02-BATCH-023,
PMID:42022232,bc218fc6fea174bf8ce10e2ea01e9de67a7e0dcde185ea19cd9841721e9524cb,include_simulation_or_mechanistic_lead,applied_seed,I_SIMULATION_MECHANISTIC,Three independently calibrated natural-history models benchmark cervical-screening strategies across cohorts with differing HPV-vaccine exposure.,codex-cli-task5-fix3-reader-a-019f8297-390c-79f1-afb3-aa6bb5eac671,W02-BATCH-023,
PMID:42027616,14b0629f885f273f3fb618e4225bda22dba29db0e5be404e0b03495cc9bfe35b,include_simulation_or_mechanistic_lead,applied_seed,I_SIMULATION_MECHANISTIC,"A COVID-19 microsimulation models vaccination, infections, hospitalizations, deaths, and misinformation-removal counterfactuals across populations.",codex-cli-task5-fix3-reader-a-019f8297-390c-79f1-afb3-aa6bb5eac671,W02-BATCH-023,
PMID:42136105,4bf0c8cbc0523841e909c0a0be5ff34f570ea629d0882f15800b0714698c6edd,include_simulation_or_mechanistic_lead,applied_seed,I_SIMULATION_MECHANISTIC,This microsimulation evaluates HIV prevention strategies and their cost-effectiveness under Brazilian epidemiological conditions.,codex-cli-task5-fix3-reader-a-019f8297-4900-7952-a950-357c9991dab0,W02-BATCH-023,
PMID:42137488,511d2e4846bfc8e5cd9555e14068c0905a4a84b28260f2a55083529cd7543c48,include_simulation_or_mechanistic_lead,method_source,I_SIMULATION_MECHANISTIC,"This study develops, tests, and calibrates a new microsimulation of maternal-fetal CMV acquisition and transmission.",codex-cli-task5-fix3-reader-a-019f8297-4900-7952-a950-357c9991dab0,W02-BATCH-023,
PMID:42385424,33bd3269a3f378510acba4d30354a5f9114066f7dd322ecbef62160759e05eb6,include_applied_seed,applied_seed,I_APPLIED_TRANSFERABLE_DESIGN,This nationwide cohort applies standardization and burden modeling to infection-associated febrile-seizure trends.,codex-cli-task5-fix3-reader-a-019f8297-4900-7952-a950-357c9991dab0,W02-BATCH-023,
PMID:42412430,caa5eb0c28d4dfcb04c4f77d683c0562508ea6cd5d3c29a893b10d1d68de6803,exclude,,X_DESCRIPTIVE_ONLY,This microsimulation projects Medicare enrollment and costs without an eligible infectious-process simulation contribution.,codex-cli-task5-fix3-reader-a-019f8297-4900-7952-a950-357c9991dab0,W02-BATCH-023,
PMID:42456468,3b54726601eb789fef1ecf7052e5fbbc0ddd265d878585da9d04449bf2af7fa2,include_simulation_or_mechanistic_lead,applied_seed,I_SIMULATION_MECHANISTIC,This dynamic microsimulation estimates how income-mobility policies could alter AIDS incidence across vulnerability groups.,codex-cli-task5-fix3-reader-a-019f8297-4900-7952-a950-357c9991dab0,W02-BATCH-023,
PMID:42467672,0c13aa6d988c1c6f00346fd036f916fd644fccdafe5378311f840a957ad04cae,exclude,,X_NOT_INFECTIOUS_TRANSFERABLE,This cancer surveillance cost-utility model offers no explicit transfer route to infectious-disease epidemiology.,codex-cli-task5-fix3-blind-019f82ad-6a07-71b3-91ff-c0af719adffa,W02-BATCH-023,
