candidate_key,source_row_sha256,primary_decision,primary_proposed_record_type,primary_reason_code,primary_reason,primary_reviewer,batch_id,retained_candidate_key
PMID:30341041,15c84d6a97a2470cf36131b8c7682db9b7552a578655090c91594b2ff9fcc940,include_method_source_lead,method_source,I_METHOD_SOURCE,The study compares tuberculosis clustering methods against phylodynamically estimated transmission times to establish interpretable thresholds for detecting recent transmission.,codex-sol-high-wave2-primary-015,W02-BATCH-015,
PMID:30422979,6db3bab05be118ec3e0cfe7a4493bd9bc90fdb7f11bcb812bad4f15ac8347cc0,include_method_source_lead,method_source,I_METHOD_SOURCE,The paper develops the PhyDyn framework for translating flexible compartmental models into structured-coalescent inference within BEAST2.,codex-sol-high-wave2-primary-015,W02-BATCH-015,
PMID:30430838,3a8f79b3d698f2e2b69b579ae2d3416982746842508ff92aa6c9d171967bbc90,include_applied_seed,applied_seed,I_APPLIED_TRANSFERABLE_DESIGN,"The study uses molecular clocks, coalescent reconstruction, and birth-death models to characterize HIV clade origins, mixing, population history, and reproduction numbers in Ukraine.",codex-sol-high-wave2-primary-015,W02-BATCH-015,
PMID:30514063,9976297bb01c63f412108265096bd95fb12f5522af873dcd91f2d4615d5d00d7,exclude,,X_COMMENTARY_ONLY,"The article advocates introducing phylodynamics for HIV control in Korea but supplies no substantive method development, evaluation, or applied analysis.",codex-sol-high-wave2-primary-015,W02-BATCH-015,
PMID:30550489,8ec49c35be7eaf9e54355900b3518577209f3ea02aa98590d1f5e8809a45de98,include_applied_seed,applied_seed,I_APPLIED_TRANSFERABLE_DESIGN,The study integrates full-genome hepatitis C sequencing with HIV sequence analysis to identify active but distinct transmission clusters among high-risk groups.,codex-sol-high-wave2-primary-015,W02-BATCH-015,
PMID:30555720,fc15bd8a460dbe2dec6f34c26009f77a335145a2b5d9ab63c37847689599dee5,include_applied_seed,applied_seed,I_APPLIED_TRANSFERABLE_DESIGN,The study uses a migration-aware phylodynamic model and population surveillance data to separate local HIV incidence from external viral introductions.,codex-sol-high-wave2-primary-015,W02-BATCH-015,
PMID:30571679,8f4df094c81a69b299abab16af9fea4249bac24febd1dd50a98f55c94e0b7ad6,include_applied_seed,applied_seed,I_APPLIED_TRANSFERABLE_DESIGN,The study reconstructs the population history and international spread of an infectious bronchitis virus lineage while showing how inconsistent nomenclature distorted epidemiological interpretation.,codex-sol-high-wave2-primary-015,W02-BATCH-015,
PMID:30590733,f502c65d2cd1e3c38ac68f68e2a539e8b679ab38be043e1bb2d8639d02527f6e,include_applied_seed,applied_seed,I_APPLIED_TRANSFERABLE_DESIGN,"The study integrates phylodynamics, selection analysis, and structural biology to characterize pseudorabies cross-species transmission, population expansion, and host adaptation.",codex-sol-high-wave2-primary-015,W02-BATCH-015,
PMID:30654482,f1fa11b6befc02eb8c5a190cfed962967efce40ecb8c38101a345f2d6ec2e14f,include_applied_seed,applied_seed,I_APPLIED_TRANSFERABLE_DESIGN,"The study combines newly generated Ebola genomes with phylogeographic and phylodynamic analyses to identify source, sink, and hub districts in Sierra Leone.",codex-sol-high-wave2-primary-015,W02-BATCH-015,
PMID:30761909,4dc74f02d40bc3997d49f165a37619ce7fd92cd691ff6ac1eb2121e41202e2fb,include_applied_seed,applied_seed,I_APPLIED_TRANSFERABLE_DESIGN,"The study integrates phylogenetic, phylodynamic, and cross-neutralization analyses to relate infectious bronchitis virus lineages to antigenic differences relevant to control programs.",codex-sol-high-wave2-primary-015,W02-BATCH-015,
PMID:30804361,0475f04757ef2481edf50496a80163c799b68b51acfc83ff7ba995ee28791a7a,include_applied_seed,applied_seed,I_APPLIED_TRANSFERABLE_DESIGN,The study applies clade-specific phylodynamic and phylogeographic reconstruction to evaluate heterogeneous HIV epidemic changes after interventions in South Africa.,codex-sol-high-wave2-primary-015,W02-BATCH-015,
PMID:30805610,b67f0f69d1569bf4a3cf6525a308dcd6ee18e4bdf45de21168615f36e6324d7a,include_applied_seed,applied_seed,I_APPLIED_TRANSFERABLE_DESIGN,The study uses birth-death and discrete-trait models to relate changes in HIV reproduction numbers and transmission-group mixing to treatment and harm-reduction policies.,codex-sol-high-wave2-primary-015,W02-BATCH-015,
PMID:30807578,1e4f76dbfb022b4d3c9f8abfdf9dfa6ea49028bd406301b523e69e2d02db4812,include_simulation_or_mechanistic_lead,method_source,I_SIMULATION_MECHANISTIC,The study simulates pathogen phylogenies on several dynamic contact networks and quantifies how network misspecification biases transmission-rate classification.,codex-sol-high-wave2-primary-015,W02-BATCH-015,
PMID:30848076,72b6e4bc8688af534037d9847764415007180b408882838ff4dc972d1e950b84,include_applied_seed,applied_seed,I_APPLIED_TRANSFERABLE_DESIGN,"The study uses complete genomes and segment-specific phylogenies to reconstruct host-defined rotavirus C lineages, reassortment, and historical cross-species transmission.",codex-sol-high-wave2-primary-015,W02-BATCH-015,
PMID:30858834,67a9fb0ecac634271f4aceb6631b64f297edf4f946acd92761bb21354f482536,include_applied_seed,applied_seed,I_APPLIED_TRANSFERABLE_DESIGN,"The study combines epidemic-growth modeling, phylogenetics, phylodynamics, and latent-class analysis to characterize HIV subepidemics and transmission groups in Serbia.",codex-sol-high-wave2-primary-015,W02-BATCH-015,
PMID:30863382,e82115fdc0b99177d6af37f183e6d4662cff43b04380d7309310c288de63428a,include_applied_seed,applied_seed,I_APPLIED_TRANSFERABLE_DESIGN,The study uses phylogenetic clustering and demographic reconstruction to compare the origins and growth phases of major HIV subtypes in Moscow.,codex-sol-high-wave2-primary-015,W02-BATCH-015,
PMID:30905774,25a262e30d91e6527aabc86565cd1a5508b90d18078ca641c2f8b21a749388bb,include_applied_seed,applied_seed,I_APPLIED_TRANSFERABLE_DESIGN,"The study combines multiyear surveillance, segment phylogenies, and whole-genome analysis to distinguish repeated rotavirus importations from local evolution.",codex-sol-high-wave2-primary-015,W02-BATCH-015,
PMID:30906285,50368b7e2d3fc5e0abf63d9230b5e387a98d4457bb5cc93006b29150c4329003,include_applied_seed,applied_seed,I_APPLIED_TRANSFERABLE_DESIGN,The longitudinal study integrates HIV sequences and clinical data to compare clustering methods and trace drug-resistance accumulation over 28 years.,codex-sol-high-wave2-primary-015,W02-BATCH-015,
PMID:30910532,321f3d127ac537a9ca0915dc1d6b65506828bbd204c56743b59fdab5ba008bcd,include_applied_seed,applied_seed,I_APPLIED_TRANSFERABLE_DESIGN,The study uses complete and partial hepatitis B genomes with Bayesian phylogeography to reconstruct genotype distribution and migration within and beyond Paraguay.,codex-sol-high-wave2-primary-015,W02-BATCH-015,
PMID:30915040,a99001dbc485b399f2a6fbeb8ccccb30b59c6228b7d7916d24fb72af7e482719,include_applied_seed,applied_seed,I_APPLIED_TRANSFERABLE_DESIGN,"The study combines national HIV sequence clustering, Bayesian dating, and geographic reconstruction to characterize Spain's largest CRF02_AG subepidemic.",codex-sol-high-wave2-primary-015,W02-BATCH-015,
PMID:30920395,fe9c60b4c72d21e06edbe97d04144e8e4f1d8a264a64f04be41db215b5a76f21,include_method_source_lead,method_source,I_METHOD_SOURCE,"The review explains how within-host HIV diversity changes transmission-tree inference and compares modern methods for estimating direction, directness, and common sources.",codex-sol-high-wave2-primary-015,W02-BATCH-015,
PMID:30946141,71eec7dee10b8af87c4eac6894cfb1689cb681d9394b5f1633971b00f08d27b5,include_diagnostic_or_correction_lead,reproducibility,I_DIAGNOSTIC_CORRECTION,"The article describes a large multisite African HIV sequence resource, its planned integration with epidemiology and phylodynamics, and a governed mechanism for external data access.",codex-sol-high-wave2-primary-015,W02-BATCH-015,
PMID:30946142,675bb893d5f98b03a6dbf5e851d494e4fd89bffad337d7271e58a8ca984c33e0,include_diagnostic_or_correction_lead,guidance,I_DIAGNOSTIC_CORRECTION,"The review examines hidden HIV risk-group inference and provides methodological cautions about missing data, bias, and privacy in molecular transmission analyses.",codex-sol-high-wave2-primary-015,W02-BATCH-015,
PMID:30948742,21f2e259d2d22e3c6df064cce9d89ca721e5fa34bba2d24b4ed33073b0f0f793,include_applied_seed,applied_seed,I_APPLIED_TRANSFERABLE_DESIGN,The study uses phylodynamics to compare the evolutionary timing and dispersal rates of foot-and-mouth disease virus clades across endemic African regions.,codex-sol-high-wave2-primary-015,W02-BATCH-015,
PMID:30951528,4be454617cfaacd148938c81686163371555df61974c4cdf11d3fcb9af496886,include_diagnostic_or_correction_lead,diagnostic,I_DIAGNOSTIC_CORRECTION,The paper develops latent-residual diagnostics for phylodynamic model misspecification and uses them to detect superspreading and unsupported within-host assumptions.,codex-sol-high-wave2-primary-015,W02-BATCH-015,
PMID:30972053,95e2922db3b9b297eabca2a6679b864a86f892e4b4023a2f28602b23190f785f,include_applied_seed,applied_seed,I_APPLIED_TRANSFERABLE_DESIGN,The study reconstructs an HIV outbreak with Bayesian phylogenetics and birth-death models and relates its declining reproduction number to earlier treatment initiation.,codex-sol-high-wave2-primary-015,W02-BATCH-015,
PMID:31001231,70da83ba1d9956e6e1b4990be89ce1dbe6d9fc2c0ca0fcfbadbb2d79c98edb08,include_applied_seed,applied_seed,I_APPLIED_TRANSFERABLE_DESIGN,The study combines multinational HIV phylogenies with Bayesian dating and ancestral-location inference to characterize expanding non-subtype-B clusters among men in Spain.,codex-sol-high-wave2-primary-015,W02-BATCH-015,
PMID:31022473,4fa1693ee2bb1d7bb316edc6ae1bdc075a9ac823d50507e14b449fea38850bfc,include_applied_seed,applied_seed,I_APPLIED_TRANSFERABLE_DESIGN,The study combines large-scale poultry surveillance with phylogenetic classification and Bayesian phylodynamics to date the introduction of an infectious bursal disease lineage.,codex-sol-high-wave2-primary-015,W02-BATCH-015,
PMID:31028702,ec6b3b56581ccba3a040f6869e2ac3c9b3c893b95e515435dea7e1ada96269ce,include_applied_seed,applied_seed,I_APPLIED_TRANSFERABLE_DESIGN,The study uses dated HIV clusters and birth-death reproduction-number estimates to identify and monitor active transmission clusters in routine surveillance.,codex-sol-high-wave2-primary-015,W02-BATCH-015,
PMID:31029717,7b04b041ee0e1245fc8acb08b58db54fc7d5d9c69a0f129430e01c509827bd7d,include_applied_seed,applied_seed,I_APPLIED_TRANSFERABLE_DESIGN,"The study applies Bayesian phylogenetic, spatial, temporal, and selection analyses to reconstruct the transmission dynamics of an emerging alphavirus.",codex-sol-high-wave2-primary-015,W02-BATCH-015,
PMID:31037220,8625f38844c7d9f0eff292eead47a8d109d95b5b50855d3a269eeb2af882cb3e,include_applied_seed,applied_seed,I_APPLIED_TRANSFERABLE_DESIGN,"The study uses whole-genome deep sequencing to jointly characterize within-patient diversity, dual infection, introductions, and epidemic evolution of enterovirus D68.",codex-sol-high-wave2-primary-015,W02-BATCH-015,
PMID:31058982,212a7d1729fafeeffe601544e00b12ada096d4d9ad1e8d4f81f8b151bd36f738,include_simulation_or_mechanistic_lead,method_source,I_SIMULATION_MECHANISTIC,"The paper develops and simulation-validates a particle-filtering framework that jointly infers epidemic incidence, prevalence, phylogenies, and birth-death parameters.",codex-sol-high-wave2-primary-015,W02-BATCH-015,
PMID:31092597,16b096795c698953f5c71ff6c38c7ff5c9a10d6791d69ab6ec8aee541c6c56de,include_method_source_lead,method_source,I_METHOD_SOURCE,"The review compares uses of ancient genomes, individual historical isolates, and isolate collections for diagnosis, transmission reconstruction, diversity, and antimicrobial-resistance evolution.",codex-sol-high-wave2-primary-015,W02-BATCH-015,
PMID:31118431,3dce82c0a5a5b1632b62122a3efad02877ec1e026dc56dbdccc89986a512376f,include_applied_seed,applied_seed,I_APPLIED_TRANSFERABLE_DESIGN,"The study integrates active surveillance, whole-genome reassortment analysis, antigenic comparison, and Bayesian phylodynamics to characterize avian influenza in Vietnam.",codex-sol-high-wave2-primary-015,W02-BATCH-015,
PMID:31141933,8d9738bcb30ea73e0f190c894f78ca93fb766d0929534d06a1021d3092890df1,include_method_source_lead,method_source,I_METHOD_SOURCE,"The review compares computational antigen optimization, ancestral reconstruction, immunomics, structural modeling, and phylodynamics for universal influenza-vaccine design.",codex-sol-high-wave2-primary-015,W02-BATCH-015,
PMID:31143866,362680f5c1bb21f64ffda96c585c59226b849b9056c5ff644dfb1d3cd78ae9b2,include_applied_seed,applied_seed,I_APPLIED_TRANSFERABLE_DESIGN,The case study uses Bayesian phylodynamic linkage analysis to investigate a suspected nonvertical HIV transmission source within a household.,codex-sol-high-wave2-primary-015,W02-BATCH-015,
PMID:31147766,893947d9bde4aeab6f2b92ade53a97a5aec3e4db222092563d20ec17b9d38771,include_applied_seed,applied_seed,I_APPLIED_TRANSFERABLE_DESIGN,"The study applies national-scale phylogeographic and coalescent analyses to characterize rabies-virus spatial structure, movement, and population history in China.",codex-sol-high-wave2-primary-015,W02-BATCH-015,
PMID:31233490,a6a7bbfc83e4152805e9d9bb0a2ed9c4bc2a4229863f16364705635a645d38c5,include_method_source_lead,method_source,I_METHOD_SOURCE,The study develops temporal multilayer-network analysis for recombining pathogens and evaluates how immune competition generates persistent antigenic strain structure.,codex-sol-high-wave2-primary-015,W02-BATCH-015,
PMID:31278682,6668e4dd8a1060e78157975d532331ca66d69b87c28c8b9069ad46e88103a2d5,include_method_source_lead,method_source,I_METHOD_SOURCE,The methods chapter benchmarks BEAGLE acceleration across CPUs and GPUs for computationally intensive Bayesian phylogenetic and phylodynamic analyses.,codex-sol-high-wave2-primary-015,W02-BATCH-015,
PMID:31280593,63fe0f6146e9d985193df93cc40595c8ea247dc66af90cdd5195c08885d34833,include_applied_seed,applied_seed,I_APPLIED_TRANSFERABLE_DESIGN,"The study applies phylodynamic source attribution to national HIV data to estimate age, ethnic, and geographic mixing patterns among men who have sex with men.",codex-sol-high-wave2-primary-015,W02-BATCH-015,
PMID:31329588,ed26ae079521cb35710c82509702e568dae8a66e17eb326af931c8ce656c65bc,include_simulation_or_mechanistic_lead,method_source,I_SIMULATION_MECHANISTIC,Simulated multihost Salmonella outbreaks are used to validate two Bayesian ancestral-state models and expose biases caused by sampling and population-size assumptions.,codex-sol-high-wave2-primary-015,W02-BATCH-015,
PMID:31364710,21de889f273424afe5b20f47b0708aa7b86ca124fa3d0aa3f5c2ca0465f1f6f3,include_diagnostic_or_correction_lead,guidance,I_DIAGNOSTIC_CORRECTION,"The paper provides a practical Skygrid workflow with best practices, pitfalls, and generalized recommendations for Bayesian population-history inference in BEAST.",codex-sol-high-wave2-primary-015,W02-BATCH-015,
PMID:31428459,d96cb8fbc278dcc03c3babff9375cbfe0ffae1527d5333542428f38ca0bcda70,include_method_source_lead,method_source,I_METHOD_SOURCE,The paper develops a structured-coalescent GLM for estimating predictors of time-varying migration and effective population size and implements it in MASCOT.,codex-sol-high-wave2-primary-015,W02-BATCH-015,
PMID:31428595,86ed0d5f54531f6df0307739d0efaadfac1a3d34562439aeb9018a0c6aed7909,include_method_source_lead,method_source,I_METHOD_SOURCE,"The review compares visualization methods for jointly exploring phylogenetic, temporal, spatial, and epidemiological information in viral surveillance.",codex-sol-high-wave2-primary-015,W02-BATCH-015,
PMID:31434783,06abbabd34362f2e8738c7a5804d2a1dea0b7addf7e6c3d82a3145f6166b38a1,exclude,,X_WRONG_RECORD_TYPE,This is an observational-study protocol describing planned influenza sequencing and spatial analyses without reporting a completed methodological evaluation or reusable guidance contribution.,codex-sol-high-wave2-primary-015,W02-BATCH-015,
PMID:31462006,44a54d33b1d8c29ad371be6c601e40b5e7f75356317416934b485070def13d77,include_applied_seed,applied_seed,I_APPLIED_TRANSFERABLE_DESIGN,"The study uses Bayesian phylodynamics to relate influenza mutations, interstate transmission routes, and environmental or transport predictors to severe epidemics in India.",codex-sol-high-wave2-primary-015,W02-BATCH-015,
PMID:31484295,7fc65b90fbc5e57ece83efa5325cac61cd3110f4d6c5427583619f4d9b3a81e8,include_applied_seed,applied_seed,I_APPLIED_TRANSFERABLE_DESIGN,The study combines viral sequencing with birth-death and coalescent skyline models to reconstruct the expansion of the West Nile lineage responsible for Italy's epidemic.,codex-sol-high-wave2-primary-015,W02-BATCH-015,
PMID:31528357,e75bf32333ce478976ea1dd3ebabd404432fd2a80d605f2c7797623626ffbe69,include_simulation_or_mechanistic_lead,method_source,I_SIMULATION_MECHANISTIC,The paper develops a multifurcating skyline estimator under Lambda-coalescents and validates its recovery of population size and superspreading information in simulations.,codex-sol-high-wave2-primary-015,W02-BATCH-015,
PMID:31532393,b2dec4d667c7af63339c62439a0a89aee07351626ab0e497a7d9c17faae22d48,include_simulation_or_mechanistic_lead,method_source,I_SIMULATION_MECHANISTIC,"The paper maps a multistrain epidemic model onto an adapting-population model to derive mechanistic regimes of pathogen persistence, extinction, and antigenic speciation.",codex-sol-high-wave2-primary-015,W02-BATCH-015,
PMID:31543416,4070ac5e04c4c3ae30b0bb475c695f39d5eac5d3c1fcbede78f88c7f545a35c1,include_applied_seed,applied_seed,I_APPLIED_TRANSFERABLE_DESIGN,"The study establishes a prevaccine surveillance baseline by combining hospital sampling, genotyping, phylogenetics, and antigenic comparison of circulating rotaviruses.",codex-sol-high-wave2-primary-015,W02-BATCH-015,
PMID:31558163,2a2f6d24572a3399b3c715df6195fbf8f3c390d096d6283a765ac1d7de96e159,include_simulation_or_mechanistic_lead,method_source,I_SIMULATION_MECHANISTIC,The study simulates genetically evolving epidemics on a livestock network to quantify superspreader- and sampling-related biases in two phylodynamic models.,codex-sol-high-wave2-primary-015,W02-BATCH-015,
PMID:31559020,f0006ad5daf49fc5ffbff8edcef56a5b605b3b5092301fb9423cf79461522540,include_applied_seed,applied_seed,I_APPLIED_TRANSFERABLE_DESIGN,"The study uses a dated whole-genome phylogeny to connect potato virus Y origins, recombination, and global spread with crop domestication and trade history.",codex-sol-high-wave2-primary-015,W02-BATCH-015,
PMID:31581471,b35f8b111b59b0cc547bf5afc0ba80ba8170a288e73413d1b94bf9665733926d,include_applied_seed,applied_seed,I_APPLIED_TRANSFERABLE_DESIGN,"The study uses Bayesian phylogeographic and demographic analysis to reconstruct the introduction, interstate dispersal, and changing growth of a Brazilian HIV lineage.",codex-sol-high-wave2-primary-015,W02-BATCH-015,
PMID:31586866,67fdcbf92bd83b72fe324e7549c86c48799213a60835f98eca7ac28915db18cf,include_applied_seed,applied_seed,I_APPLIED_TRANSFERABLE_DESIGN,The study combines discrete-trait ancestral reconstruction with predictor-informed migration models to estimate host roles and trade-driven spread of avian influenza.,codex-sol-high-wave2-primary-015,W02-BATCH-015,
PMID:31594511,6b6a5d711df4dfaa964f561caa02975d59ae21fda2b72b2fa3eeb8caf89c02a2,include_applied_seed,applied_seed,I_APPLIED_TRANSFERABLE_DESIGN,The study joins longitudinal rabies phylogeography with statistical models of lineage disappearance to distinguish endemic persistence from repeated extinction and recolonization.,codex-sol-high-wave2-primary-015,W02-BATCH-015,
PMID:31637629,e9d3143b90706e26b7198bb63e7a0ca6000d4ad6e266ea24ebf9b0743ef49f23,include_applied_seed,applied_seed,I_APPLIED_TRANSFERABLE_DESIGN,The study applies Bayesian discrete phylogeography to long-term influenza B sequence data to identify lineage origins and regional transition nodes in China.,codex-sol-high-wave2-primary-015,W02-BATCH-015,
PMID:31680698,09b8b6f0b9ec8500d4d113a8e564d6e75e150241fcdee024e910dbe62916c563,include_method_source_lead,method_source,I_METHOD_SOURCE,The review compares contact-network and genomic approaches and explains how their integration can improve inference about host behavior and pathogen transmission.,codex-sol-high-wave2-primary-015,W02-BATCH-015,
PMID:31684949,f4a326c7564b2d04e5a2e58e774aa9f312e02e7e63c1d4c69fa5f408b52937cd,include_applied_seed,applied_seed,I_APPLIED_TRANSFERABLE_DESIGN,"The study combines long-term clinical sampling, sequence typing, and phylodynamic analysis to track regional and temporal changes in canine parvovirus variants.",codex-sol-high-wave2-primary-015,W02-BATCH-015,
PMID:31767497,fe2c10e51e889fe384d2bf6e625527ba60f1421780c9929918acd1d14ec93797,include_applied_seed,applied_seed,I_APPLIED_TRANSFERABLE_DESIGN,The study fits structured-coalescent models to multiple HIV subtypes and population groups to estimate assortativity and attributable transmission fractions in Senegal.,codex-sol-high-wave2-primary-015,W02-BATCH-015,
PMID:31772058,ea6d67adaaaf7f3bf4073f7f236d3b37204a4c107c48f270a50ca16bf6e865ea,include_applied_seed,applied_seed,I_APPLIED_TRANSFERABLE_DESIGN,"The study uses multinational whole-genome data to reconstruct the emergence, resistance acquisition, and travel-associated global spread of a multidrug-resistant MRSA lineage.",codex-sol-high-wave2-primary-015,W02-BATCH-015,
PMID:31783038,e0e47d1cfe89aa4f5420832fe160c88795eb8feacce0035ac6ebae5e3b4e7536,include_applied_seed,applied_seed,I_APPLIED_TRANSFERABLE_DESIGN,"The study combines molecular dating, selection, phylodynamics, and structural epitope mapping to investigate respirovirus evolution and possible mechanisms of reinfection.",codex-sol-high-wave2-primary-015,W02-BATCH-015,
PMID:31802380,d1edf4ff5c36ff3c5849fa8a28f64a68b6959976c5d5b30520605755c97094da,include_applied_seed,applied_seed,I_APPLIED_TRANSFERABLE_DESIGN,"The study integrates Bayesian evolutionary analysis, selection tests, and receptor-structure modeling to investigate canine distemper adaptation in fur-bearing animals.",codex-sol-high-wave2-primary-015,W02-BATCH-015,
PMID:31834976,c99187a670f705b8d9cb4fd4d7146736a4a22c3fac2a1dcc88aa38a74639d5da,include_applied_seed,applied_seed,I_APPLIED_TRANSFERABLE_DESIGN,"The study uses segment-specific phylogenetics and phylodynamics to reconstruct the emergence, international migration, and present subpopulations of infectious bursal disease virus.",codex-sol-high-wave2-primary-015,W02-BATCH-015,
PMID:31848434,89deef840acf13918ea8a8dbeed7abea5f993076c24577508707ae5eeab0d3f7,include_simulation_or_mechanistic_lead,method_source,I_SIMULATION_MECHANISTIC,"The paper presents an open individual-based HIV simulator for dynamic sexual networks, interventions, policy-impact estimation, and evaluation of phylodynamic inference.",codex-sol-high-wave2-primary-015,W02-BATCH-015,
PMID:31866392,b71c194af2e17e407ca71e9da74acf0f21e8f63b721582ee0ad491bb59100e70,include_method_source_lead,method_source,I_METHOD_SOURCE,"The paper derives a joint probability density for sampled phylogenies and unplaced occurrence data, enabling combined inference from pathogen sequences and case counts.",codex-sol-high-wave2-primary-015,W02-BATCH-015,
PMID:31878875,f66dce88af99ae6620a533b5b9d0facf383f615ca789ae0694c769d963e2c5c4,include_method_source_lead,method_source,I_METHOD_SOURCE,The study compares whole genomes with a single gene for Ebola outbreak inference and proposes a metric for the temporal resolution of molecular-clock analyses.,codex-sol-high-wave2-primary-015,W02-BATCH-015,
PMID:31891636,229ebbb9f7760f3e28416578c8c8d12cfb5cb349ab1469fc9db71d973a3d4c0e,include_applied_seed,applied_seed,I_APPLIED_TRANSFERABLE_DESIGN,"The study combines Bayesian phylogenetics, likelihood methods, networks, and recombination testing to reconstruct foot-and-mouth disease incursions from India into Sri Lanka.",codex-sol-high-wave2-primary-015,W02-BATCH-015,
PMID:31917837,20e6819f68b46f40eec9c3906585a027267cdd38ca528cd8d0538b138d9ba5fc,include_applied_seed,applied_seed,I_APPLIED_TRANSFERABLE_DESIGN,"The study integrates respondent-driven sampling, weighted regression, machine-learning feature selection, and Bayesian phylogenetics to assess hepatitis C transmission among Indian men.",codex-sol-high-wave2-primary-015,W02-BATCH-015,
PMID:31921003,48bdebb00319e4f527b0acd35fcbc3ed4a6ce0c113c25c1fd396fbae40107fbd,include_applied_seed,applied_seed,I_APPLIED_TRANSFERABLE_DESIGN,The study uses global tuberculosis genomes and phylodynamics to link lineage dispersal and local expansion in the South Pacific to historical trade and migration.,codex-sol-high-wave2-primary-015,W02-BATCH-015,
PMID:31967559,4071bbba9b004d7da4cf24e126493f6e4ffb8660577d16b1b593af25032a59ae,include_method_source_lead,method_source,I_METHOD_SOURCE,"The review explains how infection phylogenies support estimation of viral growth, infection numbers, and duration and outlines the method's assumptions and challenges.",codex-sol-high-wave2-primary-015,W02-BATCH-015,
PMID:31993031,1366320491193bc8efd8c8dfe429ebfa0447cd89d24d059ba9e18e5e42905ee6,include_applied_seed,applied_seed,I_APPLIED_TRANSFERABLE_DESIGN,"The study combines molecular dating, structural mapping, selection analysis, and phylodynamics to characterize evolution of the norovirus protease region.",codex-sol-high-wave2-primary-015,W02-BATCH-015,
PMID:32012700,b388efbd20cb395fe049eebaccdbcea627588e8d433376d4c256fad93c9d75b1,include_applied_seed,applied_seed,I_APPLIED_TRANSFERABLE_DESIGN,"The study integrates molecular, epidemiological, serological, and behavioral data to compare partner-service links with phylodynamically inferred HIV transmission links.",codex-sol-high-wave2-primary-015,W02-BATCH-015,
