candidate_key,source_row_sha256,primary_decision,primary_proposed_record_type,primary_reason_code,primary_reason,primary_reviewer,batch_id,retained_candidate_key
PMID:33604537,b9168120340f1ecf89c98253849077899ad9fc7658aa16dc3c5d948beb03cf5f,include_simulation_or_mechanistic_lead,applied_seed,I_SIMULATION_MECHANISTIC,"A real-world-data microsimulation compares dialysis modalities while explicitly modeling infections, hospitalizations, modality transitions, survival, costs, and utility.",codex-sol-high-wave2-primary-022,W02-BATCH-022,
PMID:33673163,5dd4e55226902228b05f1de911cab6010d9cde320548672686a1a3b6dab6bb47,include_simulation_or_mechanistic_lead,applied_seed,I_SIMULATION_MECHANISTIC,A traveler microsimulation coupled to an extended SEIR model compares risk-tiered nucleic-acid testing strategies for Spring Festival travel in China.,codex-sol-high-wave2-primary-022,W02-BATCH-022,
PMID:33678235,91d147f9a4bbb97bdad582a0ed87d79c1ce4718f393e90a6bf5dcd512d67d164,include_simulation_or_mechanistic_lead,method_source,I_SIMULATION_MECHANISTIC,The article proposes a transparent microsimulation framework with redesigned infection-history states and transitions.,codex-cli-task5-blind-adjudicator-019f81ed-9bec-78e3-8e45-f6ffc3186482,W02-BATCH-022,
PMID:33705382,3fe27117d959feccf51c5559629dcb43c269815983f7c616682d0222e83388d9,include_simulation_or_mechanistic_lead,applied_seed,I_SIMULATION_MECHANISTIC,"The study uses two independently calibrated HPV microsimulation models to compare vaccination strategies, costs, benefits, and uncertainty.",codex-cli-task5-scope-reader-a-019f81c8-3afa-76c1-ae6c-639363a3a3d4,W02-BATCH-022,
PMID:33749164,e34f3ca5b3dc2a17833bb6b0969b668c9508dd694f2cfd08db59106ad860faf1,include_simulation_or_mechanistic_lead,applied_seed,I_SIMULATION_MECHANISTIC,"A cohort-sampled microsimulation compares pravastatin, pitavastatin, and no statin among people receiving HIV treatment in the United States.",codex-sol-high-wave2-primary-022,W02-BATCH-022,
PMID:33756510,937781847dfc7fff54d74867d3bd3d84e8160379d050f6165af7b27fa991d50b,include_applied_seed,applied_seed,I_APPLIED_TRANSFERABLE_DESIGN,"The systematic review synthesizes global lifetime HIV-management costs and stratifies estimates by national income, perspective, and decision-model type.",codex-sol-high-wave2-primary-022,W02-BATCH-022,
PMID:33878131,191e2775101d75568445a795900176f76fe601ec18114200a739e73dcf7c1584,include_simulation_or_mechanistic_lead,applied_seed,I_SIMULATION_MECHANISTIC,An activity-based microsimulation evaluates the separate and interacting effects of masks and social distancing on COVID-19 transmission in metropolitan Sydney.,codex-sol-high-wave2-primary-022,W02-BATCH-022,
PMID:33989331,a8e09e42bcc0216fbee927b5f79b6fc22137e2a0b014d21d504a17b8a6af2e29,include_simulation_or_mechanistic_lead,applied_seed,I_SIMULATION_MECHANISTIC,"A locally calibrated dynamic Markov microsimulation compares cytology, HPV testing, and hybrid cervical-screening strategies in Brazil.",codex-sol-high-wave2-primary-022,W02-BATCH-022,
PMID:34013291,2d19f8a754added51595317b88d63ecbdd7eb517995b2023a52747e192acce4b,exclude,,X_DUPLICATE,"This preprint reports the same South African COVID-19 vaccination microsimulation, authors, and findings as the retained journal article PMID:34716349.",codex-sol-high-wave2-primary-022,W02-BATCH-022,PMID:34716349
PMID:34036522,a1b597eab6abc60ef45d6b8d150f1f0354641e8cc7717961a0099237ffc51dc8,include_simulation_or_mechanistic_lead,applied_seed,I_SIMULATION_MECHANISTIC,The study combines OncoSim projections with attributable-risk and potential-impact fractions to estimate avoidable cancer mortality from infectious and other modifiable risks.,codex-sol-high-wave2-primary-022,W02-BATCH-022,
PMID:34176704,edca0e56daf096dd9c3607f44dd403b190bc2e0d6f31fcc7fea2db6a18192eae,include_simulation_or_mechanistic_lead,applied_seed,I_SIMULATION_MECHANISTIC,"A prison Markov microsimulation compares 14 hepatitis C screening pathways that vary in biomarkers, sampling methods, turnaround, acceptability, and linkage.",codex-sol-high-wave2-primary-022,W02-BATCH-022,
PMID:34231822,9ab310e31a96b3f41e2e60116f5a30b8fc8b7896f8c4445d6e2fd40b8cc0cd79,include_simulation_or_mechanistic_lead,applied_seed,I_SIMULATION_MECHANISTIC,"The study uses Monte Carlo microsimulation to compare cryptococcal screening tests through effectiveness, cost, and budget outcomes.",codex-cli-task5-scope-reader-a-019f81c8-3afa-76c1-ae6c-639363a3a3d4,W02-BATCH-022,
PMID:34259118,5ef595cc09515dcd70a384425dbe010b3cca3a69d6f57c8baab5cbe7b06f3380,include_simulation_or_mechanistic_lead,applied_seed,I_SIMULATION_MECHANISTIC,A lifetime natural-history microsimulation compares pneumococcal vaccines and no vaccination among older Japanese adults with elevated disease risk.,codex-sol-high-wave2-primary-022,W02-BATCH-022,
PMID:34364404,850df5d2833eb50fd24b6ba7cd7bb9e50d3d204db17accbd25dfcc1d68eb5f23,include_simulation_or_mechanistic_lead,applied_seed,I_SIMULATION_MECHANISTIC,"A prison transmission-dynamic stochastic microsimulation evaluates vaccination, reopening, baseline immunity, repeated introductions, and nonpharmaceutical interventions.",codex-sol-high-wave2-primary-022,W02-BATCH-022,
PMID:34499124,45b38523daaa74ddaecfa497632fca1d9fd925e1d17330ef308b1dcf440243d8,include_simulation_or_mechanistic_lead,applied_seed,I_SIMULATION_MECHANISTIC,"A microsimulation compares pandemic disruption and recovery scenarios for hepatitis C screening, linkage, treatment, cirrhosis, and mortality.",codex-sol-high-wave2-primary-022,W02-BATCH-022,
PMID:34499685,bcd4e40d938a8c04df01df7da6934ad3904b02ffe491e02914c23a4d9aae5246,include_simulation_or_mechanistic_lead,applied_seed,I_SIMULATION_MECHANISTIC,A patient-sampled microsimulation evaluates alternative cardiovascular-risk thresholds for initiating statins among people with HIV in Thailand.,codex-sol-high-wave2-primary-022,W02-BATCH-022,
PMID:34540237,a1fc286ae1ee64c612cba7121309e844c59577d8fefdb9a402bc351c945f16f5,include_simulation_or_mechanistic_lead,applied_seed,I_SIMULATION_MECHANISTIC,The study uses Markov microsimulation and sensitivity analyses to compare transplant-timing decisions under SARS-CoV-2 vaccination and variant uncertainty.,codex-cli-task5-scope-reader-a-019f81c8-3afa-76c1-ae6c-639363a3a3d4,W02-BATCH-022,
PMID:34634963,a087664d7bd5490a171897a785a55f5e7d7b7979497f841095182a7c791763c4,include_simulation_or_mechanistic_lead,method_source,I_SIMULATION_MECHANISTIC,The study combines a risk-stratified HPV microsimulation with gradient boosting to estimate individualized benefits of catch-up vaccination beyond age 26.,codex-sol-high-wave2-primary-022,W02-BATCH-022,
PMID:34716349,cd931351cb83ee620a3a3580de2b55fc5b155ac4f1836af1de3589c9c5b9d7d1,include_simulation_or_mechanistic_lead,applied_seed,I_SIMULATION_MECHANISTIC,"A South African microsimulation evaluates COVID-19 vaccination coverage, pace, prioritization, acceptance, effectiveness, cost, and epidemic dynamics.",codex-sol-high-wave2-primary-022,W02-BATCH-022,
PMID:34717286,c6f1f2b66bd5bf92f269908f8244c100768d57f0d5ab00e702d99c9904f7ac54,include_simulation_or_mechanistic_lead,method_source,I_SIMULATION_MECHANISTIC,"The paper introduces a computationally efficient, spatially flexible, data-driven epidemic microsimulation and demonstrates it by estimating lockdown effects in Devon.",codex-sol-high-wave2-primary-022,W02-BATCH-022,
PMID:34760643,cbc221bb6725b9f64fd5ceb79216ca958a86c9c6c1136afefe4a0220ef627cbf,include_method_source_lead,method_source,I_METHOD_SOURCE,"The systematic review inventories Indian cost-utility model structures, therapeutic areas including infectious diseases, reporting quality, and recurring methodological omissions.",codex-sol-high-wave2-primary-022,W02-BATCH-022,
PMID:34797862,bf3d2c995585c9225e883e2e849253222341163e06237741479ca49a3a7cf687,include_simulation_or_mechanistic_lead,method_source,I_SIMULATION_MECHANISTIC,The study develops a discrete-event and agent-based method for generating fine-scale contact matrices and using them in SARS-CoV-2 transmission models for dialysis units.,codex-sol-high-wave2-primary-022,W02-BATCH-022,
PMID:34801886,1319ac07f0222a4b892031e2c25ec1a1f44eba440a6b5153e001955df2e8290e,include_simulation_or_mechanistic_lead,applied_seed,I_SIMULATION_MECHANISTIC,"The study uses Monte Carlo microsimulation to compare cryptococcal diagnostic strategies through costs, life-years, and quality-adjusted survival.",codex-cli-task5-scope-reader-a-019f81c8-3afa-76c1-ae6c-639363a3a3d4,W02-BATCH-022,
PMID:34840300,c59948126146f5555a1eb4dc3b58a7e0e41e3db4fcf83a19b741bc08ce9660b0,include_simulation_or_mechanistic_lead,applied_seed,I_SIMULATION_MECHANISTIC,"A Markov microsimulation estimates surgical-site infections, downstream complications, costs, and QALYs for prophylactic negative-pressure wound therapy.",codex-sol-high-wave2-primary-022,W02-BATCH-022,
PMID:34861189,3ff17979f2ce9df53baa97c50449db4cd8751b167c86ff87ca8dff76fc97dbf2,include_simulation_or_mechanistic_lead,applied_seed,I_SIMULATION_MECHANISTIC,"A microsimulation compares hospital-based opioid-use treatment strategies using overdose, injection-related infection, hospitalization, survival, and cost outcomes.",codex-sol-high-wave2-primary-022,W02-BATCH-022,
PMID:34927126,511318f8d56d4919ebd07b16a78aa290a4641f83dfe926c4a76711c8726f5a9c,include_simulation_or_mechanistic_lead,applied_seed,I_SIMULATION_MECHANISTIC,An open-cohort HPV microsimulation projects male oropharyngeal cancer under vaccination scale-up and pandemic-disruption scenarios.,codex-sol-high-wave2-primary-022,W02-BATCH-022,
PMID:34930233,bab0e05533246e40a08ff8f962bfd744a80fe1fa9b57f33209a8038e4c059b3a,include_method_source_lead,method_source,I_METHOD_SOURCE,"This systematic review characterizes and quality-assesses 263 cancer-screening simulation studies, including HPV vaccination and cervical-screening models.",codex-sol-high-wave2-primary-022,W02-BATCH-022,
PMID:34932169,616f11d944bb491f67d5a035f9db1f4aea665c1367b4949cb99adb035f609ec5,include_simulation_or_mechanistic_lead,applied_seed,I_SIMULATION_MECHANISTIC,A probabilistic microsimulation compares risk-assessment and universal admission screening strategies for carbapenemase-producing Enterobacteriaceae.,codex-sol-high-wave2-primary-022,W02-BATCH-022,
PMID:34982766,499ebc444c641be5793096a234f24451f718a0d6a363f1ede995424914a52e0f,include_simulation_or_mechanistic_lead,method_source,I_SIMULATION_MECHANISTIC,"The paper develops the scalable agent-based PanSim framework and uses it to compare targeted vaccination, reopening, quarantine, testing, and other COVID-19 controls.",codex-sol-high-wave2-primary-022,W02-BATCH-022,
PMID:35059369,5b93235a554e8eeab4f7b18c38b058bc414f2a9a5f0b4fe247370724d5876230,include_simulation_or_mechanistic_lead,applied_seed,I_SIMULATION_MECHANISTIC,"A stochastic agent-based model compares isolation, quarantine, personal protection, and community containment for imported COVID-19 outbreaks in China.",codex-sol-high-wave2-primary-022,W02-BATCH-022,
PMID:35157959,6c98710f9b8435cb8d6e77a8e1c2937f20fdd628e1723d33d6fa8f02d53ad822,include_simulation_or_mechanistic_lead,applied_seed,I_SIMULATION_MECHANISTIC,The study uses natural-history microsimulation to estimate cost-effective stopping ages for cancer surveillance after hepatitis C cure.,codex-cli-task5-scope-reader-a-019f81c8-3afa-76c1-ae6c-639363a3a3d4,W02-BATCH-022,
PMID:35175286,fb8eecf02385f350ac3018de14cebf1b70fffe9eb23115cf58e6a1877eab30ba,exclude,,X_NOT_INFECTIOUS_TRANSFERABLE,The comparative breast-cancer screening microsimulations concern inherited cancer variants without an infectious outcome or stated infectious-disease transfer route.,codex-sol-high-wave2-primary-022,W02-BATCH-022,
PMID:35218935,3778db279deaffa8a4be282e665b00ac838e8e993b34966099f0d6414cc66a00,include_simulation_or_mechanistic_lead,applied_seed,I_SIMULATION_MECHANISTIC,"A cervical-disease microsimulation compares HPV, cytology, and colposcopy combinations for post-treatment surveillance after cervical intraepithelial neoplasia.",codex-sol-high-wave2-primary-022,W02-BATCH-022,
PMID:35272954,637a6dd9a8582de294af6ea4fd025e780fe43dfd8395e2cddcabdddfc8ddc0ff,include_simulation_or_mechanistic_lead,applied_seed,I_SIMULATION_MECHANISTIC,A validated hepatitis C microsimulation evaluates a theoretical core-antigen rapid test against laboratory RNA confirmation in Georgia and Malaysia.,codex-sol-high-wave2-primary-022,W02-BATCH-022,
PMID:35316304,1fc2ecbceb9299e1d69d9ea056ef75a58e80a8d97f29bfad84b9ae37f4d0d495,include_method_source_lead,method_source,I_METHOD_SOURCE,"The protocol substantively specifies quasi-experimental estimators and their integration with microsimulation, compartmental, and agent-based HIV forecasting models.",codex-sol-high-wave2-primary-022,W02-BATCH-022,
PMID:35325693,e1c74022d582cf5e252d8c5a9e0b9d28b80677f411b3a29dc291b374db129801,include_simulation_or_mechanistic_lead,applied_seed,I_SIMULATION_MECHANISTIC,The study constructs three microsimulation models to compare COVID-19 vaccine cost-utility across products and population age groups.,codex-cli-task5-scope-reader-a-019f81c8-3afa-76c1-ae6c-639363a3a3d4,W02-BATCH-022,
PMID:35390077,211c05b51696161052bee1ab372a667953a7c9e5b703b70d976a64875c724d75,include_simulation_or_mechanistic_lead,applied_seed,I_SIMULATION_MECHANISTIC,An individual-based model calibrated to Global Burden of Disease estimates compares vitamin A scale-up through measles- and diarrhea-related mortality outcomes in three African countries.,codex-sol-high-wave2-primary-022,W02-BATCH-022,
PMID:35416988,af8a40bebf9cacbc4bbe3917a7b4d14e03fc2b6259919d92bea3163856eaf833,include_simulation_or_mechanistic_lead,method_source,I_SIMULATION_MECHANISTIC,The paper develops and externally validates an HPV- and stage-stratified Markov microsimulation that optimizes surveillance schedules after oropharyngeal cancer treatment.,codex-sol-high-wave2-primary-022,W02-BATCH-022,
PMID:35429107,ef71ff989c00e43b5c1b69ac8d3b012409978d0e32f0d0b86cea753dfd9cc5b7,include_simulation_or_mechanistic_lead,applied_seed,I_SIMULATION_MECHANISTIC,"The MISCAN microsimulation quantifies changing harms, benefits, and efficiency across successive rounds of HPV-based cervical screening in a vaccinated population.",codex-sol-high-wave2-primary-022,W02-BATCH-022,
PMID:35471644,3503f8f16c4c5fd9d46ccdb6eeef6a8782dbf27896f1ff398bc3199ad034da8d,include_simulation_or_mechanistic_lead,applied_seed,I_SIMULATION_MECHANISTIC,"A trial-parameterized HIV microsimulation estimates infections averted, lifetime outcomes, cost-effectiveness, and budget impact of a resilience intervention for Indian MSM.",codex-sol-high-wave2-primary-022,W02-BATCH-022,
PMID:35516446,39c7a9c4a8e4310997ed7bfc9cb2034917401cbc9529c7efbf12e13bee5bcf4f,exclude,,X_NOT_INFECTIOUS_TRANSFERABLE,The microsimulation estimates mortality attributable to excess body weight without an infectious outcome or a concrete infectious-disease transfer route.,codex-sol-high-wave2-primary-022,W02-BATCH-022,
PMID:35521000,342a02827505e8c7865cb8a9c441ab177545327632c84b6909073d8415e926d6,include_simulation_or_mechanistic_lead,applied_seed,I_SIMULATION_MECHANISTIC,"A decision-tree microsimulation informed by meta-analysis compares mortality, kidney injury, costs, and QALYs for antibiotics treating carbapenem-resistant infections.",codex-sol-high-wave2-primary-022,W02-BATCH-022,
PMID:35603904,90aa82a0f0aa370c985ae1ffad06dc6788e9b7bf1ffd93f8a13de76891f20a59,include_method_source_lead,method_source,I_METHOD_SOURCE,The study uses interval-censored survival analysis across three cohorts to estimate and simplify HPV-type-specific clearance transitions for decision models.,codex-sol-high-wave2-primary-022,W02-BATCH-022,
PMID:35703769,dffe0c5259e29a290297d823f21cfc9f045bab153f0a2473de3c45a40b934c9a,include_simulation_or_mechanistic_lead,applied_seed,I_SIMULATION_MECHANISTIC,A stakeholder-informed HIV transmission microsimulation compares racial and ethnic allocation rules for expanded PrEP in Los Angeles County.,codex-sol-high-wave2-primary-022,W02-BATCH-022,
PMID:35809086,34e88851989a54b098822f6d753510a72a9354ea71c555bc555dd8b6d950c468,exclude,,X_NOT_INFECTIOUS_TRANSFERABLE,The Lynch-syndrome colorectal-surveillance microsimulation has no infectious outcome or stated infectious-disease transfer route.,codex-sol-high-wave2-primary-022,W02-BATCH-022,
PMID:35951446,8c37e12eb09ce45f2aff0645cc73c0315ea764c167a333cb9735a4aee7919bb4,include_simulation_or_mechanistic_lead,applied_seed,I_SIMULATION_MECHANISTIC,An HIV microsimulation evaluates effectiveness and equality trade-offs among race-targeted PrEP allocation policies for MSM in Los Angeles County.,codex-sol-high-wave2-primary-022,W02-BATCH-022,
PMID:35973704,e0d797ec8e350a3cafb2bca51f67108d683ae30aa8430518e9e963a077594498,include_method_source_lead,method_source,I_METHOD_SOURCE,"The protocol specifies interrupted-time-series, regression, and microsimulation methods for measuring indirect health-service consequences of pandemic disruption among people with chronic diseases.",codex-sol-high-wave2-primary-022,W02-BATCH-022,
PMID:36047313,0199a6c5957fa1de1ec12110e9dcc20c5c4012547149805323fdb3ef4d37b587,include_simulation_or_mechanistic_lead,applied_seed,I_SIMULATION_MECHANISTIC,"The individual-based microsimulation compares hospital screening algorithms through undetected infections, false positives, and cost per detection.",codex-cli-task5-scope-reader-a-019f81c8-3afa-76c1-ae6c-639363a3a3d4,W02-BATCH-022,
PMID:36060203,e61fe56bee35bed12c22aaabaec17258db64522459d8f5cf732ccd1ee60f60f1,include_simulation_or_mechanistic_lead,applied_seed,I_SIMULATION_MECHANISTIC,The study integrates an SIR model with random contact graphs to compare age-specific classroom SARS-CoV-2 transmission scenarios with and without masks.,codex-sol-high-wave2-primary-022,W02-BATCH-022,
PMID:36113098,ca215ae26bcd2927d47f839e2efa210f908d0de562bf4a3a9d2353f7f173c8b3,include_simulation_or_mechanistic_lead,method_source,I_SIMULATION_MECHANISTIC,"The study compares machine-learning and linear metamodels for reproducing hepatitis C microsimulation outputs, cost-effectiveness curves, and value-of-information results.",codex-sol-high-wave2-primary-022,W02-BATCH-022,
PMID:36179754,7b60762621ce98e5e4d95923321ecc4a72529482306203deb4a1c5f6e5d74567,include_simulation_or_mechanistic_lead,applied_seed,I_SIMULATION_MECHANISTIC,A Markov microsimulation uses longitudinal cohort data to estimate life expectancy and disability-free life expectancy by HIV and viral-suppression status.,codex-sol-high-wave2-primary-022,W02-BATCH-022,
PMID:36184755,6097aa9b05bd8abdbe88033031bf689978b6a2d5214ddaca373e263b7c3fe8dd,include_simulation_or_mechanistic_lead,applied_seed,I_SIMULATION_MECHANISTIC,A trial-informed microsimulation estimates dapivirine-ring effectiveness when women's HIV exposure is divided between vaginal and anal intercourse.,codex-sol-high-wave2-primary-022,W02-BATCH-022,
PMID:36240830,8987fc409564bd641e66442d8dd3a7c9018efd15356d6bbbd7867d9a4baee6cc,include_simulation_or_mechanistic_lead,applied_seed,I_SIMULATION_MECHANISTIC,A Tanzania-parameterized tuberculosis-HIV microsimulation re-evaluates preventive therapy across ART cohorts and CD4 strata using lifetime health and cost outcomes.,codex-sol-high-wave2-primary-022,W02-BATCH-022,
PMID:36277274,5aaef2036f1cd93169ad58a2a16742df1d644920f83cc3290932d942b185982a,exclude,,X_NOT_INFECTIOUS_TRANSFERABLE,The agent-based microsimulation models student travel behavior under pandemic telecommuting but does not model infection or identify a concrete infectious-disease method transfer.,codex-sol-high-wave2-primary-022,W02-BATCH-022,
PMID:36352410,874332ccaeb98149fa2fe533b828860b4a1a33981a39a4eea12b2ac2e370cfb6,include_simulation_or_mechanistic_lead,applied_seed,I_SIMULATION_MECHANISTIC,The study uses two microsimulation models to compare HPV vaccination and screening strategies by elimination timing and harm-benefit balance.,codex-cli-task5-scope-reader-a-019f81c8-3afa-76c1-ae6c-639363a3a3d4,W02-BATCH-022,
PMID:36385698,051560addacc01acee2ab16d727d29732cff911d85570bcf32ca31944e9d12c9,include_diagnostic_or_correction_lead,guidance,I_DIAGNOSTIC_CORRECTION,"The review uses model-derived performance thresholds to diagnose uptake, substitution, sensitivity, and follow-up failures in routine HPV self-sampling programs and recommends mitigations.",codex-sol-high-wave2-primary-022,W02-BATCH-022,
PMID:36478076,f09c1b3c09a2d24a980dc51e4e144bc3927304eb77f18c6ea725739d0ab119a2,include_simulation_or_mechanistic_lead,method_source,I_SIMULATION_MECHANISTIC,The study compares projections from two structurally distinct HIV microsimulations and traces differences to assumptions about disengagement and mortality.,codex-sol-high-wave2-primary-022,W02-BATCH-022,
PMID:36525554,6f33ec0be07a3e6298ff8432c5ac024e37a0ad93f331fce6a053f6b879dc184e,include_simulation_or_mechanistic_lead,applied_seed,I_SIMULATION_MECHANISTIC,A waitlist microsimulation compares standard heart-donor eligibility with accepting hepatitis C-viremic donors followed by antiviral treatment.,codex-sol-high-wave2-primary-022,W02-BATCH-022,
PMID:36645017,fba53ae9cfb814e1729210282bc6b4c5bd68f1ea52c546da01367dc8a032ccc4,include_simulation_or_mechanistic_lead,method_source,I_SIMULATION_MECHANISTIC,The paper develops and internally and externally validates a treatment microsimulation that includes severe infection as a competing clinical transition in vasculitis management.,codex-sol-high-wave2-primary-022,W02-BATCH-022,
PMID:36655795,251b60dbb170df8c31433c0011ea1c21a1759c136f4fc77b775a5f01e692441d,include_simulation_or_mechanistic_lead,applied_seed,I_SIMULATION_MECHANISTIC,"An oral HPV16 natural-history microsimulation estimates causal infection ages, herd effects, and cancer prevention from extending male vaccination beyond age 26.",codex-sol-high-wave2-primary-022,W02-BATCH-022,
PMID:36708500,49c58ff31ce47d1b7de4b423e6f5809cd8f7715062338581e2c2f6c751d137f9,include_simulation_or_mechanistic_lead,applied_seed,I_SIMULATION_MECHANISTIC,A hepatitis B state-transition model with microsimulation compares universal birth vaccination with adolescent vaccination over a lifetime horizon.,codex-sol-high-wave2-primary-022,W02-BATCH-022,
PMID:36727595,5f6aca39361d7ce5be9270283c9077d44f65ed55a9c9274ae5d905a5bf3ac4ec,exclude,,X_NOT_INFECTIOUS_TRANSFERABLE,The newborn hypertrophic-cardiomyopathy genetic-screening microsimulation has no infectious outcome or concrete infectious-disease transfer route.,codex-sol-high-wave2-primary-022,W02-BATCH-022,
PMID:36728397,c3d9c5c7b9a6f67651a289e93c77ec6c7faa9a7d99ffb7b80b41fe803949bcfb,include_simulation_or_mechanistic_lead,applied_seed,I_SIMULATION_MECHANISTIC,"An HIV microsimulation compares recovery and resource-prioritization scenarios following COVID-19 disruption of testing, PrEP, care engagement, and retention.",codex-sol-high-wave2-primary-022,W02-BATCH-022,
PMID:36731986,51abfd650a7bc55244ed458de5433f9635dc9c646888ba10e403490f53ba00b4,include_simulation_or_mechanistic_lead,applied_seed,I_SIMULATION_MECHANISTIC,"An augmented HIV microsimulation compares separate and integrated screening strategies for interdependent substance-use, mood, and pain conditions.",codex-sol-high-wave2-primary-022,W02-BATCH-022,
PMID:36735375,b0e1b22aa8f4dcd2f17f3376197cf84eb083cadad7c1f26b87ed50aeb0e3040b,include_simulation_or_mechanistic_lead,applied_seed,I_SIMULATION_MECHANISTIC,"The microsimulation compares HCV screening frequencies, outbreak assumptions, health outcomes, costs, and decision uncertainty.",codex-cli-task5-scope-reader-a-019f81cb-29c4-73b2-8aba-d441c24d9d90,W02-BATCH-022,
PMID:36749786,ab40ce7860ab42596425604bdd3596ebd8e93b7b14c915fc7845dfaf488d5758,include_simulation_or_mechanistic_lead,applied_seed,I_SIMULATION_MECHANISTIC,"An individual-based microsimulation compares vaccination, testing, booster, and visitation policies for preventing SARS-CoV-2 introductions into nursing homes.",codex-sol-high-wave2-primary-022,W02-BATCH-022,
PMID:36813297,75ab968204929b8e0062f95f5d1dcadcaedeeff24c6817f65d5493519bff6648,include_simulation_or_mechanistic_lead,applied_seed,I_SIMULATION_MECHANISTIC,Observed and counterfactual registry-based microsimulations estimate life-years lost to tuberculosis and subsequent tuberculosis-attributable chronic lung disease.,codex-sol-high-wave2-primary-022,W02-BATCH-022,
PMID:36901023,9f123a04f3c7c12f63e565800754b005d70f812de059138422863ddb4b0185d5,include_simulation_or_mechanistic_lead,applied_seed,I_SIMULATION_MECHANISTIC,"A travel-demand, SARS-CoV-2 transmission, and economic modeling framework compares testing and quarantine policies for travel between Thailand and Singapore.",codex-sol-high-wave2-primary-022,W02-BATCH-022,
PMID:36908469,ae5bbbe6b9947c708870c24b556d01459a5ec0afef7c398f5af237fabf9adfb4,include_simulation_or_mechanistic_lead,applied_seed,I_SIMULATION_MECHANISTIC,"A traveler microsimulation and net-benefit analysis compare quarantine lengths, test types, and vaccination requirements for Singapore border policy.",codex-sol-high-wave2-primary-022,W02-BATCH-022,
PMID:37036716,9402da1284bcc8f1420237208edd66845d965e7ee77a8c11ae68b24a7aec985b,include_simulation_or_mechanistic_lead,applied_seed,I_SIMULATION_MECHANISTIC,"A 23-city microsimulation estimates how continual displacement of unsheltered people who inject drugs affects overdose, injection-related infections, hospitalization, and treatment uptake.",codex-sol-high-wave2-primary-022,W02-BATCH-022,
PMID:37043198,9727975151c402fcce4b9df8c3c9f9e5c4044b7ee800a15d6135b2d423c45fde,include_simulation_or_mechanistic_lead,applied_seed,I_SIMULATION_MECHANISTIC,"The REDUCE microsimulation compares primary-care addiction-service strategies using overdose, severe injection-related infection, hospitalization, mortality, and cost outcomes.",codex-sol-high-wave2-primary-022,W02-BATCH-022,
