candidate_key,source_row_sha256,primary_decision,primary_proposed_record_type,primary_reason_code,primary_reason,primary_reviewer,batch_id,retained_candidate_key
PMID:24122943,f0f233d4f1ad81eb4200be086f55439f0253f4b7363d0ef50c9c2d72e0dd482a,include_simulation_or_mechanistic_lead,method_source,I_SIMULATION_MECHANISTIC,This study develops and simulates a Bayesian reproduction-number estimator accounting for delayed and incomplete reporting.,codex-cli-task5-fix3-reader-a-019f829d-2d28-74a2-816a-93d20ebd8d53,W01-BATCH-027,
PMID:24140322,8999d9d6e4d5dd841d040da2864788444d018741aff432ce0ec9c3a232fbc0bb,include_method_source_lead,method_source,I_METHOD_SOURCE,This study formulates and evaluates a dynamic antibody-based early-warning rule for herd infection surveillance.,codex-cli-task5-fix3-reader-a-019f829d-2d28-74a2-816a-93d20ebd8d53,W01-BATCH-027,
PMID:24152559,f6fd1576af093d10072f1bd2c2d3d6fd5bb32f7dc1f01e295372d3d748c69c1f,exclude,,X_NOT_INFECTIOUS_TRANSFERABLE,This study evaluates marine toxin monitoring for shellfish poisoning and provides no concrete infectious-disease transfer route.,codex-semantic-primary-027,W01-BATCH-027,
PMID:24188144,431fb875237f5875a35fdaf1aba0299774c6a26f78fb2fb56ac6bf3547a710a4,include_diagnostic_or_correction_lead,diagnostic,I_DIAGNOSTIC_CORRECTION,This study evaluates a mobile syndromic surveillance system against existing reporting and established performance attributes.,codex-cli-task5-fix3-reader-a-019f829d-2d28-74a2-816a-93d20ebd8d53,W01-BATCH-027,
PMID:24207050,01696bc32a9e24ce209a5e7c15203880eb88af3fe819e9d9f771c6d7123fce69,include_applied_seed,applied_seed,I_APPLIED_TRANSFERABLE_DESIGN,This study applies an outbreak and detection model to compare hospital transmissibility between MRSA genotypes.,codex-cli-task5-fix3-reader-a-019f829d-2d28-74a2-816a-93d20ebd8d53,W01-BATCH-027,
PMID:24239323,2949304eba52a0e86ed61b853316f5ac7a885ec2232fd285bd22bd9e0081c349,include_applied_seed,applied_seed,I_APPLIED_TRANSFERABLE_DESIGN,"This study integrates surveillance, cluster, travel, and genetic data to estimate epidemic detection and transmissibility.",codex-cli-task5-fix3-reader-a-019f8255-a6ad-7fa1-8e02-16bfab31e15b,W01-BATCH-027,
PMID:24245625,e5a763ecdd6f9f7de2975bdd9113d253604095052b428953cc3cd41dae29c891,include_simulation_or_mechanistic_lead,applied_seed,I_SIMULATION_MECHANISTIC,This study uses stochastic transmission simulations to estimate dengue transmissibility and intervention effects.,codex-cli-task5-fix3-reader-a-019f8255-a6ad-7fa1-8e02-16bfab31e15b,W01-BATCH-027,
PMID:24305574,f76e1833a0ce1d37e14e3067fdd33e6391d2a9621d739c9ab7e306204fd2d7bd,include_simulation_or_mechanistic_lead,applied_seed,I_SIMULATION_MECHANISTIC,This mechanistic transmission model explains asymptomatic norovirus prevalence and resulting case-control study limitations.,codex-cli-task5-fix3-reader-a-019f8255-a6ad-7fa1-8e02-16bfab31e15b,W01-BATCH-027,
PMID:24320011,66f36b6ea594446fa77ab38af109bb8978962f728b3b9bb66c22b932b870634d,include_applied_seed,applied_seed,I_APPLIED_TRANSFERABLE_DESIGN,This study develops a multivariable clinical prediction model for virologic failure using infectious-disease cohort data.,codex-cli-task5-fix3-reader-a-019f8255-a6ad-7fa1-8e02-16bfab31e15b,W01-BATCH-027,
PMID:24391797,cf47d19c43e2979c123abafec551c7c161f4d7bf4c5ad393cefdc8266e89a1cc,include_simulation_or_mechanistic_lead,method_source,I_SIMULATION_MECHANISTIC,This study develops and evaluates a parsimonious nearcasting model for infectious outbreak size and duration.,codex-cli-task5-fix3-reader-a-019f8255-a6ad-7fa1-8e02-16bfab31e15b,W01-BATCH-027,
PMID:24391936,77dcb9735ac8b058a04cb84e64ab458af32f8e5e9ef5b3291137e49f3b0c0063,include_method_source_lead,method_source,I_METHOD_SOURCE,The study develops variance-based approaches for selecting stable microbial outbreak markers.,codex-cli-task5-fix3-blind-019f82aa-9d19-74f1-b307-6366d54ae394,W01-BATCH-027,
PMID:24404138,dab41c255c1726c87dca6269d02e71d45b366496eff56946bfb3f1f122a03387,include_method_source_lead,method_source,I_METHOD_SOURCE,This study compares six methods for estimating HIV reproduction numbers and demonstrates method-dependent results.,codex-cli-task5-fix3-reader-a-019f8255-a6ad-7fa1-8e02-16bfab31e15b,W01-BATCH-027,
PMID:24416781,8cf34659d699ae5629b7a1a58915c67a1227c8663c97fb7ee65cc3a2a7dc1522,include_simulation_or_mechanistic_lead,applied_seed,I_SIMULATION_MECHANISTIC,This mechanistic vector-borne model maps climate-sensitive Chagas transmission risk and transmission-route sensitivity.,codex-cli-task5-fix3-reader-a-019f8255-a6ad-7fa1-8e02-16bfab31e15b,W01-BATCH-027,
PMID:24447577,76b7a4f43e92ddfab7c24cc2d849d2aca2202ae020eb9988bb77aaa3cc42d002,include_applied_seed,applied_seed,I_APPLIED_TRANSFERABLE_DESIGN,This study evaluates vector surveillance as an early-warning indicator for emerging human babesiosis.,codex-cli-task5-fix3-reader-a-019f8255-a6ad-7fa1-8e02-16bfab31e15b,W01-BATCH-027,
PMID:24455910,6ccf41cc8958607d2709391c8484bd5dc426035194a62153f707203618362024,include_applied_seed,applied_seed,I_APPLIED_TRANSFERABLE_DESIGN,This study evaluates media scanning and verification as a supplemental infectious-outbreak surveillance system.,codex-cli-task5-fix3-reader-a-019f8255-a6ad-7fa1-8e02-16bfab31e15b,W01-BATCH-027,
PMID:24490389,c3123859ce76685be0780792cec4c6bb402fc0a58296024c3d1a747424bfb034,include_applied_seed,applied_seed,I_APPLIED_TRANSFERABLE_DESIGN,This study constructs a geospatial real-time surveillance and warning platform for schistosomiasis exposure.,codex-cli-task5-fix3-reader-a-019f8255-a6ad-7fa1-8e02-16bfab31e15b,W01-BATCH-027,
PMID:24503179,ff3dfa327f643a1ade17ec925bad9e823fff361038b2961522347c2015a48aaf,include_applied_seed,applied_seed,I_APPLIED_TRANSFERABLE_DESIGN,This study evaluates pigeon serosurveillance for spatial identification and early warning of West Nile transmission.,codex-cli-task5-fix3-reader-a-019f8255-a6ad-7fa1-8e02-16bfab31e15b,W01-BATCH-027,
PMID:24505344,83046d0878ce0fb74a4b8539821b50c107f98a6aac282e6fe29c6a88fb725936,include_diagnostic_or_correction_lead,diagnostic,I_DIAGNOSTIC_CORRECTION,It benchmarks genomic outbreak-typing analyses against known outbreak membership and conventional PFGE.,codex-cli-task5-fix3-blind-019f82aa-9d19-74f1-b307-6366d54ae394,W01-BATCH-027,
PMID:24551367,197e60ab126a44b9f1b65affce62be24071678179b7a63170383aaa94feccfbe,include_simulation_or_mechanistic_lead,method_source,I_SIMULATION_MECHANISTIC,This study uses simulated surveillance data to benchmark a method for combining outbreak-detection algorithms.,codex-cli-task5-fix3-reader-a-019f8255-a6ad-7fa1-8e02-16bfab31e15b,W01-BATCH-027,
PMID:24573540,044e6fdda812e5c6c95c6f1bf5d540208c273d939f875c9bbb381e63e92ea60b,include_method_source_lead,method_source,I_METHOD_SOURCE,This study presents a spatial seroprevalence method for identifying geographic pockets of mumps outbreak risk.,codex-cli-task5-fix3-reader-a-019f8255-a6ad-7fa1-8e02-16bfab31e15b,W01-BATCH-027,
PMID:24574290,9c445ce9bd1e7be35513ed6170343421bc5314b97e4c67347fa47e514a61ce92,include_diagnostic_or_correction_lead,diagnostic,I_DIAGNOSTIC_CORRECTION,The study develops and evaluates real-time genomic typing tools for pathogen surveillance.,codex-cli-task5-fix3-blind-019f82aa-9d19-74f1-b307-6366d54ae394,W01-BATCH-027,
PMID:24576475,79d7b2552adf7ea97008242d331ce1e4d109612e7fc2007231ff7caa370b61df,include_diagnostic_or_correction_lead,guidance,I_DIAGNOSTIC_CORRECTION,This paper derives transferable risk-communication guidance from a silent poliovirus reintroduction detected through sewage surveillance.,codex-cli-task5-fix3-reader-a-019f8255-a6ad-7fa1-8e02-16bfab31e15b,W01-BATCH-027,
PMID:24585563,809802b0336e4915c9c48779ea21b11337da68657989fdd2fb608528388cb22a,exclude,,X_COMMENTARY_ONLY,"This editorial contains no supplied abstract or substantive method, evaluation, or guidance content.",codex-semantic-primary-027,W01-BATCH-027,
PMID:24585566,45788f7e973e7e72af396dc277dafeeaf2bd7fcb7dd9d3230150047a544af9ae,include_applied_seed,applied_seed,I_APPLIED_TRANSFERABLE_DESIGN,This pilot applies standardized early-warning indicators to evaluate programmatic risks for HIV drug resistance.,codex-cli-task5-fix3-reader-a-019f8255-a6ad-7fa1-8e02-16bfab31e15b,W01-BATCH-027,
PMID:24611126,d8ba0a2edee65b5cd99d00cd310bcb41fef8090a912db73705ca8a4d231d83c4,exclude,,X_DUPLICATE,"This record duplicates the supplied peer's title, abstract, year, journal, and authors despite distinct identifiers.",codex-cli-task5-fix3-reader-a-019f8255-a6ad-7fa1-8e02-16bfab31e15b,W01-BATCH-027,PMID:25914857
PMID:24650863,aecf36210ebcb59a211b7740229ebf0c42abfe49c285be1e2c1a3194e969932d,exclude,,X_DESCRIPTIVE_ONLY,This preliminary outbreak report describes cases and response alerts without a transferable design or method evaluation.,codex-semantic-primary-027,W01-BATCH-027,
PMID:24700976,cfe35452dfb4cdd706ebf35655e0ab366536ac350e89989205337d2496ee2198,include_method_source_lead,method_source,I_METHOD_SOURCE,This study compares three methods for estimating effective reproduction numbers from routine notification data.,codex-cli-task5-fix3-reader-a-019f8255-a6ad-7fa1-8e02-16bfab31e15b,W01-BATCH-027,
PMID:24708869,51035799a376b5734d6d13780d66a31ab971d499931837bbbaf29c6fa01c50e3,include_method_source_lead,method_source,I_METHOD_SOURCE,"This study compares deterministic, stochastic, regression, and Bayesian methods for estimating dengue reproduction numbers.",codex-cli-task5-fix3-reader-a-019f8255-a6ad-7fa1-8e02-16bfab31e15b,W01-BATCH-027,
PMID:24725750,abfed021563082efdd9f0afc2e0375b4ef2f03d3719157f59d5ada7fcff3acf8,include_applied_seed,applied_seed,I_APPLIED_TRANSFERABLE_DESIGN,This study applies standardized population-level indicators to monitor programmatic emergence of HIV drug resistance.,codex-cli-task5-fix3-reader-a-019f8255-a6ad-7fa1-8e02-16bfab31e15b,W01-BATCH-027,
PMID:24731529,897ab8c0c36f91e06c2f4d130f2b94052dd5ab9aaffe742da2b9477ed1bbec53,exclude,,X_DESCRIPTIVE_ONLY,This experimental biomarker study concerns individual host inflammatory physiology rather than transferable infectious-disease epidemiology.,codex-cli-task5-fix3-reader-a-019f8255-a6ad-7fa1-8e02-16bfab31e15b,W01-BATCH-027,
PMID:24761859,e70379539822f2e30121e8884254ec1f073c62a72296e175a20531db1ea5cf8f,exclude,,X_DESCRIPTIVE_ONLY,This questionnaire survey only describes medical students' cervical-cancer and HPV knowledge without an eligible epidemiological method.,codex-cli-task5-fix3-reader-a-019f8256-4185-7093-8b69-a5a0b4724ace,W01-BATCH-027,
PMID:24786800,4312764879ce1cb08a8a27d3fe7bf18361c85e7534e6ee3eab05c2aa517a6d06,include_applied_seed,applied_seed,I_APPLIED_TRANSFERABLE_DESIGN,The study infers measles introduction and transmissibility trends using a generalizable chain-based approach.,codex-cli-task5-fix3-blind-019f82aa-9d19-74f1-b307-6366d54ae394,W01-BATCH-027,
PMID:24800561,af3a1b6a174c4f258c7de92827908ab3a4e16a13523fec41b80473a94dc85c3a,include_applied_seed,applied_seed,I_APPLIED_TRANSFERABLE_DESIGN,This study evaluates an automated malaria warning system's association with timelier case investigation and response.,codex-cli-task5-fix3-reader-a-019f8256-4185-7093-8b69-a5a0b4724ace,W01-BATCH-027,
PMID:24812861,c89fb2c3a78942f84dd4acb91d5421ddc2bf2779f8bfd830bd2af5627ed6b455,include_applied_seed,applied_seed,I_APPLIED_TRANSFERABLE_DESIGN,The study applies and evaluates a moving-percentile infectious-disease early-warning method.,codex-cli-task5-fix3-blind-019f82aa-9d19-74f1-b307-6366d54ae394,W01-BATCH-027,
PMID:24841859,9519e9b93cbf74af333a94cb95fa9706c6e646294ea07010f142f127ef9f46dd,include_applied_seed,applied_seed,I_APPLIED_TRANSFERABLE_DESIGN,This applied Bayesian framework combines climate forecasts and surveillance for probabilistic dengue warnings.,codex-cli-task5-fix3-blind-019f82aa-9d19-74f1-b307-6366d54ae394,W01-BATCH-027,
PMID:24891460,b0b644596b6f2873fef7e729e0f57e6aee22af73c857d2e21d0087d169e38157,exclude,,X_DESCRIPTIVE_ONLY,"This report describes malaria model implementation sites but supplies no evaluated model, estimator, or surveillance method.",codex-cli-task5-fix3-reader-a-019f8256-4185-7093-8b69-a5a0b4724ace,W01-BATCH-027,
PMID:24916839,a6b8fa1b343658ebec08d5db08800be5920cbdf1b3a0a46425499ee7d6218449,include_simulation_or_mechanistic_lead,method_source,I_SIMULATION_MECHANISTIC,This study develops irregular space-time scan statistics and evaluates their outbreak-detection properties through simulation and influenza data.,codex-cli-task5-fix3-reader-a-019f8256-4185-7093-8b69-a5a0b4724ace,W01-BATCH-027,
PMID:24924622,beab2ce72b894052d88fb40d4b1b2d5e7c87dff9e20c544a29e62c4499f6e68d,include_applied_seed,applied_seed,I_APPLIED_TRANSFERABLE_DESIGN,This study models climate and land-use predictors to provide early warning of mosquito-vector abundance and phenology.,codex-cli-task5-fix3-reader-a-019f8256-4185-7093-8b69-a5a0b4724ace,W01-BATCH-027,
PMID:24943022,79bc8aa32cbc4e5160bfd6044445ed8510e6227b1460b88fd139397c71826239,include_method_source_lead,method_source,I_METHOD_SOURCE,This study constructs moving-average control charts and warning thresholds for syndromic surveillance of infectious diarrhea.,codex-cli-task5-fix3-reader-a-019f8256-4185-7093-8b69-a5a0b4724ace,W01-BATCH-027,
PMID:24969444,4a8c0a7f8b6910ee470530cafa6200b6063c8c08d9c1fa3c481233f084669c1b,exclude,,X_COMMENTARY_ONLY,This editorial has no supplied abstract or substantive methodological content for screening.,codex-semantic-primary-027,W01-BATCH-027,
PMID:24969447,5f8b5c9c2334b335816e67ba67db7ea8ef28901a3fc900426d69c8ef7c983d07,include_method_source_lead,method_source,I_METHOD_SOURCE,"This study compares temporal and spatiotemporal outbreak-detection models using sensitivity, false alarms, and detection timing.",codex-cli-task5-fix3-reader-a-019f8256-4185-7093-8b69-a5a0b4724ace,W01-BATCH-027,
PMID:24969448,93a90cbfed1cd5fb7bbbf218cbc7a2849492c8edf237ec354d1bd419e0a6a3e7,include_method_source_lead,method_source,I_METHOD_SOURCE,This study evaluates province-specific moving-percentile thresholds for reducing surveillance alerts while preserving outbreak-detection performance.,codex-cli-task5-fix3-reader-a-019f8256-4185-7093-8b69-a5a0b4724ace,W01-BATCH-027,
PMID:24988387,ab2e831d73c0ddb82a4c43615f79f2e2136dd84f616e600e5adf9b3581d4f8cb,include_applied_seed,applied_seed,I_APPLIED_TRANSFERABLE_DESIGN,This study implements and validates standardized early-warning indicators for monitoring programmatic risks of HIV drug resistance.,codex-cli-task5-fix3-reader-a-019f8256-4185-7093-8b69-a5a0b4724ace,W01-BATCH-027,
PMID:24993555,413397ce1840721a310773bb140bf6f7c7c7c5e6ac35d618a29f7840774b7e4e,exclude,,X_DESCRIPTIVE_ONLY,This family-cluster investigation describes probable limited H7N9 transmission without developing or evaluating a transferable method.,codex-cli-task5-fix3-reader-a-019f8256-4185-7093-8b69-a5a0b4724ace,W01-BATCH-027,
PMID:25002465,fbe6cbb41b469ef1b1fef30631065b096cf4a04019e6c2912a7c9e1cf2ff70ef,include_simulation_or_mechanistic_lead,applied_seed,I_SIMULATION_MECHANISTIC,This fitted transmission model estimates age-specific contributions to poliovirus spread and evaluates outbreak-response timing.,codex-cli-task5-fix3-reader-a-019f8256-4185-7093-8b69-a5a0b4724ace,W01-BATCH-027,
PMID:25015257,c8a8ac21cbee9194cf0c7d170b7f4230c0399ef6d9aee2ba4a8514d14a231784,include_simulation_or_mechanistic_lead,method_source,I_SIMULATION_MECHANISTIC,This study derives an analytic reproduction-number approximation for cellular SIR networks and assesses it through simulation.,codex-cli-task5-fix3-reader-a-019f8256-4185-7093-8b69-a5a0b4724ace,W01-BATCH-027,
PMID:25062035,b459cbcc86171de6db4f883ca07750f924c6258be8fb8cf0e9d964dbda5e9973,include_diagnostic_or_correction_lead,diagnostic,I_DIAGNOSTIC_CORRECTION,This study validates rapid whole-genome sequencing as a practical public-health method for detecting Salmonella outbreak clusters.,codex-cli-task5-fix3-reader-a-019f8256-4185-7093-8b69-a5a0b4724ace,W01-BATCH-027,
PMID:25108536,99ccd6cedc4aebf5e2b7ea455664e88a283dd2a26ada9459ae217ac63b36a0bd,exclude,,X_DESCRIPTIVE_ONLY,This incident follow-up reports no hepatitis A transmission but does not develop or evaluate a transferable analytic method.,codex-semantic-primary-027,W01-BATCH-027,
PMID:25155113,ac359962b09e2297120db4a4726e818efd20994213561a685cbba11471be5f39,include_applied_seed,applied_seed,I_APPLIED_TRANSFERABLE_DESIGN,This study evaluates sentinel chickens as surveillance indicators and early warnings for human West Nile neuroinvasive disease.,codex-cli-task5-fix3-reader-a-019f8256-4185-7093-8b69-a5a0b4724ace,W01-BATCH-027,
PMID:25160360,42dc3a075837f2a8f1b792da7d0638e7739e59b521ad6c51e100a7768643bf92,include_method_source_lead,method_source,I_METHOD_SOURCE,This study develops an ensemble of analytical techniques for detecting dengue outbreaks from incidence data.,codex-cli-task5-fix3-reader-a-019f8256-4185-7093-8b69-a5a0b4724ace,W01-BATCH-027,
PMID:25168169,af829ac17691f7e169e1e80ee2eaf4f8f1cb199d49808517e547d6e748b0d93d,include_simulation_or_mechanistic_lead,method_source,I_SIMULATION_MECHANISTIC,This study develops reproduction-number estimators for discretely observed surveillance data and evaluates their finite-sample behavior by simulation.,codex-cli-task5-fix3-reader-a-019f8256-4185-7093-8b69-a5a0b4724ace,W01-BATCH-027,
PMID:25170873,3820016d9cf7202630762f55f404f1384963926e1595be62afdf3bb7714971ab,include_diagnostic_or_correction_lead,diagnostic,I_DIAGNOSTIC_CORRECTION,"The study evaluates sensitivity, specificity, and timeliness of a dengue outbreak-detection tool.",codex-cli-task5-fix3-blind-019f82aa-9d19-74f1-b307-6366d54ae394,W01-BATCH-027,
PMID:25186370,c877fd42d7acd0d65a7c3af291afd72b838e94fbba7dca283d4805b2868b3416,include_applied_seed,applied_seed,I_APPLIED_TRANSFERABLE_DESIGN,"This systematic review synthesizes reproduction-number estimates across seasonal, pandemic, and zoonotic influenza settings.",codex-cli-task5-fix3-reader-a-019f8256-4185-7093-8b69-a5a0b4724ace,W01-BATCH-027,
PMID:25189942,bfc34679c58dc555367ebdb1cc7142b60106f46a075df66b8f8279083deb50eb,exclude,,X_COMMENTARY_ONLY,This editorial has no supplied abstract or substantive early-warning method content.,codex-semantic-primary-027,W01-BATCH-027,
PMID:25304421,cf4aa51ae2a6c082ac8da06cc5a43a60e6acea3f37b9665d707115d4ea695b8c,include_simulation_or_mechanistic_lead,applied_seed,I_SIMULATION_MECHANISTIC,This applied transmission model estimates how targeted preventive and curative interventions alter hepatitis C spread.,codex-cli-task5-fix3-reader-a-019f8258-b8b6-7922-99cb-97a5cb7cb74b,W01-BATCH-027,
PMID:25305542,d02b4bba381b22d8ccd8f73e9d465c34c7f9675e980e27e7967bb0ad878bf0bc,include_simulation_or_mechanistic_lead,method_source,I_SIMULATION_MECHANISTIC,"This study reconciles competing derivations of reproduction numbers through mechanistic dengue, tuberculosis, and sexually transmitted infection models.",codex-cli-task5-fix3-reader-a-019f8258-b8b6-7922-99cb-97a5cb7cb74b,W01-BATCH-027,
PMID:25331668,247d4bfa7db1f1e56f9cc89d90d388b8db99b22acfa63fe6948ff4fe4ba76587,exclude,,X_DUPLICATE,This record duplicates the supplied peer describing the same Danish primary-care Early Warning Score study.,codex-cli-task5-fix3-reader-a-019f8258-b8b6-7922-99cb-97a5cb7cb74b,W01-BATCH-027,PMID:26550630
PMID:25378746,9c428f7f56f5b6495cbd67e3d1e0be4e62cbed4b0855cb21d422526dd678467f,include_applied_seed,applied_seed,I_APPLIED_TRANSFERABLE_DESIGN,This study documents implementation and operational performance of a transferable post-disaster infectious-disease early-warning network.,codex-cli-task5-fix3-reader-a-019f8258-b8b6-7922-99cb-97a5cb7cb74b,W01-BATCH-027,
PMID:25403237,c0c13592ff3302d40c090bb6f3d38ef4d0eed410f59a9e6335cff5a173023792,include_method_source_lead,method_source,I_METHOD_SOURCE,This systematic review compares methods and performance evidence for drug-sales outbreak surveillance.,codex-cli-task5-fix3-blind-019f82aa-9d19-74f1-b307-6366d54ae394,W01-BATCH-027,
PMID:25409025,37c32f679e28c7175c7532e05a2efadd87bb7c9622df523961866147edbfc544,include_simulation_or_mechanistic_lead,method_source,I_SIMULATION_MECHANISTIC,This simulation framework evaluates single-stream and multistream outbreak surveillance under realistic healthcare-seeking behavior.,codex-cli-task5-fix3-reader-a-019f8258-b8b6-7922-99cb-97a5cb7cb74b,W01-BATCH-027,
PMID:25414260,30dde602b2d77d3c59498faa7be9c427a0659dc6dfa4477c198edbcfc0e46b49,include_method_source_lead,method_source,I_METHOD_SOURCE,This study develops and prospectively evaluates the ALERT algorithm for identifying community influenza-season onset.,codex-cli-task5-fix3-reader-a-019f8258-b8b6-7922-99cb-97a5cb7cb74b,W01-BATCH-027,
PMID:25427666,a437fb586d28a39c795bc1002d705266e6d6deddd9045c34e0f7d54fdd48c538,include_applied_seed,applied_seed,I_APPLIED_TRANSFERABLE_DESIGN,This study applies and evaluates a space-time scan statistic for detecting domestically acquired typhoid outbreaks.,codex-cli-task5-fix3-reader-a-019f8258-b8b6-7922-99cb-97a5cb7cb74b,W01-BATCH-027,
PMID:25445482,dfc3698a29a07f61ffc3af59c4302c074f31284039a0fc5170330ed1f477b169,include_simulation_or_mechanistic_lead,method_source,I_SIMULATION_MECHANISTIC,This study develops and validates a machine-learning model for predicting outbreak-detection performance across simulated surveillance scenarios.,codex-cli-task5-fix3-reader-a-019f8258-b8b6-7922-99cb-97a5cb7cb74b,W01-BATCH-027,
PMID:25548189,35be302da2165f06eaa2a20d201360db5a1a877df8e7607d0edccbaedaf8b738,include_applied_seed,applied_seed,I_APPLIED_TRANSFERABLE_DESIGN,This evolutionary epidemiology study traces the poultry influenza genotype that enabled emergence of a novel human virus.,codex-cli-task5-fix3-reader-a-019f8258-b8b6-7922-99cb-97a5cb7cb74b,W01-BATCH-027,
PMID:25566974,5e1953a1b5a52631efd40dcd4253a06e351a110988fc0e4c91d1ec0e9c02c602,include_simulation_or_mechanistic_lead,method_source,I_SIMULATION_MECHANISTIC,This reproducible simulation benchmark compares multiple algorithms for detecting artificial outbreaks in slaughterhouse surveillance data.,codex-cli-task5-fix3-reader-a-019f8258-b8b6-7922-99cb-97a5cb7cb74b,W01-BATCH-027,
PMID:25590612,689f0bb04c84a867c3ea518061c6efe7fa5a0a566cb3d18cc740c5197ee89471,include_simulation_or_mechanistic_lead,method_source,I_SIMULATION_MECHANISTIC,This study extends reproduction-number methods to quantify time-varying malaria interventions under seasonal transmission.,codex-cli-task5-fix3-reader-a-019f8258-b8b6-7922-99cb-97a5cb7cb74b,W01-BATCH-027,
PMID:25612253,80413d326a80e74355b1892af292306071930d79ca423e0c402295da3153776b,include_simulation_or_mechanistic_lead,method_source,I_SIMULATION_MECHANISTIC,"This study develops and simulates new change-point tests, then demonstrates them for HIV transmission correlates.",codex-cli-task5-fix3-reader-a-019f8258-b8b6-7922-99cb-97a5cb7cb74b,W01-BATCH-027,
PMID:25613653,15d82962167525a1b81534d4c9b4fca319b1532de0b15e8c2ece6e1617cde6cf,include_simulation_or_mechanistic_lead,applied_seed,I_SIMULATION_MECHANISTIC,"This applied multicohort transmission model combines serology, vaccination, and contacts to estimate measles resurgence risk.",codex-cli-task5-fix3-reader-a-019f8258-b8b6-7922-99cb-97a5cb7cb74b,W01-BATCH-027,
PMID:25619149,3fa71c8a7ea03dd3bb3508f885b4c757c96d04d16bf4b72ce8fa8e4493c6aa8c,include_simulation_or_mechanistic_lead,applied_seed,I_SIMULATION_MECHANISTIC,The study reconstructs Ebola transmission chains and simulates intervention effects on continued spread.,codex-cli-task5-fix3-blind-019f82aa-9d19-74f1-b307-6366d54ae394,W01-BATCH-027,
PMID:25642357,4f998a5ba273d0361c4156601f3e1be95ea84ede902f80f4fa318a668ad6128a,include_method_source_lead,method_source,I_METHOD_SOURCE,This study introduces piecewise exponential methodology for real-time estimation of changing Ebola transmission dynamics.,codex-cli-task5-fix3-reader-a-019f8258-b8b6-7922-99cb-97a5cb7cb74b,W01-BATCH-027,
PMID:25642364,b3bc618dc19573f2d6b2afdff830b31e509728a425703a58b3a46888c71a4eba,include_simulation_or_mechanistic_lead,applied_seed,I_SIMULATION_MECHANISTIC,This applied SEIR model estimates basic and effective reproduction numbers for Ebola across three countries.,codex-cli-task5-fix3-reader-a-019f8258-b8b6-7922-99cb-97a5cb7cb74b,W01-BATCH-027,
PMID:25756205,c72c58544d8085bc7f55d418dc128904693480d6a96d3da2149fdd139bab80d2,include_method_source_lead,method_source,I_METHOD_SOURCE,The study develops and compares an iterative Serfling regression procedure for influenza peak warning.,codex-cli-task5-fix3-reader-a-019f8259-0c13-7a30-820e-bb49a9bb8505,W01-BATCH-027,
PMID:25787265,f2a12d7abe62110d9c489e0139e70d55bff9358880137c17d7868c330df69ebe,exclude,,X_NOT_INFECTIOUS_TRANSFERABLE,This study models initiation into injection drug use rather than an infectious-disease outcome and supplies no concrete infectious transfer route.,codex-semantic-primary-027,W01-BATCH-027,
PMID:25793764,10792ed085db82642d9274f1070f1412b96dac52b7e6b3f5662db76bb1f64d22,include_simulation_or_mechanistic_lead,method_source,I_SIMULATION_MECHANISTIC,The study numerically evaluates when the basic reproduction number poorly predicts outbreak size on temporal networks.,codex-cli-task5-fix3-reader-a-019f8259-0c13-7a30-820e-bb49a9bb8505,W01-BATCH-027,
PMID:25800536,fa20f5c85f7af8de4da9e4901ab657d283a373532aeaabf852a37a175897bd22,include_diagnostic_or_correction_lead,correction,I_DIAGNOSTIC_CORRECTION,This erratum supplies correction information for an infectious-disease reproduction-number methods article.,codex-cli-task5-fix3-reader-a-019f8259-0c13-7a30-820e-bb49a9bb8505,W01-BATCH-027,
