candidate_key,source_row_sha256,primary_decision,primary_proposed_record_type,primary_reason_code,primary_reason,primary_reviewer,batch_id,retained_candidate_key
PMID:39173668,c1b5fd09c29d35cf70c712f5affc40ff52f34fa6cd1556815daec161f56fec1c,include_applied_seed,applied_seed,I_APPLIED_TRANSFERABLE_DESIGN,This study applies open-source epidemic intelligence to infectious-disease monitoring when formal wartime surveillance is disrupted.,codex-cli-task5-fix3-reader-a-019f8280-c983-74d2-9c5c-ad23cd3b0c69,W01-BATCH-035,
PMID:39182502,5ec4ed844e6a802a74db28b006496e2f32659c5906602605a1a9034e50ff54b9,include_diagnostic_or_correction_lead,diagnostic,I_DIAGNOSTIC_CORRECTION,This multisite study evaluates wastewater surveillance as an early-warning and negative-prediction system for facility outbreaks.,codex-cli-task5-fix3-reader-a-019f8280-c983-74d2-9c5c-ad23cd3b0c69,W01-BATCH-035,
PMID:39187763,8259e69e440d3362782d7c16182ad31e63a9d6408e4261b036585736678d751f,include_applied_seed,applied_seed,I_APPLIED_TRANSFERABLE_DESIGN,This applied study combines phylogenetic clustering with machine-learning source attribution for foodborne-outbreak detection.,codex-cli-task5-fix3-reader-a-019f8280-c983-74d2-9c5c-ad23cd3b0c69,W01-BATCH-035,
PMID:39188798,b99bd9d828f80630778a1ae368735685de3abbcee050f16dbf16343d72804926,include_applied_seed,applied_seed,I_APPLIED_TRANSFERABLE_DESIGN,This study evaluates longitudinal cycle-threshold measurements as early indicators of COVID-19 incidence and transmission changes.,codex-cli-task5-fix3-reader-a-019f8280-c983-74d2-9c5c-ad23cd3b0c69,W01-BATCH-035,
PMID:39208725,239eebc9a3106a2e90d2a49aac66a04739d840d9e1b574cbeff24ff05ab78f65,exclude,,X_DESCRIPTIVE_ONLY,This review concerns nanomaterial aptasensor mechanisms and laboratory detection products rather than transferable epidemiological methods.,codex-cli-task5-fix3-reader-a-019f8280-c983-74d2-9c5c-ad23cd3b0c69,W01-BATCH-035,
PMID:39222652,02557bac403684f412a42bf644ad2368a450481930f7a929dc4b4ebed045f5db,include_applied_seed,applied_seed,I_APPLIED_TRANSFERABLE_DESIGN,"This outbreak investigation reconstructs Ebola transmission chains and estimates incubation, fatality, and reproduction quantities.",codex-cli-task5-fix3-reader-a-019f8280-c983-74d2-9c5c-ad23cd3b0c69,W01-BATCH-035,
PMID:39232644,dfc86ed316945922044888de0cbc7a873f20ee546d0a4ff0d19ae5cf91a0da52,include_diagnostic_or_correction_lead,diagnostic,I_DIAGNOSTIC_CORRECTION,This study compares four clinical scores and derives cutoffs for early septic-shock prediction in diabetic patients.,codex-cli-task5-fix3-reader-a-019f8280-c983-74d2-9c5c-ad23cd3b0c69,W01-BATCH-035,
PMID:39255234,4b2c48407633678f9dc6f5a583a95191000e8836853daf068bb477bbcfe283d8,include_applied_seed,applied_seed,I_APPLIED_TRANSFERABLE_DESIGN,"This study estimates incubation, generation-time, presymptomatic-transmission, and reproduction-number distributions from historical mpox outbreaks.",codex-cli-task5-fix3-reader-a-019f8280-c983-74d2-9c5c-ad23cd3b0c69,W01-BATCH-035,
PMID:39259088,125ba6abf00aa38f3c5e7f0e098b61ddffa4dda88eea4f91d076ea46924de823,include_applied_seed,applied_seed,I_APPLIED_TRANSFERABLE_DESIGN,This outbreak study estimates time-varying reproduction numbers using parametric and nonparametric generation-interval approaches.,codex-cli-task5-fix3-reader-a-019f8280-c983-74d2-9c5c-ad23cd3b0c69,W01-BATCH-035,
PMID:39290761,ba669f80f670f2b800bc92eebf8f5347dd563b607b9773041bed74656f0e6b52,include_applied_seed,applied_seed,I_APPLIED_TRANSFERABLE_DESIGN,"This ecological application estimates regional reproduction numbers, doubling times, growth rates, and epidemic peaks.",codex-cli-task5-fix3-reader-a-019f8280-c983-74d2-9c5c-ad23cd3b0c69,W01-BATCH-035,
PMID:39296070,6940be5ae81063333ba0f2136d28c9845687a253289f7968a93ab3afbc01ae93,include_applied_seed,applied_seed,I_APPLIED_TRANSFERABLE_DESIGN,"This longitudinal cholera surveillance application combines rapid testing, culture, risk modelling, and early-warning response systems.",codex-cli-task5-fix3-reader-a-019f8280-c983-74d2-9c5c-ad23cd3b0c69,W01-BATCH-035,
PMID:39300391,90c617e47d3a59d089a9fca7d9cd46a551f0d6af5429e22fd73501cdf96545ca,include_applied_seed,applied_seed,I_APPLIED_TRANSFERABLE_DESIGN,This study applies count-regression models to evaluate internet searches for early warning and epidemic prediction.,codex-cli-task5-fix3-reader-a-019f8280-c983-74d2-9c5c-ad23cd3b0c69,W01-BATCH-035,
PMID:39338944,9a0981b44ac64d793b26f814c5feb7266c7e306e4ac18be475ef6a11af02e6b2,include_applied_seed,applied_seed,I_APPLIED_TRANSFERABLE_DESIGN,"The study combines climate, rodent surveillance, and lagged regression to develop an outbreak early-warning framework.",codex-cli-task5-fix3-reader-a-019f8280-ea69-72d1-867c-bd7ab3c87833,W01-BATCH-035,
PMID:39365069,41a150321cfe588068d34780b141014c13cf34b7930631e1cf6b99d0f0a68dbe,include_diagnostic_or_correction_lead,diagnostic,I_DIAGNOSTIC_CORRECTION,The study evaluates Nanopore sequencing accuracy for outbreak clustering and identifies clone-specific methylation failures.,codex-cli-task5-fix3-reader-a-019f8280-ea69-72d1-867c-bd7ab3c87833,W01-BATCH-035,
PMID:39366706,3de98e486e971adb9c6e50fd955ecb29459b596ccb1e12917d23c52fddab67dd,exclude,,X_COMMENTARY_ONLY,The narrative overview advocates climate-informed surveillance but does not develop or evaluate a transferable method.,codex-cli-task5-fix3-reader-a-019f8280-ea69-72d1-867c-bd7ab3c87833,W01-BATCH-035,
PMID:39371154,feccc6502e5e9544f99492549436ae329693527f7d0c4a89d55536efe7c6367d,exclude,,X_DUPLICATE,This preprint reports the same EDS-HAT study later published as PMID:40302215.,codex-semantic-primary-035,W01-BATCH-035,PMID:40302215
PMID:39373471,6d60e00109fd7e443ec80977bc11b1cb68af2aa0bec036a1b2900b2537dbbc94,include_method_source_lead,method_source,I_METHOD_SOURCE,The paper develops and validates NanoCore for read-based bacterial genomic surveillance and outbreak clustering.,codex-cli-task5-fix3-reader-a-019f8280-ea69-72d1-867c-bd7ab3c87833,W01-BATCH-035,
PMID:39391609,22d53ab84bb8d393c70fe8cdf76f2f6194f5a65135bc955d4c3814efe4f7be9a,exclude,,X_NOT_INFECTIOUS_TRANSFERABLE,The laboratory study identifies volatile markers of food spoilage without an infectious-disease epidemiological transfer route.,codex-cli-task5-fix3-reader-a-019f8280-ea69-72d1-867c-bd7ab3c87833,W01-BATCH-035,
PMID:39408139,3f5363ae4064f277c20008b8c78972dce9c8dbc54e91da1b8d7e83983a99887a,include_diagnostic_or_correction_lead,guidance,I_DIAGNOSTIC_CORRECTION,"The review inventories avian-influenza data sources, models, and early-warning systems to guide integrated surveillance.",codex-cli-task5-fix3-reader-a-019f8280-ea69-72d1-867c-bd7ab3c87833,W01-BATCH-035,
PMID:39428250,901244694ee1cd2b1b203e5a75e7dfcfdc3eba4eeff48b10154c38d5de6b4f45,include_applied_seed,applied_seed,I_APPLIED_TRANSFERABLE_DESIGN,The article describes implementation and performance of an integrated artificial-intelligence infectious-disease monitoring and response system.,codex-cli-task5-fix3-reader-a-019f8280-ea69-72d1-867c-bd7ab3c87833,W01-BATCH-035,
PMID:39446805,80728584b5f903110b34565868512c17d215eea0ce9c018da648c9899646afde,include_diagnostic_or_correction_lead,guidance,I_DIAGNOSTIC_CORRECTION,"The scoping review maps infectious-disease forecasting systems, operational gaps, and priorities for climate-health adaptation.",codex-cli-task5-fix3-reader-a-019f8280-ea69-72d1-867c-bd7ab3c87833,W01-BATCH-035,
PMID:39475072,cb1f34b45881da4a42b7af57a22aecd640decf6148ff4718ecacd7477844166a,include_diagnostic_or_correction_lead,guidance,I_DIAGNOSTIC_CORRECTION,The data-driven commentary diagnoses measurement limitations affecting wastewater surveillance of antibiotic-resistant bacteria and genes.,codex-cli-task5-fix3-reader-a-019f8280-ea69-72d1-867c-bd7ab3c87833,W01-BATCH-035,
PMID:39477659,ed4d99bbd52a8583fc62b71ab1da72ae877c487fb3d4b6c053c33c415a9e08dc,uncertain_retrieve_primary,,U_PRIMARY_RECORD_NEEDED,"The title suggests infection monitoring, but no abstract is supplied to establish the study design or contribution.",codex-semantic-primary-035,W01-BATCH-035,
PMID:39488222,76b519176fe141a79cfeccf12d1c0ca581119e3231f918de17370d192dc12a9a,include_applied_seed,applied_seed,I_APPLIED_TRANSFERABLE_DESIGN,The report applies a recurring indicator framework that includes climate-sensitive infectious-disease transmission risks and preparedness.,codex-cli-task5-fix3-reader-a-019f8280-ea69-72d1-867c-bd7ab3c87833,W01-BATCH-035,
PMID:39510516,3bf25f8d307b314c114472bf086c53ff788db89bc2cd7029f02a8122007fb5ba,include_diagnostic_or_correction_lead,guidance,I_DIAGNOSTIC_CORRECTION,The scoping review evaluates acute-respiratory-infection early-warning systems and identifies validation and standardization needs.,codex-cli-task5-fix3-reader-a-019f8280-ea69-72d1-867c-bd7ab3c87833,W01-BATCH-035,
PMID:39511577,4bc9c41673d2b274ad2d21fe3862adf070423b69cd775aade5e62bd2ff8d5136,include_diagnostic_or_correction_lead,guidance,I_DIAGNOSTIC_CORRECTION,"The systematic review compares infectious-disease early-warning data sources, technologies, limitations, and future integration priorities.",codex-cli-task5-fix3-reader-a-019f8280-ea69-72d1-867c-bd7ab3c87833,W01-BATCH-035,
PMID:39527637,24f7ddf5931fec74b8e27fb67bb72e101195a4adf4370f71c61a14419582d9aa,include_simulation_or_mechanistic_lead,method_source,I_SIMULATION_MECHANISTIC,This study develops and benchmarks joint phylodynamic and epidemiological inference for reproduction-number estimation.,codex-cli-task5-fix3-reader-a-019f8280-f774-77d3-bac9-cd5767b50820,W01-BATCH-035,
PMID:39537420,fe29016ee827f20587ac5aecf1727db59176d6c8244d8778a2d2cec5b85cd843,include_method_source_lead,method_source,I_METHOD_SOURCE,"This study constructs a transferable multistage, multisource early-warning design for dengue outbreaks.",codex-cli-task5-fix3-reader-a-019f8280-f774-77d3-bac9-cd5767b50820,W01-BATCH-035,
PMID:39548195,2c9fcc683e7df46064115c6d422e9a00bffa74890de2e4b545fbf82ab04d8a6f,include_simulation_or_mechanistic_lead,method_source,I_SIMULATION_MECHANISTIC,This study develops and validates Bayesian filtering for reproduction-number estimation under heterogeneity and delays.,codex-cli-task5-fix3-reader-a-019f8280-f774-77d3-bac9-cd5767b50820,W01-BATCH-035,
PMID:39565799,fc663f737bd39b244f26367f5aa71a4db69a947e1802de5769f583eafb6ec372,include_method_source_lead,method_source,I_METHOD_SOURCE,"This paper develops and validates a reproduction-number framework for counterfactual estimation, intervention evaluation, and feedback control of epidemics.",codex-cli-task5-fix3-blind-019f82aa-9e30-7eb1-8289-5d78da2ee1ea,W01-BATCH-035,
PMID:39566444,f1c618a2665338fd36ce3b96d049aa00c3f1c557be4c1a9896ca971a1455e0fa,include_simulation_or_mechanistic_lead,method_source,I_SIMULATION_MECHANISTIC,This study develops and evaluates wastewater-based reproduction-number estimation without known shedding dynamics.,codex-cli-task5-fix3-reader-a-019f8280-f774-77d3-bac9-cd5767b50820,W01-BATCH-035,
PMID:39577970,040821975245da1e6b0b0f3b3da2042fbf25f40e330df6f1dca8400082694617,include_applied_seed,applied_seed,I_APPLIED_TRANSFERABLE_DESIGN,"This systematic review and meta-analysis synthesizes Lassa fever transmission, severity, delay, seroprevalence, outbreak, and modeling parameters.",codex-cli-task5-fix3-blind-019f82aa-9e30-7eb1-8289-5d78da2ee1ea,W01-BATCH-035,
PMID:39587718,ba38d353a7bfff80e14acbdd464d84426860dd59b593caa4d4c1c90b6735917a,include_method_source_lead,method_source,I_METHOD_SOURCE,This article develops change-point inference and model-assessment tests with an explicit HIV application.,codex-cli-task5-fix3-reader-a-019f8280-f774-77d3-bac9-cd5767b50820,W01-BATCH-035,
PMID:39591452,246f4694add689f15f6d60ac826017c6337a8b8a1cf678d2bc02296b91c0db88,include_method_source_lead,method_source,I_METHOD_SOURCE,"This systematic review compares dengue forecasting covariates and quantitative methods while diagnosing deficiencies in model selection, reporting, and validation.",codex-cli-task5-fix3-blind-019f82aa-9e30-7eb1-8289-5d78da2ee1ea,W01-BATCH-035,
PMID:39592257,c434c33370fb858df0545a5ae4d0379ce5b88ad3a33e2df23378cdd7e8fef71c,exclude,,X_DESCRIPTIVE_ONLY,"This historical assessment descriptively maps plague cases, outbreaks, and transmission routes without developing or evaluating a transferable epidemiological method.",codex-cli-task5-fix3-blind-019f82aa-9e30-7eb1-8289-5d78da2ee1ea,W01-BATCH-035,
PMID:39696107,27911fb66308fa85e5e7e7458083f337b60574e093383437dbb0192d73bb0afb,include_diagnostic_or_correction_lead,guidance,I_DIAGNOSTIC_CORRECTION,This article evaluates event-based surveillance use and recommends more granular emergency triggers.,codex-cli-task5-fix3-reader-a-019f8280-f774-77d3-bac9-cd5767b50820,W01-BATCH-035,
PMID:39704568,92b1e53da422ac130fc3e9a00422c084f4789dc559d5ed1ed4a8c7221264331e,exclude,,X_DESCRIPTIVE_ONLY,This within-host carcinogenesis model studies pathogen-driven gene regulation rather than infectious-disease epidemiology.,codex-cli-task5-fix3-reader-a-019f8280-f774-77d3-bac9-cd5767b50820,W01-BATCH-035,
PMID:39705329,964bae2ed88542dcdae3ee36f49fe97c106469b909dbf595e1642f749df4414e,include_diagnostic_or_correction_lead,correction,I_DIAGNOSTIC_CORRECTION,This published erratum supplies correction information for an epidemiological transmission-estimation article.,codex-cli-task5-fix3-reader-a-019f8281-2d16-7f22-95fc-d27d1b865a61,W01-BATCH-035,
PMID:39708605,f2d8841706ac5ca9d4e4254bd501847ac04627184c44b47dba96430b7d5fbf6b,exclude,,X_NOT_INFECTIOUS_TRANSFERABLE,This develops an ecological-risk model for heavy-metal soil pollution without a concrete infectious-disease transfer route.,codex-semantic-primary-035,W01-BATCH-035,
PMID:39712030,be5b780a097a5e903efb8c3bc35a2b77cc0709a3db744aabd2c9bc17160a6a49,include_applied_seed,applied_seed,I_APPLIED_TRANSFERABLE_DESIGN,This clinical study evaluates vaccine complications as transferable warning indicators of immunodeficiency.,codex-cli-task5-fix3-reader-a-019f8281-2d16-7f22-95fc-d27d1b865a61,W01-BATCH-035,
PMID:39714284,cffec4bf2fb5680769452b01f698dcdff09d5e760218eab714cf3d4e14151b6d,include_applied_seed,applied_seed,I_APPLIED_TRANSFERABLE_DESIGN,This study measures longitudinal social-contact matrices relevant to infectious-disease transmission modelling.,codex-cli-task5-fix3-reader-a-019f8281-2d16-7f22-95fc-d27d1b865a61,W01-BATCH-035,
PMID:39715259,79aae243dfef834a9c8a6ea6905ab9de0c1a9c5fcb0d99aaaea2a1f3418eeb4a,include_simulation_or_mechanistic_lead,method_source,I_SIMULATION_MECHANISTIC,This study develops and evaluates a transformer estimator for time-varying reproduction numbers.,codex-cli-task5-fix3-reader-a-019f8281-2d16-7f22-95fc-d27d1b865a61,W01-BATCH-035,
PMID:39720608,877defa5f8a83c7379d6771648d8e5a145973acdcfc9e79855e8ae50f18465d1,include_diagnostic_or_correction_lead,diagnostic,I_DIAGNOSTIC_CORRECTION,This study comparatively validates early-warning scores for severe maternal sepsis outcomes.,codex-cli-task5-fix3-reader-a-019f8281-2d16-7f22-95fc-d27d1b865a61,W01-BATCH-035,
PMID:39746699,02dc2989c3cc230090458933127d40128ff409c9adc968d67418ddee9030b8ef,include_diagnostic_or_correction_lead,diagnostic,I_DIAGNOSTIC_CORRECTION,This study validates a rectal-swab molecular test as an infection early-warning tool.,codex-cli-task5-fix3-reader-a-019f8281-2d16-7f22-95fc-d27d1b865a61,W01-BATCH-035,
PMID:39775767,252ac64cfb202f6862d5463262c6bb78ba3ad1a13d7fd1823755f1d8a3bde61f,include_method_source_lead,method_source,I_METHOD_SOURCE,This study comparatively evaluates outbreak-warning algorithms using nationwide primary-care surveillance data.,codex-cli-task5-fix3-reader-a-019f8281-2d16-7f22-95fc-d27d1b865a61,W01-BATCH-035,
PMID:39780046,205c061bdb3c489ad7ef753dcd3e8c2dfb50ee6ac3059463f0a8631781da6dbb,include_diagnostic_or_correction_lead,reproducibility,I_DIAGNOSTIC_CORRECTION,"This portal provides traceable, reproducible genomic workflows for pathogen characterization and outbreak detection.",codex-cli-task5-fix3-reader-a-019f8281-2d16-7f22-95fc-d27d1b865a61,W01-BATCH-035,
PMID:39780677,8413ea6756a8d2817ff52f1ad935dc7ec5574a5a9b3bd0118b5288b59c11b956,include_diagnostic_or_correction_lead,diagnostic,I_DIAGNOSTIC_CORRECTION,This study develops and evaluates a clinical prediction model for severe pneumonia.,codex-cli-task5-fix3-reader-a-019f8281-2d16-7f22-95fc-d27d1b865a61,W01-BATCH-035,
PMID:39815688,d3c778e501afd046eda0255859d454e6546bb8f54a38a22c86ea4771cfc2707d,include_applied_seed,applied_seed,I_APPLIED_TRANSFERABLE_DESIGN,"This systematic review maps national antimicrobial-resistance early warning systems and compares their surveillance organization, definitions, alert functions, and assessments.",codex-cli-task5-fix3-blind-019f82aa-9e30-7eb1-8289-5d78da2ee1ea,W01-BATCH-035,
PMID:39816751,442d3bf9f22e0195cd42767a66da74baa74555cc2e43b9b57516bc9206fe99fc,include_method_source_lead,method_source,I_METHOD_SOURCE,"This review substantively compares infectious-disease early-warning model concepts, algorithms, and applications.",codex-cli-task5-fix3-reader-a-019f8281-2d16-7f22-95fc-d27d1b865a61,W01-BATCH-035,
PMID:39858517,209f3446bf853eb90854c360a2723759629fd163913c8a07dbb48481d999173d,include_method_source_lead,method_source,I_METHOD_SOURCE,"This review substantively compares prediction scores and biomarkers for pediatric sepsis diagnosis, risk assessment, prognosis, and treatment decisions.",codex-cli-task5-fix3-blind-019f82aa-9e30-7eb1-8289-5d78da2ee1ea,W01-BATCH-035,
PMID:39874640,a365d26f5a0ac5b240c68b1fa9d42c413f7492331596e72de9c0fa35e3b92c14,include_simulation_or_mechanistic_lead,method_source,I_SIMULATION_MECHANISTIC,This study develops and calibrates a spatially structured infectious-disease transmission model that estimates regional reproduction numbers and early warning thresholds.,codex-cli-task5-fix3-blind-019f82aa-9e30-7eb1-8289-5d78da2ee1ea,W01-BATCH-035,
PMID:39892951,785bfaf17f5400532e66fc124486c63134741d3024d729d475ae248a85934e8c,include_method_source_lead,method_source,I_METHOD_SOURCE,This review substantively explains machine-learning early-warning methods and their validation and implementation challenges.,codex-cli-task5-fix3-reader-a-019f8282-049e-7643-b0f1-fe35f0942ffd,W01-BATCH-035,
PMID:39898536,bef5b4e2b5972925981062857777c3b089442655c909deb838e6c86a311efc51,include_simulation_or_mechanistic_lead,method_source,I_SIMULATION_MECHANISTIC,This study develops a transmission model that adjusts policy-effect estimates for time-varying population immunity.,codex-cli-task5-fix3-reader-a-019f8282-049e-7643-b0f1-fe35f0942ffd,W01-BATCH-035,
PMID:39900820,6c09344726a677ad92d7e3fa806c3cf8b8dc00ef4e3c177e832ecdbd3abdbb67,include_simulation_or_mechanistic_lead,method_source,I_SIMULATION_MECHANISTIC,This study derives reproduction-number behavior for periodic nonlocal dispersal and applies it to an SIS epidemic model.,codex-cli-task5-fix3-reader-a-019f8282-049e-7643-b0f1-fe35f0942ffd,W01-BATCH-035,
PMID:39903080,1fbaf7bee4b99a87451f467e3375fc0d1f0720e3cabebb1fe2404d05f4ad0e46,exclude,,X_COMMENTARY_ONLY,This editorial provides no abstract or substantive methodological content for infectious-disease surveillance or modelling.,codex-semantic-primary-035,W01-BATCH-035,
PMID:39911747,682bed6f76b579cff79fc065b40604f11f868b7ed4c5347b6fda661a3cc9d519,include_diagnostic_or_correction_lead,diagnostic,I_DIAGNOSTIC_CORRECTION,"This study evaluates disease-specific surveillance alert thresholds using sensitivity, specificity, and Youden indices.",codex-cli-task5-fix3-reader-a-019f8282-049e-7643-b0f1-fe35f0942ffd,W01-BATCH-035,
PMID:39914162,e16ffda59d21ac5cf5e3ef53d694dec42b3f45638e8554982fa15f76b64bec0d,include_method_source_lead,method_source,I_METHOD_SOURCE,This study develops and benchmarks a multimodal deep-learning framework for respiratory-disease forecasting and warning.,codex-cli-task5-fix3-reader-a-019f8282-049e-7643-b0f1-fe35f0942ffd,W01-BATCH-035,
PMID:39923779,fbb524931643583293f651af6f2a0b2e1a17850809ac4eb186e7077a4482c78e,exclude,,X_COMMENTARY_ONLY,This letter has no supplied abstract establishing a substantive surveillance method or evaluation.,codex-semantic-primary-035,W01-BATCH-035,
PMID:39939526,bf35a1398c74cbb927f8fec0e5bec45271680fa895b19e127a5e76f412886b1f,include_simulation_or_mechanistic_lead,method_source,I_SIMULATION_MECHANISTIC,This study develops a computational framework for designing and evaluating aircraft wastewater surveillance networks.,codex-cli-task5-fix3-reader-a-019f8282-049e-7643-b0f1-fe35f0942ffd,W01-BATCH-035,
PMID:39948149,142ab8749715c73507bb58490f67bce49bf0d06c8a8d210a53a53ade257ad255,include_method_source_lead,method_source,I_METHOD_SOURCE,This study compares reproduction-number estimators and derives a robust formula using gamma generation times.,codex-cli-task5-fix3-reader-a-019f8282-049e-7643-b0f1-fe35f0942ffd,W01-BATCH-035,
PMID:39982259,4a8e352202bdc53adcaa863bca85ef8c0cf721e6be7576fc16562f7a4c33a83e,include_diagnostic_or_correction_lead,guidance,I_DIAGNOSTIC_CORRECTION,"This article describes transferable surveillance indicators, activation thresholds, and multi-level epidemic response protocols.",codex-cli-task5-fix3-reader-a-019f8282-049e-7643-b0f1-fe35f0942ffd,W01-BATCH-035,
PMID:39983687,97a6c973cafffbb3f9b11743ac82b478e8c013d2350d4e8a3d7dda6e863fb3a2,include_applied_seed,applied_seed,I_APPLIED_TRANSFERABLE_DESIGN,This study evaluates open-source intelligence as an early-warning approach for outbreaks of unknown cause.,codex-cli-task5-fix3-reader-a-019f8282-049e-7643-b0f1-fe35f0942ffd,W01-BATCH-035,
PMID:40010777,edc99e5307f922a17d4b34f09c8568434690977237814504038923cbf0671e06,include_applied_seed,applied_seed,I_APPLIED_TRANSFERABLE_DESIGN,This investigation compares complementary surveillance systems and demonstrates community event-based detection of missed respiratory illness.,codex-cli-task5-fix3-reader-a-019f8282-049e-7643-b0f1-fe35f0942ffd,W01-BATCH-035,
PMID:40020609,9407518d7d0f9182eed00e5c16a4d30a8964a838d6002d0ebb87bb8e62ad0cf5,exclude,,X_NOT_INFECTIOUS_TRANSFERABLE,This biosensor addresses a marine algal bloom rather than an infectious-disease outcome with a concrete transfer route.,codex-semantic-primary-035,W01-BATCH-035,
PMID:40021915,a524d570a1702df5316a76a0ac2c7b4ff82993847dce4d0d41245dbfa32970a5,include_simulation_or_mechanistic_lead,method_source,I_SIMULATION_MECHANISTIC,This study develops and evaluates an ensemble epidemiological forecasting system for municipal West Nile risk.,codex-cli-task5-fix3-reader-a-019f8282-049e-7643-b0f1-fe35f0942ffd,W01-BATCH-035,
PMID:40023807,6a415bd1b12ffb28641c9aff5270657463665c78689fedc0962e90a762453dd0,include_applied_seed,applied_seed,I_APPLIED_TRANSFERABLE_DESIGN,This study evaluates pathogen DNA in wildlife feces as an early-warning indicator for human disease.,codex-cli-task5-fix3-reader-a-019f8282-049e-7643-b0f1-fe35f0942ffd,W01-BATCH-035,
PMID:40036311,0dd727ec76854912598a2dc58491790d02d72d5be3ca1e7cb2f54b11da466abd,include_method_source_lead,method_source,I_METHOD_SOURCE,This study extends time-since-infection models with hospitalization data to improve reproduction-number estimation.,codex-cli-task5-fix3-reader-a-019f8282-049e-7643-b0f1-fe35f0942ffd,W01-BATCH-035,
PMID:40070440,8094e8acb3aa8dcc9db1a10878043a26dccad195a73822c4b228e812d9b5c782,include_diagnostic_or_correction_lead,guidance,I_DIAGNOSTIC_CORRECTION,This review identifies surveillance-system gaps and provides One Health recommendations for community-level infectious-disease warning.,codex-cli-task5-fix3-reader-a-019f8283-02f1-7170-8cd7-d9698c73e17f,W01-BATCH-035,
PMID:40109434,f282f10cdc1109b1b080365112aff5173f13afca03a981b1cfcc19aaf4027dec,include_applied_seed,applied_seed,I_APPLIED_TRANSFERABLE_DESIGN,This study evaluates internet search indices as transferable public-concern and early-warning signals for mpox surveillance.,codex-cli-task5-fix3-reader-a-019f8283-02f1-7170-8cd7-d9698c73e17f,W01-BATCH-035,
PMID:40139184,4c43f86d08c13aabf33b1b7fbf1435f2d26975ca858db362a11cea360a11bb55,include_applied_seed,applied_seed,I_APPLIED_TRANSFERABLE_DESIGN,"This study integrates machine learning, spatial models, and phylogenetics to generate early-warning signals for avian influenza spillover.",codex-cli-task5-fix3-reader-a-019f8283-02f1-7170-8cd7-d9698c73e17f,W01-BATCH-035,
PMID:40172553,2e7c8290b164fd706375b41fbb5bd82814fb18f2f0b39b92faa1daf47d9a4167,include_simulation_or_mechanistic_lead,method_source,I_SIMULATION_MECHANISTIC,This study develops and simulation-evaluates an efficient reproduction-number estimator accommodating temporal aggregation and case under-reporting.,codex-cli-task5-fix3-reader-a-019f8283-02f1-7170-8cd7-d9698c73e17f,W01-BATCH-035,
PMID:40177126,ecd6f81e47f315dad4eb4c5b2af72117f2f55768ef056d605e7ec38853a50a2e,include_method_source_lead,method_source,I_METHOD_SOURCE,This study develops and validates a transferable mutation-based system for prioritizing concerning respiratory-virus variants from genomic surveillance.,codex-cli-task5-fix3-reader-a-019f8283-02f1-7170-8cd7-d9698c73e17f,W01-BATCH-035,
PMID:40201994,75dcf61e386089af7bd07e470851acf004ceb413fddaff5eaf09d4e68c0396ef,include_diagnostic_or_correction_lead,diagnostic,I_DIAGNOSTIC_CORRECTION,This study develops and assesses a multivariable early-warning equation for identifying immunocompromised sepsis patients.,codex-cli-task5-fix3-reader-a-019f8283-02f1-7170-8cd7-d9698c73e17f,W01-BATCH-035,
PMID:40248888,77a0d313e372b38ac7100c19879764fa79f6bb6aa9f6cf770ee3898198ef7740,include_diagnostic_or_correction_lead,guidance,I_DIAGNOSTIC_CORRECTION,This standardized benchmarking study compares national Aedes-borne disease surveillance systems and derives preparedness recommendations.,codex-cli-task5-fix3-reader-a-019f8283-02f1-7170-8cd7-d9698c73e17f,W01-BATCH-035,
