candidate_key,source_row_sha256,primary_decision,primary_proposed_record_type,primary_reason_code,primary_reason,primary_reviewer,batch_id,retained_candidate_key
PMID:39530777,74c0e56f5d504ada6360c2e3228e33cb14f3bebb5f8d56add352c3556ebe121f,include_diagnostic_or_correction_lead,guidance,I_DIAGNOSTIC_CORRECTION,This article provides a tiered implementation framework for sustainable genomic surveillance capacity.,codex-cli-task5-fix3-reader-a-019f8280-f774-77d3-bac9-cd5767b50820,W01-BATCH-024,
PMID:39530852,3593355aaf74d6b9c36a23629a6d7c9f5078f805bca0e131565ccb138ea6c56d,include_applied_seed,applied_seed,I_APPLIED_TRANSFERABLE_DESIGN,This surveillance application characterizes resistant high-risk clones across three national settings.,codex-cli-task5-fix3-reader-a-019f8280-f774-77d3-bac9-cd5767b50820,W01-BATCH-024,
PMID:39534503,0a184a106bf4f7063dad3e3d064e5ad68d9b162eb2bfa93e0f674a6f3f1d55ad,include_applied_seed,applied_seed,I_APPLIED_TRANSFERABLE_DESIGN,"This study applies phylodynamic, phylogeographic, and selection analyses to estimate changing population dynamics and dispersal of an infectious animal virus.",codex-cli-task5-fix3-blind-019f82aa-9e30-7eb1-8289-5d78da2ee1ea,W01-BATCH-024,
PMID:39546571,79da7fce1e9191c8f5d8c9ca51a7753cf746e760e82539fee3553bfd78c8286b,include_method_source_lead,method_source,I_METHOD_SOURCE,This article develops phylogenetic integrated-velocity models for estimating and predicting pathogen dispersal.,codex-cli-task5-fix3-reader-a-019f8280-f774-77d3-bac9-cd5767b50820,W01-BATCH-024,
PMID:39554028,eca015da98e7e18bdd72b47f28cceeda2c1244275a8f50c1fa72ee4d02dd438e,exclude,,X_DUPLICATE,This preprint reports the same Markov-field vaccination-network study as the published record PMID:39504969.,codex-semantic-primary-024-retry1,W01-BATCH-024,PMID:39504969
PMID:39557054,c3f37659ce25d57cbda934840c5632e4aa1777da42aa960d0751d9a2f926a9f1,include_method_source_lead,method_source,I_METHOD_SOURCE,This outbreak investigation develops a transferable MLST scheme and validates it against genomic data.,codex-cli-task5-fix3-reader-a-019f8280-f774-77d3-bac9-cd5767b50820,W01-BATCH-024,
PMID:39557055,b072f1696bf03fe65204228631db81b4ad978a1dc18c7fb3a191498cfe502d58,include_applied_seed,applied_seed,I_APPLIED_TRANSFERABLE_DESIGN,"This study integrates phylogeography, travel histories, and ecological regression to investigate viral expansion.",codex-cli-task5-fix3-reader-a-019f8280-f774-77d3-bac9-cd5767b50820,W01-BATCH-024,
PMID:39565816,ac6ecec493f6cc67d2013abd59cbd5c30ccfdde377b950d1d4451f576110acdb,include_applied_seed,applied_seed,I_APPLIED_TRANSFERABLE_DESIGN,This study applies genomic epidemiology and resistance profiling to characterize invasive Salmonella lineages.,codex-cli-task5-fix3-reader-a-019f8280-f774-77d3-bac9-cd5767b50820,W01-BATCH-024,
PMID:39568452,af231c0bbf73c923fa1cacf3781212a9a191a6e6a8561b3d4e3b300d2a0e2289,exclude,,X_NOT_INFECTIOUS_TRANSFERABLE,This plant-image classifier addresses agricultural leaf disease without an explicit infectious-epidemiology transfer route.,codex-cli-task5-fix3-reader-a-019f8280-f774-77d3-bac9-cd5767b50820,W01-BATCH-024,
PMID:39587142,2e54031109a8cb3698be406534f6253139bf322025a4c96a6caca31d12fc6275,include_simulation_or_mechanistic_lead,method_source,I_SIMULATION_MECHANISTIC,This study develops an adaptive multiplex-network model linking vaccination behavior and epidemic thresholds.,codex-cli-task5-fix3-reader-a-019f8280-f774-77d3-bac9-cd5767b50820,W01-BATCH-024,
PMID:39608274,0fc55625970e0c36bff1353accbb6a43fe385ee1af7ca015779b60ab52facda9,include_applied_seed,applied_seed,I_APPLIED_TRANSFERABLE_DESIGN,"This genomic epidemiology study investigates foodborne transmission risks, resistance, and international relatedness.",codex-cli-task5-fix3-reader-a-019f8280-f774-77d3-bac9-cd5767b50820,W01-BATCH-024,
PMID:39611769,e9e0e3a4cd343683e1e20f559007b9f933d3e720f8383e2d252aeaf49279ae86,include_applied_seed,applied_seed,I_APPLIED_TRANSFERABLE_DESIGN,This genomic surveillance study identifies resistant Shigella clusters and transmission-associated population patterns.,codex-cli-task5-fix3-reader-a-019f8280-f774-77d3-bac9-cd5767b50820,W01-BATCH-024,
PMID:39611833,9f50b91eb8ea154b2c8dfd75c36eb26e989cc36bf026af5837056f29bf1caa18,include_applied_seed,applied_seed,I_APPLIED_TRANSFERABLE_DESIGN,This national genomic analysis detects emerging invasive Streptococcus lineages for active surveillance.,codex-cli-task5-fix3-reader-a-019f8280-f774-77d3-bac9-cd5767b50820,W01-BATCH-024,
PMID:39617920,5d79f414d959bd94a7d0d0de317812b46515697fd630b0d3cf0a8bf21897de80,include_simulation_or_mechanistic_lead,applied_seed,I_SIMULATION_MECHANISTIC,This endemic-epidemic model estimates counterfactual school-closure effects across interacting age groups.,codex-cli-task5-fix3-reader-a-019f8280-f774-77d3-bac9-cd5767b50820,W01-BATCH-024,
PMID:39629976,81c730479c0b12567ea8c0be64457c359bd7642fe5faa2c2750e36febbf7e33f,include_applied_seed,applied_seed,I_APPLIED_TRANSFERABLE_DESIGN,"This whole-genome surveillance application characterizes Campylobacter diversity, virulence, and antimicrobial resistance.",codex-cli-task5-fix3-reader-a-019f8280-f774-77d3-bac9-cd5767b50820,W01-BATCH-024,
PMID:39630499,d182c6b5890aadc2f3be4a3aeaacfb11d8271d67046953acb37b7db13f8b14f0,include_method_source_lead,method_source,I_METHOD_SOURCE,This study develops a transferable pangenome graph workflow for clustering and characterizing epidemiologically relevant antimicrobial-resistance integron diversity.,codex-cli-task5-fix3-blind-019f82aa-9e30-7eb1-8289-5d78da2ee1ea,W01-BATCH-024,
PMID:39657433,0b78ff3736c3293b24c5c17ba41754a4c525071f7f6950e4a3a3caafebc2093a,include_applied_seed,applied_seed,I_APPLIED_TRANSFERABLE_DESIGN,This global comparative-genomics study reconstructs Morganella phylogeography and longitudinal resistance evolution.,codex-cli-task5-fix3-reader-a-019f8280-f774-77d3-bac9-cd5767b50820,W01-BATCH-024,
PMID:39658728,d2dfe827f87879f7fb5fd2e0aa4143f43fe56563dc9551beac15e4db4b807452,include_applied_seed,applied_seed,I_APPLIED_TRANSFERABLE_DESIGN,This genomic epidemiology study reconstructs the emergence and evolution of resistant Pseudomonas clades.,codex-cli-task5-fix3-reader-a-019f8280-f774-77d3-bac9-cd5767b50820,W01-BATCH-024,
PMID:39670194,cd7f0ab5d28113c430dba13d06627e42886fb100f50e98bc3bf29ef41b29d562,include_applied_seed,applied_seed,I_APPLIED_TRANSFERABLE_DESIGN,This genomic surveillance application identifies recombinant viral clusters and potential immune-escape mutations.,codex-cli-task5-fix3-reader-a-019f8280-f774-77d3-bac9-cd5767b50820,W01-BATCH-024,
PMID:39676847,440e372e05e341fc78537da2ebea4b11a1ce7761f7e620dc67a98f89aaded048,include_applied_seed,applied_seed,I_APPLIED_TRANSFERABLE_DESIGN,This multicenter genomic study reconstructs resistant Clostridioides sublineages and potential transmission risks.,codex-cli-task5-fix3-reader-a-019f8280-f774-77d3-bac9-cd5767b50820,W01-BATCH-024,
PMID:39677427,68d6a8d975a022e8e9df146de5fcbb99366bc3d1780e51d5d3c367e5df8b37f5,exclude,,X_DUPLICATE,This preprint reports the same genomic-geospatial tuberculosis analysis as the supplied journal peer.,codex-cli-task5-fix3-reader-a-019f8280-f774-77d3-bac9-cd5767b50820,W01-BATCH-024,PMID:41933361
PMID:39680613,bc24545ca8f1549651afda00541a8adb67275488381a5fd9117ce825f3fb41c0,include_simulation_or_mechanistic_lead,method_source,I_SIMULATION_MECHANISTIC,This study develops travel-aware metapopulation and multilayer waning-immunity transmission models.,codex-cli-task5-fix3-reader-a-019f8280-f774-77d3-bac9-cd5767b50820,W01-BATCH-024,
PMID:39697008,38efbb9f603d29acd9b1ec210af5657a4a71ce7e45d06c5a28c0c51e7bda4971,include_applied_seed,applied_seed,I_APPLIED_TRANSFERABLE_DESIGN,This study applies complete-genome phylodynamics and phylogeography to reconstruct global hepatitis spread.,codex-cli-task5-fix3-reader-a-019f8280-f774-77d3-bac9-cd5767b50820,W01-BATCH-024,
PMID:39700140,aea634a8aece6189bf7a12dd300076b01f4f01cc45706134f7977997f7c1bf92,include_simulation_or_mechanistic_lead,method_source,I_SIMULATION_MECHANISTIC,This mechanistic metapopulation theory explains how host heterogeneity alters pathogen virulence and infectiousness.,codex-cli-task5-fix3-reader-a-019f8280-f774-77d3-bac9-cd5767b50820,W01-BATCH-024,
PMID:39709561,92760b211edd58b4210a9aec5ce66175242171833e37d09ef937109496e65ea2,exclude,,X_DESCRIPTIVE_ONLY,This molecular sequence study characterizes HPV oncoprotein substitutions without an eligible epidemiological method.,codex-cli-task5-fix3-reader-a-019f8281-2d16-7f22-95fc-d27d1b865a61,W01-BATCH-024,
PMID:39711716,b15a029a27a827b9b49ae002b9036c5deeece9fe72dd7f19acfe8fae665a14fc,include_applied_seed,applied_seed,I_APPLIED_TRANSFERABLE_DESIGN,This outbreak study combines surveillance and pathogen sequencing to infer independent geographic origins.,codex-cli-task5-fix3-reader-a-019f8281-2d16-7f22-95fc-d27d1b865a61,W01-BATCH-024,
PMID:39725566,e5b97fa31a3aab08ca50f9f846c7db26416a97b45158d2abc1cacfb400e2a9fc,include_applied_seed,applied_seed,I_APPLIED_TRANSFERABLE_DESIGN,This genomic epidemiology study applies comparative sequencing to vaccine-driven pathogen evolution and resistance.,codex-cli-task5-fix3-reader-a-019f8281-2d16-7f22-95fc-d27d1b865a61,W01-BATCH-024,
PMID:39737444,71d45b6cbd8b1d07a17ed94e4bbf759972c265d5fa338b2bb5df8b9a9fdc3b15,exclude,,X_DUPLICATE,This journal record represents the same bibliographic work as the supplied preprint peer.,codex-cli-task5-fix3-reader-a-019f8281-2d16-7f22-95fc-d27d1b865a61,W01-BATCH-024,PMID:38559244
PMID:39765616,493ac00ac585c4edbf2084a6a37e1d883534e280c0194423c58b42faf15995b5,include_diagnostic_or_correction_lead,diagnostic,I_DIAGNOSTIC_CORRECTION,This study develops and evaluates an automated classification tool for identifying disease-vector species and sex from entomological images.,codex-cli-task5-fix3-blind-019f82aa-9e30-7eb1-8289-5d78da2ee1ea,W01-BATCH-024,
PMID:39791259,f7c15df51106a3b729e9491d2be59c8eb430ffa2c2f019e34b13142f65be38ce,include_applied_seed,applied_seed,I_APPLIED_TRANSFERABLE_DESIGN,This genomic epidemiology study compares clinical and environmental isolates to investigate transmission pathways.,codex-cli-task5-fix3-reader-a-019f8281-2d16-7f22-95fc-d27d1b865a61,W01-BATCH-024,
PMID:39809813,7ba07358ce9391d76e4dd0024a585065831f33342891531d433d5dfdfd7ddbdb,exclude,,X_NOT_INFECTIOUS_TRANSFERABLE,This phylogeographic study concerns a butterfly and does not establish a concrete infectious-disease application or transfer route.,codex-semantic-primary-024-retry1,W01-BATCH-024,
PMID:39818328,71b04edb0ecd1886cbfaff7288dc7b64bf3da9e90861cd2a279216c5f89e8fc2,include_applied_seed,applied_seed,I_APPLIED_TRANSFERABLE_DESIGN,This outbreak investigation combines genomics and stochastic transmission-network reconstruction to resolve introductions.,codex-cli-task5-fix3-reader-a-019f8281-2d16-7f22-95fc-d27d1b865a61,W01-BATCH-024,
PMID:39843962,57d1321afdf0cc1318606aa84be1455e0f8f9bb128bfcd6158589633db4eac62,include_applied_seed,applied_seed,I_APPLIED_TRANSFERABLE_DESIGN,This genomic epidemiology study reconstructs resistance evolution and global pathogen lineage distribution.,codex-cli-task5-fix3-reader-a-019f8281-2d16-7f22-95fc-d27d1b865a61,W01-BATCH-024,
PMID:39850139,8d2811bc9c187853d1832b4e8937e28ceee1a2648d8e3464f0435079a5c3dd1a,exclude,,X_DESCRIPTIVE_ONLY,This virological characterization relies on animal and laboratory experiments without an eligible epidemiological method.,codex-cli-task5-fix3-reader-a-019f8281-2d16-7f22-95fc-d27d1b865a61,W01-BATCH-024,
PMID:39855294,073b6a462d482cf2c116d5da7072c2372b7763c72901459cb2d5f2e93c192beb,include_applied_seed,applied_seed,I_APPLIED_TRANSFERABLE_DESIGN,This global pathogen study applies phylogeographic and population-genetic analyses to transmission-related diversity.,codex-cli-task5-fix3-reader-a-019f8281-2d16-7f22-95fc-d27d1b865a61,W01-BATCH-024,
PMID:39864307,598b5ec4ecfe0791b10d72a1d2e176f4c706d40546df323d13be9144e7c375a5,include_applied_seed,applied_seed,I_APPLIED_TRANSFERABLE_DESIGN,"This study combines blood-donor surveillance, viral sequencing, and phylogeography to infer regional spread.",codex-cli-task5-fix3-reader-a-019f8281-2d16-7f22-95fc-d27d1b865a61,W01-BATCH-024,
PMID:39869938,cac0a4f6d0aee0022ae3186fb7f3134c0e4da8dc7201ec9cbb9b61e2c6ee750a,include_applied_seed,applied_seed,I_APPLIED_TRANSFERABLE_DESIGN,This plant-pathogen genomic epidemiology study reconstructs introduction timing and spatial dissemination.,codex-cli-task5-fix3-reader-a-019f8281-2d16-7f22-95fc-d27d1b865a61,W01-BATCH-024,
PMID:39874598,b28c026697b2ed21202668be1b2edfc6e336bcd23f05de516edd6b2a18c64347,include_diagnostic_or_correction_lead,reproducibility,I_DIAGNOSTIC_CORRECTION,This localized Nextstrain resource supports reproducible spatiotemporal pathogen surveillance and phylodynamic visualization.,codex-cli-task5-fix3-reader-a-019f8281-2d16-7f22-95fc-d27d1b865a61,W01-BATCH-024,
PMID:39878305,eccc3baaa1cdad51b7d1fd8a700d0d3c26ce2549ab5367b3f3efd79422990873,include_applied_seed,applied_seed,I_APPLIED_TRANSFERABLE_DESIGN,This genomic epidemiology study uses structured coalescent inference to quantify persistent cross-species transmission.,codex-cli-task5-fix3-reader-a-019f8281-2d16-7f22-95fc-d27d1b865a61,W01-BATCH-024,
PMID:39890226,c1d601f3508174f759f248670d43dc0d3bc9dc3f7107d8b137b83b42291865f1,include_applied_seed,applied_seed,I_APPLIED_TRANSFERABLE_DESIGN,"This study integrates surveillance, reproduction-number estimation, phylogeography, and mobility modelling to reconstruct variant spread.",codex-cli-task5-fix3-reader-a-019f8282-049e-7643-b0f1-fe35f0942ffd,W01-BATCH-024,
PMID:39892000,6b48d27db648befaab35d45adaf1e88302e8c002c393cbdb1f69a351366a85e6,include_simulation_or_mechanistic_lead,method_source,I_SIMULATION_MECHANISTIC,This study develops a metapopulation transmission model with Kalman-filter data assimilation for regional epidemic inference.,codex-cli-task5-fix3-reader-a-019f8282-049e-7643-b0f1-fe35f0942ffd,W01-BATCH-024,
PMID:39898316,f08b701ea45d0c0c95428dee3c9427d230dd863a1722d1f5433f7b6f32f10c8d,include_applied_seed,applied_seed,I_APPLIED_TRANSFERABLE_DESIGN,This study applies comparative genomic epidemiology to assess resistant bacterial population overlap across host species.,codex-cli-task5-fix3-reader-a-019f8282-049e-7643-b0f1-fe35f0942ffd,W01-BATCH-024,
PMID:39918339,f36f8a0c13d5fae99ba223a97c09d07c2f5be32aa63f4e7f535419d51e2ac211,include_applied_seed,applied_seed,I_APPLIED_TRANSFERABLE_DESIGN,This study applies Bayesian phylogeography to infer cross-border transmission of drug-resistant Salmonella.,codex-cli-task5-fix3-reader-a-019f8282-049e-7643-b0f1-fe35f0942ffd,W01-BATCH-024,
PMID:39922832,7143a984405f1b5684429fbd03af8c312e7a199fa94ff031a67199a76ffb1e6a,include_applied_seed,applied_seed,I_APPLIED_TRANSFERABLE_DESIGN,This study informatively applies genomic epidemiology and population-structure analyses to pathogen isolates.,codex-cli-task5-fix3-blind-019f82aa-9e7b-7180-bc24-d230938ebe65,W01-BATCH-024,
PMID:39936851,dab2694befc511ad76c9089ca7772c0d88c375cca22b49e1f05bef1fc9a1e4b3,include_applied_seed,applied_seed,I_APPLIED_TRANSFERABLE_DESIGN,"This study applies phylogenetic, phylodynamic, and reproduction-number analyses to Omicron sublineage spread.",codex-cli-task5-fix3-reader-a-019f8282-049e-7643-b0f1-fe35f0942ffd,W01-BATCH-024,
PMID:39944375,24be63bdc72455034e02e850e06c10a96640f16427461527bcb4d96c6b63af1c,include_simulation_or_mechanistic_lead,method_source,I_SIMULATION_MECHANISTIC,This study develops hybrid agent-based and population transmission models that reduce computational cost.,codex-cli-task5-fix3-reader-a-019f8282-049e-7643-b0f1-fe35f0942ffd,W01-BATCH-024,
PMID:39957983,d468e376681a20ba8c994fc169c701049c23d9068e21b1c6c45634602145ca1e,include_method_source_lead,method_source,I_METHOD_SOURCE,This article substantively explains implementation of genomic epidemiology for healthcare outbreak management.,codex-cli-task5-fix3-blind-019f82aa-9e7b-7180-bc24-d230938ebe65,W01-BATCH-024,
PMID:39958990,4a1a0ec1a361f7052c809fb60e41dfea5c0fa71761969a1e3d69d05689dc9578,include_applied_seed,applied_seed,I_APPLIED_TRANSFERABLE_DESIGN,This study combines genomic distances and epidemiological data to identify possible nosocomial transmission clusters.,codex-cli-task5-fix3-reader-a-019f8282-049e-7643-b0f1-fe35f0942ffd,W01-BATCH-024,
PMID:39962182,67ed3d0d4b50a772229915493ea660f0511c95e98be4c5f3f4bcc4d24612d19b,include_simulation_or_mechanistic_lead,method_source,I_SIMULATION_MECHANISTIC,This study develops a metapopulation framework to estimate epidemic origins and network spreading geometry.,codex-cli-task5-fix3-reader-a-019f8282-049e-7643-b0f1-fe35f0942ffd,W01-BATCH-024,
PMID:39965190,9e40ccf1602570dcb6d0c23ecba49a8983d3546696d27a26e44ff8bcdfc467d2,include_simulation_or_mechanistic_lead,applied_seed,I_SIMULATION_MECHANISTIC,This study integrates mobility networks into a mechanistic metapopulation model of SARS-CoV-2 diffusion.,codex-cli-task5-fix3-blind-019f82aa-9e7b-7180-bc24-d230938ebe65,W01-BATCH-024,
PMID:39972521,ade06b384cc91d9007dd05d2e94631f6f1334d1a223e59d0416bb8ca0fab4681,include_diagnostic_or_correction_lead,guidance,I_DIAGNOSTIC_CORRECTION,This study develops an operational framework for integrated One Health surveillance and genomic data analysis.,codex-cli-task5-fix3-reader-a-019f8282-049e-7643-b0f1-fe35f0942ffd,W01-BATCH-024,
PMID:39984887,b1e76ee004d333e012de79fb9573806cf140c1e797255faa8d6a0d178557281c,exclude,,X_NOT_INFECTIOUS_TRANSFERABLE,This lockdown-era sleep-quality prediction study has a noninfectious outcome and supplies no concrete infectious-disease transfer route.,codex-semantic-primary-024-retry1,W01-BATCH-024,
PMID:39988586,ba4900fe798f507015b719b67796708d4ee2b0d589b9bd6906f01dabbe7229cd,include_diagnostic_or_correction_lead,diagnostic,I_DIAGNOSTIC_CORRECTION,This study develops and externally validates a multimodal model for early surgical-site infection detection.,codex-cli-task5-fix3-reader-a-019f8282-049e-7643-b0f1-fe35f0942ffd,W01-BATCH-024,
PMID:40011766,92a35fe893848937fc8786816c9db978139ac65fe3f90ecfae1e70fdbd04302c,include_applied_seed,applied_seed,I_APPLIED_TRANSFERABLE_DESIGN,This study integrates strain-resolved metagenomics and isolate sequencing to characterize healthcare pathogen sharing.,codex-cli-task5-fix3-reader-a-019f8282-049e-7643-b0f1-fe35f0942ffd,W01-BATCH-024,
PMID:40020892,f7e0f42370c87f454ceab0f70efe84603c2ad0dee95a660ea08fefa434ae73ac,include_applied_seed,applied_seed,I_APPLIED_TRANSFERABLE_DESIGN,"This study applies phylodynamic methods to reconstruct plant-virus introductions, diffusion, and recombination-related inference limits.",codex-cli-task5-fix3-reader-a-019f8282-049e-7643-b0f1-fe35f0942ffd,W01-BATCH-024,
PMID:40023787,69b1a2edb6041c316a289a4a08daefbe20315862e1b1cc5c8cf68a1e440e43eb,include_applied_seed,applied_seed,I_APPLIED_TRANSFERABLE_DESIGN,This study integrates genomic and traditional epidemiology to distinguish introductions from within-unit outbreak spread.,codex-cli-task5-fix3-reader-a-019f8282-049e-7643-b0f1-fe35f0942ffd,W01-BATCH-024,
PMID:40028458,368ef0c8ee551972a9d1c3b66823eeb2fe7dafe25fd3eb94fe402227d06b08a1,include_applied_seed,applied_seed,I_APPLIED_TRANSFERABLE_DESIGN,"Beyond assay development, this study applies phylogeography to infer citrus-virus diversity and dispersal patterns.",codex-cli-task5-fix3-reader-a-019f8282-049e-7643-b0f1-fe35f0942ffd,W01-BATCH-024,
PMID:40029330,18f196836aa0945d72dc735793f31e01a9828647d32cefb95e1a1964d7a0e542,include_applied_seed,applied_seed,I_APPLIED_TRANSFERABLE_DESIGN,This study applies global phylogeography and plasmid analysis to reconstruct resistant Morganella dissemination.,codex-cli-task5-fix3-reader-a-019f8282-049e-7643-b0f1-fe35f0942ffd,W01-BATCH-024,
PMID:40058502,e63543536bf454db4a9cd973e8d70cf86b5954cb26364fafa8527df6d08cefb3,include_applied_seed,applied_seed,I_APPLIED_TRANSFERABLE_DESIGN,This study integrates phylogenomics and epidemiological data to identify enteric-fever transmission clusters and outbreaks.,codex-cli-task5-fix3-reader-a-019f8282-049e-7643-b0f1-fe35f0942ffd,W01-BATCH-024,
PMID:40066809,504270bb3c08be6aa0108a20b8db83f9779c28ab668e6182ccba5857c4a8fd1f,include_applied_seed,applied_seed,I_APPLIED_TRANSFERABLE_DESIGN,"This study combines viral genotyping, risk-factor analysis, and genomic networks to characterize hepatitis A resurgence.",codex-cli-task5-fix3-reader-a-019f8282-049e-7643-b0f1-fe35f0942ffd,W01-BATCH-024,
PMID:40072967,7c7e027c91b8fdb244b9363eb6c020df2909cc981b5722762562d3ab28352223,include_applied_seed,applied_seed,I_APPLIED_TRANSFERABLE_DESIGN,"This study applies population genomics, connectivity analysis, and environmental associations to investigate malaria transmission and adaptation.",codex-cli-task5-fix3-reader-a-019f8283-02f1-7170-8cd7-d9698c73e17f,W01-BATCH-024,
PMID:40102552,e50909a3d729bb1c48a1210eece12f0ce00d14ccfba06c40796c0f56d0d72e10,include_applied_seed,applied_seed,I_APPLIED_TRANSFERABLE_DESIGN,This study applies phylogenetic and geographic analyses to characterize hepatitis B viral population variation across regions.,codex-cli-task5-fix3-reader-a-019f8283-02f1-7170-8cd7-d9698c73e17f,W01-BATCH-024,
PMID:40123883,6865d63081a2f6d04b73e8e06f827a8b7aca59920facc1450c5e53a6cca03794,include_diagnostic_or_correction_lead,diagnostic,I_DIAGNOSTIC_CORRECTION,This study develops and evaluates an explainable imaging model for real-time diagnosis of multiple infectious lung diseases.,codex-cli-task5-fix3-reader-a-019f8283-02f1-7170-8cd7-d9698c73e17f,W01-BATCH-024,
PMID:40133528,1c944069582740986bc94214161c23b959fea6b60a5230de58d9fcbff77d293c,include_simulation_or_mechanistic_lead,applied_seed,I_SIMULATION_MECHANISTIC,This study combines phylogeography with sexual-network modelling to explain the expansion and decline of an mpox epidemic.,codex-cli-task5-fix3-reader-a-019f8283-02f1-7170-8cd7-d9698c73e17f,W01-BATCH-024,
PMID:40134787,42743dfc6a105becd89b02ee1cf1e7827f49d87f4a553c10de4549bc8668c975,include_applied_seed,applied_seed,I_APPLIED_TRANSFERABLE_DESIGN,This study applies large-scale comparative genomics and surveillance data to investigate zoonotic Salmonella transmission and resistance.,codex-cli-task5-fix3-reader-a-019f8283-02f1-7170-8cd7-d9698c73e17f,W01-BATCH-024,
PMID:40142478,d65939127595f5d74446dddd13791636392a9dddee448d443bae692d3ad458b8,include_applied_seed,applied_seed,I_APPLIED_TRANSFERABLE_DESIGN,"This study applies phylogenetic, phylogeographic, and phylodynamic analyses to infer West Nile virus dispersal routes.",codex-cli-task5-fix3-reader-a-019f8283-02f1-7170-8cd7-d9698c73e17f,W01-BATCH-024,
PMID:40165066,4982323856679fd96fcdbb74b06fd315e267d0e4047d38a59e26d6d397e52c5b,include_applied_seed,applied_seed,I_APPLIED_TRANSFERABLE_DESIGN,This study applies whole-genome surveillance and phylogenetic analysis to characterize clinical Klebsiella resistance and virulence.,codex-cli-task5-fix3-reader-a-019f8283-02f1-7170-8cd7-d9698c73e17f,W01-BATCH-024,
PMID:40165792,effcf5b449ecd55da3e444241a48841973880e7a8a050ded8c4bd738c0eeb8ae,include_applied_seed,applied_seed,I_APPLIED_TRANSFERABLE_DESIGN,This study combines isolate sequencing and international comparative genomics to investigate plasmid-mediated carbapenem resistance dissemination.,codex-cli-task5-fix3-reader-a-019f8283-02f1-7170-8cd7-d9698c73e17f,W01-BATCH-024,
PMID:40166569,f06222c504c04284b4fb9369ab5cfd0b59d07d0617a259d299da056ad85e7b78,exclude,,X_DESCRIPTIVE_ONLY,This model prioritizes antimicrobial drug combinations for potency and toxicity rather than addressing an eligible epidemiological process.,codex-cli-task5-fix3-reader-a-019f8283-02f1-7170-8cd7-d9698c73e17f,W01-BATCH-024,
PMID:40177079,d045abd6cfc198ef21df933566470167883c48c9f311bde5d88721949f6d905a,include_applied_seed,applied_seed,I_APPLIED_TRANSFERABLE_DESIGN,"This structured review incorporates phylogenomics to characterize zoonotic tuberculosis reservoirs, geographic emergence, and transmission pathways.",codex-cli-task5-fix3-reader-a-019f8283-02f1-7170-8cd7-d9698c73e17f,W01-BATCH-024,
PMID:40194534,e828e7c89f1bb56cfef3d1dcc452b34c44d24f0740ca581c952abf8d845fc8dc,include_simulation_or_mechanistic_lead,applied_seed,I_SIMULATION_MECHANISTIC,This study combines genomic surveillance with a multistrain transmission simulation to explain regional lineage dynamics.,codex-cli-task5-fix3-reader-a-019f8283-02f1-7170-8cd7-d9698c73e17f,W01-BATCH-024,
PMID:40196585,e1a06f30a74330dbd8539f5e075eab0f983f571acbade5c725a8b6fbb4efc0a0,include_simulation_or_mechanistic_lead,method_source,I_SIMULATION_MECHANISTIC,This study develops three landscape phylogeographic methods and compares their statistical performance using dedicated simulation frameworks.,codex-cli-task5-fix3-reader-a-019f8283-02f1-7170-8cd7-d9698c73e17f,W01-BATCH-024,
PMID:40229304,978ed79728eaf0583206c6f2416bc35aee3f5c29b51e0055c58f75483067d1be,include_applied_seed,applied_seed,I_APPLIED_TRANSFERABLE_DESIGN,This multicentre genomic epidemiology study characterizes temporal population dynamics and transmission patterns of bloodstream Acinetobacter isolates.,codex-cli-task5-fix3-reader-a-019f8283-02f1-7170-8cd7-d9698c73e17f,W01-BATCH-024,
PMID:40234634,b8ab9b413be9d605c446d6de9a203804edcb7f041fae10370685b434bece8781,include_applied_seed,applied_seed,I_APPLIED_TRANSFERABLE_DESIGN,This study applies genomic typing and phylogenetic analysis to characterize difficult-to-treat resistant Pseudomonas lineages and potential spread.,codex-cli-task5-fix3-reader-a-019f8283-02f1-7170-8cd7-d9698c73e17f,W01-BATCH-024,
PMID:40239323,d68b97e80bc8b7b01006abf564defc76ebc8697cec035c5737d7cf053718e546,include_method_source_lead,method_source,I_METHOD_SOURCE,This study evaluates nonparametric Hawkes models and reproduction-number classifiers for prospective detection of epidemic case surges.,codex-cli-task5-fix3-reader-a-019f8283-02f1-7170-8cd7-d9698c73e17f,W01-BATCH-024,
