candidate_key,source_row_sha256,primary_decision,primary_proposed_record_type,primary_reason_code,primary_reason,primary_reviewer,batch_id,retained_candidate_key
PMID:36718319,302e59ab5abc8edee071f7d9e6102bd9949cb64ef11f3f79d10c5e4b9adbd73f,include_applied_seed,applied_seed,I_APPLIED_TRANSFERABLE_DESIGN,The study estimates between-farm African swine fever R0 using a susceptible-infectious regression approach under alternative infectious-period scenarios.,codex-semantic-primary-033-split-rerun3,W01-BATCH-033,
PMID:36722802,eee01443a57cc9e3821e87d43f56050285fb6c3e0b5a5c2c4944920bfa103379,include_method_source_lead,method_source,I_METHOD_SOURCE,The paper develops and simulation-evaluates a negative-binomial framework for jointly estimating time-varying reproduction and dispersion parameters.,codex-semantic-primary-033-split-rerun3,W01-BATCH-033,
PMID:36726647,83fad63206fb3d06c5ea52189cefbeea3a537e4dad9c7c162025e152829825ba,exclude,,X_NOT_INFECTIOUS_TRANSFERABLE,The study evaluates hospital early-warning scores for chronic obstructive pulmonary disease exacerbation prognosis rather than an infectious-disease surveillance or transmission method.,codex-semantic-primary-033-split-rerun3,W01-BATCH-033,
PMID:36750871,f048c46c21548514f78fdc604472fd544f46f52cea0948bf8242060f8c0c8d40,include_applied_seed,applied_seed,I_APPLIED_TRANSFERABLE_DESIGN,"The mixed-methods evaluation assesses completeness, timeliness, and practical use of routine cholera surveillance data for early warning during conflict.",codex-semantic-primary-033-split-rerun3,W01-BATCH-033,
PMID:36753328,85f8273cbbeddbfde5c9c303bc512ee93329be72944476cde4a585900c56960d,include_applied_seed,applied_seed,I_APPLIED_TRANSFERABLE_DESIGN,The study evaluates geospatial case-cluster mapping with an early-warning system to target active tuberculosis case finding.,codex-semantic-primary-033-split-rerun3,W01-BATCH-033,
PMID:36787234,7c3528479abc727b0480b3a78fd2b7349cef8bf4420773f8cf6a6b29f82bcbe6,include_method_source_lead,method_source,I_METHOD_SOURCE,The paper proposes and cross-validates a dysregulated dynamic-network-biomarker method for pre-symptomatic influenza warning signals.,codex-semantic-primary-033-split-rerun3,W01-BATCH-033,
PMID:36812522,f4988f91d8752f6d13549d09635185b2c4781b877645208346349454f778d4d2,include_diagnostic_or_correction_lead,guidance,I_DIAGNOSTIC_CORRECTION,The scoping review identifies input-data and methodological limitations of real-time Rt estimation and summarizes approaches intended to address them.,codex-semantic-primary-033-split-rerun3,W01-BATCH-033,
PMID:36845803,1d223cabfb3e976e769acb5b26d0dad17385d41218153742d89f5983a0f39146,include_simulation_or_mechanistic_lead,applied_seed,I_SIMULATION_MECHANISTIC,The study applies a mortality-adjusted SIR model to estimate mpox herd-immunity thresholds and reproduction numbers across countries.,codex-semantic-primary-033-split-rerun3,W01-BATCH-033,
PMID:36848355,6c5e95c074c205eb2ef6f35cd1efb11fa43004dde11c26b6ef6791df77c23de2,include_diagnostic_or_correction_lead,correction,I_DIAGNOSTIC_CORRECTION,The paper develops a correction and bias decomposition for reproduction-number interpretation when testing volume changes over time.,codex-semantic-primary-033-split-rerun3,W01-BATCH-033,
PMID:36869118,6949b853275dcb244177b523d45e43734da21de98e18dc82d26be86b99ccb17a,include_applied_seed,applied_seed,I_APPLIED_TRANSFERABLE_DESIGN,The study builds a weather-based machine-learning classifier and spatial outbreak index for district-level Puumala hantavirus early warning.,codex-semantic-primary-033-split-rerun3,W01-BATCH-033,
PMID:36896517,7bbca16245f8acba3d3a9e13e4504b901538d32a6dabb00e2fdd0f810625be1c,include_simulation_or_mechanistic_lead,applied_seed,I_SIMULATION_MECHANISTIC,The study uses a stochastic augmented SVEIR model and extended Kalman filtering to estimate COVID-19 Rt and vaccination rates.,codex-semantic-primary-033-split-rerun3,W01-BATCH-033,
PMID:36915077,3d44d266a09c1d9c080684ee6df3219673aade4b9a0888fe2d4ded52a9447ac3,include_method_source_lead,method_source,I_METHOD_SOURCE,The paper develops and simulation-tests Bayesian spatiotemporal model selection and averaging for location-specific reproduction-number estimation.,codex-semantic-primary-033-split-rerun3,W01-BATCH-033,
PMID:36919878,8a3b75bb826479aa57cd07b789ff09250dd678876814fb91488667806e513c68,include_diagnostic_or_correction_lead,diagnostic,I_DIAGNOSTIC_CORRECTION,The study validates NEWS and qSOFA for predicting mortality and ICU admission during febrile neutropenic episodes in chemotherapy patients.,codex-semantic-primary-033-split-rerun3,W01-BATCH-033,
PMID:36929985,1b1680af7df6eaaeb7f405021299ad97eca771c09c623163d48c7be0290d70a5,include_method_source_lead,method_source,I_METHOD_SOURCE,The study uses Bayesian reconstruction of household transmission trees to estimate variant-specific COVID-19 serial intervals including negative intervals.,codex-semantic-primary-033-split-rerun3,W01-BATCH-033,
PMID:36945350,97aeff701f101050c9a785e1612d3d75e2b665527f9556eb6e72d910c6b3107e,include_applied_seed,applied_seed,I_APPLIED_TRANSFERABLE_DESIGN,The paper implements a digital-twin ventilation warning system that integrates building sensors and forecasts to reduce indoor coronavirus transmission risk.,codex-semantic-primary-033-split-rerun3,W01-BATCH-033,
PMID:36962831,449a046adc9930d09f958d78121a6f6b8327ea3b05d4fe07cd5fd6d6ae1bb8ba,include_applied_seed,applied_seed,I_APPLIED_TRANSFERABLE_DESIGN,The study combines cholera Rt estimation with machine learning to identify social and environmental outbreak-risk thresholds.,codex-semantic-primary-033-split-rerun3,W01-BATCH-033,
PMID:36967669,44dd12b9be23379424a4ef18b5cf1fadef994e54deef16659b0dde19b4f36d08,include_diagnostic_or_correction_lead,guidance,I_DIAGNOSTIC_CORRECTION,The narrative review compares epidemic intelligence systems and describes how artificial intelligence can support early outbreak detection.,codex-semantic-primary-033-split-rerun3,W01-BATCH-033,
PMID:36996096,190e8ab3a6b29f3816290fe491ae2e843fcbd534cc4ee36189f6d479c4685f0d,include_applied_seed,applied_seed,I_APPLIED_TRANSFERABLE_DESIGN,The study applies WHO early-warning indicators to quantify facility and regional risks for preventable HIV drug resistance.,codex-semantic-primary-033-split-rerun3,W01-BATCH-033,
PMID:37012517,b7e6c8c19497db8367daecc7224815ca3ae7edc1be50906a696cc1b19f94f37a,exclude,,X_NOT_INFECTIOUS_TRANSFERABLE,The paper develops an optical imaging probe for rheumatoid arthritis pathogenesis rather than an infectious-disease method with a concrete transfer route.,codex-semantic-primary-033-split-rerun3,W01-BATCH-033,
PMID:37061316,43463723392b118eedad4b8b7f70ce11c85e9b07331d5bdd5c3b0a9ee1d543a3,include_diagnostic_or_correction_lead,guidance,I_DIAGNOSTIC_CORRECTION,The paper proposes an aircraft-wastewater genomic surveillance network and its data-linkage architecture for pandemic early warning.,codex-semantic-primary-033-split-rerun3,W01-BATCH-033,
PMID:37104296,3c41f48147230e81fa05dbb1c93a2735896240de0815d956cc2c3334fe8925c5,include_simulation_or_mechanistic_lead,applied_seed,I_SIMULATION_MECHANISTIC,The study uses temperature-dependent compartmental transmission models and climate scenarios to project Zika and dengue epidemic potential.,codex-semantic-primary-033-split-rerun3,W01-BATCH-033,
PMID:37104337,9509b70470ef809aeaccc1e5620fca8d433c47641dc7088f2d2fb4569014b33a,include_applied_seed,applied_seed,I_APPLIED_TRANSFERABLE_DESIGN,The paper evaluates wastewater detection against notified cases to quantify early-warning predictive values in low-incidence COVID-19 settings.,codex-semantic-primary-033-split-rerun3,W01-BATCH-033,
PMID:37128312,87a6bd0ce5343179fa59abd4903b0cec73494e23feb7d596cec3d46e0f72bc67,include_simulation_or_mechanistic_lead,applied_seed,I_SIMULATION_MECHANISTIC,The study compares compartmental dengue models parameterized by particle swarm optimization to estimate R0 from national incidence data.,codex-semantic-primary-033-split-rerun3,W01-BATCH-033,
PMID:37132229,79714d8bbfad50d026dda866c8f32dfa8cc1a38f4e1a37ef613cf4a541cb256e,include_simulation_or_mechanistic_lead,method_source,I_SIMULATION_MECHANISTIC,The simulation study evaluates how viral-load correlations along transmission chains can bias early reproduction-number estimates.,codex-semantic-primary-033-split-rerun3,W01-BATCH-033,
PMID:37133905,fad2a9ec5e370516917960063555006f9ec0bec63171c2aee07d0b0a90a11cc4,include_method_source_lead,method_source,I_METHOD_SOURCE,The study evaluates genomic typing schemes against epidemiological outbreak links to compare their suitability for Campylobacter surveillance.,codex-semantic-primary-033-split-rerun3,W01-BATCH-033,
PMID:37133929,821bd37d1a8c57ccf8255eacc98ba27b8a25ffcc4d9d566385de7bb7af72555b,include_diagnostic_or_correction_lead,guidance,I_DIAGNOSTIC_CORRECTION,The paper presents and assesses feasibility considerations for a community infrared-thermometer and AI framework for respiratory outbreak warning.,codex-semantic-primary-033-split-rerun3,W01-BATCH-033,
PMID:37147822,946e9bb8c9d8ff062cd12e65c26f6ea11d3a85b1f86b1454feba200da1b383c5,include_diagnostic_or_correction_lead,guidance,I_DIAGNOSTIC_CORRECTION,The review describes surveillance methods and warning models for designing a multichannel system for emerging respiratory communicable diseases.,codex-semantic-primary-033-split-rerun3,W01-BATCH-033,
PMID:37166763,9ac51d3d32510bf000f184b167a34b81641ba44819692ca19bdac97713380c3d,include_simulation_or_mechanistic_lead,applied_seed,I_SIMULATION_MECHANISTIC,The study uses a data-informed individual-based meningococcal transmission model to evaluate reactive control and vaccination strategies.,codex-semantic-primary-033-split-rerun3,W01-BATCH-033,
PMID:37172174,d297990e236e64f1ab18ca06c754213ed0a45e7a6245fc5eb05c311009c3b56a,include_applied_seed,applied_seed,I_APPLIED_TRANSFERABLE_DESIGN,The paper describes a COVID-19 dashboard that combines retrospective surveillance with agent-based simulation forecasts for local control planning.,codex-semantic-primary-033-split-rerun3,W01-BATCH-033,
PMID:37174143,e0421f0ccf1514d15a30fec286f5714edd682c1873c0116dbe968af3030461dc,include_applied_seed,applied_seed,I_APPLIED_TRANSFERABLE_DESIGN,"The national survey maps early-warning-system coverage, data flows, and implementation barriers for emerging antimicrobial-resistance profiles.",codex-semantic-primary-033-split-rerun3,W01-BATCH-033,
PMID:37180301,f1608f521b61f4f478c50ac9b75f0be5b04e562da02d74a166ad7f9e96fa3416,include_diagnostic_or_correction_lead,diagnostic,I_DIAGNOSTIC_CORRECTION,The prospective study compares NEWS2 and qSOFA diagnostic accuracy for mortality prediction among emergency patients with suspected infection.,codex-semantic-primary-033-split-rerun3,W01-BATCH-033,
PMID:37194269,329f03d04a14091468b2b1a41b8cb15298b441288bffab281178142e23ae6e0a,include_applied_seed,applied_seed,I_APPLIED_TRANSFERABLE_DESIGN,The study evaluates Bayesian hydrometeorological models and a two-stage approach for leptospirosis outbreak prediction.,codex-semantic-primary-033-split-rerun3,W01-BATCH-033,
PMID:37203518,9f9fde48ab8cc2dd1df1380ec821b227c0a1effabf2a2bdf9b8262630b5d3a94,include_applied_seed,applied_seed,I_APPLIED_TRANSFERABLE_DESIGN,The study tests search and social-media signals with lag analyses and LSTM forecasting for COVID-19 early warning.,codex-semantic-primary-033-split-rerun3,W01-BATCH-033,
PMID:37221077,52301e11d9bb2289968bbf86e8d6c7627ce10de0824ac4652fb134f99ca04891,include_applied_seed,applied_seed,I_APPLIED_TRANSFERABLE_DESIGN,The field study implements syndromic surveillance using EARS-3C and space-time scanning to warn of border-area communicable-disease outbreaks.,codex-semantic-primary-033-split-rerun3,W01-BATCH-033,
PMID:37234097,60d8c27f5914bdfc794ce842a4f25076666b78f7b477f53c134f902a5fc184ec,include_method_source_lead,method_source,I_METHOD_SOURCE,The paper introduces and evaluates the cEVI early-warning index and combinations of warning indices for detecting epidemic waves.,codex-semantic-primary-033-split-rerun3,W01-BATCH-033,
PMID:37243598,fba69b8b3826156fa5628ca418d0fb89426da982b62e66ec0d7709d5bdb53f75,exclude,,X_NOT_INFECTIOUS_TRANSFERABLE,The protocol concerns nanoprobes for detecting a kiwifruit fungal pathogen and does not establish a concrete human or animal infectious-disease transfer route.,codex-semantic-primary-033-split-rerun3,W01-BATCH-033,
PMID:37261374,b855c9e4b7570b4a68a80b281b9938537b9d429d94146bf094178f218fbaa827,include_diagnostic_or_correction_lead,diagnostic,I_DIAGNOSTIC_CORRECTION,The retrospective cohort compares clinical early-warning scores and thresholds for predicting severe COVID-19 Delta outcomes.,codex-semantic-primary-033-split-rerun3,W01-BATCH-033,
PMID:37286834,e8a4a5a91427833e9972f29a652564dd47dd55504beac82e1d9fac59782e84c9,include_applied_seed,applied_seed,I_APPLIED_TRANSFERABLE_DESIGN,"The wastewater programme combines viral-load monitoring, sequencing, and statistical models to provide early detection of COVID-19 waves and variants.",codex-semantic-primary-033-split-rerun3,W01-BATCH-033,
PMID:37289431,fd752afc12172088ac2768ceb13d48ed4443900660504c2949d59bb748e3045e,include_applied_seed,applied_seed,I_APPLIED_TRANSFERABLE_DESIGN,"The multinational outbreak investigation combines notification networks, case tracing, sensitive toxin assays, and genomic evidence for source attribution.",codex-semantic-primary-033-split-rerun3,W01-BATCH-033,
PMID:37322837,f331c2aa6ef5e9ebfa5c745fa7df5aa466524faaca4959ab9dc62e914f8bf8d3,include_diagnostic_or_correction_lead,guidance,I_DIAGNOSTIC_CORRECTION,The conceptual review specifies a bottom-up and top-down One Health early-warning and response-system framework for zoonotic outbreaks.,codex-semantic-primary-033-split-rerun3,W01-BATCH-033,
PMID:37325911,dc9a00b2507a9c3be09c023b6af2cc73d92eeeea48e5bc105cfff3ec9a7793ad,include_applied_seed,applied_seed,I_APPLIED_TRANSFERABLE_DESIGN,The study estimates mpox effective reproduction numbers from surveillance data and compares transmission trends across regions and population groups.,codex-semantic-primary-033-split-rerun3,W01-BATCH-033,
PMID:37327561,0d2ab5ad0300d205f83ad137f689a250fe26d151531a50d8a34378c1a1303558,include_applied_seed,applied_seed,I_APPLIED_TRANSFERABLE_DESIGN,The study evaluates AI parsing of open-source rash-and-fever reports to monitor potential missed mpox outbreak signals.,codex-semantic-primary-033-split-rerun3,W01-BATCH-033,
PMID:37336072,2f2ef0667676b4101b5e2d4abe685e1fbe5d74d7b2121d3766bb89fe904bc7f5,exclude,,X_COMMENTARY_ONLY,This commentary critiques the politics of early-warning practices for opioid overdose without presenting an infectious-disease method resource.,codex-semantic-primary-033-split-rerun3,W01-BATCH-033,
PMID:37344123,1fb711f1212dd9407cd005563447f0b1b7090cea84c30f50008842fa5f18d4ef,include_diagnostic_or_correction_lead,diagnostic,I_DIAGNOSTIC_CORRECTION,The cohort study evaluates whether combining NEWS with neutrophil-to-lymphocyte ratio improves mortality prediction in pneumonia.,codex-semantic-primary-033-split-rerun3,W01-BATCH-033,
PMID:37347416,5a2b61efa0edcd1a282b1d5d2f5ea99491f0fc80d9699cff705558cfd0ceeb42,include_method_source_lead,method_source,I_METHOD_SOURCE,The study develops a multilevel Bayesian penalized-spline model for latent SARS-CoV-2 loads from noisy and left-censored wastewater data.,codex-semantic-primary-033-split-rerun3,W01-BATCH-033,
PMID:37347815,769bda351d04e0b086d569349506814ce7a576ec6ffe47e92792b41fca3a4112,include_applied_seed,applied_seed,I_APPLIED_TRANSFERABLE_DESIGN,The study estimates serial intervals and basic and district-level reproduction numbers for the Sudan virus outbreak from surveillance data.,codex-semantic-primary-033-split-rerun3,W01-BATCH-033,
PMID:37350244,9d8e9102eb644b8eb0544a02f8791524a04277cf67097b12bed11111eac5fcb0,include_method_source_lead,method_source,I_METHOD_SOURCE,The study evaluates a ward-specific Clostridioides difficile outbreak-warning algorithm against transmission events confirmed by typing and sequencing.,codex-semantic-primary-033-split-rerun3,W01-BATCH-033,
PMID:37354912,acfa2cb1f784717123136ed26715de42d05da14e04c7006016c1006a7a7d31b9,uncertain_retrieve_primary,,U_PRIMARY_RECORD_NEEDED,"The title indicates Ebola outbreak detection and response, but no abstract is supplied to determine whether the article contains substantive methodological content.",codex-semantic-primary-033-split-rerun3,W01-BATCH-033,
PMID:37361054,016d3a394ffcd2ecca6c98aaff77a42057b428e60fd23ac44ded2ba1e9a43dc0,include_simulation_or_mechanistic_lead,method_source,I_SIMULATION_MECHANISTIC,The paper develops and analyzes a nonlocal dispersal epidemic model linking transmission to air-pollution concentration and derives its R0 behavior.,codex-semantic-primary-033-split-rerun3,W01-BATCH-033,
PMID:37362865,9d18ae7f258cf95ddab56b08b58f32e8ba4bb2562e6ae183564303592102feeb,include_diagnostic_or_correction_lead,guidance,I_DIAGNOSTIC_CORRECTION,"The review synthesizes multimodal virus databases and methods for variant forecasting, evolutionary modeling, and early warning.",codex-semantic-primary-033-split-rerun3,W01-BATCH-033,
PMID:37367195,6706ea4036b4656019504620575b7167cf9b0f3c2ec74b4d3bc12583a6b8024c,include_simulation_or_mechanistic_lead,applied_seed,I_SIMULATION_MECHANISTIC,The paper proposes a clinical metagenomic surveillance network and uses SEIR simulation to estimate detection probability and coverage requirements.,codex-semantic-primary-033-split-rerun3,W01-BATCH-033,
PMID:37386526,6a0dbc29b1315e1f901736e6a31268a4f767e4169987a43333c66632eab5b493,include_simulation_or_mechanistic_lead,applied_seed,I_SIMULATION_MECHANISTIC,The experimental contact-transmission study estimates African swine fever transmission rates and R0 using susceptible-infectious-removed models.,codex-semantic-primary-033-split-rerun3,W01-BATCH-033,
PMID:37405705,f7244a049322895d4b1eac63fa315111c8e8698614c24cb5a3d114d8909585af,include_applied_seed,applied_seed,I_APPLIED_TRANSFERABLE_DESIGN,The proof-of-concept study designs wastewater SARS-CoV-2 monitoring in a defined population and compares it with clinical and syndromic surveillance.,codex-semantic-primary-033-split-rerun3,W01-BATCH-033,
PMID:37416322,246e69b370526d5785326efd630fc2499aac1edfca570ae06bd233d06213a604,include_method_source_lead,method_source,I_METHOD_SOURCE,"The paper develops EpiMix, a Bayesian regression approach for Rt estimation with exogenous factors and random effects, and tests it in simulations.",codex-semantic-primary-033-split-rerun3,W01-BATCH-033,
PMID:37419130,e6014ed55b3d705bc83f8a1d605807268099068300cc03232b747b4e776bb87f,include_diagnostic_or_correction_lead,guidance,I_DIAGNOSTIC_CORRECTION,The review identifies surveillance disruption and proposes strengthening early-warning and response networks for communicable-disease control after conflict and earthquakes.,codex-semantic-primary-033-split-rerun3,W01-BATCH-033,
PMID:37428407,59fcf3fd256c8bbe70ce784e96cc65910bb3ed91d8bdbda9f1d7126126f5b86a,include_diagnostic_or_correction_lead,diagnostic,I_DIAGNOSTIC_CORRECTION,The prospective HIV cohort validates a semi-qualitative patient-generated index as an early-warning measure for brain-health outcomes.,codex-semantic-primary-033-split-rerun3,W01-BATCH-033,
PMID:37451348,c64105f89f8d74e327d67f85a5b4aa7da5f5571bcacbce37044353132cc6eb6a,include_method_source_lead,method_source,I_METHOD_SOURCE,The study evaluates a low-capacity whole-genome sequencing platform against an established platform for enteric-disease surveillance and outbreak detection.,codex-semantic-primary-033-split-rerun3,W01-BATCH-033,
PMID:37471346,9ecd15f7fdc43177ae91c01d5d1f806b3cca338af7ef20d1af3ae8ec7d986d7f,include_applied_seed,applied_seed,I_APPLIED_TRANSFERABLE_DESIGN,The campus study evaluates wastewater SARS-CoV-2 RNA detection and extraction methods against reported case clusters for early surveillance.,codex-semantic-primary-033-split-rerun3,W01-BATCH-033,
PMID:37490532,3d9d2a4be1f01cb55cc30bb6b5456fef4d106b779db366735558b78ccb9e540e,include_method_source_lead,method_source,I_METHOD_SOURCE,The study develops and validates the Covid-SURGE algorithm to distinguish sustained community COVID-19 wastewater surges from background noise.,codex-semantic-primary-033-split-rerun3,W01-BATCH-033,
PMID:37521307,09304199148972955cf75f3b7d7b277ac6afa33d7c002a7689240283e1dec9e3,include_method_source_lead,method_source,I_METHOD_SOURCE,The paper extends Farrington Flexible to multisite mixed-effects outbreak detection and evaluates it in simulations and sick-leave data.,codex-semantic-primary-033-split-rerun3,W01-BATCH-033,
PMID:37524952,e13ffab3bfb7be7ec39afc695ce4d93adc01c972c2b8e2c25cbec640401eea0e,include_method_source_lead,method_source,I_METHOD_SOURCE,The paper develops and experimentally validates a deep-learning protein-interaction framework for predicting SARS-CoV-2 infectivity and variant evolution.,codex-semantic-primary-033-split-rerun3,W01-BATCH-033,
PMID:37543637,f6d31297168f22a14a21403236b8ee0e235c6c57fc3ab1cafec4baa8d652dc76,exclude,,X_NOT_INFECTIOUS_TRANSFERABLE,The study develops a Bayesian-network early-warning model for diabetes risk factors without a concrete infectious-disease transfer route.,codex-semantic-primary-033-split-rerun3,W01-BATCH-033,
PMID:37569237,af70ea8bfb7dfeb0e07a5ac0ecac3a51a902831dd303e601071a08b0d4447666,exclude,,X_NOT_INFECTIOUS_TRANSFERABLE,"The study develops gas-sensor and chemometric monitoring for apple spoilage, not infectious-disease epidemiology or surveillance.",codex-semantic-primary-033-split-rerun3,W01-BATCH-033,
PMID:37578878,8abe567a7e2c02001ef8f70b760e66d7b90d04a7119447b44e584d2f8bf18e8d,include_diagnostic_or_correction_lead,guidance,I_DIAGNOSTIC_CORRECTION,The review assesses biosensor approaches and implementation needs for rapid water-source detection of the infectious parasite Cryptosporidium.,codex-semantic-primary-033-split-rerun3,W01-BATCH-033,
PMID:37606730,4409a0e4678066bf8bf8e024345a5f2e367a7dde5515a49b4a737790132dad56,include_simulation_or_mechanistic_lead,method_source,I_SIMULATION_MECHANISTIC,The paper derives reproduction-number and persistence properties for an age-structured spatial SIS epidemic model under varying diffusion rates.,codex-semantic-primary-033-split-rerun3,W01-BATCH-033,
PMID:37615346,5aeae9e53d39190768ea6f49936356fbcfa6fb32d515a51cf826f63ecc9c772f,include_diagnostic_or_correction_lead,diagnostic,I_DIAGNOSTIC_CORRECTION,"The study develops, externally validates, and benchmarks a laboratory-based score for near-term severe COVID-19 outcomes.",codex-semantic-primary-033-split-rerun3,W01-BATCH-033,
PMID:37639484,f8e396c5a2dcbac3ca633a259172cae485bac0ad4a16fdf10aae3d1fa6114d5d,include_method_source_lead,method_source,I_METHOD_SOURCE,The paper develops software and simulation-validates an expectation-maximization method for estimating Rt from temporally aggregated incidence data.,codex-semantic-primary-033-split-rerun3,W01-BATCH-033,
PMID:37644974,6887768ed9f10fb2ac4f613e7729c47a46d5045926325094a77e8c7a257cdae7,include_applied_seed,applied_seed,I_APPLIED_TRANSFERABLE_DESIGN,The cohort study uses early-warning-score strata to identify delayed antibiotic treatment pathways and mortality among patients admitted with bloodstream infection.,codex-semantic-primary-033-split-rerun3,W01-BATCH-033,
PMID:37647118,47138dac9effb254daff8841dec74f5c5b2f0d86574958f88067af0c3d2be5cc,include_applied_seed,applied_seed,I_APPLIED_TRANSFERABLE_DESIGN,"The outbreak investigation demonstrates active case finding, product tracing, and genomic sequencing for early detection and source attribution of Pseudomonas infections.",codex-semantic-primary-033-split-rerun3,W01-BATCH-033,
PMID:37649793,50fef65feb34d3c2a4a817e64a082143b5cf59b58f4e5b6b1f56397e3dfa8006,include_method_source_lead,method_source,I_METHOD_SOURCE,"The paper simulation-compares a particle-filter Rt estimator with EpiEstim under reporting delays, presymptomatic spread, and imperfect observation.",codex-semantic-primary-033-split-rerun3,W01-BATCH-033,
PMID:37671788,5e8f78c7370b9dabcfe360872003efbf8f77f06e7828dc0afb4d32b3804e12d6,include_applied_seed,applied_seed,I_APPLIED_TRANSFERABLE_DESIGN,The study applies nonlinear mixed changepoint models to quantify the timing and persistence of COVID-19-related changes in community antibiotic consumption.,codex-semantic-primary-033-split-rerun3,W01-BATCH-033,
PMID:37673643,45b78a158c3ce45b1160eda235d28f7e0c6d62cd7ca7f8e923762610406c5166,include_diagnostic_or_correction_lead,diagnostic,I_DIAGNOSTIC_CORRECTION,The diagnostic cohort compares 21 prehospital early-warning scores combined with paramedic impression for identifying urgently treated sepsis.,codex-semantic-primary-033-split-rerun3,W01-BATCH-033,
PMID:37679113,a52ce33db942efecff1927c45a651b310f01e006177b70c89208afba2cd6b19a,include_method_source_lead,method_source,I_METHOD_SOURCE,The paper proposes and simulation-validates a method for estimating time-varying reproduction-number changes due to interventions or seasonal transmission.,codex-semantic-primary-033-split-rerun3,W01-BATCH-033,
PMID:37679512,ff5ebe9edf4235121a752f4e2484692b7ec822ac947d4fbc4e3ec3a37eb5cbcb,include_applied_seed,applied_seed,I_APPLIED_TRANSFERABLE_DESIGN,The study quantifies spatial and temporal lead times of Baidu search signals for COVID-19 case increases under differing testing intensity.,codex-semantic-primary-033-split-rerun3,W01-BATCH-033,
