candidate_key,source_row_sha256,primary_decision,primary_proposed_record_type,primary_reason_code,primary_reason,primary_reviewer,batch_id,retained_candidate_key
PMID:34880504,30461d7534b0ad1ef805b88a5d83d2475baa21195c063754a646f513dabb48e8,include_diagnostic_or_correction_lead,diagnostic,I_DIAGNOSTIC_CORRECTION,This study diagnoses selection bias in large vaccine surveys and decomposes resulting population-estimation error.,codex-cli-task5-fix3-reader-a-019f829d-2df9-7871-9207-2fd478db87c2,W01-BATCH-044,
PMID:34883066,a7073e7f27d74c0cdad6bf38a2cf880a15fbd1735b681e3dfabbdccc24b043fb,exclude,,X_DESCRIPTIVE_ONLY,"This population pharmacokinetic simulation optimizes neonatal therapeutic dosing, an explicitly ineligible modelling purpose.",codex-cli-task5-fix3-reader-a-019f829d-2df9-7871-9207-2fd478db87c2,W01-BATCH-044,
PMID:34901380,8569366a1e5d17b3493c94d55696113aab31385e870cdf2910d6147c152f5091,include_simulation_or_mechanistic_lead,method_source,I_SIMULATION_MECHANISTIC,The deterministic model develops a mechanistic representation of direct and environmental COVID-19 transmission.,codex-cli-task5-fix3-blind-019f82aa-9d23-7102-9c1c-10a100e7b26f,W01-BATCH-044,
PMID:34908459,b32de62a2f4acbc0a902de6bb2b36db9ef51c35447d04d2b8c0ef1bb30204b13,exclude,,X_DESCRIPTIVE_ONLY,This agent-based biofilm study models within-host microbial interactions rather than population-level infectious epidemiological processes.,codex-cli-task5-fix3-reader-a-019f829d-2df9-7871-9207-2fd478db87c2,W01-BATCH-044,
PMID:34928280,1189b9eda0b46e87b38a27f490fb46d6ce708c00d995a0b751a66f00b3e2d2fa,exclude,,X_DESCRIPTIVE_ONLY,This molecular binding simulation supports antibiotic ligand design without an eligible epidemiological method or process model.,codex-cli-task5-fix3-reader-a-019f829d-2df9-7871-9207-2fd478db87c2,W01-BATCH-044,
PMID:34930336,b7fe62960f78babbcbaf74e949417f6f99b2f1399e3f1a522f798cc8344bf66e,include_simulation_or_mechanistic_lead,applied_seed,I_SIMULATION_MECHANISTIC,"This infectious-process simulation examines how transmission, immune escape, incidence, and epidemic trends govern variant predominance.",codex-cli-task5-fix3-reader-a-019f829d-2df9-7871-9207-2fd478db87c2,W01-BATCH-044,
PMID:34932931,72223b2d8fe86657cafcd2d1abdf1a56a5e2c4f11ed180e13beff782a11fa91d,include_simulation_or_mechanistic_lead,applied_seed,I_SIMULATION_MECHANISTIC,"This calibrated agent-based transmission model compares testing, vaccination, and visitation strategies in nursing homes.",codex-cli-task5-fix3-reader-a-019f829d-2df9-7871-9207-2fd478db87c2,W01-BATCH-044,
PMID:34933883,a9f0ea2187acd89e1cff22ba89cf0ef2e3bad5297bc58419b25504aa69e98425,include_simulation_or_mechanistic_lead,applied_seed,I_SIMULATION_MECHANISTIC,"This agent-based transmission model evaluates university timetabling, testing, tracing, and vaccination interventions.",codex-cli-task5-fix3-reader-a-019f829d-2df9-7871-9207-2fd478db87c2,W01-BATCH-044,
PMID:34934069,1ec06b6d158fd67fa951328dc072c9556f19b1fc9c93caf00a17a59011ae6840,exclude,,X_DESCRIPTIVE_ONLY,"The review summarizes the immunological mechanisms, safety, and vaccine-platform uses of emulsion adjuvants without developing, comparing, or prescribing an epidemiologic or surveillance method.",codex-sol-high-primary-044-3x50,W01-BATCH-044,
PMID:34934610,697abeafbd83d35f2d8ef4c86de11adaee6f3a9924bc814d5577a1508166f9bd,exclude,,X_NOT_INFECTIOUS_TRANSFERABLE,"The agent-based model concerns the life cycle of pandemic-related online collective behavior rather than an infectious outcome, and the abstract provides no concrete route to infectious-disease epidemiology.",codex-sol-high-primary-044-3x50,W01-BATCH-044,
PMID:34942397,c2bcdc5d10b9b54eb8f68798c6a1ac58d736b07a9e0bac2e81b0caada691fb54,exclude,,X_DESCRIPTIVE_ONLY,The study performs molecular docking and receptor simulations for therapeutic compound screening rather than epidemiological inference.,codex-cli-task5-fix3-reader-a-019f8278-0713-79f2-8d5e-8db81337545d,W01-BATCH-044,
PMID:34976570,ec9e9e302f6074d9ed840833e10bc748df793808d575576aa35f2a6c2926f762,include_simulation_or_mechanistic_lead,method_source,I_SIMULATION_MECHANISTIC,The study develops and benchmarks a fitted mechanistic model for epidemic assessment and forecasting.,codex-cli-task5-fix3-reader-a-019f8278-0713-79f2-8d5e-8db81337545d,W01-BATCH-044,
PMID:35020691,34aff23b62df767dc111e0f0dc6bb3f32fb73c71bf15eb88c308d96c7ec0dbe0,exclude,,X_NOT_INFECTIOUS_TRANSFERABLE,This cancer case report describes a pembrolizumab response in a malignant peripheral nerve sheath tumor and supplies no infectious-disease outcome or concrete methodological transfer route.,codex-sol-high-primary-044-3x50,W01-BATCH-044,
PMID:35043076,85e713e8a0478d5b1d10eb02a747cefa1f29d912da9efef8fa85804ad973f92f,include_simulation_or_mechanistic_lead,method_source,I_SIMULATION_MECHANISTIC,The study develops and fits a mechanistic transmission model incorporating airborne virus and infectious immigration.,codex-cli-task5-fix3-reader-a-019f8278-0713-79f2-8d5e-8db81337545d,W01-BATCH-044,
PMID:35054129,6daca788049c913673aa8472a56776c9fcf3f8570eb1847bb5c6bc857ff005e7,exclude,,X_NOT_INFECTIOUS_TRANSFERABLE,"The simulation evaluates physicians' adherence to emergency management of status epilepticus, while respiratory infection is only background motivation rather than the modeled or measured outcome.",codex-sol-high-primary-044-3x50,W01-BATCH-044,
PMID:35087051,28470bc1cb6032d369b8caeee33ca8bbdd0bdf2b32bc4660afe6343847aceb0d,include_simulation_or_mechanistic_lead,applied_seed,I_SIMULATION_MECHANISTIC,The study calibrates an agent-based epidemic model to compare school prevention strategies under transmission.,codex-cli-task5-fix3-reader-a-019f8278-0713-79f2-8d5e-8db81337545d,W01-BATCH-044,
PMID:35092678,4fc5503d3efe57205b88140a7aec49ccd3b9fbcef7cd6741b38346a66c5464e5,include_simulation_or_mechanistic_lead,applied_seed,I_SIMULATION_MECHANISTIC,The study uses an agent-based model to assess vaccination strategies and nursing-home outbreak dynamics.,codex-cli-task5-fix3-reader-a-019f8278-0713-79f2-8d5e-8db81337545d,W01-BATCH-044,
PMID:35103090,d1dbd4c096256db7c198db59db934c75df148c45976bd7dd7955fd3a2be3c0ef,include_simulation_or_mechanistic_lead,method_source,I_SIMULATION_MECHANISTIC,The study develops and checks an agent-based model of COVID-19 epidemic propagation using surveillance data.,codex-cli-task5-fix3-reader-a-019f8278-0713-79f2-8d5e-8db81337545d,W01-BATCH-044,
PMID:35107262,1889fcc87f94e0c0a3031b68c06fac8bb3789adc6f536336dc66709c69710664,exclude,,X_NOT_INFECTIOUS_TRANSFERABLE,"The study develops modified red-blood-cell standards for electrical cytometry and separation, but infection is only a possible use context and no concrete infectious-disease transfer is demonstrated.",codex-sol-high-primary-044-3x50,W01-BATCH-044,
PMID:35118478,7be6b8424be59decb839472935b9cee4f4b4b63412e97f174c4918d5c9c2c6ff,include_simulation_or_mechanistic_lead,method_source,I_SIMULATION_MECHANISTIC,The study extends a viral-dynamics simulation framework to optimize antigen-test-based isolation decision rules.,codex-cli-task5-fix3-reader-a-019f8278-0713-79f2-8d5e-8db81337545d,W01-BATCH-044,
PMID:35124405,46ba951c6c1f27c4b90638c9c66ec59dcb02fd1d5183d03b52a47a23d4df7fe1,include_simulation_or_mechanistic_lead,method_source,I_SIMULATION_MECHANISTIC,The simulation evaluates a Bayesian hidden Markov surveillance model for detecting infected animal herds.,codex-cli-task5-fix3-reader-a-019f8278-0713-79f2-8d5e-8db81337545d,W01-BATCH-044,
PMID:35126218,fbe0796e04876344cb4878bacdcffd6bae985fcf3bd43c44b4df6d3c65960533,exclude,,X_NOT_INFECTIOUS_TRANSFERABLE,"The study models construction-project development and economic stability with fear of COVID-19 as a moderator, but it has no infectious outcome or concrete epidemiologic transfer route.",codex-sol-high-primary-044-3x50,W01-BATCH-044,
PMID:35149970,798cf58d2195d584feefe52a9310c72ec9a24570a8641f9eaecdf64ef69cf6f5,include_applied_seed,applied_seed,I_APPLIED_TRANSFERABLE_DESIGN,The study applies comparative post-market surveillance analysis to benchmark vaccine adverse-event risks against common medicines.,codex-cli-task5-fix3-reader-a-019f8278-5f6c-7802-b139-6bbd0c581185,W01-BATCH-044,
PMID:35187170,31b5154e2283fa4a52431e620de438f68251665404b8fb54640b01bb6f9d5068,exclude,,X_DESCRIPTIVE_ONLY,The record reports nanoparticle-assisted antibacterial synthesis and molecular docking without a transferable epidemiological contribution.,codex-cli-task5-fix3-reader-a-019f8278-5f6c-7802-b139-6bbd0c581185,W01-BATCH-044,
PMID:35205123,26aef332f77e47c600da7ac605ccd077431bb644bd65b979a5dad3460a2502e4,exclude,,X_NOT_INFECTIOUS_TRANSFERABLE,"The agent-based model concerns inheritance and mating-related prevalence of genetic deafness rather than infection, and the abstract identifies no concrete infectious-disease transfer route.",codex-sol-high-primary-044-3x50,W01-BATCH-044,
PMID:35222030,aceb459c0d4b7c5f8bf7dccbcaa3972042c758df3e182a5bfca1bdcb2777a728,exclude,,X_DESCRIPTIVE_ONLY,The simulation optimizes within-host antiviral treatment effects rather than a transferable epidemiological or transmission method.,codex-cli-task5-fix3-reader-a-019f8278-5f6c-7802-b139-6bbd0c581185,W01-BATCH-044,
PMID:35224813,b91744de587e4ca69971697f77f7a8d4f4a0d0708761517a642bb2d8f561bec5,exclude,,X_NOT_INFECTIOUS_TRANSFERABLE,"The benchmark compares tools for prioritizing human genetic-disease variants, and the abstract does not establish a concrete application to infectious pathogens or surveillance.",codex-sol-high-primary-044-3x50,W01-BATCH-044,
PMID:35229833,67be9b9a1af37f7a351b4b3a107c575340d907c32a4badf0454ba5a8bf8fb82b,exclude,,X_DESCRIPTIVE_ONLY,The study models molecular drug permeability across cellular membranes without an epidemiological estimator or infectious-process model.,codex-cli-task5-fix3-reader-a-019f8278-5f6c-7802-b139-6bbd0c581185,W01-BATCH-044,
PMID:35238437,180043acdc08d6b626cf0a313044834579d0093acc65d9b559dc6ab7db7723d7,include_simulation_or_mechanistic_lead,applied_seed,I_SIMULATION_MECHANISTIC,The study applies an agent-based transmission model to evaluate reopening policies and support public-health decisions.,codex-cli-task5-fix3-reader-a-019f8278-5f6c-7802-b139-6bbd0c581185,W01-BATCH-044,
PMID:35239518,df8d4e795a364ae8cb1b31ee98017111fd3e8b49ff3d768640add4bfbf2643d2,include_simulation_or_mechanistic_lead,method_source,I_SIMULATION_MECHANISTIC,The study derives and simulates an inverse-probability estimator for causal vaccine-effectiveness estimands under test-negative designs.,codex-cli-task5-fix3-reader-a-019f8278-5f6c-7802-b139-6bbd0c581185,W01-BATCH-044,
PMID:35245337,1ccd3c9a167fdab4e35fdd64dcddf9dcec941bfdb0f5730b4fa06e1e83182fd4,include_simulation_or_mechanistic_lead,method_source,I_SIMULATION_MECHANISTIC,The study develops ensemble-based data-assimilation methods for calibrating epidemiological agent-based models from surveillance data.,codex-cli-task5-fix3-reader-a-019f8278-5f6c-7802-b139-6bbd0c581185,W01-BATCH-044,
PMID:35245888,6bb64460eba9ae562c99561d87c8562e71e481dc93ca83384b223104ea501349,exclude,,X_NOT_INFECTIOUS_TRANSFERABLE,"The study predicts oncologic recurrence after surgery for HPV-positive cancer, but recurrence rather than infection is the outcome and no concrete infectious-epidemiology transfer route is supplied.",codex-sol-high-primary-044-3x50,W01-BATCH-044,
PMID:35255958,c359ebe692a5d2f75739ef7ccd29143b7a42d9c8d296eecc56c736dbe61be8b6,exclude,,X_DESCRIPTIVE_ONLY,The benchmark concerns molecular drug-screening machine learning without a transferable infectious-disease epidemiological method.,codex-cli-task5-fix3-reader-a-019f8278-5f6c-7802-b139-6bbd0c581185,W01-BATCH-044,
PMID:35270344,5281ea71546d794506d4d9518cd84d7d6aeb681d9ee599d8abf25086a3496cbf,include_simulation_or_mechanistic_lead,applied_seed,I_SIMULATION_MECHANISTIC,The study applies an agent-based facility transmission model to evaluate infection-control interventions in long-term care.,codex-cli-task5-fix3-reader-a-019f8278-5f6c-7802-b139-6bbd0c581185,W01-BATCH-044,
PMID:35290758,74480521a7954283336ecf033fdba7f6152b9e9d81d956739f7f726eff992b94,include_diagnostic_or_correction_lead,reproducibility,I_DIAGNOSTIC_CORRECTION,The study reproducibly benchmarks nineteen bacterial phylogenomic workflows across replicated in-silico evolutionary scenarios.,codex-cli-task5-fix3-reader-a-019f8278-5f6c-7802-b139-6bbd0c581185,W01-BATCH-044,
PMID:35298388,7275e79376e70d9dac3596e0264f0efa1213369f77d2fbab53b00646fb8b1250,include_simulation_or_mechanistic_lead,method_source,I_SIMULATION_MECHANISTIC,The study develops a fine-grained large-population agent-based framework for simulating epidemic spread and policies.,codex-cli-task5-fix3-reader-a-019f8278-5f6c-7802-b139-6bbd0c581185,W01-BATCH-044,
PMID:35301289,ed3acecb3e8182ce9577d53ea700115b52219dd3c76bc0b29233c067f72c3093,include_simulation_or_mechanistic_lead,applied_seed,I_SIMULATION_MECHANISTIC,The study applies an agent-based transmission model to compare reactive and mass vaccination strategies.,codex-cli-task5-fix3-reader-a-019f8278-5f6c-7802-b139-6bbd0c581185,W01-BATCH-044,
PMID:35305315,89942eff51096edf1a1f45253cdf718a934b08c0ee847410cc05bc18981cb97c,exclude,,X_COMMENTARY_ONLY,"The record is identified as a comment and provides no abstract or other evidence of substantive methodological, diagnostic, correction, or guidance content.",codex-sol-high-primary-044-3x50,W01-BATCH-044,
PMID:35311063,ca350e58b238545be3e94204c598f7cdeef3e7f623cd1616d32daa7fdae1bcfb,exclude,,X_DESCRIPTIVE_ONLY,The study performs molecular docking and dynamics for antiviral compound screening without an epidemiological contribution.,codex-cli-task5-fix3-reader-a-019f8278-5f6c-7802-b139-6bbd0c581185,W01-BATCH-044,
PMID:35315266,1beca729477d4a5b51a043e1df24c7bf0dbf70154e64a32b4cdfcf626828c787,include_applied_seed,applied_seed,I_APPLIED_TRANSFERABLE_DESIGN,This study validates risk-adjustment models for benchmarking hospital-acquired infections and other nursing-sensitive outcomes.,codex-cli-task5-fix3-reader-a-019f8278-c417-7d43-9b63-f108222a379e,W01-BATCH-044,
PMID:35320292,2dd270b25f3543d71b7c679fde90bec3a25cd7eb73aa6b4556c67962a5acc6c2,include_simulation_or_mechanistic_lead,applied_seed,I_SIMULATION_MECHANISTIC,This agent-based model simulates facility contamination transmission and compares corrective control strategies.,codex-cli-task5-fix3-reader-a-019f8278-c417-7d43-9b63-f108222a379e,W01-BATCH-044,
PMID:35350133,ffcd7a7fddd8f5682ec3ea4b0ce655b68c8105ca90c609ec9b037c61264e69b4,exclude,,X_DESCRIPTIVE_ONLY,This laboratory drug-screening study optimizes strain panels without an epidemiological method contribution.,codex-cli-task5-fix3-reader-a-019f8278-c417-7d43-9b63-f108222a379e,W01-BATCH-044,
PMID:35350246,7b3ece8446600c74f7d14fc5a8dd26bad2cd487f9000a3e965f1c58239a68da0,exclude,,X_NOT_INFECTIOUS_TRANSFERABLE,The study benchmarks mitochondrial variant callers and pathogenicity resources for human genetic disease without identifying a concrete route to infectious-disease analysis.,codex-sol-high-primary-044-3x50,W01-BATCH-044,
PMID:35360357,a89def48977f2c828255121ad5f04ebc17f02a3980e4cc736f78adbc0604b3ba,include_simulation_or_mechanistic_lead,method_source,I_SIMULATION_MECHANISTIC,"The spatial agent-based model mechanistically links host dispersal, habitat, ticks, and pathogen transmission.",codex-cli-task5-fix3-blind-019f82aa-9d23-7102-9c1c-10a100e7b26f,W01-BATCH-044,
PMID:35378075,fd705ed71d1be4fe56a99c778857856c00597bc38c3ba7e30159e586bf72a034,include_simulation_or_mechanistic_lead,applied_seed,I_SIMULATION_MECHANISTIC,"This calibrated agent-based transmission model compares school testing, vaccination, and closure strategies.",codex-cli-task5-fix3-reader-a-019f8278-c417-7d43-9b63-f108222a379e,W01-BATCH-044,
PMID:35418652,c04f0e89abd9dc97de7e9712f2542e05563d72f06838728c85aed0b49a423682,include_simulation_or_mechanistic_lead,applied_seed,I_SIMULATION_MECHANISTIC,This coupled spatial and SIR agent-based framework compares indoor transmission interventions.,codex-cli-task5-fix3-reader-a-019f8278-c417-7d43-9b63-f108222a379e,W01-BATCH-044,
PMID:35423354,4bd0c1432929c51e071a7e125a27a319b37abfa328469b50d902a07bb0ab82d8,exclude,,X_DESCRIPTIVE_ONLY,This molecular-dynamics study examines receptor binding and structural adaptation rather than epidemiological transmission methods.,codex-cli-task5-fix3-reader-a-019f8278-c417-7d43-9b63-f108222a379e,W01-BATCH-044,
PMID:35431517,a8095a6248e2cb7d4301e32ee19d16b868d35a47f29d21ae91cc5f9ce13d8e0d,exclude,,X_DESCRIPTIVE_ONLY,This molecular screening study searches for antiviral protease inhibitors without an epidemiological contribution.,codex-cli-task5-fix3-reader-a-019f8278-c417-7d43-9b63-f108222a379e,W01-BATCH-044,
PMID:35446847,cb2f8cb7fcc8d6cc13c6c56bae82a8d6445193066276f4c54ca8d464a26a76dd,include_simulation_or_mechanistic_lead,applied_seed,I_SIMULATION_MECHANISTIC,This age-structured stochastic SEIR model compares alternative vaccine-dose timing policies.,codex-cli-task5-fix3-reader-a-019f8278-c417-7d43-9b63-f108222a379e,W01-BATCH-044,
PMID:35463401,bacac6c38546f30296b2cb298324e16336f23a19a6af4a1400a7551e2445bbeb,include_simulation_or_mechanistic_lead,method_source,I_SIMULATION_MECHANISTIC,The study develops and independently validates a mechanistic model of plant-pathogen infection dynamics.,codex-cli-task5-fix3-blind-019f82aa-9d23-7102-9c1c-10a100e7b26f,W01-BATCH-044,
PMID:35474851,66bdbea7e42ad7665383a7cda781e7b250e9302134f5acc0f88ff9681b874d58,include_simulation_or_mechanistic_lead,applied_seed,I_SIMULATION_MECHANISTIC,This agent-based transmission model evaluates operational and spatial determinants of clinic cross-infection risk.,codex-cli-task5-fix3-reader-a-019f8278-c417-7d43-9b63-f108222a379e,W01-BATCH-044,
PMID:35490269,ac33852d28004debe1efc589d13533d4c60253a2c0fe94be7065947889472b42,exclude,,X_NOT_INFECTIOUS_TRANSFERABLE,"The agent-based model concerns melanoma tumor–immune interactions and cancer treatment, and the abstract provides no concrete route to infectious-disease epidemiology.",codex-sol-high-primary-044-3x50,W01-BATCH-044,
PMID:35495092,3a65dfa6aae8f34f5e6ee59b2d6edba620b3ecdaa970b83bd7178c4bb934e638,include_simulation_or_mechanistic_lead,applied_seed,I_SIMULATION_MECHANISTIC,This spatial agent-based epidemic model compares mobility-restriction scenarios as transferable decision support.,codex-cli-task5-fix3-reader-a-019f8278-c417-7d43-9b63-f108222a379e,W01-BATCH-044,
PMID:35515150,296021f14cc3463505ca2fa3ac3aacdcbe9e90041ba02d7e392f5d140aa1640a,exclude,,X_DESCRIPTIVE_ONLY,This molecular docking study evaluates a therapeutic compound without an epidemiological method.,codex-cli-task5-fix3-reader-a-019f8278-cbac-7730-9a0d-323efa6435be,W01-BATCH-044,
PMID:35515722,fce6be5e5b66946a267c4728a66b81810f1f8c0e2c06b532241a2c2278d8bc40,exclude,,X_DESCRIPTIVE_ONLY,This simulated intubation exercise evaluates clinical technique rather than infectious-disease epidemiology.,codex-cli-task5-fix3-reader-a-019f8278-cbac-7730-9a0d-323efa6435be,W01-BATCH-044,
PMID:35531051,66ee70bbab576ab9018ca8a1e03937630b1465e802f5071b2b6f63c52d230420,include_simulation_or_mechanistic_lead,method_source,I_SIMULATION_MECHANISTIC,The study develops and simulates a spatiotemporal estimator of personal airborne exposure.,codex-cli-task5-fix3-reader-a-019f8278-cbac-7730-9a0d-323efa6435be,W01-BATCH-044,
PMID:35537564,536fd720b9a5cd04e52dc7faea82eeebc6f6ad385b5b35b0946b6c4e6a9079f8,include_applied_seed,applied_seed,I_APPLIED_TRANSFERABLE_DESIGN,"The implemented electronic system supports transferable infection-control observation, feedback, and benchmarking.",codex-cli-task5-fix3-reader-a-019f8278-cbac-7730-9a0d-323efa6435be,W01-BATCH-044,
PMID:35540703,e65372a55029844db9a4231b5ffe914bab34e9b0328cc6e6b723f51aad7dfb75,include_simulation_or_mechanistic_lead,applied_seed,I_SIMULATION_MECHANISTIC,This agent-based transmission model projects booster and testing strategies under waning immunity.,codex-cli-task5-fix3-reader-a-019f8278-cbac-7730-9a0d-323efa6435be,W01-BATCH-044,
PMID:35543436,5ff2d6536e580442776033828335305f4933429e87398aa3b5371a21f016cf2b,exclude,,X_NOT_INFECTIOUS_TRANSFERABLE,This medical-education quality comparison lacks an explicit infectious-disease epidemiological transfer route.,codex-cli-task5-fix3-blind-019f82aa-9d23-7102-9c1c-10a100e7b26f,W01-BATCH-044,
PMID:35545230,d2544d6cdbd1fca3cdd073dd592bc1e761104ed17940e06853eb3997855b8736,include_simulation_or_mechanistic_lead,method_source,I_SIMULATION_MECHANISTIC,The authors develop and simulate a robust estimator for delayed infection incidence.,codex-cli-task5-fix3-reader-a-019f8278-cbac-7730-9a0d-323efa6435be,W01-BATCH-044,
PMID:35551272,acbc176c3e5c104353aa0f65fcf68a11efc1152e65c0910cc4550e28c9b2d84c,include_applied_seed,applied_seed,I_APPLIED_TRANSFERABLE_DESIGN,The study explicitly transfers zoonotic transmission modelling to mechanistic human-animal contact estimation.,codex-cli-task5-fix3-reader-a-019f8278-cbac-7730-9a0d-323efa6435be,W01-BATCH-044,
PMID:35573896,e8d0a7df36b44467757dd8f2f40795ea6d42fdfd659d8c546b5f25d9278c496e,include_simulation_or_mechanistic_lead,method_source,I_SIMULATION_MECHANISTIC,The proposed estimators quantify uncertainty in simulation-derived operating characteristics of Bayesian adaptive trials.,codex-cli-task5-fix3-blind-019f82aa-9d23-7102-9c1c-10a100e7b26f,W01-BATCH-044,
PMID:35590305,d3ba9c736981eec9a7495feb23572aa267c23c6a8b046cddb056e2ed9f1852b2,include_simulation_or_mechanistic_lead,applied_seed,I_SIMULATION_MECHANISTIC,The agent-based transmission model compares nursing-home testing and vaccination strategies.,codex-cli-task5-fix3-reader-a-019f8278-cbac-7730-9a0d-323efa6435be,W01-BATCH-044,
PMID:35596137,85e25ee00d418f1fbfedcef8fbc689c59924666605e2bfe39c6820d08aeed70e,include_simulation_or_mechanistic_lead,method_source,I_SIMULATION_MECHANISTIC,The simulation benchmarks regression practices and demonstrates invalid infectious-risk interpretations.,codex-cli-task5-fix3-reader-a-019f8278-cbac-7730-9a0d-323efa6435be,W01-BATCH-044,
PMID:35604952,7917346fca4714627020c6ab7fb44e02112d9915a9c89b9d02c787c574832a16,include_simulation_or_mechanistic_lead,method_source,I_SIMULATION_MECHANISTIC,The authors develop and simulate an estimator for epidemic case reporting.,codex-cli-task5-fix3-reader-a-019f8278-cbac-7730-9a0d-323efa6435be,W01-BATCH-044,
PMID:35606518,ed10243a6e467807518fe3b00d65b460a17a6756c304ecc45f9614fbd99b705f,exclude,,X_DESCRIPTIVE_ONLY,This preclinical mouse vaccine study lacks a transferable epidemiological contribution.,codex-cli-task5-fix3-reader-a-019f8278-cbac-7730-9a0d-323efa6435be,W01-BATCH-044,
PMID:35637643,4aa05398301b61e7cc5661b9a1d6c9fb5aeae3f5483220b4dcce5a23a63eb03b,include_simulation_or_mechanistic_lead,applied_seed,I_SIMULATION_MECHANISTIC,The agent-based model compares population-specific COVID-19 vaccination allocation strategies.,codex-cli-task5-fix3-reader-a-019f8278-cbac-7730-9a0d-323efa6435be,W01-BATCH-044,
PMID:35637862,a6dd0e29ceba550b2d9abbfd31abea43d0813eda7e550fcb0ccb96d2c382e964,include_simulation_or_mechanistic_lead,applied_seed,I_SIMULATION_MECHANISTIC,The Markov simulation estimates and projects national chronic hepatitis burden.,codex-cli-task5-fix3-reader-a-019f8278-cbac-7730-9a0d-323efa6435be,W01-BATCH-044,
PMID:35666508,95ab2177ba71a8a0f42392eeac1be634a9e2ddecf16437500a0ab02a288790f4,include_applied_seed,applied_seed,I_APPLIED_TRANSFERABLE_DESIGN,The study applies a test-negative design to estimate variant-specific vaccine effectiveness.,codex-cli-task5-fix3-reader-a-019f8278-cbac-7730-9a0d-323efa6435be,W01-BATCH-044,
PMID:35675629,7a21959476bcbacf1a5d3376f7ce1f85fb258a8dd1e476d3e22d320b85fd9445,exclude,,X_DESCRIPTIVE_ONLY,This clinical training simulation tests resuscitation workflow rather than epidemiological methodology.,codex-cli-task5-fix3-reader-a-019f8278-cbac-7730-9a0d-323efa6435be,W01-BATCH-044,
PMID:35694813,b962602de683334c1e4979f325f118b44fea7a6c73d494ce9f686328f58a520a,exclude,,X_DESCRIPTIVE_ONLY,This molecular docking study proposes an antiviral compound without epidemiological methodology.,codex-cli-task5-fix3-reader-a-019f8278-cbac-7730-9a0d-323efa6435be,W01-BATCH-044,
PMID:35696558,a1901ef42d754b033386c9eb4fa86acdd7d184940c6f3604ba601819214e561a,include_simulation_or_mechanistic_lead,applied_seed,I_SIMULATION_MECHANISTIC,"The agent-based model estimates transmission locations, superspreading, and targeted mitigation opportunities.",codex-cli-task5-fix3-reader-a-019f8278-cbac-7730-9a0d-323efa6435be,W01-BATCH-044,
PMID:35705638,12087f3cc645e89a2d93a401649d9e14232c48146618731c12925ffaba496aec,include_diagnostic_or_correction_lead,reproducibility,I_DIAGNOSTIC_CORRECTION,The article provides gold-standard genomic datasets for reproducible antimicrobial-resistance benchmarking.,codex-cli-task5-fix3-reader-a-019f8278-cbac-7730-9a0d-323efa6435be,W01-BATCH-044,
PMID:35719665,b15be25f8bca175c734e3e9ba61bc2f979139001b09946a75e8a679e1c240ec3,include_simulation_or_mechanistic_lead,applied_seed,I_SIMULATION_MECHANISTIC,The spatial agent-based model evaluates combined influenza-control interventions using mobility data.,codex-cli-task5-fix3-reader-a-019f8278-cbac-7730-9a0d-323efa6435be,W01-BATCH-044,
PMID:35723559,a3455b2607037a5915956b6720fc6c66a77b7f00d12ba3d34cfa5df33054dff8,include_diagnostic_or_correction_lead,diagnostic,I_DIAGNOSTIC_CORRECTION,The simulation diagnoses whether published age-specific vaccine efficacies are statistically plausible.,codex-cli-task5-fix3-reader-a-019f8278-cbac-7730-9a0d-323efa6435be,W01-BATCH-044,
PMID:35724314,0fe644f4cb9ab004d5bf862f9b9d5369fc12ce3b40832e5d1d98182732555a20,include_simulation_or_mechanistic_lead,applied_seed,I_SIMULATION_MECHANISTIC,This study develops and independently validates a mechanistic weather-driven plant-disease epidemic model for prediction and control decisions.,codex-cli-task5-fix3-reader-a-019f8279-1697-7933-a4bc-cf88c2651291,W01-BATCH-044,
