candidate_key,source_row_sha256,primary_decision,primary_proposed_record_type,primary_reason_code,primary_reason,primary_reviewer,batch_id,retained_candidate_key
PMID:32827032,5be194f59ac0d5026a0dc77906b5f1e19950796c3af32b5ce8a9a1a3aa377695,include_applied_seed,applied_seed,I_APPLIED_TRANSFERABLE_DESIGN,This multicentre interrupted time-series analysis evaluates SEP-1 sepsis policy effects on antibiotic use and CDI rates.,codex-semantic-primary-B2,W01-BATCH-002,
PMID:32829400,c7dcf359bbc17ae87d235230dc1dccd8a981198a9a2282740a6dfb75dfa29e7b,include_applied_seed,applied_seed,I_APPLIED_TRANSFERABLE_DESIGN,The nationwide regression-discontinuity natural experiment estimates infant BCG vaccination effects on COVID-19 outcomes.,codex-cli-task5-scope-reader-a-019f81bd-c369-7452-b69a-dc72027333da,W01-BATCH-002,
PMID:32830261,1ba39322fde53b53e4cd947f1cf34c6915a592159e5cebc71033a9432be65b9d,include_applied_seed,applied_seed,I_APPLIED_TRANSFERABLE_DESIGN,The regression-discontinuity design estimates behavioral effects of national HPV vaccination eligibility.,codex-cli-task5-scope-reader-a-019f81bd-c369-7452-b69a-dc72027333da,W01-BATCH-002,
PMID:32866224,b08aa05ddfe66a51f77a0b93a8163a9e8715a4ec7cdc16d753a93ccb8ea1c55e,include_applied_seed,applied_seed,I_APPLIED_TRANSFERABLE_DESIGN,This interrupted time-series study evaluates postprescription review and mandatory consultation for carbapenem use.,codex-semantic-primary-B2,W01-BATCH-002,
PMID:32874021,c4bf745c8f562492530153570d5cd2124c1d80b42af9c3d583adcd8bc8904d3f,exclude,,X_NOT_INFECTIOUS_TRANSFERABLE,This event study evaluates airline stock returns after COVID-19 announcements rather than infectious-disease epidemiology.,codex-semantic-primary-B2,W01-BATCH-002,
PMID:32888442,22d294410d361746bd070df06ddb601b34c197dbb4b6628e315e44818742f01a,include_applied_seed,applied_seed,I_APPLIED_TRANSFERABLE_DESIGN,This whole-population interrupted time-series analysis evaluates smoke-free interventions using childhood respiratory admissions and a control condition.,codex-semantic-primary-B2,W01-BATCH-002,
PMID:32903257,8b529363f0838e4ffedf810c9b34967d3d5f12ae52093840de92056f21f8357a,include_applied_seed,applied_seed,I_APPLIED_TRANSFERABLE_DESIGN,This controlled intervention evaluation uses comparative interrupted time series to assess TB active case finding among displaced populations.,codex-semantic-primary-B2,W01-BATCH-002,
PMID:32936910,354049434993c74b8e8c6c016548c399c0013aa75443f0bf6b69f48b45fac1b8,include_applied_seed,applied_seed,I_APPLIED_TRANSFERABLE_DESIGN,This controlled interrupted time-series study uses electronic hand-hygiene monitoring to examine hospital outbreaks and response.,codex-semantic-primary-B2,W01-BATCH-002,
PMID:32961094,9269366efcf1ff60db46f40a0d646a704a93ed882f12c8079eca5c20d68851a9,include_applied_seed,applied_seed,I_APPLIED_TRANSFERABLE_DESIGN,This nationwide interrupted time-series study evaluates expanded palivizumab coverage using RSV hospitalization outcomes.,codex-semantic-primary-B2,W01-BATCH-002,
PMID:32974644,587ec2927909593b70902a68196f91e4d10a8650273c964f33cf67de846b3607,include_method_source_lead,method_source,I_METHOD_SOURCE,The article develops a real-time test-negative design and explains its efficiency and bias considerations.,codex-cli-task5-scope-reader-a-019f81bd-c369-7452-b69a-dc72027333da,W01-BATCH-002,
PMID:33012218,05a44834eb4c0047a512da863e1911d8166def4d83c4f5c3ec383b3b7a853923,exclude,,X_NOT_INFECTIOUS_TRANSFERABLE,This interrupted time-series study evaluates general hospital utilization during COVID-19 rather than infectious-disease outcomes or interventions.,codex-semantic-primary-B2,W01-BATCH-002,
PMID:33020109,0136e5f4ded993dd8dfaa37ee353fbbcec75e42ee67134621d306316fc13c33d,include_applied_seed,applied_seed,I_APPLIED_TRANSFERABLE_DESIGN,"This interrupted time-series analysis evaluates lockdown effects on primary-care access, including HIV and child-health services.",codex-semantic-primary-B2,W01-BATCH-002,
PMID:33053172,0512efb40a40605bf3f29923d31cd94afbcd8c7ffcd4e12648973bad14ee218a,include_applied_seed,applied_seed,I_APPLIED_TRANSFERABLE_DESIGN,This two-stage interrupted time-series analysis estimates province-specific and pooled excess mortality during the COVID-19 outbreak.,codex-semantic-primary-B2,W01-BATCH-002,
PMID:33065295,0e2c3c90d0d6cdb26905b008505d6c29a40ddd69bacad7fa75a2a9ecc835a961,include_applied_seed,applied_seed,I_APPLIED_TRANSFERABLE_DESIGN,This interrupted time-series analysis evaluates South Africa's ART program using population-level Kaposi sarcoma incidence.,codex-semantic-primary-B2,W01-BATCH-002,
PMID:33083025,8e03e8aece4f59b106e060a31ab0395e2529afb239b3c8913a7c8033320514fd,exclude,,X_DESCRIPTIVE_ONLY,This mouse vaccine experiment evaluates immunogenicity and protection without a transferable epidemiological method.,codex-cli-task5-scope-reader-a-019f81c0-eeb9-7703-a04f-4d0ee5caea0e,W01-BATCH-002,
PMID:33084836,689a3c333db3f9b346fc8726b837966c75d46d02de59a7bf3ebef3019c401d9d,include_applied_seed,applied_seed,I_APPLIED_TRANSFERABLE_DESIGN,This interrupted time-series analysis estimates lockdown effects on COVID-19 cases and deaths in Brazilian capitals.,codex-semantic-primary-B2,W01-BATCH-002,
PMID:33094113,7a08d185ef65d6dc2aae76d40bf1e3215581b892ac1f477811c83bfd4470f846,include_diagnostic_or_correction_lead,diagnostic,I_DIAGNOSTIC_CORRECTION,This interrupted time-series study evaluates computerized decision support for reducing inappropriate C. difficile testing.,codex-semantic-primary-B2,W01-BATCH-002,
PMID:33208595,bc47b6435a865fc7feba5a4d3c0be1aefae8b59acef4b5167934133400facf52,exclude,,X_NOT_INFECTIOUS_TRANSFERABLE,This instrumental-variable application compares orthopedic prosthesis designs and does not provide an infectious-disease transfer route.,codex-semantic-primary-B2,W01-BATCH-002,
PMID:33212023,f6ca00ac8a4afd5d5bafce23224269785df9ea31a22c2f07cb9b98b0f67478d4,exclude,,X_NOT_INFECTIOUS_TRANSFERABLE,This interrupted time-series study evaluates suicide mortality during COVID-19 but does not address infectious-disease epidemiology.,codex-semantic-primary-B2,W01-BATCH-002,
PMID:33213290,978fa456692e850ce85f17ac399e79ff14aa6cfe7ea6d00aaa11f692b911a197,include_diagnostic_or_correction_lead,diagnostic,I_DIAGNOSTIC_CORRECTION,This evaluation tests how species-specific negative control sera affect interpretation of a brucellosis fluorescence polarization assay.,codex-semantic-primary-B2,W01-BATCH-002,
PMID:33220696,cd94c5f150bada5ffe73dcc5e0096981889dc5979bf0063a6ce861bd3ae9fbf1,include_applied_seed,applied_seed,I_APPLIED_TRANSFERABLE_DESIGN,"This interrupted time-series analysis evaluates Iran's COVID-19 mass-screening scale-up using cases, recoveries, and deaths.",codex-semantic-primary-B2,W01-BATCH-002,
PMID:33227258,f3e52b0752e0ca1484780b1d811ce319721f104771b289f56b8c2d9c40be413d,include_applied_seed,applied_seed,I_APPLIED_TRANSFERABLE_DESIGN,This time-series study uses synthetic controls and multiple imputation to evaluate PCV10 effects on pneumonia admissions.,codex-semantic-primary-B2,W01-BATCH-002,
PMID:33252457,12d2a533b34595019c88b4d0ed6636c1205d2d30849bfd41c11b2f0bba7bca4e,exclude,,X_NOT_INFECTIOUS_TRANSFERABLE,This interrupted time-series study evaluates trauma epidemiology during shelter-in-place rather than infectious-disease outcomes.,codex-semantic-primary-B2,W01-BATCH-002,
PMID:33254521,332f4b7a7af8d11f6fa5fe6f2481c0292d35c9a26a66982c135b14d49bee4636,exclude,,X_COMMENTARY_ONLY,This medical-hypothesis article asserts an instrumental-variable association without supplying sufficient empirical methods or results.,codex-semantic-primary-B2,W01-BATCH-002,
PMID:33264703,319b4275fd4950c747ad18394f7fc653342cd6fa4d9b3776192e5fb41bd41159,include_applied_seed,applied_seed,I_APPLIED_TRANSFERABLE_DESIGN,This study applies fuzzy regression discontinuity to estimate behavioral effects of vaccine eligibility.,codex-cli-task5-scope-reader-a-019f81c0-eeb9-7703-a04f-4d0ee5caea0e,W01-BATCH-002,
PMID:33273115,dd421dc32a2cb70e329761672ed15a40ac6af4b6ffab900ed15e0ce5f6df2569,include_applied_seed,applied_seed,I_APPLIED_TRANSFERABLE_DESIGN,This synthetic control analysis estimates the effect of mandatory face masks on reported COVID-19 infections.,codex-semantic-primary-B2,W01-BATCH-002,
PMID:33289028,9366983a43e0b557c757cb74800ddd4ff46dedcf68b08df71f00e9c9cff337a8,include_applied_seed,applied_seed,I_APPLIED_TRANSFERABLE_DESIGN,This controlled quasiexperimental study uses difference-in-differences to evaluate outpatient antibiotic stewardship core elements.,codex-semantic-primary-B2,W01-BATCH-002,
PMID:33290405,e6fa286f81576ff00698fc47135480a551020b3299ab1410014873d3059628f0,exclude,,X_NOT_INFECTIOUS_TRANSFERABLE,This cohort study concerns obesity duration and cardiometabolic risk factors without an infectious-disease application or transfer route.,codex-semantic-primary-B2,W01-BATCH-002,
PMID:33313186,c076ff86f1c982432d80aa5127751743aad9b96713103deb4fd17fe21bca16d1,include_diagnostic_or_correction_lead,diagnostic,I_DIAGNOSTIC_CORRECTION,This difference-in-differences study shows how funded RSV antigen testing changed reported surveillance incidence rather than transmission.,codex-semantic-primary-B2,W01-BATCH-002,
PMID:33324258,0c2c14d97fe8c408596be83bf8b664d76fd938864d2d15915f891bfe99224572,exclude,,X_NOT_INFECTIOUS_TRANSFERABLE,This controlled interrupted time-series study evaluates mental-health referrals during lockdown rather than infectious-disease epidemiology.,codex-semantic-primary-B2,W01-BATCH-002,
PMID:33337670,af2c3f608cfb639ea941b053cfa79cf50f923b828206b346546bc7d12464ae6c,include_method_source_lead,method_source,I_METHOD_SOURCE,This study develops and evaluates a self-matched negative-control estimator for naturally acquired immunity.,codex-cli-task5-scope-reader-a-019f81c0-eeb9-7703-a04f-4d0ee5caea0e,W01-BATCH-002,
PMID:33342357,e0ff95130f6b945a3eadeac355a3f015fe8526bd4e7d96b36d4a68fb327dc69f,include_applied_seed,applied_seed,I_APPLIED_TRANSFERABLE_DESIGN,"This interrupted time-series study evaluates Brazil's HAART introduction using HIV burden, mortality, and disability trends.",codex-semantic-primary-B2,W01-BATCH-002,
PMID:33349733,d2c70060f0e9789fc78b4036057b4a071bf5426f0fdd1221b5ec0dfd9f7f28fc,exclude,,X_NOT_INFECTIOUS_TRANSFERABLE,This event study evaluates Australian stock-market sector performance after COVID-19 announcements rather than infectious-disease epidemiology.,codex-semantic-primary-B2,W01-BATCH-002,
PMID:33376449,f398d8f8c0b22daa4da821f50e21ffff38a2c63f4c677e465f2733ae0e3351d9,include_method_source_lead,method_source,I_METHOD_SOURCE,This article develops multiply robust double-negative-control estimators and evaluates them by simulation and vaccine-safety application.,codex-semantic-primary-B2,W01-BATCH-002,
PMID:33392142,8be9097fe58977d3ce3ea49b77f64e031e4e97956a85800ee00389f85f92a6c9,include_applied_seed,applied_seed,I_APPLIED_TRANSFERABLE_DESIGN,This multiple interrupted time-series study uses synthetic controls to evaluate quarantine and mask policies across Latin American countries.,codex-semantic-primary-B2,W01-BATCH-002,
PMID:33398914,0f96ba1781a1aa09f96fb1f589c3b234246d162dabc767a2b3d3a8dcb88c4cd1,include_method_source_lead,method_source,I_METHOD_SOURCE,This study emulates a target trial with real-world data to compare infection risks after alternative sarcoidosis treatments.,codex-semantic-primary-B2,W01-BATCH-002,
PMID:33431614,5949d6cb20a8a5d7f094ed9e6df97a980e70db53dab5f2a79f1ad3b891492a93,exclude,,X_NOT_INFECTIOUS_TRANSFERABLE,This regression discontinuity study evaluates demand for telemedicine abortion during COVID-19 rather than infectious-disease epidemiology.,codex-semantic-primary-B2,W01-BATCH-002,
PMID:33436402,e4f4751e8ec9ed75bac89c9f2548f0242e1a1e27971f53d63bf72c5618349293,include_applied_seed,applied_seed,I_APPLIED_TRANSFERABLE_DESIGN,This longitudinal chart-review comparison evaluates healthcare-system programs and identifies changes in preventable hospital-associated infections.,codex-semantic-primary-B2,W01-BATCH-002,
PMID:33441352,09e7f96a273df9c8e0264943066ab2836bd1dffeda59469f3673d23e7ed8c21c,exclude,,X_WRONG_RECORD_TYPE,This record is a protocol for a planned antimicrobial stewardship evaluation and reports no completed method findings.,codex-semantic-primary-B2,W01-BATCH-002,
PMID:33447371,d3221bb9bb4afb4caba17deaed5d46387cd58ae4d3a609105190e2406a694f63,exclude,,X_WRONG_RECORD_TYPE,This record is a study protocol for a planned controlled interrupted time-series evaluation of Wolbachia mosquito releases.,codex-semantic-primary-B2,W01-BATCH-002,
PMID:33452187,9a2fafe11b3363282f049ac3f753dbf7148a68589e55081b37094c9d27d07368,exclude,,X_WRONG_RECORD_TYPE,This record is a protocol for a planned veterinary antimicrobial stewardship evaluation and reports no completed results.,codex-semantic-primary-B2,W01-BATCH-002,
PMID:33479325,922db67f95dc94196173887bba74fc4afd04eeef922ce60ba5586410c0f53f5d,include_method_source_lead,method_source,I_METHOD_SOURCE,This article develops a multiple-event study model to estimate separate effects of concurrently adopted COVID-19 interventions.,codex-semantic-primary-B2,W01-BATCH-002,
PMID:33487182,a623ff68699907579a42eadbb1a8cd3007410c87f9ed9cf8efd9c4f586dee5c3,include_applied_seed,applied_seed,I_APPLIED_TRANSFERABLE_DESIGN,"This interrupted time-series study evaluates a febrile-neutropenia algorithm using antimicrobial use, bloodstream infection, and safety outcomes.",codex-semantic-primary-B2,W01-BATCH-002,
PMID:33499030,ec2c0e99ce2d89ea2af74f686ea3f3082a3a8e9b18a9cbafc09d8cf80ed139e4,include_method_source_lead,method_source,I_METHOD_SOURCE,This study applies and describes multi-fuzzy regression discontinuity analysis for evaluating COVID-19 policy stringency effects.,codex-semantic-primary-B2,W01-BATCH-002,
PMID:33515424,c9f86df2ff4baae10d339014c6a8a9f48cb6035961304abcdb6017d1d31aedb2,include_applied_seed,applied_seed,I_APPLIED_TRANSFERABLE_DESIGN,This interrupted time-series study estimates effects of an outpatient antibiotic clinic on healthcare use.,codex-cli-task5-scope-reader-a-019f81c0-eeb9-7703-a04f-4d0ee5caea0e,W01-BATCH-002,
PMID:33518465,65646333949bd55ebd111dcab1c830748c1f31ec9f821854ffbc1682a3847402,include_applied_seed,applied_seed,I_APPLIED_TRANSFERABLE_DESIGN,This interrupted time-series study evaluates MMR revaccination policy using population-level non-target infection hospitalizations.,codex-semantic-primary-B2,W01-BATCH-002,
PMID:33539527,283c1e726a54c3e1b2de18eb613fcbd42cd0dafc43099b442b332b74ada62554,include_applied_seed,applied_seed,I_APPLIED_TRANSFERABLE_DESIGN,This interrupted time-series analysis evaluates COVID-19 pandemic effects on corticosteroid and antibiotic prescribing in England.,codex-semantic-primary-B2,W01-BATCH-002,
PMID:33549166,97db00a4c15e3ffb8e32908dd999d94d52ba7ad7e7549c63c4d4c42a8d8c5c2a,include_applied_seed,applied_seed,I_APPLIED_TRANSFERABLE_DESIGN,"This clinic-network interrupted time-series analysis estimates lockdown effects on HIV testing, ART initiation, and treatment collection.",codex-semantic-primary-B2,W01-BATCH-002,
PMID:33575744,ee17cef0eff749ee2daadd6ef9ead38b0b8f2fd54ec252a2472c268e5d2a1d09,include_applied_seed,applied_seed,I_APPLIED_TRANSFERABLE_DESIGN,This three-period interrupted time-series study evaluates streamlined antimicrobial prophylaxis protocols for ECMO patients.,codex-semantic-primary-B2,W01-BATCH-002,
PMID:33587981,c04b6ff7b90b5a62dba574d4a42cb2dbc503af5a4e8297600941f54a4f8b5ab9,include_applied_seed,applied_seed,I_APPLIED_TRANSFERABLE_DESIGN,This multicentre interrupted time-series study evaluates a colon-surgery bundle to reduce surgical-site infections.,codex-semantic-primary-B2,W01-BATCH-002,
PMID:33591995,c77e56878dc4237cc864498200a56ddfd0760c5132396603ca1951de6fcf7e3a,include_simulation_or_mechanistic_lead,applied_seed,I_SIMULATION_MECHANISTIC,This ecological Bayesian synthetic-control model estimates national childhood pneumonia mortality reductions attributable to PCV introduction.,codex-semantic-primary-B2,W01-BATCH-002,
PMID:33595053,a706cec810065d689ea528fe2ff3af142e06e44f6ba2a5e24cb01f2a525d1ea2,include_method_source_lead,method_source,I_METHOD_SOURCE,This article explains how target-trial specification can improve causal interpretation of agent-based infectious-disease models with interference.,codex-semantic-primary-B2,W01-BATCH-002,
PMID:33606891,e5ff8dce792105eda4cf9ac7da0cfbb9e4595037c08e4f198efec9842a2787e2,include_method_source_lead,method_source,I_METHOD_SOURCE,This study demonstrates target-trial emulation with treatment and censoring weighting for urinary-tract infection safety outcomes.,codex-semantic-primary-B2,W01-BATCH-002,
PMID:33690150,c4e0fdce41eeb22bdf3dae02c814e4e4920f443732323e04be2034e1ab817f86,include_applied_seed,applied_seed,I_APPLIED_TRANSFERABLE_DESIGN,This population-based interrupted time-series study evaluates pandemic effects on antibiotic prescribing while accounting for respiratory and urinary consultations.,codex-semantic-primary-B2,W01-BATCH-002,
PMID:33693517,042968401fd884d99f6b206913dcbc7d11eb7e1eb239c42fbbc2b7a4628666dd,include_applied_seed,applied_seed,I_APPLIED_TRANSFERABLE_DESIGN,This multicountry regression discontinuity analysis estimates Treat-All policy effects on HIV CD4 testing and viral-load monitoring.,codex-semantic-primary-B2,W01-BATCH-002,
PMID:33725488,987fdfa2da784dc637c8d65bafbab7668fd04e9c6bed54e26553dd3fcaa6fe12,include_applied_seed,applied_seed,I_APPLIED_TRANSFERABLE_DESIGN,This natural-experiment difference-in-differences study estimates changes in institutional trust following COVID-19 lockdown measures.,codex-semantic-primary-B2,W01-BATCH-002,
PMID:33733528,9461b058a3b64f0db89fd38f28fe6f6918cec95cc8eb5d6cbc83b0c285582ace,exclude,,X_NOT_INFECTIOUS_TRANSFERABLE,This difference-in-differences study evaluates a dementia-care incentive and does not provide an infectious-disease transfer route.,codex-semantic-primary-B2,W01-BATCH-002,
PMID:33755026,0ed4ae90461115a70b07b2ed618305df3120d7bfbb825f4adfbe6084ffe53c27,exclude,,X_WRONG_RECORD_TYPE,This record is a protocol for a planned interrupted time-series evaluation of an app to reduce catheter-associated infections.,codex-semantic-primary-B2,W01-BATCH-002,
PMID:33782111,3382b1dea6ed55aaa776538b99113e95f1fc9b34fcd63185b77d1f7f0704d210,exclude,,X_NOT_INFECTIOUS_TRANSFERABLE,This difference-in-differences study evaluates pop-up cycling infrastructure and cycling counts rather than infectious-disease outcomes.,codex-semantic-primary-B2,W01-BATCH-002,
PMID:33783394,cdb8389f5892af1d5f57869365b659dd2443fec2c2c7abc79776130c5472fbbb,include_method_source_lead,method_source,I_METHOD_SOURCE,This article develops temporal and spatial aggregation approaches for improving synthetic-control estimates of vaccine impact.,codex-semantic-primary-B2,W01-BATCH-002,
PMID:33788326,386779ba89a2b51d529917d22c06fe71f4de7b9326bde14d36d94b8942eb3693,include_method_source_lead,method_source,I_METHOD_SOURCE,"This study emulates a target trial with marginal structural models to estimate harm-reduction effects on HIV, HCV, and HBV acquisition.",codex-semantic-primary-B2,W01-BATCH-002,
PMID:33795979,c9c9d0c522c63cebeafa28db24446b371433043b1c5bd66ae692ec7d92e56a10,include_applied_seed,applied_seed,I_APPLIED_TRANSFERABLE_DESIGN,This interrupted time-series analysis evaluates Iranian social-distancing policy using national COVID-19 incidence and mortality trends.,codex-semantic-primary-B2,W01-BATCH-002,
PMID:33798201,4a623d1be8703c12ac62bf5a1cb7ce9d5f250817a50604e4584a0ab4252cd968,include_applied_seed,applied_seed,I_APPLIED_TRANSFERABLE_DESIGN,This controlled interrupted time-series study evaluates routine HIV resistance testing policy using mortality and service-use outcomes.,codex-semantic-primary-B2,W01-BATCH-002,
PMID:33858719,560b7dafe8b34bd6599febeaf92e9fa3985d34555a00d478eb3528076d092d44,include_diagnostic_or_correction_lead,diagnostic,I_DIAGNOSTIC_CORRECTION,This population interrupted time-series study uses negative-control and sensitivity analyses to examine nonspecific pneumonia endpoints after PCV introduction.,codex-semantic-primary-B2,W01-BATCH-002,
PMID:33877954,ffee6186e60ecdfa87540b3c33a1076238b4ad2a63427b2af12d123871542e80,include_applied_seed,applied_seed,I_APPLIED_TRANSFERABLE_DESIGN,This ecological interrupted time-series study evaluates a national pneumococcal immunization program using elderly pneumonia outcomes.,codex-semantic-primary-B2,W01-BATCH-002,
PMID:33902631,a82e03a11c449e0eb800a24f82ba024caab299446f64aebb4d9105c989366742,include_applied_seed,applied_seed,I_APPLIED_TRANSFERABLE_DESIGN,This multilevel interrupted time-series analysis evaluates Indonesia's strategic ART expansion across the HIV care continuum.,codex-semantic-primary-B2,W01-BATCH-002,
PMID:33909042,759d781b69f37afce452f97028a67d7456e15d943595f5b48c48337450e961aa,include_applied_seed,applied_seed,I_APPLIED_TRANSFERABLE_DESIGN,This interrupted time-series analysis estimates COVID-19 intervention effects on cause-specific hospital-visit patterns.,codex-semantic-primary-B2,W01-BATCH-002,
PMID:33924387,465817fac2890d8e753b8c39dff7f1531fdeaa5f188fa627f16e71cc93147197,exclude,,X_NOT_INFECTIOUS_TRANSFERABLE,This interrupted time-series study evaluates infant vitamin D levels during COVID-19 confinement rather than infectious-disease epidemiology.,codex-semantic-primary-B2,W01-BATCH-002,
PMID:33972996,d514cf169a34d0bf85c44bc6392b039ca094966fb2c31b534fa17f7f49ff5bcf,include_applied_seed,applied_seed,I_APPLIED_TRANSFERABLE_DESIGN,This multicentre study evaluates a probiotic prescribing decision-support intervention using interrupted time series and propensity matching for CDI prevention.,codex-semantic-primary-B2,W01-BATCH-002,
