candidate_key,source_row_sha256,primary_decision,primary_proposed_record_type,primary_reason_code,primary_reason,primary_reviewer,batch_id,retained_candidate_key
PMID:33469026,cba36c38ec5795e68bccf039806d37ab2c2c1766146233b424c1263d0db41ff0,include_applied_seed,applied_seed,I_APPLIED_TRANSFERABLE_DESIGN,This regional SARS-CoV-2 WGS study identifies lineages and local transmission clusters preceding recognized community spread in Lombardy.,codex-semantic-primary-020,W01-BATCH-020,
PMID:33489927,1432b610240a155dff24d1c7ddd9ae34beb7c4474c4546cd1229868a5c7c69a1,include_diagnostic_or_correction_lead,guidance,I_DIAGNOSTIC_CORRECTION,This review describes active genomic surveillance workflows for tracing zoonotic hantavirus infections and outbreak sources.,codex-semantic-primary-020,W01-BATCH-020,
PMID:33496239,aa478ee1275b4f95550f6e178b334c9c9140a6443b9e2988a253a61b3f314fab,include_applied_seed,applied_seed,I_APPLIED_TRANSFERABLE_DESIGN,This public-health sequencing study identifies HCV transmission clusters across correctional and syringe-service settings.,codex-semantic-primary-020,W01-BATCH-020,
PMID:33497838,62753f3a73600ae4de29d55353266a454ff0f99a4f50db66b6987be0b0e135d0,include_method_source_lead,method_source,I_METHOD_SOURCE,This study demonstrates DNA barcoding and phylogeography to correct vector taxonomy relevant to schistosomiasis and fasciolosis surveillance.,codex-semantic-primary-020,W01-BATCH-020,
PMID:33510171,4222e027bfa2583655bd7be00421027e13c7ca61cc6dfc3bea3e99f2515599de,include_applied_seed,applied_seed,I_APPLIED_TRANSFERABLE_DESIGN,This phylogeographic analysis combines SARS-CoV-2 genomes and travel histories to estimate Russian introductions and a hospital outbreak reproduction number.,codex-semantic-primary-020,W01-BATCH-020,
PMID:33513050,5bcc3f37a483dc2ba312b35498408359862bf5f9978a06a34009459c7620e863,include_simulation_or_mechanistic_lead,applied_seed,I_SIMULATION_MECHANISTIC,This paper proposes a mechanistic immune-network hypothesis for how intravenous immunoglobulin could mitigate severe COVID-19.,codex-semantic-primary-020,W01-BATCH-020,
PMID:33515508,b848f953274b8edc7dc87fb884985d07449c6bf1f752c03edff10bd01687234d,include_simulation_or_mechanistic_lead,applied_seed,I_SIMULATION_MECHANISTIC,"This age- and region-structured rubella model estimates underreporting, congenital rubella burden, and optimal supplemental immunization strategies.",codex-semantic-primary-020,W01-BATCH-020,
PMID:33523787,05a71cd897d452fb222f5adb0ac89c5c8bdc1744fe32d940909a63d8848351d1,include_simulation_or_mechanistic_lead,applied_seed,I_SIMULATION_MECHANISTIC,"This spatially explicit host-pathogen metapopulation model predicts plant disease dynamics from host structure, climate, and dispersal.",codex-semantic-primary-020,W01-BATCH-020,
PMID:33528560,1dfd98dc0a88155fe2a7e419eaed988157de7cd83fdf4ad10ae62f6a1a7a315a,include_diagnostic_or_correction_lead,guidance,I_DIAGNOSTIC_CORRECTION,This article provides a detailed practical protocol for continuous phylogeographic inference and interpretation in BEAST.,codex-semantic-primary-020,W01-BATCH-020,
PMID:33534755,0faa56a18b0d0b15f4b76bac5d6768b1119f26ef20b1a4272e684e5f53d1d4b4,include_simulation_or_mechanistic_lead,applied_seed,I_SIMULATION_MECHANISTIC,This climate- and mobility-informed spatiotemporal network model produces dengue suitability and probabilistic risk maps without incidence data.,codex-semantic-primary-020,W01-BATCH-020,
PMID:33557932,57697562452b83c92f7ef35d9a87d8a23669a6d00f96376ef106f65c983695a8,include_diagnostic_or_correction_lead,correction,I_DIAGNOSTIC_CORRECTION,This study identifies endosymbiont-linked mitochondrial bias as a confounder of vector phylogeography and recommends complementary markers.,codex-semantic-primary-020,W01-BATCH-020,
PMID:33558856,71488c903a83912142d0ed0a40d38564678325230b3aaf223e34b47ac1b9f090,include_simulation_or_mechanistic_lead,applied_seed,I_SIMULATION_MECHANISTIC,This fine-grained Irish metapopulation network model evaluates phased and adaptive COVID-19 containment strategies.,codex-semantic-primary-020,W01-BATCH-020,
PMID:33558859,0378ee1ecc8875df8f8b9ee80192c3086f338cd41033c3d849194597f7574006,include_applied_seed,applied_seed,I_APPLIED_TRANSFERABLE_DESIGN,This global-context genomic analysis infers multiple SARS-CoV-2 introductions and possible cryptic circulation in Morocco.,codex-semantic-primary-020,W01-BATCH-020,
PMID:33571105,5601a8d679c24d67bad75da0634b73db0a98577952c94f9e808022adceb006d6,include_method_source_lead,method_source,I_METHOD_SOURCE,This paper uses a geographically structured phylodynamic model to reconstruct early European SARS-CoV-2 migration and local transmission.,codex-semantic-primary-020,W01-BATCH-020,
PMID:33617114,d51235c2aac2ff37eb21ffba6bc2540732aa710bbada7304ba138c54b8f79423,include_diagnostic_or_correction_lead,guidance,I_DIAGNOSTIC_CORRECTION,"This protocol paper explains simulation, transmission-tree inference, and result exploration using the TransPhylo genomic epidemiology tool.",codex-semantic-primary-020,W01-BATCH-020,
PMID:33620303,f0e34156587d1b04ca5d1028d0c9fe4175eb305980e37d87bca7518bdc3fdeb2,include_applied_seed,applied_seed,I_APPLIED_TRANSFERABLE_DESIGN,This WGS investigation uses genomic relatedness to evaluate whether apparent hospital cryptococcosis cases share a source.,codex-semantic-primary-020,W01-BATCH-020,
PMID:33622493,d0fbc0fae4ae952007dee7d5374b44bde87cdd3864cb420445c8b58664bfdf87,include_applied_seed,applied_seed,I_APPLIED_TRANSFERABLE_DESIGN,This prospective border-region TB genomic surveillance study distinguishes importation from local and prison-associated transmission.,codex-semantic-primary-020,W01-BATCH-020,
PMID:33643952,a5c0bd173ab4360ae1e05bc1a697bf264ac596a297f61e9c5367fe48bdbf66c7,include_applied_seed,applied_seed,I_APPLIED_TRANSFERABLE_DESIGN,"This clinical parasite sequencing study characterizes Echinococcus genotypes, haplotype diversity, and regional transmission-related heterogeneity.",codex-semantic-primary-020,W01-BATCH-020,
PMID:33649227,adf5cd9fcf545d0ec4f6e058155c8ade000e5d9b9dfacbcc4948c297b589ee35,include_simulation_or_mechanistic_lead,applied_seed,I_SIMULATION_MECHANISTIC,This general social-group metapopulation model simulates reciprocal effects of host structure and canine distemper or mange transmission.,codex-semantic-primary-020,W01-BATCH-020,
PMID:33650490,7e7bf4e51052ecb5de2b51c7e347665ae3da039c5c1b558b4e0d1faefd7f4149,include_applied_seed,applied_seed,I_APPLIED_TRANSFERABLE_DESIGN,This care-home genomic and temporal clustering analysis distinguishes within-home outbreaks from independent SARS-CoV-2 introductions.,codex-semantic-primary-020,W01-BATCH-020,
PMID:33661076,1f1221ddd5ce1b8446201e3f27f636ada3540257ac1d37d7a62728ebe0c35118,exclude,,X_COMMENTARY_ONLY,This science-and-technology-studies analysis critiques media circulation of preliminary genomic findings without providing an epidemiologic method resource.,codex-semantic-primary-020,W01-BATCH-020,
PMID:33671631,15d39710d2b4933a7c30898dc74a9858fe9103f358ddebe623cebf8373612de4,include_applied_seed,applied_seed,I_APPLIED_TRANSFERABLE_DESIGN,This hospital-based SARS-CoV-2 sequencing and phylodynamic study characterizes early lineages and introductions in Madrid.,codex-semantic-primary-020,W01-BATCH-020,
PMID:33673082,b68e95442400606498ed09020b976e247e88d58d56887dc56f788c1be77020f1,include_applied_seed,applied_seed,I_APPLIED_TRANSFERABLE_DESIGN,This geographically structured fish-virus genomic analysis defines haplotypes and adaptive variation relevant to infection surveillance.,codex-semantic-primary-020,W01-BATCH-020,
PMID:33677388,1c5bf015231f1f3cb9f9f5b0b044ab94a4ca6f8c21be6f6b9e4323f0c066d2ca,include_diagnostic_or_correction_lead,guidance,I_DIAGNOSTIC_CORRECTION,This review explains evolutionary and metapopulation mechanisms shaping plant pathogen effectors and host immune diversity.,codex-semantic-primary-020,W01-BATCH-020,
PMID:33692199,49acb074c00ba6792feaea4dfe34ff84c67639c44aeca48828c37e2b2578a952,include_applied_seed,applied_seed,I_APPLIED_TRANSFERABLE_DESIGN,"This national WGS study identifies MRSA clades and their resistance, virulence, and mobile-element features for surveillance.",codex-semantic-primary-020,W01-BATCH-020,
PMID:33718257,06fbed94d6bec73ef657d745ca8407754818d3eb515655c7b0b59b932e0ec2ac,include_applied_seed,applied_seed,I_APPLIED_TRANSFERABLE_DESIGN,"This study triangulates MLVA, SNP typing, and WGS to link human and animal Q-fever strains and identify public-health risk lineages.",codex-semantic-primary-020,W01-BATCH-020,
PMID:33730096,fc37e5970fb6ab4cca5264fc5867d2ec3a1229e3d4e256c7e4d7d3100b7a7d89,include_applied_seed,applied_seed,I_APPLIED_TRANSFERABLE_DESIGN,This study uses a fungal-associated virus as a phylogeographic proxy to reconstruct white-nose syndrome spread.,codex-semantic-primary-020,W01-BATCH-020,
PMID:33735223,fd727153ef1c4755a1c3b562f316e19ef7d3e7090c9f411cac549a3731da81e3,include_simulation_or_mechanistic_lead,method_source,I_SIMULATION_MECHANISTIC,"This paper derives and validates analytical measures of metapopulation superspreader capacity from connectivity, reproduction number, and mobility.",codex-semantic-primary-020,W01-BATCH-020,
PMID:33741737,5726e1a8624f8238f0a9f46b4a73b18da59329f8495330bdfc3a591007f0de71,include_applied_seed,applied_seed,I_APPLIED_TRANSFERABLE_DESIGN,This Bayesian genomic phylogeography reconstructs the historical Eurasian spread of an agriculturally important plant pathogen.,codex-semantic-primary-020,W01-BATCH-020,
PMID:33746561,f23448af153c492cd3fe15112037d0b3bb0b0dd9ac44a21981e3444c9fc81007,include_method_source_lead,method_source,I_METHOD_SOURCE,This paper proposes a time-modulated Hawkes-process epidemic model and applies it to countermeasure scenarios in Italy.,codex-semantic-primary-020,W01-BATCH-020,
PMID:33747543,47fd23b4dde69854045df5a1497d684dc14c1284895bedb1f702b78af20fca30,include_applied_seed,applied_seed,I_APPLIED_TRANSFERABLE_DESIGN,This densely sampled local genomic phylodynamic analysis estimates COVID-19 reproduction numbers and undiagnosed burden in Weifang.,codex-semantic-primary-020,W01-BATCH-020,
PMID:33751421,49d6e0d9b6449d01097a913787d92d406b2e6c95e880126ae51507d463e1edf8,include_applied_seed,applied_seed,I_APPLIED_TRANSFERABLE_DESIGN,"This large global WGS study characterizes Clostridioides difficile phylogeography, recombination, toxin diversity, and AMR associations.",codex-semantic-primary-020,W01-BATCH-020,
PMID:33776143,7d6312fba38c652c7fad591668bc7a9def253f55d449dd4ef18765f50340cab5,include_simulation_or_mechanistic_lead,method_source,I_SIMULATION_MECHANISTIC,"This paper analyzes a piecewise-parameter COVID-19 network model to represent behavioral change, mobility, and recurrent epidemic waves.",codex-semantic-primary-020,W01-BATCH-020,
PMID:33793564,eea8d14adcdb2f7be0198055cfe5865273d3287cc3504bb2573ce469124f9931,include_method_source_lead,method_source,I_METHOD_SOURCE,This paper develops semi-mechanistic Hawkes processes to separate imported and local malaria transmission in near-elimination settings.,codex-semantic-primary-020,W01-BATCH-020,
PMID:33795722,bb9b9648315022d56f5e45e5d3e83eafb04de8a1e3ff9c3db9da13688a599a4d,include_method_source_lead,method_source,I_METHOD_SOURCE,"This study integrates incidence curves, instantaneous reproduction numbers, and genome variation into a SARS-CoV-2 surveillance framework.",codex-semantic-primary-020,W01-BATCH-020,
PMID:33807036,bc00eb157c7c7f5ddb2a23230a2858a392d0260e5f8ed92b7de485739eef5192,include_applied_seed,applied_seed,I_APPLIED_TRANSFERABLE_DESIGN,"This hospital and environmental WGS study resolves Candida auris transmission dynamics, source lineage, and resistance mutations.",codex-semantic-primary-020,W01-BATCH-020,
PMID:33836121,4cd30d97c165486edfd4c7faf8965b4b2133e9e524b77a400ce63964da96a011,include_diagnostic_or_correction_lead,guidance,I_DIAGNOSTIC_CORRECTION,This protocol provides a reproducible BEAST workflow for discrete phylogeography using covariates and individual travel histories.,codex-semantic-primary-020,W01-BATCH-020,
PMID:33838588,e93414ed503777d1d985f35420764f7c62c027f3ba74b43280e4874635fc49c5,include_simulation_or_mechanistic_lead,applied_seed,I_SIMULATION_MECHANISTIC,"This calibrated sexual-network agent-based model compares screening, partner services, and treatment strategies for chlamydia control.",codex-semantic-primary-020,W01-BATCH-020,
PMID:33842904,d5012fc244bcc3b73405da2d9a6e8a3910a74ccdc52be986237d619fa75f4941,include_diagnostic_or_correction_lead,reproducibility,I_DIAGNOSTIC_CORRECTION,This systematic review benchmarks tuberculosis genomic epidemiology reporting against STROME-ID and identifies reproducibility gaps.,codex-semantic-primary-020,W01-BATCH-020,
PMID:33845898,bf73c2e71bafcaf60bcbe49f88b1098888e08dfa3f8e8d32fb72f3f5b99b15f1,include_simulation_or_mechanistic_lead,applied_seed,I_SIMULATION_MECHANISTIC,This fitted stochastic spatial metapopulation model represents sheep movements and evaluates sheep-scab transmission dynamics.,codex-semantic-primary-020,W01-BATCH-020,
PMID:33875000,719c2467fc3e020c46f2294c559f79ae549f1b93b5a714b47c9f7b1f0a568c44,include_diagnostic_or_correction_lead,reproducibility,I_DIAGNOSTIC_CORRECTION,This paper provides and evaluates a community-guided genomic surveillance and AMR-prediction platform for Neisseria gonorrhoeae.,codex-semantic-primary-020,W01-BATCH-020,
PMID:33899563,39725e533f1cc2aebf5551c6b85f97f51f992103598e49bf1c1ca31780306c9f,include_method_source_lead,method_source,I_METHOD_SOURCE,This comparative modeling study quantifies how network versus mass-action structure changes projected infectious-disease intervention effectiveness.,codex-semantic-primary-020,W01-BATCH-020,
PMID:33900399,2265d0c96d429ee1082ed8fe35cab8fd4b9018bca59cd716565c921132526291,include_applied_seed,applied_seed,I_APPLIED_TRANSFERABLE_DESIGN,"This clinical-genomic SARS-CoV-2 study links viral variants and clades with hospitalization, mortality, and laboratory outcomes.",codex-semantic-primary-020,W01-BATCH-020,
PMID:33907496,7025828915340516ee3bcc64c45c3ca7056d0e6153ce3ee22dffbbdd96a3f151,include_method_source_lead,method_source,I_METHOD_SOURCE,This paper evaluates network integration strategies for improving computational prediction of host-pathogen protein interactions.,codex-semantic-primary-020,W01-BATCH-020,
PMID:33910066,d7448e0b72d7bcce29a29427432e3b61fcdee309c63ef49ba967d0f7adea6657,include_applied_seed,applied_seed,I_APPLIED_TRANSFERABLE_DESIGN,This study uses spatial analysis and viral and vector phylogeography to forecast Kyasanur forest disease risk areas.,codex-semantic-primary-020,W01-BATCH-020,
PMID:33926962,f9d89cd736d70af83110b00b68516aefa9d4adde9907f57add7a1df4644c2442,include_method_source_lead,method_source,I_METHOD_SOURCE,This comparative study shows how alternative movement models materially alter metapopulation infectious-disease inferences and malaria predictions.,codex-semantic-primary-020,W01-BATCH-020,
PMID:33945455,1d7ad9197a9ba51e73ee99a052fd779b69d551b390092ec034a8af08bff77f0e,include_applied_seed,applied_seed,I_APPLIED_TRANSFERABLE_DESIGN,"This paired epidemiological and WGS TB surveillance study maps lineage diversity, transmission clusters, and cross-district spread.",codex-semantic-primary-020,W01-BATCH-020,
PMID:33977295,b2f69e902d2fbfe447fc2a8674b5f1176ddf7623be58bc793e5648463c2a96cb,include_applied_seed,applied_seed,I_APPLIED_TRANSFERABLE_DESIGN,This genomic outbreak investigation evaluates why daily antigen testing did not prevent SARS-CoV-2 transmission in athletics.,codex-semantic-primary-020,W01-BATCH-020,
PMID:33980920,e57844343c88413c042052880d073645a9edfe1c42bdaadedf3b560f406a3d4c,include_simulation_or_mechanistic_lead,applied_seed,I_SIMULATION_MECHANISTIC,"This large-scale multiplex-network agent-based SEIR model evaluates Singapore COVID-19 controls across households, workplaces, crowds, and dormitories.",codex-semantic-primary-020,W01-BATCH-020,
PMID:33999991,3a3ca159c4cad4272bf0df954882495a7c7272078331506757c34bccf4b7b7bc,include_applied_seed,applied_seed,I_APPLIED_TRANSFERABLE_DESIGN,This serial regional genomic surveillance study reconstructs clonal CRE emergence and patient-transfer-mediated spread among post-acute facilities.,codex-semantic-primary-020,W01-BATCH-020,
PMID:34016042,036d1e6d5d4ae6ec8cb7e1011db7c2de29bd2d2d3c64b49e18c99bfc2719e227,include_applied_seed,applied_seed,I_APPLIED_TRANSFERABLE_DESIGN,"This municipality-level genomic and phylodynamic study links SARS-CoV-2 evolution, clinical information, and spatial transmission in Brazil.",codex-semantic-primary-020,W01-BATCH-020,
PMID:34021447,4c1e80a63114ee885fc64c0b1f37964da873f66cbc7dc62e23d8458def47648a,include_simulation_or_mechanistic_lead,method_source,I_SIMULATION_MECHANISTIC,This paper analyzes a low-dimensional compact pairwise SIS network model and derives threshold and endemic-equilibrium results.,codex-semantic-primary-020,W01-BATCH-020,
PMID:34027824,2a0ee72bd6b5cd2d641a35a580b9bf947aeb671fbbdb2332a4d934cdf272b659,include_applied_seed,applied_seed,I_APPLIED_TRANSFERABLE_DESIGN,"This three-year hospital WGS surveillance study characterizes Candida auris transmission, phylogenetic origin, and antifungal resistance.",codex-semantic-primary-020,W01-BATCH-020,
PMID:34035424,cd132b2d13e7074416a16667e128f2db3bb87716de6214dddb903b66137d5b4d,include_simulation_or_mechanistic_lead,method_source,I_SIMULATION_MECHANISTIC,"This host-metapopulation SIR model examines coupled migration, demography, and rapid host evolution after pathogen introduction.",codex-semantic-primary-020,W01-BATCH-020,
PMID:34035535,5195ca5fbc81a9985dddd9e2e80c2221e95d59b93d5dcc5597518da24775d450,include_applied_seed,applied_seed,I_APPLIED_TRANSFERABLE_DESIGN,This genomic epidemiology study identifies lineage persistence and replacement underlying successive COVID-19 waves in Amazonas.,codex-semantic-primary-020,W01-BATCH-020,
PMID:34040209,524318813f117e3a85659e8d476871c41cc6cf83b710e312b13e547d5806e404,include_method_source_lead,method_source,I_METHOD_SOURCE,This paper develops and validates a universal spatiotemporal human-mobility law with a stated application to epidemic mitigation.,codex-semantic-primary-020,W01-BATCH-020,
PMID:34049993,52d2f72ee86b21ba47d9d9d0f77e9368e42591bb90ba506ab32e50094ed182d4,include_simulation_or_mechanistic_lead,applied_seed,I_SIMULATION_MECHANISTIC,"This mobility-flow SEIR framework uses data assimilation to estimate intracounty COVID-19 heterogeneity by age, race, and business traffic.",codex-semantic-primary-020,W01-BATCH-020,
PMID:34051492,5322d029d96d597c19c573978067937d0fc487bba7228897512c7e1c29424814,include_diagnostic_or_correction_lead,diagnostic,I_DIAGNOSTIC_CORRECTION,This study evaluates neighborhood- and building-scale wastewater sequencing for SARS-CoV-2 strain surveillance and pathogen detection.,codex-semantic-primary-020,W01-BATCH-020,
PMID:34053446,5bb593537a0b1d8d2641b1999ec8bce8a9a117766ea30f1b4de627b4e1e333fa,include_simulation_or_mechanistic_lead,applied_seed,I_SIMULATION_MECHANISTIC,This age-structured Belgian metapopulation model is calibrated to hospitalization data to evaluate lockdown exit and case-isolation strategies.,codex-semantic-primary-020,W01-BATCH-020,
PMID:34055726,6a474a5bc790d36dfefe4009fb39e7165fa124d035117c297477644a9116ffce,include_applied_seed,applied_seed,I_APPLIED_TRANSFERABLE_DESIGN,This outbreak investigation combines SARS-CoV-2 genomes and person-place networks to assess transmission in disability group homes.,codex-semantic-primary-020,W01-BATCH-020,
PMID:34060902,a555d59ca3308955bc2f0b19e55248581c18637077a4f9bfcca64abc6b4c2bb7,include_applied_seed,applied_seed,I_APPLIED_TRANSFERABLE_DESIGN,This study evaluates how SNV and plasmid analysis revise conventional epidemiologic CPE transmission clusters in a hospital system.,codex-semantic-primary-020,W01-BATCH-020,
PMID:34068358,202c0e9f1e68376afe2fafffaf09959541ae4b9814d05ebbb0be02302fc9e41a,include_simulation_or_mechanistic_lead,applied_seed,I_SIMULATION_MECHANISTIC,This individual sexual-network transmission model estimates HPV elimination under alternative vaccination coverage scenarios.,codex-semantic-primary-020,W01-BATCH-020,
PMID:34093495,85521cc792ac237386d1b3cc52f82da3d50eb6b84750f32d09714da7c0666aec,include_applied_seed,applied_seed,I_APPLIED_TRANSFERABLE_DESIGN,This newly generated provincial sequence dataset applies multiple phylogenetic methods to estimate SARS-CoV-2 diversity and origin timing in China.,codex-semantic-primary-020,W01-BATCH-020,
PMID:34100030,0944495e4b3f2307975d38bcaaf17108d175f0191e6fe2f07f7fc4cc19467150,exclude,,X_WRONG_RECORD_TYPE,This is a preprint rather than a completed peer-reviewed research record and supplies no distinct methodological resource beyond its application.,codex-semantic-primary-020,W01-BATCH-020,
PMID:34109037,ea9b60acf93e7486d169de37395c4528fd94c274f5ee4d9cefff38ba6e9d2b55,include_simulation_or_mechanistic_lead,applied_seed,I_SIMULATION_MECHANISTIC,"This risk-structured metapopulation model uses sensitivity analysis to compare COVID-19 vaccination delivery, efficacy, coverage, and mobility restrictions.",codex-semantic-primary-020,W01-BATCH-020,
PMID:34115791,efc31c0c10dfcf832ab094e8942d3bd4b281ad63756832681bcf87f15a77d206,include_applied_seed,applied_seed,I_APPLIED_TRANSFERABLE_DESIGN,This study fits and interprets gravity-law models of city-level COVID-19 spatial diffusion in Hubei.,codex-semantic-primary-020,W01-BATCH-020,
PMID:34154550,7978db80a457917a085611e65c14f30cf4f44a2f195353930fe126eb4389d9cc,include_applied_seed,applied_seed,I_APPLIED_TRANSFERABLE_DESIGN,"This bloodstream-isolate WGS study reconstructs MRSA clonal expansion, recombination, and population dynamics over time.",codex-semantic-primary-020,W01-BATCH-020,
PMID:34156923,82f813d5c284a40f014b2f5ed281950d11da827083e5dc432db5073f0254cd48,include_applied_seed,applied_seed,I_APPLIED_TRANSFERABLE_DESIGN,This national genomic surveillance study estimates SARS-CoV-2 introductions and dates a locally predominant Palestinian lineage.,codex-semantic-primary-020,W01-BATCH-020,
PMID:34168675,babe10c7204695bebbb63b14931d0aea553ab1246da5ad7762c44ca8b5ef2c26,include_applied_seed,applied_seed,I_APPLIED_TRANSFERABLE_DESIGN,This Bayesian phylogeographic study uses a large sequence collection to distinguish sustained local St. Louis encephalitis circulation from repeated importation.,codex-semantic-primary-020,W01-BATCH-020,
PMID:34179963,60ca143be23fe69188406d18f65b9f7e5de0efd6e9fa52fe361678bd22f257ab,include_applied_seed,applied_seed,I_APPLIED_TRANSFERABLE_DESIGN,This national molecular and genomic surveillance study identifies clonal and transnational drivers of metallo-beta-lactamase Pseudomonas spread.,codex-semantic-primary-020,W01-BATCH-020,
