candidate_key,source_row_sha256,primary_decision,primary_proposed_record_type,primary_reason_code,primary_reason,primary_reviewer,batch_id,retained_candidate_key
PMID:22826486,f011bd13e5464af927af71e81f88f2f36b99188b602700911fdc1c602b2d39f8,include_applied_seed,applied_seed,I_APPLIED_TRANSFERABLE_DESIGN,The study demonstrates companion-animal sentinel sampling and laboratory testing to monitor zoonotic parasite exposure in Indigenous communities.,codex-semantic-primary-009,W01-BATCH-009,
PMID:22844405,d476e1d5bb8924e458c65191d0f9f1403e26c26d2ae79417e68bd6a367b53c04,include_diagnostic_or_correction_lead,diagnostic,I_DIAGNOSTIC_CORRECTION,The study uses Bayesian latent-class models to estimate malaria test accuracy and prevalence without assuming microscopy is a perfect reference test.,codex-semantic-primary-009,W01-BATCH-009,
PMID:22863403,9d9203cd2842b4a484132e82d7f00dc8b37ac54f6e7d5f3a7b6af79068254ff2,include_applied_seed,applied_seed,I_APPLIED_TRANSFERABLE_DESIGN,The study describes a long-running sentinel design combining clinical ILI data with virological testing across Côte d'Ivoire.,codex-semantic-primary-009,W01-BATCH-009,
PMID:22867003,12346dfe27f11a06f8f0eb3f398a1d76d35e992ce17c7bf00e7f00b432aa880f,include_applied_seed,applied_seed,I_APPLIED_TRANSFERABLE_DESIGN,"The study evaluates airport fever screening as a dengue surveillance and border-triage strategy, including predictive links to domestic cases.",codex-semantic-primary-009,W01-BATCH-009,
PMID:22884042,a98ca82369bc691014a6fa2dae53e51d8df9595beb9707c86fd0c0eaeeb05711,exclude,,X_DESCRIPTIVE_ONLY,The study descriptively reports HIV prevalence and behavioural trends in repeated sentinel samples without a transferable analytic or surveillance-design evaluation.,codex-semantic-primary-009,W01-BATCH-009,
PMID:22911898,2eafec02ebe91dee26705e16a8c153da6529ffd44f73d889b0f72f124cfecefa,include_method_source_lead,method_source,I_METHOD_SOURCE,The paper develops and validates power and sample-size formulas for case-series models with exposure-onset measurement error.,codex-semantic-primary-009,W01-BATCH-009,
PMID:22984519,170994bfe37c22731ee504826f58d2fc531f10f0166e54391aced29a58edd28a,exclude,,X_DESCRIPTIVE_ONLY,The prospective hospital surveillance study primarily describes detected respiratory viruses and influenza waves without evaluating a transferable method.,codex-semantic-primary-009,W01-BATCH-009,
PMID:22993809,5582141c661f133ce5c52d86bfa61074e5e56dcc51c7e559193fbb2888dac41f,uncertain_retrieve_primary,,U_PRIMARY_RECORD_NEEDED,"The title indicates a descriptive sentinel-surveillance analysis, but no abstract is available to determine whether it contributes a transferable method or design.",codex-semantic-primary-009,W01-BATCH-009,
PMID:23020929,51d5221e5e25d0d64a1e2c37e97f739f442dd991ddc7a22801d30fb247fc308c,include_applied_seed,applied_seed,I_APPLIED_TRANSFERABLE_DESIGN,The study applies two-source capture-recapture to quantify missed mucormycosis cases and surveillance-source sensitivity.,codex-semantic-primary-009,W01-BATCH-009,
PMID:23050554,01c57152591fc2d8cc13ef43123bf3ad4fbffaeec91cc327c99f34b5dad10a8d,include_applied_seed,applied_seed,I_APPLIED_TRANSFERABLE_DESIGN,The study combines three surveillance sources with multiple imputation and log-linear capture-recapture to estimate paediatric HIV diagnoses.,codex-semantic-primary-009,W01-BATCH-009,
PMID:23066727,b52c9611e5c798981b87c752d5f7b38162bcbe39067de536d43abf90121d8242,exclude,,X_WRONG_RECORD_TYPE,This is a study protocol describing a planned surveillance network rather than reporting methodological evaluation or results.,codex-semantic-primary-009,W01-BATCH-009,
PMID:23073789,1820e9f3df67a855db35bd1581bb86c9703c3b85f278992eaba495e20bdf6b0c,include_method_source_lead,method_source,I_METHOD_SOURCE,"The paper demonstrates a modified latent-class model for estimating screening-test error when no gold standard exists, despite its cervical-cancer application.",codex-semantic-primary-009,W01-BATCH-009,
PMID:23124850,106fcd7848035207589b13ea4964c28f55b12548dae451b5269171371f1da455,include_method_source_lead,method_source,I_METHOD_SOURCE,The paper develops and evaluates a non-homogeneous hidden Markov model for influenza nowcasting and epidemic-state inference.,codex-semantic-primary-009,W01-BATCH-009,
PMID:23164432,a3d4ca03cfbb401252b5512f947024782b4f4c8b919a263e1eb5ff16c020b851,include_diagnostic_or_correction_lead,diagnostic,I_DIAGNOSTIC_CORRECTION,The study uses latent-class analysis to evaluate PCR and culture for bovine Staphylococcus aureus infection without a perfect reference test.,codex-semantic-primary-009,W01-BATCH-009,
PMID:23166708,62d9e02b966ee35a5f6fa79a6943d895aa99a567dde612e653f33efeccef2bc3,include_diagnostic_or_correction_lead,diagnostic,I_DIAGNOSTIC_CORRECTION,The study estimates diagnostic-test accuracy and tuberculosis prevalence in elephants using a latent-class model under unknown disease status.,codex-semantic-primary-009,W01-BATCH-009,
PMID:23169958,e7da087a9a62522afa7de746663e79692d92fe10181ce68a14e285f1fd1caa5b,exclude,,X_DESCRIPTIVE_ONLY,The paper reports descriptive long-term influenza surveillance findings in Senegal without a substantive methodological evaluation.,codex-semantic-primary-009,W01-BATCH-009,
PMID:23169976,e2d0ba9e864b33a1f1e66b65e80da5c2c70eb640b82a09a2857c86a9d589ffd9,exclude,,X_DESCRIPTIVE_ONLY,The paper reports early influenza sentinel-surveillance results in Rwanda without evaluating a transferable surveillance method.,codex-semantic-primary-009,W01-BATCH-009,
PMID:23169977,e0ea9dfaf8b2e86bf15e035541020a5ba26ce3f2aa87751ea77f1bcd867d72b2,exclude,,X_DESCRIPTIVE_ONLY,The paper describes influenza findings from Tanzanian sentinel sites without a transferable analytic or design contribution.,codex-semantic-primary-009,W01-BATCH-009,
PMID:23194895,4b303dacdd7b94c26a9402985a284b5497c08f151521764eafee8cdbae084d30,include_diagnostic_or_correction_lead,diagnostic,I_DIAGNOSTIC_CORRECTION,The study evaluates PCR threshold choices and culture accuracy for bovine Streptococcus agalactiae using latent-class analysis.,codex-semantic-primary-009,W01-BATCH-009,
PMID:23216501,ec90aead3b9fbe066fa3aca0da1c5ce581b688439d68b515ea4649d06338af63,exclude,,X_DESCRIPTIVE_ONLY,The paper reports chlamydia testing and positivity rates from existing sentinel clinics without evaluating the surveillance design.,codex-semantic-primary-009,W01-BATCH-009,
PMID:23287541,55226083e0d35d1aa06e7ac68284ab4244572e5b486b8d4624cf12247c09af68,include_applied_seed,applied_seed,I_APPLIED_TRANSFERABLE_DESIGN,The study describes a national sentinel platform and links regional viral circulation to climate patterns to inform control timing.,codex-semantic-primary-009,W01-BATCH-009,
PMID:23349667,38e8ebcbb907afe07caad858f4908c5fbf6a15ea327df895cba1446b32574e87,include_diagnostic_or_correction_lead,diagnostic,I_DIAGNOSTIC_CORRECTION,The study re-estimates dengue diagnostic accuracy with Bayesian latent-class models to correct for an imperfect reference assay.,codex-semantic-primary-009,W01-BATCH-009,
PMID:23383591,944700698769899eea4de6be607e861bccf1144c19d72d45fcf30417fd42ef48,include_applied_seed,applied_seed,I_APPLIED_TRANSFERABLE_DESIGN,The study uses three-list capture-recapture and log-linear models to estimate unobserved HIV-positive pregnant women.,codex-semantic-primary-009,W01-BATCH-009,
PMID:23399422,ccb3c5b9d94d5c05b4a29cbbda8f942cca7ff3cf43a059ff1e7e377d36b4f2b9,include_applied_seed,applied_seed,I_APPLIED_TRANSFERABLE_DESIGN,The study applies a test-negative case-control design within sentinel surveillance to generate interim influenza vaccine-effectiveness estimates.,codex-semantic-primary-009,W01-BATCH-009,
PMID:23438031,60bd0e284c2e51deec025c38dd8ce664c8f1b7a1f359d909234df284b24d2661,exclude,,X_DESCRIPTIVE_ONLY,"The secondary analysis reports demographic correlates of HIV, syphilis, and HCV prevalence without a transferable methodological contribution.",codex-semantic-primary-009,W01-BATCH-009,
PMID:23449183,c6c82572a5e84c873e40073eba3d8df8a813a2fa3cae4b483a86d0e1b62b750e,include_applied_seed,applied_seed,I_APPLIED_TRANSFERABLE_DESIGN,The multicountry study applies a test-negative sentinel-network design for early influenza vaccine-effectiveness estimation.,codex-semantic-primary-009,W01-BATCH-009,
PMID:23459420,de12e82ea9b2da48c9acf956fc9d59afa1250eab5dc683c46240ea53c0527035,include_diagnostic_or_correction_lead,diagnostic,I_DIAGNOSTIC_CORRECTION,The study evaluates multiple canine echinococcosis diagnostics and conditional dependence with Bayesian latent-class models.,codex-semantic-primary-009,W01-BATCH-009,
PMID:23522183,70f3325fb61f8d2428766c2b0dab987238afbed9a9c5874f87ed318c470ea423,include_applied_seed,applied_seed,I_APPLIED_TRANSFERABLE_DESIGN,The study applies linked-source log-linear capture-recapture to infer injecting-drug-use transmission risk among diagnosed HCV cases.,codex-semantic-primary-009,W01-BATCH-009,
PMID:23538054,9680cc540feaf808b5bf553ea07d66e265843c09667087f9c8e434b87a1aeaa5,include_diagnostic_or_correction_lead,diagnostic,I_DIAGNOSTIC_CORRECTION,The study evaluates Toxoplasma serology using Bayesian latent-class analysis with clustered farm-level data.,codex-semantic-primary-009,W01-BATCH-009,
PMID:23538942,a9614b640d7253a4569ae881708e0192fe89439ced5840ac6a83db38ad7bf97b,exclude,,X_NOT_INFECTIOUS_TRANSFERABLE,The paper develops latent-transition analysis for dietary patterns without a concrete infectious-disease application or stated transfer route.,codex-semantic-primary-009,W01-BATCH-009,
PMID:23562370,8d44aae7ecd1f4bf43c467c8754daaeca772fa45d8df6bdb368c65199b1c377c,include_applied_seed,applied_seed,I_APPLIED_TRANSFERABLE_DESIGN,The study uses latent-class analysis to identify substance-use profiles linked to sexual HIV-transmission risk in a high-prevalence population.,codex-semantic-primary-009,W01-BATCH-009,
PMID:23572379,a9779e48fb239a4cc40023d3375751bfea4cd11e36605ca31ee5674e41f7911f,include_applied_seed,applied_seed,I_APPLIED_TRANSFERABLE_DESIGN,The follow-up sentinel study uses repeated cross-sectional parasitological measurement to assess helminth-control programme impact.,codex-semantic-primary-009,W01-BATCH-009,
PMID:23581956,1a25b0030ae1a7036c47f1168c51fdf17635e0badcd0815af3d0756e4a15e3b5,include_applied_seed,applied_seed,I_APPLIED_TRANSFERABLE_DESIGN,The paper applies a hospital sentinel case definition to compare nosocomial and community-acquired influenza outcomes.,codex-semantic-primary-009,W01-BATCH-009,
PMID:23650442,0bed2c4a36aef23de034101a313190477e3303791173879a5255357b5bfbf680,include_method_source_lead,method_source,I_METHOD_SOURCE,The paper develops bias-corrected measurement-error case-series models for imprecisely timed time-varying exposures.,codex-semantic-primary-009,W01-BATCH-009,
PMID:23691004,24b86ffc58d93b22b1f4b0925f9f4b5a7d5c32b5f785d25a5128f41c9457698a,include_method_source_lead,method_source,I_METHOD_SOURCE,The paper develops a unilist capture-recapture framework combining zero-inflated Poisson and hurdle models to assess surveillance completeness.,codex-semantic-primary-009,W01-BATCH-009,
PMID:23703338,53d0b79096c184214bed64b784cf5050c57c7608f2418fc56df27b9ca80436fc,include_applied_seed,applied_seed,I_APPLIED_TRANSFERABLE_DESIGN,The paper demonstrates multicentre hospital sentinel surveillance for bacterial meningitis and vaccine-impact assessment.,codex-semantic-primary-009,W01-BATCH-009,
PMID:23731166,a944ad916e4fb36b115f8a46c002719ce6b257247159ea95ed96aa4599e1881f,include_method_source_lead,method_source,I_METHOD_SOURCE,The paper evaluates validity and power of naive hypothesis tests in case-series analyses with exposure-timing error.,codex-semantic-primary-009,W01-BATCH-009,
PMID:23798669,8489ec0cc02af1c0b674a5ed480335884b47ffa66247d1825680f1dfa99ab95e,exclude,,X_DESCRIPTIVE_ONLY,The paper reports prevalence trends of transmitted HIV resistance from sentinel samples without evaluating the surveillance or analytic method.,codex-semantic-primary-009,W01-BATCH-009,
PMID:23798720,fdbcb5f3977f1cff44d8437ab003fd7da0b30bbef82c83fb754f31ae01a1f5ff,include_applied_seed,applied_seed,I_APPLIED_TRANSFERABLE_DESIGN,The case series evaluates how influenza sentinel sampling detects mild H7N9 infections and reveals surveillance under-ascertainment.,codex-semantic-primary-009,W01-BATCH-009,
PMID:23800108,3357d00a9f29886254a7ad506d2a2b665afc79114df099d712292f9a1085ee9d,include_applied_seed,applied_seed,I_APPLIED_TRANSFERABLE_DESIGN,The paper documents a systematic process for implementing influenza sentinel surveillance within an existing national IDSR platform.,codex-semantic-primary-009,W01-BATCH-009,
PMID:23803487,d40cb491858ea9995006e87a5363d8e41533832711d0a42a46188b3b88e52f69,include_applied_seed,applied_seed,I_APPLIED_TRANSFERABLE_DESIGN,The study estimates H7N9 clinical severity while explicitly adjusting for incomplete outcomes and using sentinel data to infer symptomatic fatality risk.,codex-semantic-primary-009,W01-BATCH-009,
PMID:23867812,03fae643063d2ff3d6cec44f383ba10078b5a546591421943d616243416c3164,include_method_source_lead,method_source,I_METHOD_SOURCE,"The paper develops planning calculations for sequential database surveillance, illustrated through a vaccine safety example.",codex-semantic-primary-009,W01-BATCH-009,
PMID:23883156,5f6a7112019f922e93eedd8cbdd19865695e84f3b2d99562db2e3c53f61ff077,include_diagnostic_or_correction_lead,diagnostic,I_DIAGNOSTIC_CORRECTION,"This study uses latent class analysis to estimate diagnostic sensitivity, specificity, and disease incidence without a gold standard.",codex-cli-task5-scope-reader-a-019f81bd-c390-7a41-ad40-50fded53ac57,W01-BATCH-009,
PMID:23900718,47feee00957747b733cb62341bab58b6b99c8f2a464260bfe46972deeb198256,include_method_source_lead,method_source,I_METHOD_SOURCE,The paper extends mixed-effects approaches for baseline adjustment and measurement error and demonstrates them in an HIV cohort.,codex-semantic-primary-009,W01-BATCH-009,
PMID:23908946,fc5ac49c54eafa19db322614229599ead2d7ada6311cbe76bcde055ea8ac6ee3,include_diagnostic_or_correction_lead,guidance,I_DIAGNOSTIC_CORRECTION,The paper formally evaluates China's HIV sentinel system against CDC surveillance attributes and provides operational improvement recommendations.,codex-semantic-primary-009,W01-BATCH-009,
PMID:23969035,7021e0a91c7ee130e9e68a8b0a1a477bce1a66cdcad935f79e0e70fc1278439a,include_applied_seed,applied_seed,I_APPLIED_TRANSFERABLE_DESIGN,The study links hospitalization and prospective-case datasets and applies capture-recapture models to improve encephalitis incidence estimates.,codex-semantic-primary-009,W01-BATCH-009,
PMID:23997308,9ed19e376b9bf7399e6f085728c996074cbde6356d3a53afc4f02eb08108941b,include_diagnostic_or_correction_lead,guidance,I_DIAGNOSTIC_CORRECTION,The paper evaluates a paediatric respiratory sentinel system using CDC surveillance-system evaluation criteria.,codex-semantic-primary-009,W01-BATCH-009,
PMID:24049867,0ff19f08607fd737c63bd9a242ee37d4c052104344fbd39ca5ac4c19a2d4617b,include_diagnostic_or_correction_lead,guidance,I_DIAGNOSTIC_CORRECTION,This WHO guidance prescribes methods and standards for determining whether PMTCT data can replace antenatal HIV sentinel surveillance.,codex-semantic-primary-009,W01-BATCH-009,
PMID:24050481,a236fd35449dc69aa96010327009f51a9c0c698541e14f22c6ad7d80013997df,include_diagnostic_or_correction_lead,diagnostic,I_DIAGNOSTIC_CORRECTION,The study uses latent-class analysis to reassess biomarker performance for severe sepsis diagnosis in emergency care.,codex-semantic-primary-009,W01-BATCH-009,
PMID:24065437,c759462fbc12232bdd285bed036815b6810d166722b4a9f8453eed2c37ddd210,include_applied_seed,applied_seed,I_APPLIED_TRANSFERABLE_DESIGN,The study uses latent-class analysis to distinguish MSM drug-use profiles associated with HIV risk.,codex-semantic-primary-009,W01-BATCH-009,
PMID:24107261,9420a5e611d4ca8873f8f6658aeee3ab32e4173af1e9be907652c79af4bbe1ff,include_method_source_lead,method_source,I_METHOD_SOURCE,The systematic review integrates surveillance and independent-study HIV prevalence data and compares their geographic agreement.,codex-semantic-primary-009,W01-BATCH-009,
PMID:24125599,ed401e7cf1ecf4ad7460461e333bcf1ed1eae569f09236f94197c2dde1dee1a6,exclude,,X_DESCRIPTIVE_ONLY,The repeated sentinel analysis descriptively reports HCV prevalence by population group without a transferable design evaluation.,codex-semantic-primary-009,W01-BATCH-009,
PMID:24162744,4bff880091765f413fab8b2fd7c6dc930bfa844cb89f2e2f4912be6db844ced7,include_diagnostic_or_correction_lead,guidance,I_DIAGNOSTIC_CORRECTION,The review sets out complementary strategies for measuring inpatient antimicrobial use for benchmarking and national surveillance.,codex-semantic-primary-009,W01-BATCH-009,
PMID:24188574,c8487d16fc014aedbcdab01936e0d5e40ccc1384f6cc84af7e54a62511040f62,include_applied_seed,applied_seed,I_APPLIED_TRANSFERABLE_DESIGN,The study applies capture-recapture to estimate imported dengue incidence and evaluate completeness of complementary surveillance systems.,codex-semantic-primary-009,W01-BATCH-009,
PMID:24272278,5c67c7eb0988f338c2213756032f8dec0fd2354a5f178aca9b0a2cb498e91565,include_diagnostic_or_correction_lead,guidance,I_DIAGNOSTIC_CORRECTION,"The systematic review critically evaluates latent-class diagnostic-study assumptions, reporting, and model checking practices.",codex-semantic-primary-009,W01-BATCH-009,
PMID:24274387,990afa1ba7804acfa7a057811e133ebc273f7409e54a65d20e72e0b0f8477fd5,include_applied_seed,applied_seed,I_APPLIED_TRANSFERABLE_DESIGN,The study combines a clinician network and discharge database with capture-recapture to assess surveillance completeness and timeliness.,codex-semantic-primary-009,W01-BATCH-009,
PMID:24300884,0c3f8770c80741202d4b9e1bef370bba8a8761507b66a2240b2041606b4ef96a,include_applied_seed,applied_seed,I_APPLIED_TRANSFERABLE_DESIGN,The study combines four registers and antenatal screening data to estimate diagnosed and undiagnosed chronic HBV prevalence.,codex-semantic-primary-009,W01-BATCH-009,
PMID:24321203,1175fbdf4aeb6976609c84c85b51e1b4d8ee0b4a46b3b157e1a0e5993917fe2e,include_simulation_or_mechanistic_lead,method_source,I_SIMULATION_MECHANISTIC,The paper compares computational sentinel-site placement algorithms by simulating influenza surveillance performance over multiple seasons.,codex-semantic-primary-009,W01-BATCH-009,
PMID:24326582,62ba37195593ab0c28d28e09a142980a9ffab40b3bad82bd7a2ec2a642d3dd7c,include_applied_seed,applied_seed,I_APPLIED_TRANSFERABLE_DESIGN,The sentinel study combines HPV DNA and serology to estimate vaccine-type naivety and inform vaccination targeting.,codex-semantic-primary-009,W01-BATCH-009,
PMID:24330021,467d982d4e5db63b7990f075b575c3c234977570915c5a5a077c7c5d66ad6170,include_applied_seed,applied_seed,I_APPLIED_TRANSFERABLE_DESIGN,The study shows how routine community molecular testing can extend sentinel surveillance to characterize mild Mycoplasma pneumoniae infection.,codex-semantic-primary-009,W01-BATCH-009,
PMID:24434174,d97bc9e7d93a67d2acd839d3ab3101166a2c7a01490789cd59727d9061213ed0,include_diagnostic_or_correction_lead,diagnostic,I_DIAGNOSTIC_CORRECTION,The study quantifies laboratory-reporting delays in Salmonella surveillance and models factors associated with reduced timeliness.,codex-semantic-primary-009,W01-BATCH-009,
PMID:24439966,0736acd34ee02d7c49aa76ef820924694eae7c67659ee3428094a788df8eadb8,include_diagnostic_or_correction_lead,diagnostic,I_DIAGNOSTIC_CORRECTION,The study estimates somatic-cell-count and culture accuracy for bovine mastitis using Bayesian latent-class models.,codex-semantic-primary-009,W01-BATCH-009,
PMID:24449152,716664b8844fbff71fc18b0798e502068a5d24b116a3ebe7c39128043f5324b1,include_applied_seed,applied_seed,I_APPLIED_TRANSFERABLE_DESIGN,The study uses latent-class analysis of adolescent sexual behaviours to predict subsequent STI outcomes.,codex-semantic-primary-009,W01-BATCH-009,
PMID:24480060,8c327ef6d11dfa1502d2fa8cfdd5a955e46cbf268de4d5af8c477e4c59f20b38,include_applied_seed,applied_seed,I_APPLIED_TRANSFERABLE_DESIGN,The paper evaluates the implementation and output of a large routine laboratory-data sentinel system for respiratory viruses.,codex-semantic-primary-009,W01-BATCH-009,
PMID:24510363,6b653f68dc942c0695845f7f5ac9b5a919243613d42b7c944ef3817e5c03d176,include_applied_seed,applied_seed,I_APPLIED_TRANSFERABLE_DESIGN,The study uses latent-class analysis to derive dual drug-and-sexual HIV-risk profiles among injection drug users.,codex-semantic-primary-009,W01-BATCH-009,
PMID:24524234,89c401af267a079cac7f22a07ff53e74181f8226f8c85a89615c87f6493551d1,include_applied_seed,applied_seed,I_APPLIED_TRANSFERABLE_DESIGN,The study applies a test-negative sentinel-network design for interim effectiveness estimation against A(H1N1)pdm09.,codex-semantic-primary-009,W01-BATCH-009,
PMID:24528433,dc51f6f0c9410f8ea36f9c7a5eb9fe7e61206c3e6ad0e78ba85791e3f5051bdc,exclude,,X_DESCRIPTIVE_ONLY,The study uses standard random-effects Poisson regression to describe chlamydia positivity trends without a reusable methodological advance.,codex-semantic-primary-009,W01-BATCH-009,
PMID:24566353,67d5076030ef8649e5e11113281136c6b10341a167473b5f9864ac560f1c2e58,exclude,,X_COMMENTARY_ONLY,"The brief review advocates sentinel, environmental, and geospatial approaches but supplies no substantive method content.",codex-semantic-primary-009,W01-BATCH-009,
PMID:24587120,37e4a827268ba27445f9ffaf2e0d399f79b776cc7bd406756b44410f45b1b73b,include_applied_seed,applied_seed,I_APPLIED_TRANSFERABLE_DESIGN,The study uses latent-class analysis to identify HIV-risk knowledge profiles and relate them to stigma among South African youth.,codex-semantic-primary-009,W01-BATCH-009,
PMID:24618105,7db4069e0700ff932b9d24e77aa48d6ac02f90081eed3ea70bfa1aea5c57be91,include_diagnostic_or_correction_lead,guidance,I_DIAGNOSTIC_CORRECTION,"The paper evaluates implementation challenges, data concordance, and SMS reporting within an Ethiopian malaria sentinel system.",codex-semantic-primary-009,W01-BATCH-009,
PMID:24625178,2d4aca1b4a2ec612ec085ab5f1a9bf1bef65ae2803a66dbe6136363050db04f3,include_applied_seed,applied_seed,I_APPLIED_TRANSFERABLE_DESIGN,The study incorporates social-network variables into latent-class risk profiling for sexually transmitted and bloodborne infection prevention.,codex-semantic-primary-009,W01-BATCH-009,
PMID:24689319,7b813b2a2996b1d5350a43e3925b1f9b1734979ae36c512713820a390a761844,include_applied_seed,applied_seed,I_APPLIED_TRANSFERABLE_DESIGN,The study uses mapped hotspots and two-sample capture-recapture to estimate male sex-worker population sizes for HIV programming.,codex-semantic-primary-009,W01-BATCH-009,
PMID:24708296,d4fb175f57b8f991eac26b85458133ff56f9a05000a87906b44733e2deb88c11,include_applied_seed,applied_seed,I_APPLIED_TRANSFERABLE_DESIGN,"This study applies multi-event capture-recapture modeling to jointly estimate infection-state transitions, immunity dynamics, and host survival.",codex-cli-task5-scope-reader-a-019f81bd-c390-7a41-ad40-50fded53ac57,W01-BATCH-009,
PMID:24739547,c57708ae748592d3051e12915acfb3a1ca14b08d687add588fbce4ab193a1790,exclude,,X_DESCRIPTIVE_ONLY,The sentinel analysis describes serology and sexual behaviours among drug-user groups without a transferable methodological contribution.,codex-semantic-primary-009,W01-BATCH-009,
PMID:24777440,35051d82a985cdaf339fafd3b057bd7dbbb0dc5477f338fcbdf923028541d351,include_applied_seed,applied_seed,I_APPLIED_TRANSFERABLE_DESIGN,The study uses latent-class analysis to characterize male-escort client encounters and identify HIV-prevention opportunities.,codex-semantic-primary-009,W01-BATCH-009,
PMID:24821749,d94b5f24e85a93f47ee8664098ccc0a2d679cde38596c80cdafe41f3819c40ad,include_applied_seed,applied_seed,I_APPLIED_TRANSFERABLE_DESIGN,The study combines latent-class social profiles with viral phylogenetics to infer HIV transmission mixing patterns.,codex-semantic-primary-009,W01-BATCH-009,
PMID:24899369,3e6a4f93ae43c143a3b67da37cc072f634bc5e96b9330d39cf606754cbd78f84,include_applied_seed,applied_seed,I_APPLIED_TRANSFERABLE_DESIGN,The study develops a clinical decision tree from equine sentinel data to improve early West Nile fever detection.,codex-semantic-primary-009,W01-BATCH-009,
PMID:24930473,ad4a831ea8504f41993356939b6e62754ac1cadae6d7413057ca64995ba763f1,include_method_source_lead,method_source,I_METHOD_SOURCE,The paper develops and evaluates Bayesian nowcasting models that account for reporting-delay distributions during an STEC outbreak.,codex-semantic-primary-009,W01-BATCH-009,
PMID:24955962,1fe5e7e1d5259f35f68ef370b2a2f4f6dff2e621850533b4d6ef71f2ffbfbc21,exclude,,X_DESCRIPTIVE_ONLY,The paper reports six years of Kenyan influenza sentinel findings without evaluating a transferable surveillance method.,codex-semantic-primary-009,W01-BATCH-009,
PMID:24959929,db4b0994b2e2bc61d49f0ece5b7f946a8bfe117f64baa1412a0c85867e50284f,include_applied_seed,applied_seed,I_APPLIED_TRANSFERABLE_DESIGN,"The study integrates multiple sentinel systems, virology, and age-specific consultation measures to characterize an ILI outbreak.",codex-semantic-primary-009,W01-BATCH-009,
PMID:24963890,0186cd338b7f410f84c50bb3dd7bed44021bb0d626e3fcee9a297cffdee6c870,include_diagnostic_or_correction_lead,correction,I_DIAGNOSTIC_CORRECTION,The study experimentally quantifies measurement error to correct claims that shipping delays substantially alter Legionella culture counts.,codex-semantic-primary-009,W01-BATCH-009,
PMID:24966221,74409c63f96bccd528b569e8f89521ed61b5a4a8e2d20e66df6cb4163547106e,exclude,,X_NOT_INFECTIOUS_TRANSFERABLE,"The historical reanalysis concerns pellagra, a nutritional-deficiency disease, without a concrete infectious-disease transfer route in the abstract.",codex-semantic-primary-009,W01-BATCH-009,
