candidate_key,source_row_sha256,primary_decision,primary_proposed_record_type,primary_reason_code,primary_reason,primary_reviewer,batch_id,retained_candidate_key
PMID:41337677,ed619bed19d7b8f81dfff3ae3bda5f3b215ef21a2b886f87d0ca970a8bbc1975,include_applied_seed,applied_seed,I_APPLIED_TRANSFERABLE_DESIGN,This interrupted time-series pilot evaluates feasibility and preliminary effects of a clinic-level HIV prevention intervention.,codex-cli-task5-fix3-reader-a-019f8285-5dde-7ef2-85c5-83282c4fc0d9,W01-BATCH-007,
PMID:41346486,3c7ddc153b34bcffcc541d164a308972e28fb5f82bf483eaa8e9da7cc9d2648d,include_applied_seed,applied_seed,I_APPLIED_TRANSFERABLE_DESIGN,"This interrupted time-series analysis estimates immediate, trend, and withdrawal effects of antimicrobial-stewardship feedback.",codex-cli-task5-fix3-reader-a-019f8285-5dde-7ef2-85c5-83282c4fc0d9,W01-BATCH-007,
PMID:41364631,a24f39cb202b9bac44333574b6d26032ab88ae9b6c55991e5451042f79670290,exclude,,X_DESCRIPTIVE_ONLY,This difference-in-differences analysis evaluates school reopening effects on mental-health outcomes rather than infectious-disease transmission or control.,codex-semantic-primary-007,W01-BATCH-007,
PMID:41364874,fdcd30b6277e9e58f02947a3776474c02df185dd4bde238a482bd5af3bfd87ae,exclude,,X_NOT_INFECTIOUS_TRANSFERABLE,This cancer treatment comparison applies target trial emulation without an infectious-disease epidemiological application or explicit transfer route.,codex-cli-task5-fix3-reader-a-019f82a0-b463-75a1-8ac6-ba6b802d3d36,W01-BATCH-007,
PMID:41385293,2b557551eb8e929551c752f61a86fb42892ed725f36b531343ba4078db504da5,exclude,,X_COMMENTARY_ONLY,This is a reply comment without an abstract or enough methodological content to serve as a resource.,codex-semantic-primary-007,W01-BATCH-007,
PMID:41385523,e843eb1009924dd986f8f8d29b4bcb4f51319e7cce01e28891fb65084e208203,include_applied_seed,applied_seed,I_APPLIED_TRANSFERABLE_DESIGN,This quasi-experimental interrupted time series estimates a quality-improvement intervention's effect within an HIV-prevention circumcision program.,codex-cli-task5-fix3-reader-a-019f82a0-b463-75a1-8ac6-ba6b802d3d36,W01-BATCH-007,
PMID:41387113,e3fc2a3325b89e3410e4dbe241a9a76e53fb7f62c891d6ff7a6a77defd11532a,exclude,,X_NOT_INFECTIOUS_TRANSFERABLE,This metabolic treatment comparison in transplant candidates is not an infectious-disease application despite including infections as secondary outcomes.,codex-cli-task5-fix3-reader-a-019f82a0-b463-75a1-8ac6-ba6b802d3d36,W01-BATCH-007,
PMID:41392612,76d5763d8f2e9fc0fc27dc3ddd4cd41b7cd634c6f72d7694fbeddf3c40ae2cac,exclude,,X_COMMENTARY_ONLY,This comment provides no abstract or substantive methodological content beyond responding to another study.,codex-semantic-primary-007,W01-BATCH-007,
PMID:41405712,89bc39c5aa4c7c0415e64762f248fbc54078bd07955baabde4dfeee1b26921ba,exclude,,X_NOT_INFECTIOUS_TRANSFERABLE,This perioperative drug analysis concerns orthopedic complications and offers no explicit infectious-disease epidemiological application or transfer route.,codex-cli-task5-fix3-reader-a-019f82a0-b463-75a1-8ac6-ba6b802d3d36,W01-BATCH-007,
PMID:41409621,1ad3b74dad29d2e15a84fd3a3115f7213dde44d87b88839e7303b0e35d971a79,include_applied_seed,applied_seed,I_APPLIED_TRANSFERABLE_DESIGN,"This interrupted time series evaluates antimicrobial stewardship effects on diagnostic sampling, antibiotic use, costs, and resistant organisms.",codex-cli-task5-fix3-reader-a-019f82a0-b463-75a1-8ac6-ba6b802d3d36,W01-BATCH-007,
PMID:41413926,bb2e71f1bdf188d0e08790ba71e6dafca2f647b0184d01b0cedd78c0a7ebc753,include_applied_seed,applied_seed,I_APPLIED_TRANSFERABLE_DESIGN,This interrupted time series estimates population changes in syphilis positivity following regional implementation and provincial scale-up of rapid testing.,codex-cli-task5-fix3-reader-a-019f82a0-b463-75a1-8ac6-ba6b802d3d36,W01-BATCH-007,
PMID:41421781,c987290ca31be243057107f283a6fb319c41d84940c9cd8b3e0b874103ee0f4d,include_applied_seed,applied_seed,I_APPLIED_TRANSFERABLE_DESIGN,This applied AMR study combines time-series forecasting models with interrupted time series analysis of national policy effects.,codex-cli-task5-fix3-reader-a-019f82a0-b463-75a1-8ac6-ba6b802d3d36,W01-BATCH-007,
PMID:41423550,cc00ff398f31ed416ac8cd03a654f3599f279f5578a1a152565d129563358148,include_applied_seed,applied_seed,I_APPLIED_TRANSFERABLE_DESIGN,This population-based target trial emulation estimates antiviral effectiveness against short-term and long-term cardiovascular complications following COVID-19.,codex-cli-task5-fix3-reader-a-019f82a0-b463-75a1-8ac6-ba6b802d3d36,W01-BATCH-007,
PMID:41423896,3c5228a26a05c8d6ea85ee70046b1d73ff6b62a748b30a748b3c133a0f643739,include_applied_seed,applied_seed,I_APPLIED_TRANSFERABLE_DESIGN,This longitudinal time-to-event study estimates incident hypertension after COVID-19 while explicitly assessing diagnostic-testing confounding.,codex-cli-task5-fix3-reader-a-019f82a0-b463-75a1-8ac6-ba6b802d3d36,W01-BATCH-007,
PMID:41431611,ba6677674cae4987dc894f00aa64547d70e975499156b04cc0a572214391193c,include_applied_seed,applied_seed,I_APPLIED_TRANSFERABLE_DESIGN,This interrupted time series estimates the effect of resumed governmental HPV vaccination recommendations on population vaccination rates.,codex-cli-task5-fix3-reader-a-019f82a0-b463-75a1-8ac6-ba6b802d3d36,W01-BATCH-007,
PMID:41436186,ead0ecb47c85c1d50648f460b68feec14552b98e40a95c9fb67e61bbcbc95907,include_applied_seed,applied_seed,I_APPLIED_TRANSFERABLE_DESIGN,"This nationally scoped interrupted time series estimates COVID-19 disruption of HIV, malaria, tuberculosis, and vaccination services.",codex-cli-task5-fix3-reader-a-019f82a0-b463-75a1-8ac6-ba6b802d3d36,W01-BATCH-007,
PMID:41443474,8082101c9728d17395b1f031ca175a10d2c909c1fea20ecc77bfee5f03cbb92a,include_applied_seed,applied_seed,I_APPLIED_TRANSFERABLE_DESIGN,This target trial emulation compares metabolic therapies among chronic hepatitis B patients using per-protocol and propensity-score analyses.,codex-cli-task5-fix3-reader-a-019f82a0-b463-75a1-8ac6-ba6b802d3d36,W01-BATCH-007,
PMID:41445937,b99e00f47f612335cb4a02c2c57b660e9e378724360540773eac0506658718b6,include_applied_seed,applied_seed,I_APPLIED_TRANSFERABLE_DESIGN,This synthetic-control study estimates the counterfactual community transmission effect of mandatory school masking policies.,codex-cli-task5-fix3-reader-a-019f82a0-b463-75a1-8ac6-ba6b802d3d36,W01-BATCH-007,
PMID:41448219,57a184fcfe13b1631f8eb639f2257871dd354671519badea225bb17b791b5ae4,exclude,,X_NOT_INFECTIOUS_TRANSFERABLE,This delirium medication safety comparison is not an infectious-disease application despite including pneumonia and urinary infection outcomes.,codex-cli-task5-fix3-reader-a-019f82a0-b463-75a1-8ac6-ba6b802d3d36,W01-BATCH-007,
PMID:41449460,0599bb109a6642c9cdb76b341b0c41d56d0571e8cc4baa2da2bd565add16f837,include_applied_seed,applied_seed,I_APPLIED_TRANSFERABLE_DESIGN,"This interrupted time series evaluates a department-specific antimicrobial stewardship intervention using prescribing, utilization, and resistance measures.",codex-cli-task5-fix3-reader-a-019f82a0-b463-75a1-8ac6-ba6b802d3d36,W01-BATCH-007,
PMID:41469686,3c47b67cc0859b3a94dbb480dfbe2e1a8c717803ceb7bd161dc91ce45986085e,include_applied_seed,applied_seed,I_APPLIED_TRANSFERABLE_DESIGN,This target trial emulation estimates comparative herpes infection risks associated with alternative diabetes therapies and vaccination status.,codex-cli-task5-fix3-reader-a-019f82a0-b463-75a1-8ac6-ba6b802d3d36,W01-BATCH-007,
PMID:41469965,dabfa6916cf06b142f3c5dccb43deda565d77ff10ba6ab22a5f6462b0de54ec4,include_applied_seed,applied_seed,I_APPLIED_TRANSFERABLE_DESIGN,This nationwide interrupted time series estimates immediate and sustained policy effects across multiple notifiable infectious diseases.,codex-cli-task5-fix3-reader-a-019f82a0-b463-75a1-8ac6-ba6b802d3d36,W01-BATCH-007,
PMID:41472532,0b3992deaff5222a33a31cf5692730dc7b9a810248e44d6776e995e09ed144d8,exclude,,X_NOT_INFECTIOUS_TRANSFERABLE,This interrupted time-series study evaluates surgical imaging in breast reconstruction rather than an infectious-disease question.,codex-semantic-primary-007,W01-BATCH-007,
PMID:41484851,6082134a96251607ebbc6e93d994ca55d70c30e6b8be095dcde1bce15b0a8f0d,exclude,,X_DESCRIPTIVE_ONLY,This interrupted time-series analysis describes pandemic-associated birth outcomes without an infectious-disease control or surveillance contribution.,codex-semantic-primary-007,W01-BATCH-007,
PMID:41485032,2177b31da89b8eea908fcc11941228a6b21eb555b205274fdb3aa21f79cdcd5d,include_applied_seed,applied_seed,I_APPLIED_TRANSFERABLE_DESIGN,This population-based synthetic-control study estimates the counterfactual effect of mobile teams on COVID-19 booster uptake.,codex-cli-task5-fix3-reader-a-019f82a0-b463-75a1-8ac6-ba6b802d3d36,W01-BATCH-007,
PMID:41495081,638ca196c208007a43d1131345aa96d03b754c38fe2dc88b8457d32d963794c9,exclude,,X_DESCRIPTIVE_ONLY,This passive-serum transfer experiment is a preclinical vaccine efficacy study rather than an eligible epidemiological design.,codex-cli-task5-fix3-reader-a-019f82a0-b463-75a1-8ac6-ba6b802d3d36,W01-BATCH-007,
PMID:41501610,16b77ce24a266274cb046a3d4099b408459537cf1a48a493e0b419dae923db02,include_applied_seed,applied_seed,I_APPLIED_TRANSFERABLE_DESIGN,This interrupted time series uses syndromic surveillance and an ineligible age comparison group to estimate universal RSV immunization effects.,codex-cli-task5-fix3-reader-a-019f82a0-b463-75a1-8ac6-ba6b802d3d36,W01-BATCH-007,
PMID:41511171,80b8a47d37bed21147f61fdb697a8e86346a108f44f92c1bdb8c3a2c93a3e78c,include_applied_seed,applied_seed,I_APPLIED_TRANSFERABLE_DESIGN,This federated cross-national target trial emulation estimates real-world COVID-19 vaccine effectiveness using daily matching and restricted mean survival time.,codex-cli-task5-fix3-reader-a-019f82a0-b463-75a1-8ac6-ba6b802d3d36,W01-BATCH-007,
PMID:41511917,b10f0771c0b66a74fd341caac852abb6d4221c66a691ebf9224acee812db6bd4,include_applied_seed,applied_seed,I_APPLIED_TRANSFERABLE_DESIGN,This HIV cohort emulates a treatment-switch trial using marginal structural models and evaluates effect modification by antiviral resistance.,codex-cli-task5-fix3-reader-a-019f82a0-b463-75a1-8ac6-ba6b802d3d36,W01-BATCH-007,
PMID:41520795,a21c29e82aebfe5f83ce80db9602dbe4f0b16c7d9045f4d2085070701761eed5,include_applied_seed,applied_seed,I_APPLIED_TRANSFERABLE_DESIGN,This population-based interrupted time series estimates changes in pediatric infection mortality during and after pandemic interventions.,codex-cli-task5-fix3-reader-a-019f82a0-b463-75a1-8ac6-ba6b802d3d36,W01-BATCH-007,
PMID:41522295,057fa77dcf134c005cc4d66cc6af04add2b6505ad20dcbcc5582598076455a4e,exclude,,X_WRONG_RECORD_TYPE,This article proposes a future social-media vaccination campaign and interrupted time-series evaluation without reporting completed research.,codex-semantic-primary-007,W01-BATCH-007,
PMID:41556325,a2d9358c9424347ff6ee03f2158606856d5d35a5ce5e764bcdf6660727fd4d7f,include_applied_seed,applied_seed,I_APPLIED_TRANSFERABLE_DESIGN,This study applies interrupted time-series regression to estimate a vaccination program's population impact.,codex-cli-task5-fix3-reader-a-019f8286-80cf-7540-ac77-4730cac6d214,W01-BATCH-007,
PMID:41559605,14eb6b44e6d6b254edaf5a815c87c0b4aae1381dbf33e405178bf81769983c19,include_applied_seed,applied_seed,I_APPLIED_TRANSFERABLE_DESIGN,This study uses interrupted time series to estimate telemedicine effects on infectious-disease service utilization.,codex-cli-task5-fix3-reader-a-019f8286-80cf-7540-ac77-4730cac6d214,W01-BATCH-007,
PMID:41565341,2a7cb83a17b99074df6372436ea998387c5264ddb10376f6208868f3fa0f3149,exclude,,X_WRONG_RECORD_TYPE,This is a protocol for a future synthetic-control evaluation of a community vaccination intervention and contains no results.,codex-semantic-primary-007,W01-BATCH-007,
PMID:41581648,eed9221dfe1124782d77d718e204ff52112bad1b153ae73cfb93de36429f682b,include_applied_seed,applied_seed,I_APPLIED_TRANSFERABLE_DESIGN,This study applies target-trial emulation with weighting to estimate postinfection symptom risks.,codex-cli-task5-fix3-reader-a-019f8286-80cf-7540-ac77-4730cac6d214,W01-BATCH-007,
PMID:41591220,0d42b0c4dfdce0030b763bc624d0d589c8523449d618f076a51929716f8b6054,include_applied_seed,applied_seed,I_APPLIED_TRANSFERABLE_DESIGN,This study applies covariate-adjusted interrupted time series to estimate dengue vaccination impact.,codex-cli-task5-fix3-reader-a-019f8286-80cf-7540-ac77-4730cac6d214,W01-BATCH-007,
PMID:41594057,432d31a2102e7ff1d9efdb815e8bf33609549dc3d93ea9d6c03db87d646436d6,include_applied_seed,applied_seed,I_APPLIED_TRANSFERABLE_DESIGN,This study applies segmented interrupted time series to neonatal infection-control interventions and antimicrobial use.,codex-cli-task5-fix3-reader-a-019f8286-80cf-7540-ac77-4730cac6d214,W01-BATCH-007,
PMID:41611945,f3912f99ea1af17d5705eed7e8e462c194a50b2aa0ae15caccb7d17e0cbdd667,include_applied_seed,applied_seed,I_APPLIED_TRANSFERABLE_DESIGN,This study applies interrupted time series to estimate pandemic intervention effects on influenza.,codex-cli-task5-fix3-reader-a-019f8286-80cf-7540-ac77-4730cac6d214,W01-BATCH-007,
PMID:41618187,9c426b3e0010cd2bfeaedb5bb7343f659b1acd9977eb5b98ab5e1cd3554d960e,include_applied_seed,applied_seed,I_APPLIED_TRANSFERABLE_DESIGN,This study applies seasonally adjusted interrupted time series to infectious-disease control policies.,codex-cli-task5-fix3-reader-a-019f8286-80cf-7540-ac77-4730cac6d214,W01-BATCH-007,
PMID:41623291,2bc7aeb4687ba3c76a157d0b118aa036f544522a53acd67b2cdb8bb84f1dc65c,exclude,,X_DESCRIPTIVE_ONLY,"This interrupted time-series analysis evaluates dialysis modality transitions during COVID-19 rather than infectious-disease prevention, treatment, or surveillance.",codex-semantic-primary-007,W01-BATCH-007,
PMID:41651232,9e37642400247378c8e93dd8780b8c13415495f429699a76ad957aed8705bec7,exclude,,X_DESCRIPTIVE_ONLY,This interrupted time-series study describes suicide trends during COVID-19 but does not evaluate an infectious-disease intervention or transferable infectious method.,codex-semantic-primary-007,W01-BATCH-007,
PMID:41656899,fcb2fdad71def32671a3c878abc20bcb73b84e5918a7ab3b2f47f117e775e320,include_applied_seed,applied_seed,I_APPLIED_TRANSFERABLE_DESIGN,This study applies interrupted time series to antimicrobial procurement and prescribing outcomes.,codex-cli-task5-fix3-reader-a-019f8286-80cf-7540-ac77-4730cac6d214,W01-BATCH-007,
PMID:41666099,c8b78e60ca46f63dafcf145fd6460d108a88ecaef250316d01cab333e712ec37,include_diagnostic_or_correction_lead,correction,I_DIAGNOSTIC_CORRECTION,This published erratum supplies bibliographic correction information for a causal vaccination study.,codex-cli-task5-fix3-reader-a-019f8286-80cf-7540-ac77-4730cac6d214,W01-BATCH-007,
PMID:41677089,5d77aced94c6f5ae3742ff5b1991f47d352c0d722bd6d1ecc91deb32e639cda7,exclude,,X_DESCRIPTIVE_ONLY,This interrupted time-series analysis describes post-stroke antithrombotic use during COVID-19 without evaluating infectious disease control or treatment.,codex-semantic-primary-007,W01-BATCH-007,
PMID:41700712,e8009ade3564be23f015aff5d3a7f5da39f9e1eb84f392adedcf015a2ba31fbf,exclude,,X_NOT_INFECTIOUS_TRANSFERABLE,This bladder-cancer microbiome workflow provides no explicit infectious-disease epidemiological transfer route.,codex-cli-task5-fix3-reader-a-019f8286-80cf-7540-ac77-4730cac6d214,W01-BATCH-007,
PMID:41700716,3507a98e1d3655cd98afc88d70401fc16643f3c8dfca731b82fef90e47440107,include_applied_seed,applied_seed,I_APPLIED_TRANSFERABLE_DESIGN,This study applies interrupted time series to pandemic-related changes in antimicrobial resistance.,codex-cli-task5-fix3-reader-a-019f8286-80cf-7540-ac77-4730cac6d214,W01-BATCH-007,
PMID:41712213,b426038ca2541df8052b60fae0d9de8fa10d0b1509f9a7d74f1d3ca15431446b,include_diagnostic_or_correction_lead,guidance,I_DIAGNOSTIC_CORRECTION,The study diagnoses target-trial implementation problems and provides structured methodological guidance.,codex-cli-task5-fix3-blind-019f82aa-9dd0-7900-aef5-9f2241e44ab6,W01-BATCH-007,
PMID:41715165,241533031b5f0a8952997575722141b67c330b3dd94ddab131e003e549447222,include_applied_seed,applied_seed,I_APPLIED_TRANSFERABLE_DESIGN,This study applies regression discontinuity to estimate guideline effects among women stratified by HIV status.,codex-cli-task5-fix3-reader-a-019f8286-80cf-7540-ac77-4730cac6d214,W01-BATCH-007,
PMID:41718663,2c6cc8da4c4260aa3596722ad58b9ea11db7234783a6277a14a307382bae1714,include_applied_seed,applied_seed,I_APPLIED_TRANSFERABLE_DESIGN,This matched cohort study uses negative-control outcomes to assess bias in postinfection risk estimates.,codex-cli-task5-fix3-reader-a-019f8286-80cf-7540-ac77-4730cac6d214,W01-BATCH-007,
PMID:41722654,9f7d8665c84a9fdf316baa83435865f8ed6a0696d6d0029512132c04b39235f5,include_applied_seed,applied_seed,I_APPLIED_TRANSFERABLE_DESIGN,"This study applies interrupted time series to antimicrobial guidelines, prescribing, infections, and costs.",codex-cli-task5-fix3-reader-a-019f8286-80cf-7540-ac77-4730cac6d214,W01-BATCH-007,
PMID:41736010,daa44b79f6dfd7c1df040d58fa873b8d0dc035fba3024ac4eb31a4a952353dcf,include_applied_seed,applied_seed,I_APPLIED_TRANSFERABLE_DESIGN,This study applies interrupted time series to respiratory surveillance across pandemic phases.,codex-cli-task5-fix3-reader-a-019f8286-80cf-7540-ac77-4730cac6d214,W01-BATCH-007,
PMID:41755720,d8e87cbafea5b619f42cc6b5beebd415a6bd8455b1d68a60100e22819bfb3744,include_diagnostic_or_correction_lead,guidance,I_DIAGNOSTIC_CORRECTION,The article assesses feasible designs and bias checks for influenza vaccine-effectiveness studies.,codex-cli-task5-fix3-blind-019f82aa-9dd0-7900-aef5-9f2241e44ab6,W01-BATCH-007,
PMID:41774845,e85871bad094edda363070db7ad7fd0396059b5db40993ebbb3a52e7fd2aff1e,exclude,,X_NOT_INFECTIOUS_TRANSFERABLE,This natural experiment estimates wildfire health effects without an explicit infectious-disease methodological transfer route.,codex-cli-task5-fix3-reader-a-019f82a0-b63f-7210-aca7-5caaab2fa450,W01-BATCH-007,
PMID:41775120,6de544763456827e529ec6330e575ef75dabf4c5c388886689a26eb462ae92cc,include_applied_seed,applied_seed,I_APPLIED_TRANSFERABLE_DESIGN,This nationwide target-trial emulation estimates long-term ophthalmic effects associated with herpes zoster vaccination.,codex-cli-task5-fix3-reader-a-019f82a0-b63f-7210-aca7-5caaab2fa450,W01-BATCH-007,
PMID:41775276,2afb72a236e59532b8e894e94309fb078dc667a5433b0bc600a0658dba331510,exclude,,X_DESCRIPTIVE_ONLY,This interrupted time-series analysis evaluates pandemic effects on emergency-to-ICU access and mortality rather than infectious-disease control outcomes.,codex-semantic-primary-007,W01-BATCH-007,
PMID:41776078,3a7355a63038be62c74c084e84d32626a1f5020cc1c62d28eb6b0c36c7d7f37f,include_applied_seed,applied_seed,I_APPLIED_TRANSFERABLE_DESIGN,This study constructs a governance index and applies quasi-experimental analyses to multinational antimicrobial-resistance outcomes.,codex-cli-task5-fix3-reader-a-019f82a0-b63f-7210-aca7-5caaab2fa450,W01-BATCH-007,
PMID:41787927,9828c0d96c419c8346f59c4474d51e3ed7120e0f0d98165e4cb356769b650911,include_applied_seed,applied_seed,I_APPLIED_TRANSFERABLE_DESIGN,This study emulates initiation and sequential trials to compare cardiovascular risks of HIV treatment regimens.,codex-cli-task5-fix3-reader-a-019f82a0-b63f-7210-aca7-5caaab2fa450,W01-BATCH-007,
PMID:41788029,931d3783b0592628226ef2ea55dc9f247fe1893fd22c96179093cfc84d1b5cdc,include_applied_seed,applied_seed,I_APPLIED_TRANSFERABLE_DESIGN,This population-based case-control study uses target-trial emulation to estimate two-season nirsevimab effectiveness.,codex-cli-task5-fix3-reader-a-019f82a0-b63f-7210-aca7-5caaab2fa450,W01-BATCH-007,
PMID:41807002,535d51dcb765f4673634731d6ed7fe8b552c568769df82ad8eeed39027ffe37d,include_applied_seed,applied_seed,I_APPLIED_TRANSFERABLE_DESIGN,This multinational regression-discontinuity study estimates pandemic effects on HIV treatment access and timely initiation.,codex-cli-task5-fix3-reader-a-019f82a0-b63f-7210-aca7-5caaab2fa450,W01-BATCH-007,
PMID:41816940,b6bed63d807ec1959e79e11900b4c44067ddbe2d0d15f187865d23428a88abb4,include_applied_seed,applied_seed,I_APPLIED_TRANSFERABLE_DESIGN,This interrupted time-series study evaluates population trends in pneumococcal disease following policy and pandemic changes.,codex-cli-task5-fix3-reader-a-019f82a0-b63f-7210-aca7-5caaab2fa450,W01-BATCH-007,
PMID:41819297,369228d92a9cd6eb2b3e94a0a969a2190c0a9a5683c4aba74831e2a092d0e8b5,include_applied_seed,applied_seed,I_APPLIED_TRANSFERABLE_DESIGN,This target-trial emulation estimates comparative cardiometabolic effects of initiating alternative HIV treatment regimens.,codex-cli-task5-fix3-reader-a-019f82a0-b63f-7210-aca7-5caaab2fa450,W01-BATCH-007,
PMID:41845376,3a370d458a811dbef303ec4e150fd96ea2b5c4b5a2cad15e3aacfdb5e5fe0313,include_applied_seed,applied_seed,I_APPLIED_TRANSFERABLE_DESIGN,"This target-trial emulation uses cloning, censoring, and weighting to estimate post-COVID antiviral effects.",codex-cli-task5-fix3-reader-a-019f82a0-b63f-7210-aca7-5caaab2fa450,W01-BATCH-007,
PMID:41850617,40d4ffe016cc83faabba0416e2c4941cee477af0f2c5eab889fd60b11f20ea5a,include_applied_seed,applied_seed,I_APPLIED_TRANSFERABLE_DESIGN,This multicenter target-trial emulation compares treatment strategies for Enterococcus faecalis bloodstream infection.,codex-cli-task5-fix3-reader-a-019f82a0-b63f-7210-aca7-5caaab2fa450,W01-BATCH-007,
PMID:41911278,8b41a4dd6b73d2fcc77fe8d547a1012da1141f81fbd17f10e09ab16e57ee167d,include_simulation_or_mechanistic_lead,method_source,I_SIMULATION_MECHANISTIC,This study defines a vaccine-effectiveness estimand and evaluates new nonmatching estimators through simulations and application.,codex-cli-task5-fix3-reader-a-019f82a0-b63f-7210-aca7-5caaab2fa450,W01-BATCH-007,
PMID:41911941,02cddf59c76ef9b4888c7ab1e540c7cad2c9b7f9c81baf55e1232258057259e7,include_applied_seed,applied_seed,I_APPLIED_TRANSFERABLE_DESIGN,This sequential target-trial emulation estimates cardiometabolic risks after switching HIV treatment regimens.,codex-cli-task5-fix3-reader-a-019f82a0-b63f-7210-aca7-5caaab2fa450,W01-BATCH-007,
PMID:41919659,d2e304a643c2762a7b6a56d346c68581cb29ad963498e64e8fef37d4408b3e68,include_applied_seed,applied_seed,I_APPLIED_TRANSFERABLE_DESIGN,This interrupted time-series study evaluates active surveillance and cohorting effects on hospital-acquired resistant infections.,codex-cli-task5-fix3-reader-a-019f82a0-b63f-7210-aca7-5caaab2fa450,W01-BATCH-007,
PMID:41946553,dcf64836af41cf59f79cc934556350545ecf144e7eacb9f96f1b6efe774c7f96,include_applied_seed,applied_seed,I_APPLIED_TRANSFERABLE_DESIGN,This interrupted time-series study estimates antimicrobial-stewardship effects on prescribing and postoperative infection outcomes.,codex-cli-task5-fix3-reader-a-019f82a0-b63f-7210-aca7-5caaab2fa450,W01-BATCH-007,
PMID:41958561,f5cf4fd67e26e4f46625006960f3d7fb662fe27b7bbca5249d0b78daedf13d5b,include_applied_seed,applied_seed,I_APPLIED_TRANSFERABLE_DESIGN,An interrupted time-series design evaluates an ICU infection-prevention nursing intervention.,codex-cli-task5-fix3-reader-a-019f8287-5f58-7aa3-9714-5327ad484a57,W01-BATCH-007,
PMID:41965975,dc064c46ad2ff03091d738df5d0ab4a8a5f8eda8c5c7b5d485118145d45df600,include_applied_seed,applied_seed,I_APPLIED_TRANSFERABLE_DESIGN,A regression-discontinuity design estimates how pre-booked appointments affect vaccination uptake.,codex-cli-task5-fix3-reader-a-019f8287-5f58-7aa3-9714-5327ad484a57,W01-BATCH-007,
PMID:41969243,7805b4988cbc92402c2e7e771fb923fdfc0e5c660edcc64741901c378615b29f,exclude,,X_NOT_INFECTIOUS_TRANSFERABLE,This target-trial emulation addresses noninfectious diabetic cardiorenal treatment outcomes without an explicit infectious-disease transfer route.,codex-cli-task5-fix3-reader-a-019f8287-5f58-7aa3-9714-5327ad484a57,W01-BATCH-007,
PMID:41974005,90c27318d5546cbabc0b8cee0a12ee9414ee0941df7f070cef1d02b0429e5ca8,include_applied_seed,applied_seed,I_APPLIED_TRANSFERABLE_DESIGN,A multicenter target-trial emulation compares antibiotic durations for community-acquired pneumonia.,codex-cli-task5-fix3-reader-a-019f8287-5f58-7aa3-9714-5327ad484a57,W01-BATCH-007,
PMID:41986971,b8f5401b6025e4f51c1aea1d15ae5221dcce67496516e84868bb22a729c5326b,include_applied_seed,applied_seed,I_APPLIED_TRANSFERABLE_DESIGN,Segmented interrupted time-series regression estimates pandemic-associated changes in candidemia trends.,codex-cli-task5-fix3-reader-a-019f8287-5f58-7aa3-9714-5327ad484a57,W01-BATCH-007,
PMID:41990555,c6a0b86fd456ff3695fd1c02551fe9ca8db2f6ace920dffbb6626546076e4c98,exclude,,X_NOT_INFECTIOUS_TRANSFERABLE,This noninfectious neuromyelitis treatment study lacks an explicit transferable infectious-disease application.,codex-cli-task5-fix3-reader-a-019f8287-5f58-7aa3-9714-5327ad484a57,W01-BATCH-007,
