candidate_key,source_row_sha256,primary_decision,primary_proposed_record_type,primary_reason_code,primary_reason,primary_reviewer,batch_id,retained_candidate_key
PMID:30976806,a03dc210abbaff468ce4d88f01d2443633d78085583736bd5a7a43a247eb7085,include_method_source_lead,method_source,I_METHOD_SOURCE,This article explains regression-discontinuity designs and develops their application to observational vaccine-effect evaluation.,codex-cli-task5-scope-reader-a-019f81bd-c390-75e3-b2d3-9b8539858011,W01-BATCH-002,
PMID:30993854,187ab3d57eb6be41a6f8fc8203975ea1e84ce7e8c1b6fa8117f8a88155e68eb0,include_applied_seed,applied_seed,I_APPLIED_TRANSFERABLE_DESIGN,This study applies interrupted time-series analysis to evaluate Rwanda's Treat All HIV policy.,codex-semantic-primary-B2,W01-BATCH-002,
PMID:31040249,5d466c92c337de9ed6764b6db0733e4c2747545e109a7637d6a61961eab585a1,include_applied_seed,applied_seed,I_APPLIED_TRANSFERABLE_DESIGN,"This study links media coverage, search data, and surveillance outcomes through interrupted time-series analysis during a gonorrhoea outbreak.",codex-semantic-primary-B2,W01-BATCH-002,
PMID:31051323,9b0eb80d8ca3ef4ea3bff6a2a6f05f98426256b1010b6450fa1baaee7df6c5b0,include_applied_seed,applied_seed,I_APPLIED_TRANSFERABLE_DESIGN,"This study combines city-level interrupted time series, meta-analysis, and meta-regression to estimate flood-related diarrhoea risk.",codex-semantic-primary-B2,W01-BATCH-002,
PMID:31063192,47a0a80a647ed41c076b7db81c467cf0d37dc1d295a7efb313cb3ed0413a25e8,include_method_source_lead,method_source,I_METHOD_SOURCE,This article proposes and illustrates a protocol and analysis harmonization procedure for comparing randomized and observational HIV treatment effects.,codex-semantic-primary-B2,W01-BATCH-002,
PMID:31124428,84604772e1323db64d00f15f28b74dcdb00ca0bfa9cab15093b2fa5d95d3c7e5,include_applied_seed,applied_seed,I_APPLIED_TRANSFERABLE_DESIGN,This controlled interrupted time-series evaluation estimates the effect of a regional multifacility CDI prevention collaborative.,codex-semantic-primary-B2,W01-BATCH-002,
PMID:31147680,f32fe51e1bd3f6325190fe434f9909cd9b399f8735051ad44702c45b879123cd,include_applied_seed,applied_seed,I_APPLIED_TRANSFERABLE_DESIGN,This study uses interrupted time-series regression of claims data to evaluate varicella vaccination policy and herpes zoster incidence.,codex-semantic-primary-B2,W01-BATCH-002,
PMID:31173597,b0001cb7906c59808f10dc94ede183f2b3acb91ce97e544ff0b2f480a0c38f6a,include_applied_seed,applied_seed,I_APPLIED_TRANSFERABLE_DESIGN,This population-based interrupted time-series study evaluates an antimicrobial stewardship intervention using prescribing and resistant bacteraemia outcomes.,codex-semantic-primary-B2,W01-BATCH-002,
PMID:31177269,2ab3af5e5c80679889a9218b234132110786aad7af029a266126003b9745ee28,include_applied_seed,applied_seed,I_APPLIED_TRANSFERABLE_DESIGN,This interrupted time-series evaluation assesses a quality-reporting policy using surgical infection and readmission outcomes.,codex-semantic-primary-B2,W01-BATCH-002,
PMID:31181056,de3c90ab1ed2db9c40a9ad964c83f68e43224ab1d686a879e0f770eafd9aec85,include_applied_seed,applied_seed,I_APPLIED_TRANSFERABLE_DESIGN,This multicountry regression discontinuity analysis estimates the impact of Treat All adoption on rapid ART initiation.,codex-semantic-primary-B2,W01-BATCH-002,
PMID:31185011,7efe92322ec0a2445a57fd2846336ad9c0c8369f132d3694ab0d78e20c46475b,include_method_source_lead,method_source,I_METHOD_SOURCE,This systematic review and evidence map synthesizes evaluated government policies to reduce human antimicrobial use and their study designs.,codex-semantic-primary-B2,W01-BATCH-002,
PMID:31200889,95be35c2a1adc29522f3933352e7173304158e3aed7ec39d28e8f7b149c309d1,include_applied_seed,applied_seed,I_APPLIED_TRANSFERABLE_DESIGN,This multicountry surveillance analysis evaluates rotavirus vaccine introduction using pre-post comparisons and interrupted time series.,codex-semantic-primary-B2,W01-BATCH-002,
PMID:31220872,6b85a94cca1906cdf205ed44fe084451c59e1fe43019a6284823581c97ae8ed5,include_applied_seed,applied_seed,I_APPLIED_TRANSFERABLE_DESIGN,This sharp regression discontinuity study evaluates social-norm feedback sent to high antibiotic-prescribing practices.,codex-semantic-primary-B2,W01-BATCH-002,
PMID:31251948,29fd888707ab0815964a5162719067dc7e4e4245a1d956e52c5e40fc6b533f34,uncertain_retrieve_primary,,U_PRIMARY_RECORD_NEEDED,"The title identifies an interrupted time-series infection-control evaluation, but the supplied record has no abstract or methods sufficient to assess it responsibly.",codex-semantic-primary-B2,W01-BATCH-002,
PMID:31284300,f7d1c47fed92d9310478e73677fdb8fc29686cfbb235d38ff0f1d07971ca6164,include_applied_seed,applied_seed,I_APPLIED_TRANSFERABLE_DESIGN,This study applies interrupted time series and ecological correlations to assess associations between PrEP implementation and STI rates.,codex-semantic-primary-B2,W01-BATCH-002,
PMID:31299411,232a960cd9ac81dfa24e4850ba297e7df0b4382cae2169c680babc0c6ef084d5,include_applied_seed,applied_seed,I_APPLIED_TRANSFERABLE_DESIGN,This nine-year quasi-experimental interrupted time-series study evaluates an oncology antimicrobial stewardship program.,codex-semantic-primary-B2,W01-BATCH-002,
PMID:31310298,240a6675a4c732e498a47dedf4683338e0acf1e2f3134145743c83570b7915e0,include_applied_seed,applied_seed,I_APPLIED_TRANSFERABLE_DESIGN,This comparative interrupted time-series study evaluates mandated sepsis protocols against control states.,codex-semantic-primary-B2,W01-BATCH-002,
PMID:31335865,fda9038c92dfac449908545479785f86b339d5395793e71ecd82115f7c6edf91,include_applied_seed,applied_seed,I_APPLIED_TRANSFERABLE_DESIGN,This cluster-randomized evaluation uses difference-in-differences to assess differentiated HIV ART delivery models.,codex-semantic-primary-B2,W01-BATCH-002,
PMID:31362914,89ae2b4d0efe89173f308bc73a595d941dfce01dff0a93d76c6bef7c7a0c78a4,include_applied_seed,applied_seed,I_APPLIED_TRANSFERABLE_DESIGN,This staggered-policy difference-in-differences analysis estimates voluntary licensing effects on hepatitis C treatment uptake.,codex-semantic-primary-B2,W01-BATCH-002,
PMID:31375116,d0c9ca89805a088ff5fb615ed70eb9eeb43344d9818221c97d0cd8fa7c0e072e,include_applied_seed,applied_seed,I_APPLIED_TRANSFERABLE_DESIGN,This study demonstrates synthetic control analysis for estimating treaty-adoption effects on vaccination and child mortality.,codex-semantic-primary-B2,W01-BATCH-002,
PMID:31504327,30aefa5c55c63a63f7f6ab4c54830464c610cce3143e5d91bd99f58f9622da5d,include_applied_seed,applied_seed,I_APPLIED_TRANSFERABLE_DESIGN,This natural-experiment difference-in-differences study evaluates removing hepatitis C treatment restrictions among people with HIV.,codex-semantic-primary-B2,W01-BATCH-002,
PMID:31504341,55c7ef1198087c8ed6ef07729e4beac0839e09f1a12ad8dc1aaee29b45fc6ac2,include_applied_seed,applied_seed,I_APPLIED_TRANSFERABLE_DESIGN,The controlled cohort evaluates an infection-prevention intervention using adjusted hazards and a negative-control outcome.,codex-cli-task5-scope-reader-a-019f81bd-c369-7452-b69a-dc72027333da,W01-BATCH-002,
PMID:31522849,fa313735140af4b84cd7c113a908c31638cdbab67b517c5514232da6de01eec5,exclude,,X_NOT_INFECTIOUS_TRANSFERABLE,This randomized trial evaluates oral immunotherapy for peanut allergy rather than an infectious-disease epidemiology design.,codex-semantic-primary-B2,W01-BATCH-002,
PMID:31539423,cbc9ab9a7f301c2793baa1e8da957ff60b4d1592ab96509e92a09f349d14b64b,include_applied_seed,applied_seed,I_APPLIED_TRANSFERABLE_DESIGN,The national regression-discontinuity design estimates the causal effect of repeated prescribing feedback.,codex-cli-task5-scope-reader-a-019f81bd-c369-7452-b69a-dc72027333da,W01-BATCH-002,
PMID:31544211,d988cd426b1c917cfcc432aa676c982f77e15159e2b0a1645512494f48c79c58,include_applied_seed,applied_seed,I_APPLIED_TRANSFERABLE_DESIGN,This controlled interrupted time-series analysis estimates rotavirus vaccine impact while adjusting for a control series and health-worker strikes.,codex-semantic-primary-B2,W01-BATCH-002,
PMID:31545803,1290347cd87f0fec2bc0a579e4a07f6bbaa988273261f81d804dba738569c50c,include_diagnostic_or_correction_lead,diagnostic,I_DIAGNOSTIC_CORRECTION,This interrupted time-series analysis uses related and unrelated congenital-anomaly outcomes to distinguish Zika effects from improved registration.,codex-semantic-primary-B2,W01-BATCH-002,
PMID:31585252,c98be6250ffa584fa165d98e8c7b70e09cc1c7d4ce23104e11e5963b209fefc2,include_applied_seed,applied_seed,I_APPLIED_TRANSFERABLE_DESIGN,This veterinary study applies a two-stage hierarchical interrupted time-series model to quantify bacterial kidney disease effects.,codex-semantic-primary-B2,W01-BATCH-002,
PMID:31610933,ff598ae9022b0345757fac952c0c0f138824c1bf797502a3144ba49ed1c1bef4,include_applied_seed,applied_seed,I_APPLIED_TRANSFERABLE_DESIGN,This national interrupted time-series analysis evaluates clinical guideline effects on pediatric antibiotic prescribing composition.,codex-semantic-primary-B2,W01-BATCH-002,
PMID:31616576,1d7af7b12b35d9ba9467d36a332a06f529844d5ae588c8510462cd0e229008c3,exclude,,X_DESCRIPTIVE_ONLY,This cross-sectional symptom comparison uses ordinary adjusted regression without a transferable epidemiologic design contribution.,codex-semantic-primary-B2,W01-BATCH-002,
PMID:31658203,62f9ee8dc2da1a8044c31a3679b667751cfab3605aeb03401055364af7cde28a,include_applied_seed,applied_seed,I_APPLIED_TRANSFERABLE_DESIGN,This study combines counterfactual ARIMA forecasting and interrupted time series to evaluate legalized syringe exchange policies.,codex-semantic-primary-B2,W01-BATCH-002,
PMID:31678230,6375b83ab8cc90a5ea6f0986ba5091f006be62c5c6c0b97267fa70c7882f0b17,include_applied_seed,applied_seed,I_APPLIED_TRANSFERABLE_DESIGN,This prospective interrupted time-series study evaluates audit-and-feedback antimicrobial stewardship in intensive care units.,codex-semantic-primary-B2,W01-BATCH-002,
PMID:31703557,5b73f70ca0815f0e6e189377cc1516e95f95726f9ba707b10a7132e50f2c122e,include_applied_seed,applied_seed,I_APPLIED_TRANSFERABLE_DESIGN,This national interrupted time-series analysis evaluates the raw beef liver ban while adjusting for seasonality and a concurrent regulation.,codex-semantic-primary-B2,W01-BATCH-002,
PMID:31751470,f4b90bce03ed7e24f15e5ef4a9a3bef017f69253c8b767163a81c197e7bc51be,include_applied_seed,applied_seed,I_APPLIED_TRANSFERABLE_DESIGN,This quasi-experimental study combines interrupted time series and community-trend adjustment to evaluate antimicrobial cycling and VRE outcomes.,codex-semantic-primary-B2,W01-BATCH-002,
PMID:31752787,0d6f10f30e41e05137c2d56932f897db3d066347297a4e3f6178b84819ab1017,exclude,,X_NOT_INFECTIOUS_TRANSFERABLE,This difference-in-differences study evaluates a sugary-drink tax and beverage consumption rather than an infectious-disease application.,codex-semantic-primary-B2,W01-BATCH-002,
PMID:31767423,109aa8c438820afade7fc4985a80a97bb9748770ddc15a8767a0ec6d6b2ea256,include_applied_seed,applied_seed,I_APPLIED_TRANSFERABLE_DESIGN,This long-term interrupted time-series study evaluates a primary-care stewardship program using prescribing quality and ESBL infection incidence.,codex-semantic-primary-B2,W01-BATCH-002,
PMID:31813967,c5cb33d0328f46da5502b41554ff45ce663f63fb764ce9cd71de4b76717bed28,include_applied_seed,applied_seed,I_APPLIED_TRANSFERABLE_DESIGN,This 14-year controlled interrupted time-series study evaluates a hospital stewardship program using community-acquired outcomes as controls.,codex-semantic-primary-B2,W01-BATCH-002,
PMID:31835603,6e33851adaf21e897b808eaaa30d7d3651a7dff35682edf5450931d0fe8cf505,include_applied_seed,applied_seed,I_APPLIED_TRANSFERABLE_DESIGN,This segmented Poisson interrupted time-series study evaluates antenatal syphilis point-of-care testing implementation.,codex-semantic-primary-B2,W01-BATCH-002,
PMID:31869328,f0d979ab440370d6137b251019452659a745967f0221214971349180523d17ec,include_applied_seed,applied_seed,I_APPLIED_TRANSFERABLE_DESIGN,This study combines state-level synthetic control and county-level difference-in-differences to evaluate vaccine-exemption policy.,codex-semantic-primary-B2,W01-BATCH-002,
PMID:31940920,2375093ebca470aad55284a143d829527fd7143d63c4671bbe21c728d7db845b,include_applied_seed,applied_seed,I_APPLIED_TRANSFERABLE_DESIGN,This comparative interrupted time-series analysis estimates pathogen-specific enteric infection risks during flooding.,codex-semantic-primary-B2,W01-BATCH-002,
PMID:32046804,8d90c862d1a707b6a3ba7f798c1d1c0ee87bab1e6797be67f31128fbb3b9eea5,include_applied_seed,applied_seed,I_APPLIED_TRANSFERABLE_DESIGN,The interrupted time-series analysis evaluates incidence changes following successive pertussis vaccination schedules.,codex-cli-task5-scope-reader-a-019f81bd-c369-7452-b69a-dc72027333da,W01-BATCH-002,
PMID:32062053,ec6f2b8fe03fd02cc4e76bde7a8a7f32cb17156654c4b0a0618f4fa959afb46d,include_applied_seed,applied_seed,I_APPLIED_TRANSFERABLE_DESIGN,This multilevel interrupted time-series study assesses a staffing directive and healthcare-associated infection rates.,codex-semantic-primary-B2,W01-BATCH-002,
PMID:32070630,084401314461aab16b1f86945bf78e22d13df3cc523460fda897be29bde4d689,include_applied_seed,applied_seed,I_APPLIED_TRANSFERABLE_DESIGN,This interrupted time-series evaluation assesses a quality-control intervention to reduce catheter-associated urinary tract infections.,codex-semantic-primary-B2,W01-BATCH-002,
PMID:32093092,4836010e6dcb852094bfc0c80d1a68c761afa58f44d5974a2208a0763e72c448,include_applied_seed,applied_seed,I_APPLIED_TRANSFERABLE_DESIGN,This interrupted time-series study develops notification and test-positivity outcomes to evaluate an alcohol-tax policy's association with chlamydia.,codex-semantic-primary-B2,W01-BATCH-002,
PMID:32111639,40fe00969debe3a7b9d54e60cdaf7348afa8bb19d4f0be5c10f6e1765cef40db,include_applied_seed,applied_seed,I_APPLIED_TRANSFERABLE_DESIGN,This multicountry difference-in-differences analysis estimates paid maternity leave effects on childhood bloody diarrhoea.,codex-semantic-primary-B2,W01-BATCH-002,
PMID:32120383,cc98a095bcdbc1df34bba076a2d51f6c80192578c321f0904affbf58ba5e7edd,include_applied_seed,applied_seed,I_APPLIED_TRANSFERABLE_DESIGN,This regression discontinuity study exploits age-based eligibility to estimate influenza vaccination effects on hospitalization and mortality.,codex-semantic-primary-B2,W01-BATCH-002,
PMID:32146909,8a5d4f3469ca1675ae7a63c5cc3648d615504f0b829267a7fe2fef7f6be0ce5a,uncertain_retrieve_primary,,U_PRIMARY_RECORD_NEEDED,"The title identifies an interrupted time-series evaluation of environmental Fusarium control, but no abstract is supplied to support a responsible judgment.",codex-semantic-primary-B2,W01-BATCH-002,
PMID:32151333,742e512de1237d8041842b7f9319eda92e1a1b63ca73e3c927298bc8c69db6ea,include_applied_seed,applied_seed,I_APPLIED_TRANSFERABLE_DESIGN,This multicentre interrupted time-series study evaluates de-implementation of inappropriate vascular and urinary catheter use.,codex-semantic-primary-B2,W01-BATCH-002,
PMID:32155264,29390d00465798aa9cf25b1a7c73e7f7692cff5a2d9bbe73c96799ed6fab50d0,include_applied_seed,applied_seed,I_APPLIED_TRANSFERABLE_DESIGN,The quasi-experimental study evaluates an antibiotic-allergy decision intervention using weighting and interrupted time series.,codex-cli-task5-scope-reader-a-019f81bd-c369-7452-b69a-dc72027333da,W01-BATCH-002,
PMID:32196748,7044b57253779aa847d4f27861247c3abd8855654e706b3d98182ea1572bab58,exclude,,X_NOT_INFECTIOUS_TRANSFERABLE,This Mendelian randomization application concerns amyotrophic lateral sclerosis and does not supply an infectious-disease transfer route.,codex-semantic-primary-B2,W01-BATCH-002,
PMID:32215253,7f560f4cab447204b4bf3f9a8490f0ca19c7b13d2ed7909756d95a8062aa9c22,exclude,,X_NOT_INFECTIOUS_TRANSFERABLE,This synthetic-biology toolbox develops genome engineering methods for a nonpathogenic industrial bacterium rather than infectious-disease epidemiology.,codex-semantic-primary-B2,W01-BATCH-002,
PMID:32234344,22fe2db77fbddde5b7ae08398eb19588feaa1381f8f929976d908ef380958ba7,include_applied_seed,applied_seed,I_APPLIED_TRANSFERABLE_DESIGN,This interrupted time-series evaluation estimates PCV13 effects on childhood pneumonia admissions using control conditions.,codex-semantic-primary-B2,W01-BATCH-002,
PMID:32294844,7092700033f030f10f949cd8bcb177c4432d54cbccfe0ad8b48dff2a6c36ceb5,include_applied_seed,applied_seed,I_APPLIED_TRANSFERABLE_DESIGN,This national interrupted time-series analysis evaluates China's HIV treatment policy using fatality trends.,codex-semantic-primary-B2,W01-BATCH-002,
PMID:32317012,4da6cdc1f19ae76b3e1f648bf8fe80754d74201d8019590d10d439176fbc79d8,include_applied_seed,applied_seed,I_APPLIED_TRANSFERABLE_DESIGN,This controlled interrupted time-series analysis evaluates a persuasive stewardship intervention implemented during a KPC outbreak.,codex-semantic-primary-B2,W01-BATCH-002,
PMID:32329153,39b3ebbfa88989ef0403bcc7aac21e420b2c901f6dffe99830cdeee803693009,include_applied_seed,applied_seed,I_APPLIED_TRANSFERABLE_DESIGN,This facility-level difference-in-differences evaluation estimates the effects of an HIV stigma-reduction intervention.,codex-semantic-primary-B2,W01-BATCH-002,
PMID:32343766,05a933fa6e60ae0a129f3bc836c00f5f745fb8545bd4136bf82ee425e862d4fd,include_diagnostic_or_correction_lead,guidance,I_DIAGNOSTIC_CORRECTION,This interrupted time-series study evaluates the prescribing impact of revised CDI clinical practice guidelines.,codex-semantic-primary-B2,W01-BATCH-002,
PMID:32364587,0472d79680a9fa2919ae94cbbebfc5ed4fe07e41ef1e19ad14d9356c6e43de6b,include_diagnostic_or_correction_lead,guidance,I_DIAGNOSTIC_CORRECTION,This interrupted time-series report evaluates an evidence-based cefazolin allergy-clarification prescribing tool.,codex-semantic-primary-B2,W01-BATCH-002,
PMID:32366658,f0988001e7a9e3dbaa0d864878607eab07788777cad82f9da722d2df9fa05b2b,include_applied_seed,applied_seed,I_APPLIED_TRANSFERABLE_DESIGN,This all-state event study quantifies information-seeking responses to announcements of local COVID-19 cases.,codex-semantic-primary-B2,W01-BATCH-002,
PMID:32423770,dd2a03dbbc516dbb29bfbe912dbea6567341c30262fa8da4bcb0eecad1592d4e,include_applied_seed,applied_seed,I_APPLIED_TRANSFERABLE_DESIGN,This multi-site study develops a spatiotemporal autocorrelated model to evaluate China's measles elimination action.,codex-semantic-primary-B2,W01-BATCH-002,
PMID:32433015,b506db991a94d6dd081e6aa61e7d9a4b1454194b334127ff672edad1ee560d67,include_diagnostic_or_correction_lead,diagnostic,I_DIAGNOSTIC_CORRECTION,The report identifies reagent contamination affecting molecular diagnostic reliability and deployment.,codex-cli-task5-blind-adjudicator-019f81f1-054e-7370-a58d-73039f4fdb3f,W01-BATCH-002,
PMID:32460892,d25a350abdf0f2dba3f4cc23373bc86abaf9e2e5b32c0df8d21134d523896a85,include_applied_seed,applied_seed,I_APPLIED_TRANSFERABLE_DESIGN,This interrupted time-series study evaluates a long-term WHO multimodal hand-hygiene implementation using process measures.,codex-semantic-primary-B2,W01-BATCH-002,
PMID:32463375,d7cdac2da19b073572f09207f275e32b27b9104b1289e8c938ff41e38f2f177d,exclude,,X_NOT_INFECTIOUS_TRANSFERABLE,This interrupted time-series study evaluates smoking-cessation app uptake rather than an infectious-disease outcome or intervention.,codex-semantic-primary-B2,W01-BATCH-002,
PMID:32493530,39bd9f78ced51dcd207472eba6eae5c214f7580f700e708ab5e131ea2ee7056f,include_diagnostic_or_correction_lead,diagnostic,I_DIAGNOSTIC_CORRECTION,This interrupted time-series study distinguishes infection-control effects from diagnostic stewardship effects on reported hospital-onset CDI.,codex-semantic-primary-B2,W01-BATCH-002,
PMID:32502123,58ff59e1512385a0a181a91af3ce1cf99c5aa76f43daa4ae044435dfc2555b27,include_applied_seed,applied_seed,I_APPLIED_TRANSFERABLE_DESIGN,The study combines difference-in-differences and causal mediation to evaluate an antibiotic-prescribing policy.,codex-cli-task5-scope-reader-a-019f81bd-c369-7452-b69a-dc72027333da,W01-BATCH-002,
PMID:32525220,de24fc4e59ffc64546f62061da5ce3e33c486e570d0251fa0589fa4055f44a3b,exclude,,X_NOT_INFECTIOUS_TRANSFERABLE,This basic immunology study investigates intracellular T-cell signaling rather than an infectious-disease epidemiology method or application.,codex-semantic-primary-B2,W01-BATCH-002,
PMID:32529592,eb7989b61f9360f97b65efd966a16ba878314f5d26e22c100af9cc7ba7204d3c,include_applied_seed,applied_seed,I_APPLIED_TRANSFERABLE_DESIGN,This cross-country interrupted time-series analysis estimates associations between mobility-based distancing and COVID-19 epidemic changepoints.,codex-semantic-primary-B2,W01-BATCH-002,
PMID:32534628,31dde730383f7601ce439a47a12739457f79f23dfe13907645a28d70b4244aeb,exclude,,X_DESCRIPTIVE_ONLY,The phase-one trial evaluates vaccine safety and immunogenicity without a transferable epidemiological method contribution.,codex-cli-task5-scope-reader-a-019f81bd-c369-7452-b69a-dc72027333da,W01-BATCH-002,
PMID:32537883,04b2f5fef8d2520585d6dac9040ba205808e1b243db6677c71d98296477851ef,include_method_source_lead,method_source,I_METHOD_SOURCE,This study evaluates negative-control outcomes as a validity check for residual confounding in comparative effectiveness research.,codex-semantic-primary-B2,W01-BATCH-002,
PMID:32576459,0e0d10448cc701a3160b3f1c0fbcb5b02cd6d4a58379ded3fcf31d0d05343b48,include_applied_seed,applied_seed,I_APPLIED_TRANSFERABLE_DESIGN,This influenza vaccine economic evaluation applies instrumental-variable methods to address treatment-selection bias.,codex-semantic-primary-B2,W01-BATCH-002,
PMID:32634537,8c2a34aa48b779063d9c90b0191ec478af2ef64b030edd104090ac254cfead87,include_applied_seed,applied_seed,I_APPLIED_TRANSFERABLE_DESIGN,This multicentre interrupted time-series study evaluates discontinuing contact precautions while measuring healthcare-associated infections.,codex-semantic-primary-B2,W01-BATCH-002,
PMID:32634831,b1297eb3a39a8fc29839c5913156eca0275cc85ef4e7cd018772ba18a54cd2b5,include_applied_seed,applied_seed,I_APPLIED_TRANSFERABLE_DESIGN,This seasonally adjusted interrupted time-series study evaluates Hib and PCV13 introduction using childhood pneumonia hospitalizations and deaths.,codex-semantic-primary-B2,W01-BATCH-002,
PMID:32648891,84ed061c9dfd68918a1797ca6c45a9af0cab699b38eebf353ec8942110ef4ca8,include_simulation_or_mechanistic_lead,method_source,I_SIMULATION_MECHANISTIC,This simulated-outbreak study compares stepped-wedge trial designs and analysis methods for infectious-disease interventions.,codex-semantic-primary-B2,W01-BATCH-002,
PMID:32648905,c30fee4deb2c7b16950b02b7d3f77177a4302b912b8cca176d048524840b5b6d,include_applied_seed,applied_seed,I_APPLIED_TRANSFERABLE_DESIGN,This national-cohort regression discontinuity study estimates viral-load monitoring guideline effects on HIV retention and suppression.,codex-semantic-primary-B2,W01-BATCH-002,
PMID:32669358,2c84966b69de9508127ceadd73c8096d982aa2ad6f626abec471b6ce1994e562,include_applied_seed,applied_seed,I_APPLIED_TRANSFERABLE_DESIGN,This multicountry natural experiment synthesizes interrupted time-series estimates of physical-distancing interventions on COVID-19 incidence.,codex-semantic-primary-B2,W01-BATCH-002,
PMID:32676643,9ac1bdccac959b0c5aaaa99f0b8ce6a8888820407edb513dec03ac6f743b0420,include_diagnostic_or_correction_lead,guidance,I_DIAGNOSTIC_CORRECTION,This commentary substantively explains causal-question formulation and quasi-experimental design challenges for air pollution and COVID-19 research.,codex-semantic-primary-B2,W01-BATCH-002,
PMID:32702302,09eb9a324bc6607dac8ce26c76934757c545762522da0297ad6f53bfe40deb2b,include_applied_seed,applied_seed,I_APPLIED_TRANSFERABLE_DESIGN,This national surveillance interrupted time-series analysis estimates PCV effects while characterizing serotype replacement.,codex-semantic-primary-B2,W01-BATCH-002,
PMID:32718948,75c5a071932f8239211cc17af0eeeb61df967cc781df853111be04485edee91b,include_applied_seed,applied_seed,I_APPLIED_TRANSFERABLE_DESIGN,This controlled interrupted time-series study evaluates a free-care policy during an Ebola outbreak using multiple service outcomes.,codex-semantic-primary-B2,W01-BATCH-002,
PMID:32727905,b8738e1b4b50e246413e692a590ce910914f71e73ca9133c26009beae296354f,include_applied_seed,applied_seed,I_APPLIED_TRANSFERABLE_DESIGN,This mobility-data event study estimates income-stratified social-distancing responses to COVID-19 emergency declarations.,codex-semantic-primary-B2,W01-BATCH-002,
PMID:32731112,067eb68f408d7de0834d90c73ba384fffa3d992e0a719c16c180e921a9beb79d,include_diagnostic_or_correction_lead,diagnostic,I_DIAGNOSTIC_CORRECTION,This interrupted time-series study evaluates opt-out bundled HIV and HCV testing at a syringe services program.,codex-semantic-primary-B2,W01-BATCH-002,
PMID:32756893,ead48d78294273e285c643b2c2111244dccbca37eb46d9bf57d80e13b1fdaade,include_applied_seed,applied_seed,I_APPLIED_TRANSFERABLE_DESIGN,This event study estimates changes in COVID-19 case growth after large protest events in selected cities.,codex-semantic-primary-B2,W01-BATCH-002,
PMID:32764758,8e4abd5a4fad56f09982d398930b15871b574ee09300d4a82a5817c370db6198,include_applied_seed,applied_seed,I_APPLIED_TRANSFERABLE_DESIGN,This population-based interrupted time-series study estimates cases averted by earlier dengue response activation and assesses vector-density mediation.,codex-semantic-primary-B2,W01-BATCH-002,
PMID:32810149,7f6fafe145cb0c25102c073178f108b25afbe86a207fe0169fcffb892381fa38,include_applied_seed,applied_seed,I_APPLIED_TRANSFERABLE_DESIGN,This matched-cohort study uses difference-in-differences to evaluate school-located influenza vaccination and indirect effects.,codex-semantic-primary-B2,W01-BATCH-002,
