candidate_key,source_row_sha256,primary_decision,primary_proposed_record_type,primary_reason_code,primary_reason,primary_reviewer,batch_id,retained_candidate_key
PMID:35725614,ce4a6ae9e8b1426c68faf7f94f15471ac9a3bb1aee547b1d7b11269db08d3bc2,include_applied_seed,applied_seed,I_APPLIED_TRANSFERABLE_DESIGN,This study applies a structured benchmarking design to evaluate emergency clinical-trial oversight capacity before and after technical assistance.,codex-cli-task5-fix3-reader-a-019f8279-1697-7933-a4bc-cf88c2651291,W01-BATCH-044,
PMID:35737945,26d4ed8b7518a44b09959c08d95dbbc690d4650a53ce16d0c6fdfd8b8fca6c0b,exclude,,X_DESCRIPTIVE_ONLY,"The study describes patient, regional, and hospital variation in empiric antibiotic prescribing using conventional regression without identifying a reusable methodological contribution.",codex-sol-high-primary-044-3x50,W01-BATCH-044,
PMID:35750893,56ac2f24cdf0183ce544ef730e141e59e807eec132950b61c2f35e69da4b42d5,exclude,,X_DESCRIPTIVE_ONLY,This molecular-dynamics study supports development of a peptide-functionalized laboratory biosensor without an eligible epidemiological method or application.,codex-cli-task5-fix3-reader-a-019f8279-1697-7933-a4bc-cf88c2651291,W01-BATCH-044,
PMID:35759429,a3e281a75894f0325ba011726633bfaa0d4bd7c753549ee56525b3705ade2a10,include_diagnostic_or_correction_lead,reproducibility,I_DIAGNOSTIC_CORRECTION,This study reproducibly benchmarks eight genome assemblers across multiple viral sequencing datasets and performance metrics.,codex-cli-task5-fix3-reader-a-019f8279-1697-7933-a4bc-cf88c2651291,W01-BATCH-044,
PMID:35766331,2808da504c61cf9c07bcf5d6dfbcdf637b820df119e34782c190de7ee7a5759c,exclude,,X_NOT_INFECTIOUS_TRANSFERABLE,This quantum-chemistry benchmark estimates molecular binding energies and offers no explicit transferable infectious-disease epidemiological route.,codex-cli-task5-fix3-reader-a-019f8279-1697-7933-a4bc-cf88c2651291,W01-BATCH-044,
PMID:35775610,be8e0d8242124a44f2458257b3de140a97d93e4fa314207b30fcbacfa11e504a,include_simulation_or_mechanistic_lead,method_source,I_SIMULATION_MECHANISTIC,This study develops a large-scale epidemic agent-based simulator and reinforcement-learning decision rule for pandemic control policies.,codex-cli-task5-fix3-reader-a-019f8279-1697-7933-a4bc-cf88c2651291,W01-BATCH-044,
PMID:35783149,422b3013692b497e7020dcee50f56c8f380c9a5208b175f9ed1712d7ac74a6be,exclude,,X_DESCRIPTIVE_ONLY,This study provides a social-media sentiment dataset and classification exercise without a transferable infectious-disease epidemiological contribution.,codex-cli-task5-fix3-reader-a-019f8279-1697-7933-a4bc-cf88c2651291,W01-BATCH-044,
PMID:35784212,e3c0832149bc7335b6b918d7ee8ab159c5472d442bb9d8dd1388862fa6373ecc,include_simulation_or_mechanistic_lead,applied_seed,I_SIMULATION_MECHANISTIC,This study applies SEIR and agent-based models to evaluate multiscale interventions during a documented COVID-19 outbreak.,codex-cli-task5-fix3-reader-a-019f8279-1697-7933-a4bc-cf88c2651291,W01-BATCH-044,
PMID:35793754,ac03018ac169536fdb308c9fa09039ccfeb9a1026dcb4ed0a76a39f099f62d32,include_simulation_or_mechanistic_lead,applied_seed,I_SIMULATION_MECHANISTIC,This study applies a three-dimensional agent-based transmission model to evaluate Omicron interventions in hyperdense Hong Kong.,codex-cli-task5-fix3-reader-a-019f8279-1697-7933-a4bc-cf88c2651291,W01-BATCH-044,
PMID:35821794,194d3338f45b3438785f471d4e59410d6ac1dca89216cba456e4fa09dea7ca64,exclude,,X_NOT_INFECTIOUS_TRANSFERABLE,This review concerns agent-based modeling of community violence and mentions infectious-disease control only as an analogy without specifying a concrete transfer back to infectious-disease research.,codex-sol-high-primary-044-3x50,W01-BATCH-044,
PMID:35837574,86410785d7afb00c9d0ca69384f205cb1a50363de9309fbda162c354eddfe2b0,include_simulation_or_mechanistic_lead,method_source,I_SIMULATION_MECHANISTIC,This study develops a configurable agent-based digital twin for comparing localized pandemic interventions and their trade-offs.,codex-cli-task5-fix3-reader-a-019f8279-1697-7933-a4bc-cf88c2651291,W01-BATCH-044,
PMID:35847383,9f10cc08fe9776ff5679cb23712d84173cb0f5e14ebee3835961f4683b0af1f5,include_diagnostic_or_correction_lead,guidance,I_DIAGNOSTIC_CORRECTION,"This article provides concrete guidance for dynamic datasets, metrics, validation, and quality control in AMR pipeline benchmarking.",codex-cli-task5-fix3-reader-a-019f8279-1697-7933-a4bc-cf88c2651291,W01-BATCH-044,
PMID:35849570,bfa8e75167cfabbc74983ed581863a710a45fb1aeafe5be414a17a6e79e28a2a,include_applied_seed,applied_seed,I_APPLIED_TRANSFERABLE_DESIGN,This study applies standardized incidence-prevalence and incidence-mortality metrics to assess heterogeneous HIV epidemic transitions.,codex-cli-task5-fix3-reader-a-019f8279-1697-7933-a4bc-cf88c2651291,W01-BATCH-044,
PMID:35850050,d76062b8c8de7ad963d01befe61dc650b2e86a2d18bfd5718b78b618266d6ee9,exclude,,X_DESCRIPTIVE_ONLY,This molecular-dynamics study examines intracellular cholesterol transport and mutation effects without an eligible epidemiological contribution.,codex-cli-task5-fix3-reader-a-019f8279-1697-7933-a4bc-cf88c2651291,W01-BATCH-044,
PMID:35851600,df14ece6890bac8f798aed3ca86517e61e479fe9c7c8ffa891da734224ddce7a,include_simulation_or_mechanistic_lead,applied_seed,I_SIMULATION_MECHANISTIC,This study applies and validates an agent-based mobility simulation to identify occupation-specific malaria exposure patterns.,codex-cli-task5-fix3-reader-a-019f8279-1697-7933-a4bc-cf88c2651291,W01-BATCH-044,
PMID:35852017,88432e0bd613d3229167b981aea225571891227639422c0b117d5688fe2b9488,include_simulation_or_mechanistic_lead,method_source,I_SIMULATION_MECHANISTIC,"This study evaluates network targeted maximum-likelihood estimation under multiple interference mechanisms, including infection transmission.",codex-cli-task5-fix3-reader-a-019f8279-1697-7933-a4bc-cf88c2651291,W01-BATCH-044,
PMID:35866396,1dc1c01712931684beacfeec8d2ec5f8b2eac43f5e13494851acef273e1d9385,include_diagnostic_or_correction_lead,reproducibility,I_DIAGNOSTIC_CORRECTION,"This article provides a documented, standardized, open benchmark dataset for reproducible COVID-19 ultrasound diagnostic analytics.",codex-cli-task5-fix3-reader-a-019f8279-1697-7933-a4bc-cf88c2651291,W01-BATCH-044,
PMID:35872591,5ac8d50aad275469e58a74c72ed90166911131b9446283f07698c9be5381930d,include_simulation_or_mechanistic_lead,method_source,I_SIMULATION_MECHANISTIC,This study compares longitudinal viral-load summaries and uses simulation to evaluate an imputation remedy for selection bias.,codex-cli-task5-fix3-reader-a-019f8279-1697-7933-a4bc-cf88c2651291,W01-BATCH-044,
PMID:35878574,4a50ed46570f52350b7d4d3e022a7d566c37e4d73a025da8bb2f6dd218681fb8,include_simulation_or_mechanistic_lead,method_source,I_SIMULATION_MECHANISTIC,"This article documents a mechanistic multi-host epidemic model, synthetic surveillance data, and reproducible animal-health modelling challenge.",codex-cli-task5-fix3-reader-a-019f8279-1697-7933-a4bc-cf88c2651291,W01-BATCH-044,
PMID:35908330,162cb4db5c147874e426a0eb1685af996b00f3ed8f68e9931f57d26777f4f88f,include_simulation_or_mechanistic_lead,applied_seed,I_SIMULATION_MECHANISTIC,This study uses a calibrated agent-based transmission model to compare regional vaccination-allocation strategies.,codex-cli-task5-fix3-reader-a-019f8279-4dc7-7761-9058-fc92779cbc2e,W01-BATCH-044,
PMID:35923301,b9046e9e8f44499889c9f76d5eb57d55efde821c61eedc508f8b9c861112aa2b,exclude,,X_DESCRIPTIVE_ONLY,This simulation evaluates vaccine-storage temperature checks but does not supply an eligible epidemiological analytical method.,codex-cli-task5-fix3-reader-a-019f8279-4dc7-7761-9058-fc92779cbc2e,W01-BATCH-044,
PMID:35930335,ec458f8a745369ebdb760a8fa440d0e0778b86a343e394efd577af6e553dba17,exclude,,X_DESCRIPTIVE_ONLY,This molecular-dynamics study examines bacterial protein conformations without an epidemiological method or transferable application.,codex-cli-task5-fix3-reader-a-019f8279-4dc7-7761-9058-fc92779cbc2e,W01-BATCH-044,
PMID:35932728,2bd2a6b14b0ee27a4dc68bd2d86b152d557457e21546ff69b7edb5b76aa373fd,include_simulation_or_mechanistic_lead,method_source,I_SIMULATION_MECHANISTIC,This study develops an agent-based transmission model for evaluating COVID-19 containment and reopening policies.,codex-cli-task5-fix3-reader-a-019f8279-4dc7-7761-9058-fc92779cbc2e,W01-BATCH-044,
PMID:35943207,02e9fcd3757e409bfcefb3c4b0de758ef809699521ca203b5a9943a77a9c40e1,include_diagnostic_or_correction_lead,guidance,I_DIAGNOSTIC_CORRECTION,It establishes infection benchmarks and a transferable prevention-prioritization framework.,codex-cli-task5-fix3-blind-019f82aa-9d58-7990-b5b8-e855e090f826,W01-BATCH-044,
PMID:35958084,d692c1f402f31e68c80e52f6f9c17101919b5c8af03bef15407efa0afd36b672,include_simulation_or_mechanistic_lead,applied_seed,I_SIMULATION_MECHANISTIC,This study uses an agent-based classroom transmission model to compare school mitigation strategies.,codex-cli-task5-fix3-reader-a-019f8279-4dc7-7761-9058-fc92779cbc2e,W01-BATCH-044,
PMID:35965458,3fccec5aee7d8de2a4b9d429af40516c56df29bdfad72fb2bf0fa6f4f6f81430,include_simulation_or_mechanistic_lead,applied_seed,I_SIMULATION_MECHANISTIC,This study combines statistical and agent-based models to estimate variant transmissibility and intervention effects.,codex-cli-task5-fix3-reader-a-019f8279-4dc7-7761-9058-fc92779cbc2e,W01-BATCH-044,
PMID:35965459,63854c57bf3180aea8d28fee796e863cb7763e92bdbebdc82763d5b2d6f7653c,include_simulation_or_mechanistic_lead,applied_seed,I_SIMULATION_MECHANISTIC,This study uses spatial agent-based and renewal models with counterfactual simulations of interventions.,codex-cli-task5-fix3-reader-a-019f8279-4dc7-7761-9058-fc92779cbc2e,W01-BATCH-044,
PMID:35971958,81427c98c9b514a79e84fdd177f467a5e8321f67b34d7814a23c3903b95c5b87,exclude,,X_DESCRIPTIVE_ONLY,"This molecular docking and dynamics study screens a candidate SARS-CoV-2 compound but provides no transferable epidemiologic design, surveillance method, or population transmission model.",codex-sol-high-primary-044-3x50,W01-BATCH-044,
PMID:35978182,596d0f68e92c33ef01b6045696a57ffb68a63214db9c1aa641c82178f43a3074,include_simulation_or_mechanistic_lead,applied_seed,I_SIMULATION_MECHANISTIC,This registry-based simulation compares scheduled catheter-removal decision rules for preventing bloodstream infections.,codex-cli-task5-fix3-reader-a-019f8279-4dc7-7761-9058-fc92779cbc2e,W01-BATCH-044,
PMID:35981006,4cca1da48df18ae93429f4a15bf4e400f64586507669b889f20b21fa88eeac13,include_simulation_or_mechanistic_lead,applied_seed,I_SIMULATION_MECHANISTIC,This study couples agent-based migration and infection models to examine avian-influenza transmission mechanisms.,codex-cli-task5-fix3-reader-a-019f8279-4dc7-7761-9058-fc92779cbc2e,W01-BATCH-044,
PMID:35986075,7bfc291d02f0a17dc4362c13f0d84085c9c0f0e0e6edef93668aaf47cb9660f3,exclude,,X_DESCRIPTIVE_ONLY,This general synthetic-patient generator does not establish an eligible infectious-disease epidemiological method contribution.,codex-cli-task5-fix3-reader-a-019f8279-4dc7-7761-9058-fc92779cbc2e,W01-BATCH-044,
PMID:35986322,97dc797e4df24c2672e6f53c9eff7c199693f88126e2a9ef835be96c1e062e2e,include_simulation_or_mechanistic_lead,method_source,I_SIMULATION_MECHANISTIC,This study develops stochastic queueing decision models for vaccination-site capacity and service planning.,codex-cli-task5-fix3-reader-a-019f8279-4dc7-7761-9058-fc92779cbc2e,W01-BATCH-044,
PMID:35990145,ba13ce6a35c85eb4059d314980774f7484a16abbc748a1a85fe4b5dfcb71d374,include_method_source_lead,method_source,I_METHOD_SOURCE,It evaluates diagnostic classifiers and PCR contribution using infectious-disease patient data.,codex-cli-task5-fix3-blind-019f82aa-9d58-7990-b5b8-e855e090f826,W01-BATCH-044,
PMID:35995954,e3b8037db6db1f9e7c5c76588441da925771ec9ae9d89c6143d415ed310c81ea,include_method_source_lead,method_source,I_METHOD_SOURCE,It develops a surrogate biomarker for estimating HIV prevention efficacy.,codex-cli-task5-fix3-blind-019f82aa-9d58-7990-b5b8-e855e090f826,W01-BATCH-044,
PMID:36011877,8b8f078ebb4b6217ab82b9431f36bfc7781494a45813d7d19b20a7472e620a1b,include_simulation_or_mechanistic_lead,method_source,I_SIMULATION_MECHANISTIC,It develops and validates an agent-based COVID-19 transmission model.,codex-cli-task5-fix3-blind-019f82aa-9d58-7990-b5b8-e855e090f826,W01-BATCH-044,
PMID:36035085,b27d41d134f85edec8b2b6b4e63cf3718c232cfaf4dd6ff3139d947d1b724a54,include_simulation_or_mechanistic_lead,method_source,I_SIMULATION_MECHANISTIC,"This study develops a mechanistic agent-based framework coupling indoor airflow, droplets, and infection transmission.",codex-cli-task5-fix3-reader-a-019f8279-4dc7-7761-9058-fc92779cbc2e,W01-BATCH-044,
PMID:36037156,19def1a6a49519bcbd33730ef7fe66e80accca154cb666295091f307845fbf38,include_simulation_or_mechanistic_lead,applied_seed,I_SIMULATION_MECHANISTIC,This study uses an agent-based infectious-process model to compare long-term COVID-19 intervention scenarios.,codex-cli-task5-fix3-reader-a-019f8279-4dc7-7761-9058-fc92779cbc2e,W01-BATCH-044,
PMID:36039775,01e22994e7b79c7834b0779a57cdad4859bf9845b3a4a9550055209f91d87353,exclude,,X_NOT_INFECTIOUS_TRANSFERABLE,This molecular characterization of a mycobacterial protein is directed toward cancer research and supplies no concrete transfer route to infectious-disease epidemiology.,codex-sol-high-primary-044-3x50,W01-BATCH-044,
PMID:36041081,59a7cf73a3801d69cc30851ab84377785c46ce222bcb4198887c6ebbe0b9e4aa,include_simulation_or_mechanistic_lead,applied_seed,I_SIMULATION_MECHANISTIC,This study uses an agent-based infectious-contamination model to evaluate surveillance patterns and corrective actions.,codex-cli-task5-fix3-reader-a-019f8279-4dc7-7761-9058-fc92779cbc2e,W01-BATCH-044,
PMID:36056892,50b37cae00834610bb1e6a7e4daf35763ded56ddefcc40b198451ff193ce8adb,include_simulation_or_mechanistic_lead,method_source,I_SIMULATION_MECHANISTIC,This simulation study evaluates vaccine-effectiveness waning estimators and develops an improved time-partitioned Cox method.,codex-cli-task5-fix3-reader-a-019f8279-4dc7-7761-9058-fc92779cbc2e,W01-BATCH-044,
PMID:36065752,5ac2d70d917f7e9c9a31d8f74421b965aa04c5440b19e04f32c71214dea2bb0c,include_applied_seed,applied_seed,I_APPLIED_TRANSFERABLE_DESIGN,This study uses prespecified landmark analyses to avoid immortal-time bias when evaluating antimicrobial-treatment timing.,codex-cli-task5-fix3-reader-a-019f8279-4dc7-7761-9058-fc92779cbc2e,W01-BATCH-044,
PMID:36067157,daf14ece249ba4cc93d525ba6150f80de5ca5194d005e8666f26f72902208bc7,include_simulation_or_mechanistic_lead,applied_seed,I_SIMULATION_MECHANISTIC,This agent-based transmission model evaluates alternative global COVID-19 vaccine allocation strategies across 148 countries.,codex-cli-task5-fix3-reader-a-019f829d-2dcd-73c0-967d-a18e1249dd61,W01-BATCH-044,
PMID:36082774,3bc9ad1a927b6e8ce128c13934c2fa93ea44952b46df67c070cd6d3005564e4d,include_method_source_lead,method_source,I_METHOD_SOURCE,This study develops and compares two risk-adjusted benchmarking models for hospital-onset bacteremia and fungemia surveillance.,codex-cli-task5-fix3-reader-a-019f829d-2dcd-73c0-967d-a18e1249dd61,W01-BATCH-044,
PMID:36083618,d0e973ca467d429f3cd6d1485677f1abf4bd67ac2311224bd68cd73af7007d01,include_simulation_or_mechanistic_lead,method_source,I_SIMULATION_MECHANISTIC,This simulation benchmarks how nonrandom surveillance missingness biases population estimates despite weighting and larger samples.,codex-cli-task5-fix3-reader-a-019f829d-2dcd-73c0-967d-a18e1249dd61,W01-BATCH-044,
PMID:36091848,5651b413949dafbfb7b71da00f924fb91d4899b06aa4057bd3198ffd12ef666c,include_simulation_or_mechanistic_lead,applied_seed,I_SIMULATION_MECHANISTIC,This record applies agent-based infectious-process simulation to COVID-19 epidemic development and regulatory-measure assessment in Russia.,codex-cli-task5-fix3-reader-a-019f829d-2dcd-73c0-967d-a18e1249dd61,W01-BATCH-044,
PMID:36093336,0b63acd042fcb2c033520d905b65af2b5748515e5ca12cf806fa6ad98df4c9de,include_diagnostic_or_correction_lead,reproducibility,I_DIAGNOSTIC_CORRECTION,This contribution supplies standardized open benchmark datasets and verification scripts for reproducible SARS-CoV-2 surveillance bioinformatics.,codex-cli-task5-fix3-reader-a-019f829d-2dcd-73c0-967d-a18e1249dd61,W01-BATCH-044,
PMID:36096407,08e3ed5b243bcece8ff8bdc14847153025fb5641bf95771bc5b2a9bd1f1a1e93,include_simulation_or_mechanistic_lead,applied_seed,I_SIMULATION_MECHANISTIC,"This age-and-nutrition-stratified transmission model simulates how supplementation, wasting treatment, and vaccination alter measles outcomes.",codex-cli-task5-fix3-reader-a-019f829d-2dcd-73c0-967d-a18e1249dd61,W01-BATCH-044,
PMID:36129214,93ba0df69b95619dd3c32680ca812f396d3419db7e795baf467bcd76a9d92d2e,exclude,,X_DESCRIPTIVE_ONLY,"This molecular docking, dynamics, and structure-activity study supports HBV compound design but does not contribute a transferable epidemiologic or population-level infectious-disease method.",codex-sol-high-primary-044-3x50,W01-BATCH-044,
PMID:36166462,c992777ec8b4c6b7a81043f066f4c33c7bec807b2b3392762000880840f3f5d5,include_simulation_or_mechanistic_lead,method_source,I_SIMULATION_MECHANISTIC,This study develops an agent-based transmission model and non-local calibration method transferable across endemic villages.,codex-cli-task5-fix3-reader-a-019f829d-2dcd-73c0-967d-a18e1249dd61,W01-BATCH-044,
PMID:36168021,80a752ace814b00b7ce7fe5449417b20d09230a249db922e77219e24f92a513f,include_simulation_or_mechanistic_lead,method_source,I_SIMULATION_MECHANISTIC,This study develops an open spatial agent-based framework for evaluating facility-specific infectious-outbreak mitigation policies.,codex-cli-task5-fix3-reader-a-019f829d-2dcd-73c0-967d-a18e1249dd61,W01-BATCH-044,
PMID:36190799,f58f043ef313840b9a41e14a547b26a808e05409d2a9364193425717bba5f68c,exclude,,X_NOT_INFECTIOUS_TRANSFERABLE,This chemical respiratory-sensitization hazard model is outside infectious-disease epidemiology and supplies no explicit epidemiological transfer route.,codex-cli-task5-fix3-reader-a-019f829d-2dcd-73c0-967d-a18e1249dd61,W01-BATCH-044,
PMID:36197919,81d71787a854b7fec491f8edafdf78290b8d536c73a459402798714fa8edd824,include_simulation_or_mechanistic_lead,method_source,I_SIMULATION_MECHANISTIC,"This study compares machine-learning methods for efficient Bayesian inference from stochastic agent-based models, including infectious spread.",codex-cli-task5-fix3-reader-a-019f829d-2dcd-73c0-967d-a18e1249dd61,W01-BATCH-044,
PMID:36208211,d5d5f8823ad7bccf750a416c5e52546752a0d462b7c9ba60804fa8df34f16998,include_simulation_or_mechanistic_lead,applied_seed,I_SIMULATION_MECHANISTIC,This agent-based transmission study compares symptomatic and asymptomatic rapid-testing strategies for reducing SARS-CoV-2 infections in Zambia.,codex-cli-task5-fix3-reader-a-019f829d-2dcd-73c0-967d-a18e1249dd61,W01-BATCH-044,
PMID:36238719,c92342ca90de91753072c4c36506550fa1d3782f76b4020da0a194b8c3e9f5ff,exclude,,X_DUPLICATE,This bioRxiv preprint is the same bibliographic work later published under the supplied peer record.,codex-cli-task5-fix3-reader-a-019f829d-2dcd-73c0-967d-a18e1249dd61,W01-BATCH-044,PMID:38127835
PMID:36251657,f32d4dc524e7508f6c0f8df023303eba908d8b5814ea10e143d56fe6e81c819b,include_simulation_or_mechanistic_lead,applied_seed,I_SIMULATION_MECHANISTIC,This locally parameterized agent-based model compares HIV prevention and care pathways for reaching an incidence-reduction target.,codex-cli-task5-fix3-reader-a-019f829d-2dcd-73c0-967d-a18e1249dd61,W01-BATCH-044,
PMID:36253074,e90e40e98f4cded59a444897f31b1c34aff6dd5b622a6149e3b132dc8d28a813,exclude,,X_NOT_INFECTIOUS_TRANSFERABLE,This survey benchmarks laboratory rodent husbandry practices for animal-welfare refinement without an infectious outcome or a concrete infectious-disease methodological transfer route.,codex-sol-high-primary-044-3x50,W01-BATCH-044,
PMID:36269282,adf108d74c89f3e190698980c3aef38db24b64556e746e3824a46f3fea5f7a15,include_diagnostic_or_correction_lead,reproducibility,I_DIAGNOSTIC_CORRECTION,This reproducible benchmark compares metagenomic taxonomic classifiers using simulated and real sequence data for infectious diagnostics.,codex-cli-task5-fix3-reader-a-019f829d-2dcd-73c0-967d-a18e1249dd61,W01-BATCH-044,
PMID:36275668,f4bc1f88b9cace98265cb009896506f3a042eef3ce07be6b512af8b98a92c68b,exclude,,X_DESCRIPTIVE_ONLY,The review discusses tissue-resident immune cells as vaccine-immunogenicity benchmarks without an epidemiological method or transferable infectious-process application.,codex-cli-task5-fix3-reader-a-019f82a0-5bed-70b1-ab34-88806039e25d,W01-BATCH-044,
PMID:36276939,5f629102393ce66861489a30890433f4e279ad636f6b99ce4f73c6a61e8d856d,exclude,,X_NOT_INFECTIOUS_TRANSFERABLE,This comparison of post-GWAS tools is conducted entirely in major depression and gives no concrete transfer route to infectious-disease epidemiology.,codex-sol-high-primary-044-3x50,W01-BATCH-044,
PMID:36288362,ad758123c3a242ed7d9f2bf79f8568a98ea403e88fc4c3a3555e3ee3fc3bdff4,include_simulation_or_mechanistic_lead,method_source,I_SIMULATION_MECHANISTIC,The simulation compares bias in four epidemic measures under temporally varying and incomplete case detection.,codex-cli-task5-fix3-reader-a-019f82a0-5bed-70b1-ab34-88806039e25d,W01-BATCH-044,
PMID:36300522,3c31988a016025223e09177c6a7682f527c3813baf8a444e4d6546903182bcbd,exclude,,X_DESCRIPTIVE_ONLY,"This virtual screening and molecular-dynamics analysis prioritizes candidate SARS-CoV-2 inhibitors but offers no transferable epidemiologic design, surveillance method, or transmission model.",codex-sol-high-primary-044-3x50,W01-BATCH-044,
PMID:36305040,0abcf48a4e57c9b260d8304a9f812a121a92bb03f8d5393ae34790331a976650,include_simulation_or_mechanistic_lead,method_source,I_SIMULATION_MECHANISTIC,The agent-based trial emulation evaluates effect modification of HIV-prevention spillovers using extended randomization-based estimators.,codex-cli-task5-fix3-reader-a-019f82a0-5bed-70b1-ab34-88806039e25d,W01-BATCH-044,
PMID:36312982,44cd5acdd2b68de450fd62035bda44a2a36f540207e3819e065ecb171c367048,exclude,,X_DESCRIPTIVE_ONLY,The study benchmarks a commercial sequencing-kit and flow-cell combination without developing a transferable epidemiological method.,codex-cli-task5-fix3-reader-a-019f82a0-5bed-70b1-ab34-88806039e25d,W01-BATCH-044,
PMID:36315387,a4e3784bf85101b5ba18d75cce5cf4ede264f00e6b13ac5c57180c4b8422f442,include_simulation_or_mechanistic_lead,method_source,I_SIMULATION_MECHANISTIC,It develops an agent-based model of multi-host Leptospira transmission dynamics.,codex-cli-task5-fix3-blind-019f82aa-9d58-7990-b5b8-e855e090f826,W01-BATCH-044,
PMID:36338939,af431d1dd1213e0d3fed6ae6d03ec353bd24d620cc3b59934afcb767eb64b299,exclude,,X_DESCRIPTIVE_ONLY,"Although it benchmarks two docking programs, this compound-screening study remains a molecular SARS-CoV-2 inhibitor analysis without a transferable epidemiologic or surveillance contribution.",codex-sol-high-primary-044-3x50,W01-BATCH-044,
PMID:36366307,a576faafdbaaef095b86bae7669f8d996de07fcacd901179ae138e164d975da9,include_simulation_or_mechanistic_lead,applied_seed,I_SIMULATION_MECHANISTIC,"The agent-based transmission study evaluates two-dose influenza vaccination under alternative timing, uptake, effectiveness, and waning scenarios.",codex-cli-task5-fix3-reader-a-019f82a0-5bed-70b1-ab34-88806039e25d,W01-BATCH-044,
PMID:36400087,b9014b7c4594cbf1a147859a2f30c605ff60625708d22146fddc8ab00aff0265,include_applied_seed,applied_seed,I_APPLIED_TRANSFERABLE_DESIGN,The longitudinal cohort estimates low-level HIV viraemia prevalence and subsequent failure risks using regression models.,codex-cli-task5-fix3-reader-a-019f82a0-5bed-70b1-ab34-88806039e25d,W01-BATCH-044,
PMID:36408671,ffaa2df8e24ede27d306f9dbc256521ac5b5a85bb72729b249889b90de757d7b,exclude,,X_DESCRIPTIVE_ONLY,"The study models within-host hepatitis biomarkers and drug effects to optimize antiviral combination therapy, an expressly ineligible therapeutic application.",codex-cli-task5-fix3-reader-a-019f82a0-5bed-70b1-ab34-88806039e25d,W01-BATCH-044,
PMID:36411944,1ae8a4080a12de94188d011c724fdef120d063f753310fb32cbd7e38448e0667,exclude,,X_NOT_INFECTIOUS_TRANSFERABLE,This genetic and molecular-dynamics analysis concerns androgen insensitivity syndrome and provides no concrete transfer route to infectious-disease epidemiology.,codex-sol-high-primary-044-3x50,W01-BATCH-044,
PMID:36426357,7bb4f63b700c16fe745df8a1e02876ad113e7833c3f0912117c4f3230505e2d7,include_method_source_lead,method_source,I_METHOD_SOURCE,It benchmarks a transferable genotyping method with explicit infectious-disease application.,codex-cli-task5-fix3-blind-019f82aa-9d58-7990-b5b8-e855e090f826,W01-BATCH-044,
PMID:36436383,c8e85086e3c8960653862f0bde7d77d78eb313a8382b59863c14ba1c6a3b216b,include_simulation_or_mechanistic_lead,applied_seed,I_SIMULATION_MECHANISTIC,"The Monte Carlo farm model simulates infection transmission, chronic mastitis dynamics, and resulting economic outcomes.",codex-cli-task5-fix3-reader-a-019f82a0-5bed-70b1-ab34-88806039e25d,W01-BATCH-044,
PMID:36443439,856b9f2e030c8af7d2c0f9dd071178deb9ce4648986e3edba3c887be608cf1f9,include_simulation_or_mechanistic_lead,method_source,I_SIMULATION_MECHANISTIC,The study develops a real-time inferential mechanistic model bridging short-term epidemic forecasting and longer-term policy scenarios.,codex-cli-task5-fix3-reader-a-019f82a0-5bed-70b1-ab34-88806039e25d,W01-BATCH-044,
PMID:36446187,50e7437045db4d7a548a74c3a448f9a7a143b0e8d5d239bb4a1761c96ea43663,exclude,,X_NOT_INFECTIOUS_TRANSFERABLE,This molecular-dynamics investigation concerns amyotrophic lateral sclerosis protein dimerization and supplies no concrete infectious-disease transfer route.,codex-sol-high-primary-044-3x50,W01-BATCH-044,
