candidate_key,source_row_sha256,primary_decision,primary_proposed_record_type,primary_reason_code,primary_reason,primary_reviewer,batch_id,retained_candidate_key
PMID:40252620,b9d83651d10b5d07d7e603282a846cb431c95169572060d0cf1f46ab5edbfc0f,include_applied_seed,applied_seed,I_APPLIED_TRANSFERABLE_DESIGN,This study informatively applies and compares forecasting models for infectious-disease outbreak detection.,codex-cli-task5-fix3-blind-019f82aa-9e7b-7180-bc24-d230938ebe65,W01-BATCH-035,
PMID:40302215,be02e8a4aefbe10483764ce1052e3b3bca2821ed045c86fa9aa7403e5ecc6c03,include_applied_seed,applied_seed,I_APPLIED_TRANSFERABLE_DESIGN,"This study implements and evaluates real-time genomic surveillance using outbreak, intervention, clinical, and economic outcomes.",codex-cli-task5-fix3-reader-a-019f8283-0fd1-7161-8d28-45f2252832bf,W01-BATCH-035,
PMID:40303021,29a299ca28bc65cfbc1acdd8901300ea37fe8d6ea474daf01dc4d63412e59018,include_diagnostic_or_correction_lead,diagnostic,I_DIAGNOSTIC_CORRECTION,This study designs and validates a syndromic outbreak-detection system against an established surveillance program.,codex-cli-task5-fix3-blind-019f82aa-9e7b-7180-bc24-d230938ebe65,W01-BATCH-035,
PMID:40303108,dabbce099181de3ecbe95a5e17f1fdbfe1583b303abf67d83907a9c3090b2748,include_applied_seed,applied_seed,I_APPLIED_TRANSFERABLE_DESIGN,This study estimates African swine fever reproduction numbers and constructs a qualitative model of disease dynamics and control.,codex-cli-task5-fix3-reader-a-019f8283-0fd1-7161-8d28-45f2252832bf,W01-BATCH-035,
PMID:40319832,cc38eedf978367b7ca17562d19dedb603f91e47c992ebfd8cec5cae4ba480cb7,exclude,,X_COMMENTARY_ONLY,This letter provides no supplied methodological analysis beyond its title-level commentary claim.,codex-semantic-primary-035,W01-BATCH-035,
PMID:40352319,adcb8a8a3c67933105e1ec10ff49d403a92f6c37c89d0baec551a98980b490be,include_applied_seed,applied_seed,I_APPLIED_TRANSFERABLE_DESIGN,This study develops an interpretable machine-learning early-warning model for forecasting dengue outbreaks from surveillance and environmental data.,codex-cli-task5-fix3-reader-a-019f8283-0fd1-7161-8d28-45f2252832bf,W01-BATCH-035,
PMID:40359068,7c83c11af8433abf50f71bd61cb5a4f23fdf6ee9b35bafe0b50b0388820f006c,include_applied_seed,applied_seed,I_APPLIED_TRANSFERABLE_DESIGN,This article describes a scalable public-private implementation model for multimodal airport pathogen surveillance and early warning.,codex-cli-task5-fix3-reader-a-019f8283-0fd1-7161-8d28-45f2252832bf,W01-BATCH-035,
PMID:40359087,f65545f327c7e1122b3c9833e0185c3079a650dc244e110e862861bd8ad308e2,include_applied_seed,applied_seed,I_APPLIED_TRANSFERABLE_DESIGN,This study documents nationwide implementation of molecular cluster detection for identifying and responding to rapid HIV transmission.,codex-cli-task5-fix3-reader-a-019f8283-0fd1-7161-8d28-45f2252832bf,W01-BATCH-035,
PMID:40359413,e6ed5f7634a3afc7baaa361bb784790a8a69a6dc15cda8358d8c41d540ad4079,include_simulation_or_mechanistic_lead,method_source,I_SIMULATION_MECHANISTIC,This study develops and benchmarks a genomic dense-region tagging method for robust foodborne-outbreak detection.,codex-cli-task5-fix3-reader-a-019f8283-0fd1-7161-8d28-45f2252832bf,W01-BATCH-035,
PMID:40367150,bee684d642dea367aa7f26ccc885b9b23c5f695e8bccbfd4019a36f3a1519fb9,include_diagnostic_or_correction_lead,guidance,I_DIAGNOSTIC_CORRECTION,"This scoping review compares malaria early-warning methods, performance measures, implementation barriers, and priorities for methodological standardization.",codex-cli-task5-fix3-reader-a-019f8283-0fd1-7161-8d28-45f2252832bf,W01-BATCH-035,
PMID:40380686,f144dcebc92958795d27bbcf3c57de8208306ed3ce1834c798ed51d2b78117e0,include_diagnostic_or_correction_lead,reproducibility,I_DIAGNOSTIC_CORRECTION,This study proposes a practical benchmark for evaluating anomaly-detection algorithms in epidemic surveillance.,codex-cli-task5-fix3-blind-019f82aa-9e7b-7180-bc24-d230938ebe65,W01-BATCH-035,
PMID:40424811,625022e621bd87690ce2c4c86d09cf32c635611846c488faf29963b628fc8bec,exclude,,X_NOT_INFECTIOUS_TRANSFERABLE,This early-warning model concerns harmful algal blooms without a concrete infectious-disease transfer route.,codex-semantic-primary-035,W01-BATCH-035,
PMID:40438071,ac0fc632f5f857200229a2d24795deaee04ec087dacc170f6496ffeb8e368406,include_method_source_lead,method_source,I_METHOD_SOURCE,This study refines a respiratory syndrome case definition and develops a graded multi-algorithm epidemic early-warning framework.,codex-cli-task5-fix3-reader-a-019f8283-0fd1-7161-8d28-45f2252832bf,W01-BATCH-035,
PMID:40445148,7f7c5a5870f4894dd73add9a44c0aaaa59b0f21b0b1166a32811c605be1bc540,include_method_source_lead,method_source,I_METHOD_SOURCE,This study develops a stochastic differential-equation approach for estimating time-varying transmission parameters and forecasting epidemic peaks.,codex-cli-task5-fix3-reader-a-019f8283-0fd1-7161-8d28-45f2252832bf,W01-BATCH-035,
PMID:40448545,b50777225727e6da874fdb86a2ab27357d5c5cb3b46eed84763a7b2d39265ae8,include_diagnostic_or_correction_lead,diagnostic,I_DIAGNOSTIC_CORRECTION,This study evaluates a rapid typing workflow for real-time outbreak detection and infection control.,codex-cli-task5-fix3-blind-019f82aa-9e7b-7180-bc24-d230938ebe65,W01-BATCH-035,
PMID:40463569,7e8fd041e03466d8f6db3d1d151ee2f7a8174f78eb6a44098a6ce2e820e67574,include_method_source_lead,method_source,I_METHOD_SOURCE,This study develops and evaluates an electronic-record machine-learning method for augmenting spatiotemporal infectious-outbreak detection.,codex-cli-task5-fix3-reader-a-019f8283-7816-77b1-9d95-541dd1700bb7,W01-BATCH-035,
PMID:40477403,4c5b7b6ca8f30a214a7a27ed950d89fffa821081a4367feea12e4e79bd18ea58,include_applied_seed,applied_seed,I_APPLIED_TRANSFERABLE_DESIGN,This study estimates reproduction and dispersion parameters from contact-tracing clusters using a Poisson-gamma mixture model.,codex-cli-task5-fix3-reader-a-019f8283-7816-77b1-9d95-541dd1700bb7,W01-BATCH-035,
PMID:40478870,be784abe6557a0d5eb144da6cca399cff1bafd8bf0093b4dc9cdccbe42167c73,include_simulation_or_mechanistic_lead,method_source,I_SIMULATION_MECHANISTIC,This network simulation identifies and quantifies endogenous competition as a mechanism reducing infectious-disease reproduction.,codex-cli-task5-fix3-reader-a-019f8283-7816-77b1-9d95-541dd1700bb7,W01-BATCH-035,
PMID:40504145,781d86103c48147dd8986dc48105d7372c18dfbf187351381d74f7206bcf1cdd,include_simulation_or_mechanistic_lead,applied_seed,I_SIMULATION_MECHANISTIC,This calibrated compartmental transmission model investigates plague seasonality and compares rat-and-flea intervention strategies.,codex-cli-task5-fix3-reader-a-019f8283-7816-77b1-9d95-541dd1700bb7,W01-BATCH-035,
PMID:40508906,f923a3cdf0f5497b0c2be7d10189478515d0ff76c75b217df6492b417eb1aac4,exclude,,X_DESCRIPTIVE_ONLY,"This bibliometric mapping describes publication trends rather than developing, evaluating, or prescribing a surveillance method.",codex-semantic-primary-035,W01-BATCH-035,
PMID:40513075,153a137330c0488f9c65f284bc4b7b1fa1bec65d11624401bc1d0ad05ad314ce,include_simulation_or_mechanistic_lead,method_source,I_SIMULATION_MECHANISTIC,This study develops an extended contact-matrix method within a mechanistic epidemic transmission model.,codex-cli-task5-fix3-blind-019f82aa-9e7b-7180-bc24-d230938ebe65,W01-BATCH-035,
PMID:40538722,6d7a118b41d774f3fd4f0f83595055b5952a7e5f6c5c92446d36b05f9328f80a,include_applied_seed,applied_seed,I_APPLIED_TRANSFERABLE_DESIGN,This scoping review synthesizes empirical livestock reproduction-number estimates across epidemiological settings for prevention and control decisions.,codex-cli-task5-fix3-reader-a-019f8283-7816-77b1-9d95-541dd1700bb7,W01-BATCH-035,
PMID:40540509,7ff152b74a6055d75b590f02ff7cda2b923ff98833560bfbdd3f27724b7b0513,include_applied_seed,applied_seed,I_APPLIED_TRANSFERABLE_DESIGN,This outbreak-response evaluation applies reporting-timeliness targets and signal-verification indicators to identify surveillance strengths and bottlenecks.,codex-cli-task5-fix3-reader-a-019f8283-7816-77b1-9d95-541dd1700bb7,W01-BATCH-035,
PMID:40554864,e67221583e0c973a8f34e9ec9e94f6eb153b80708a2db23c4c8fe1758478f9b6,include_method_source_lead,method_source,I_METHOD_SOURCE,"This study systematically compares eight wastewater-based reproduction-number estimators across methods, spatial scales, usability, and computation.",codex-cli-task5-fix3-reader-a-019f8283-7816-77b1-9d95-541dd1700bb7,W01-BATCH-035,
PMID:40564885,4ce4f93b3ab92654fa77dc0cdf2f958fccc8529ef14473a4c7473d9c28c81fa0,include_diagnostic_or_correction_lead,diagnostic,I_DIAGNOSTIC_CORRECTION,This prospective study compares five early-warning scores for long-term mortality discrimination among patients with suspected respiratory infection.,codex-cli-task5-fix3-reader-a-019f8283-7816-77b1-9d95-541dd1700bb7,W01-BATCH-035,
PMID:40568328,4d9b9153d88e7f5050049780d162d61850c19fb4d83c844fdc60a96d3c181e5c,include_diagnostic_or_correction_lead,diagnostic,I_DIAGNOSTIC_CORRECTION,This study modifies and validates an early-warning score for infection-specific treatment triage and mortality prediction.,codex-cli-task5-fix3-reader-a-019f8283-7816-77b1-9d95-541dd1700bb7,W01-BATCH-035,
PMID:40572198,1227a8ec7e104abd8dbecbb8ecbafb4a0960a0776510265f13d697f9ef608a3c,include_diagnostic_or_correction_lead,reproducibility,I_DIAGNOSTIC_CORRECTION,This study validates and compares genomic subtyping schemes for national outbreak surveillance.,codex-cli-task5-fix3-blind-019f82aa-9e7b-7180-bc24-d230938ebe65,W01-BATCH-035,
PMID:40585271,fb45559457b14854a247f55e6664cdb34562208166cbdb9d85fab1ad9fab74d2,exclude,,X_DUPLICATE,This Research Square preprint duplicates the identical ML biosurveillance study retained as PMID:40463569.,codex-semantic-primary-035,W01-BATCH-035,PMID:40463569
PMID:40588668,95f57dfba57b8689beeae2a7b91571a3e538e14005c53846f8bce9d5579e127a,include_diagnostic_or_correction_lead,reproducibility,I_DIAGNOSTIC_CORRECTION,"This study presents and evaluates an open-source interoperable system for reproducible cluster, contact-network, and epidemic-curve surveillance.",codex-cli-task5-fix3-reader-a-019f8283-7816-77b1-9d95-541dd1700bb7,W01-BATCH-035,
PMID:40591894,dc8235c030ad1943e8b2a62815f5b4ba073b1f67e1007bfbda0268474cd9e684,include_diagnostic_or_correction_lead,diagnostic,I_DIAGNOSTIC_CORRECTION,This study validates wastewater measurements and sequencing as an early-warning surveillance approach for pertussis outbreaks.,codex-cli-task5-fix3-reader-a-019f8283-7816-77b1-9d95-541dd1700bb7,W01-BATCH-035,
PMID:40593996,b08329f2d0668bcff908b7ee20ecb8683089ab6dbacd96439511c74b1f1358d9,include_simulation_or_mechanistic_lead,method_source,I_SIMULATION_MECHANISTIC,This study develops Bayesian filtering methods for transmission-rate and changepoint inference in stochastic epidemic models.,codex-cli-task5-fix3-blind-019f82aa-9e7b-7180-bc24-d230938ebe65,W01-BATCH-035,
PMID:40598569,473f4f0156b3b0a63985cdff41f6f5bb42faf2e55470244504851572550733eb,include_diagnostic_or_correction_lead,diagnostic,I_DIAGNOSTIC_CORRECTION,This study evaluates rolling hygiene noncompliance metrics as an early-warning indicator for hospital bacterial outbreaks.,codex-cli-task5-fix3-reader-a-019f8283-7816-77b1-9d95-541dd1700bb7,W01-BATCH-035,
PMID:40604751,25332d87282117d0bbd5a0e28e52e2ad68ad03e0b4dacb4090c1fb015ee1b293,exclude,,X_DESCRIPTIVE_ONLY,This qualitative acceptability study does not develop or evaluate the proposed outbreak-detection method itself.,codex-cli-task5-fix3-blind-019f82aa-9e7b-7180-bc24-d230938ebe65,W01-BATCH-035,
PMID:40626156,154130ddf412f563388ca9bdc91a5acf2b7d802e070f7b85d8bf27eeeebac3b3,include_method_source_lead,method_source,I_METHOD_SOURCE,"This systematic review compares artificial-intelligence methods, data sources, and limitations for infectious-disease early warning.",codex-cli-task5-fix3-blind-019f82aa-9e7b-7180-bc24-d230938ebe65,W01-BATCH-035,
PMID:40628288,5ab4f7fd48a8ec6867fe35b638191866e00e8cd2bfde3e4b037ea0c3d5e8bad6,include_simulation_or_mechanistic_lead,method_source,I_SIMULATION_MECHANISTIC,This derives and simulates a heterogeneous-population renewal framework for estimating time-dependent reproduction numbers.,codex-cli-task5-fix3-reader-a-019f8284-04d2-7172-a7b4-34de82fce0ba,W01-BATCH-035,
PMID:40644517,dc2ad5a787c161344b28b4b4fb89bc68de09be539df3e1fbfbeb765441913d5e,include_applied_seed,applied_seed,I_APPLIED_TRANSFERABLE_DESIGN,This retrospectively compares network and spatial strategies for allocating limited outbreak surveillance.,codex-cli-task5-fix3-reader-a-019f8284-04d2-7172-a7b4-34de82fce0ba,W01-BATCH-035,
PMID:40666148,c74edc78f83ef869cb1476b1b26feaab78adecae1f45cb43c9a6ebddf5805f8c,include_applied_seed,applied_seed,I_APPLIED_TRANSFERABLE_DESIGN,This evaluates politically heterogeneous social-media signals for spatial epidemic early warning.,codex-cli-task5-fix3-reader-a-019f8284-04d2-7172-a7b4-34de82fce0ba,W01-BATCH-035,
PMID:40678371,5fc4b0fdb9f08823b657ee9471dbf1edb745539d583a1265eb91fab1d3185e5a,include_applied_seed,applied_seed,I_APPLIED_TRANSFERABLE_DESIGN,This evaluates routine primary-care data and aberration algorithms for dengue outbreak warning.,codex-cli-task5-fix3-reader-a-019f8284-04d2-7172-a7b4-34de82fce0ba,W01-BATCH-035,
PMID:40699209,8ed36f50ebb03097a211c23503d179af8fe770aaf1943246258c37bec7370415,exclude,,X_NOT_INFECTIOUS_TRANSFERABLE,This sentinel-site framework targets drug and alcohol overdoses rather than an infectious-disease outcome.,codex-semantic-primary-035,W01-BATCH-035,
PMID:40724171,62402b759ff0d2bed488becbdf838c960ae839049a91de167af730c86883dc5e,include_diagnostic_or_correction_lead,guidance,I_DIAGNOSTIC_CORRECTION,"This maps digital outbreak-surveillance methods, performance measures, limitations, and reporting recommendations.",codex-cli-task5-fix3-reader-a-019f8284-04d2-7172-a7b4-34de82fce0ba,W01-BATCH-035,
PMID:40738152,6695caa50517a8f34317d7a77760f6e406cf3b630d9048483cd8083539f6ebb5,include_diagnostic_or_correction_lead,diagnostic,I_DIAGNOSTIC_CORRECTION,This demonstrates rapid antigen testing as a practical remote outbreak-detection approach.,codex-cli-task5-fix3-reader-a-019f8284-04d2-7172-a7b4-34de82fce0ba,W01-BATCH-035,
PMID:40742731,71746d963c6b0779ce30c16a0b8b0010a8ac257c00bcbf7a2a3345125e6dd0e5,exclude,,X_WRONG_RECORD_TYPE,This is a prospective study protocol without results or substantive completed method evaluation.,codex-semantic-primary-035,W01-BATCH-035,
PMID:40753987,c6932473e698396cba8ec2a095c94ecb1b5d797a3aac0acdde6df6dbcf1bb76a,include_simulation_or_mechanistic_lead,applied_seed,I_SIMULATION_MECHANISTIC,This integrates transmission-pair data and catalytic modelling to estimate measles susceptibility and reproduction.,codex-cli-task5-fix3-reader-a-019f8284-04d2-7172-a7b4-34de82fce0ba,W01-BATCH-035,
PMID:40754050,c01c9fc55c63bd3bea1bf58ceb8b304c1ce306fa90123ae967b07fb85dccd554,include_simulation_or_mechanistic_lead,method_source,I_SIMULATION_MECHANISTIC,This develops and simulates a hybrid machine-learning architecture for dengue early warning.,codex-cli-task5-fix3-reader-a-019f8284-04d2-7172-a7b4-34de82fce0ba,W01-BATCH-035,
PMID:40754791,93cb42e7d7129be248c3925470a2c2a4718d017377788095a5b70d0596dbf89d,include_method_source_lead,method_source,I_METHOD_SOURCE,This study develops likelihood-based smoothing and Bayesian uncertainty methods for real-time reproduction-number estimators.,codex-cli-task5-fix3-blind-019f82aa-9e7b-7180-bc24-d230938ebe65,W01-BATCH-035,
PMID:40769217,f1da5fba233497ea6f5cc4020dc2faa02f94032d58f92fc883e750df65f5caad,include_method_source_lead,method_source,I_METHOD_SOURCE,This develops and compares probability-based machine-learning methods for influenza early warning.,codex-cli-task5-fix3-reader-a-019f8284-04d2-7172-a7b4-34de82fce0ba,W01-BATCH-035,
PMID:40799812,5ffa01184cb5d1403339cf62ed4bbb460fe2d70e125ec2d0f99064e01aa85c95,include_simulation_or_mechanistic_lead,method_source,I_SIMULATION_MECHANISTIC,This develops and simulates a tractable stochastic estimator for wastewater-derived reproduction numbers.,codex-cli-task5-fix3-reader-a-019f8284-04d2-7172-a7b4-34de82fce0ba,W01-BATCH-035,
PMID:40802689,a2d57730e9854f3b3986c40818ddbdda5674a4175e38eb3fa3b8629334f2b1c6,include_method_source_lead,method_source,I_METHOD_SOURCE,This develops and globally evaluates ensemble approaches for short-term dengue forecasting.,codex-cli-task5-fix3-reader-a-019f8284-04d2-7172-a7b4-34de82fce0ba,W01-BATCH-035,
PMID:40810005,fb84aa18e1664c7c74df3721bb8f237e90a133297c35a0f4e3dd40d57abccbf7,include_diagnostic_or_correction_lead,guidance,I_DIAGNOSTIC_CORRECTION,"This perspective proposes an integrated conceptual framework for AI-enabled epidemic intelligence, early warning, forecasting, and response.",codex-cli-task5-fix3-reader-a-019f8284-4851-7cd3-a4ef-29b1cb23bfae,W01-BATCH-035,
PMID:40821002,2272c4ff734fd89f1985703d3dc390f7b9840f2e192ed18ee16c80d46d5c15ff,exclude,,X_NOT_INFECTIOUS_TRANSFERABLE,This early-warning system manages a crop fungal disease without a concrete infectious-disease epidemiology transfer route.,codex-semantic-primary-035,W01-BATCH-035,
PMID:40821641,93169a36e4eb6425d1379e4ace7617026d85123226848c43e1ab20b1a0c09cf1,include_diagnostic_or_correction_lead,diagnostic,I_DIAGNOSTIC_CORRECTION,This study evaluates an early-warning score and serological markers for predicting adverse pediatric respiratory-infection outcomes.,codex-cli-task5-fix3-reader-a-019f8284-4851-7cd3-a4ef-29b1cb23bfae,W01-BATCH-035,
PMID:40822277,150beaa999d7b56e514570e6e9004812bf2bec5da740c69ede7e9c03f1c6d7e0,include_method_source_lead,method_source,I_METHOD_SOURCE,This study develops and compares an optimized hybrid forecasting and warning framework for infectious gastroenteritis.,codex-cli-task5-fix3-blind-019f82aa-9e7b-7180-bc24-d230938ebe65,W01-BATCH-035,
PMID:40826114,b6bb2ba8075afd1b1ebd2688f18a513adbef83c9b2a2a717990acef9a5ddfce5,include_diagnostic_or_correction_lead,correction,I_DIAGNOSTIC_CORRECTION,This published author correction supplies bibliographic correction information for an infectious-disease vaccination-model article.,codex-cli-task5-fix3-reader-a-019f8284-4851-7cd3-a4ef-29b1cb23bfae,W01-BATCH-035,
PMID:40829919,1c516eb3fd1aed658407ae43911e8b2603780317a4cb45af16d750e2d8376b1e,include_diagnostic_or_correction_lead,guidance,I_DIAGNOSTIC_CORRECTION,This review synthesizes multi-source surveillance data and early-warning indicators to guide respiratory infectious-disease monitoring systems.,codex-cli-task5-fix3-reader-a-019f8284-4851-7cd3-a4ef-29b1cb23bfae,W01-BATCH-035,
PMID:40833110,165abb53135dc5bd18f8797f325fa3908344a6537c194250b64457ca44e76e2f,include_diagnostic_or_correction_lead,diagnostic,I_DIAGNOSTIC_CORRECTION,This study evaluates piggery-effluent and environmental-water testing as complementary surveillance tools for Japanese encephalitis outbreak detection.,codex-cli-task5-fix3-reader-a-019f8284-4851-7cd3-a4ef-29b1cb23bfae,W01-BATCH-035,
PMID:40845887,b4e40ce37ace58550e635e817e43f5506e262957d2b41c218a107bc9a3789ceb,include_applied_seed,applied_seed,I_APPLIED_TRANSFERABLE_DESIGN,This quasi-experimental study combines causal diagrams and propensity scores to estimate burial-intervention effects on Ebola transmission.,codex-cli-task5-fix3-reader-a-019f8284-4851-7cd3-a4ef-29b1cb23bfae,W01-BATCH-035,
PMID:40848364,f1e0d0a31fe010588576f42a7594bb9eb1d0ef16322c2d9256becb2181b38a2c,include_method_source_lead,method_source,I_METHOD_SOURCE,This study develops and evaluates an environmental genomic surveillance system for early identification and risk assessment of SARS-CoV-2 mutations.,codex-cli-task5-fix3-reader-a-019f8284-4851-7cd3-a4ef-29b1cb23bfae,W01-BATCH-035,
PMID:40854758,1d4e4c5bfbcee33032b61fb630a10c8081bb7fcda3aa509444102ef150658f5d,include_diagnostic_or_correction_lead,guidance,I_DIAGNOSTIC_CORRECTION,This article proposes and justifies a preparedness framework for rapid confirmation and response after emerging infectious-disease outbreaks.,codex-cli-task5-fix3-reader-a-019f8284-4851-7cd3-a4ef-29b1cb23bfae,W01-BATCH-035,
PMID:40857622,6c11a6acc3b71c1815dbba2ff05b6f09ace1940d37393204951ca70924724fb5,include_diagnostic_or_correction_lead,diagnostic,I_DIAGNOSTIC_CORRECTION,This study develops and compares corrections for pandemic-distorted outbreak alarm thresholds in surveillance.,codex-cli-task5-fix3-blind-019f82aa-9e7b-7180-bc24-d230938ebe65,W01-BATCH-035,
PMID:40862594,6bc47bc18e60627b0ad62fc8a69aad2843890d3a16cffebba78e09176dcd33c6,include_diagnostic_or_correction_lead,reproducibility,I_DIAGNOSTIC_CORRECTION,This study benchmarks commercial genomic relatedness pipelines for reproducible hospital outbreak detection.,codex-cli-task5-fix3-blind-019f82aa-9e7b-7180-bc24-d230938ebe65,W01-BATCH-035,
PMID:40871279,94bb98d1cd18f1aabfac085ab4f4410bf3e16e33652aa23bbeea612a75047855,include_applied_seed,applied_seed,I_APPLIED_TRANSFERABLE_DESIGN,This controlled school study evaluates rotating molecular screening as an early-warning strategy for asymptomatic SARS-CoV-2 infections.,codex-cli-task5-fix3-reader-a-019f8284-4851-7cd3-a4ef-29b1cb23bfae,W01-BATCH-035,
PMID:40876468,136acd2d31f8eab3001d4733d1a69beb954bb057f9f24a3eb9ab1d8eecbbb917,include_diagnostic_or_correction_lead,guidance,I_DIAGNOSTIC_CORRECTION,This Personal View provides implementation guidance for integrating rapid diagnostic tests into cholera surveillance and outbreak response.,codex-cli-task5-fix3-reader-a-019f8284-4851-7cd3-a4ef-29b1cb23bfae,W01-BATCH-035,
PMID:40896167,da6ee6561d5e30b5463accd7109b3bb48ee0342b8e63f86e6fe31111c361deec,include_diagnostic_or_correction_lead,guidance,I_DIAGNOSTIC_CORRECTION,This review applies the 7-1-7 framework to organize practical guidance for strengthening African outbreak detection capacity.,codex-cli-task5-fix3-reader-a-019f8284-4851-7cd3-a4ef-29b1cb23bfae,W01-BATCH-035,
PMID:40954021,2cc450d790f82e61ac8f9dac89c9006febae345c90eeaf6ba423e9b85794f48a,uncertain_retrieve_primary,,U_PRIMARY_RECORD_NEEDED,"The title indicates sewage monitoring, but the absent abstract prevents responsible assessment of the abridged publication's contribution.",codex-semantic-primary-035,W01-BATCH-035,
PMID:40965270,ead2970c54392818353780d64e77f4ae4c081ccf5f3fba5f7523ff5f9311c325,exclude,,X_NOT_INFECTIOUS_TRANSFERABLE,This review concerns postharvest fungal spoilage and food mycotoxins without a concrete infectious-disease application route.,codex-semantic-primary-035,W01-BATCH-035,
PMID:40972628,687049895a25a224d11e85f71ae3aeb26474b5f91e55a33cd4f89f89c5fc52a5,include_diagnostic_or_correction_lead,guidance,I_DIAGNOSTIC_CORRECTION,This review proposes a conceptual framework for applying artificial intelligence across infectious-disease research and practice.,codex-cli-task5-fix3-reader-a-019f8284-51b2-7a61-afd5-a78066b65bef,W01-BATCH-035,
PMID:40975107,acd47ba831b8708c4488f19dd125dcf94360f887a9d71412b3c572a7e2048003,include_diagnostic_or_correction_lead,guidance,I_DIAGNOSTIC_CORRECTION,This Personal View supplies a stepwise framework for integrating community-based zoonotic surveillance and response.,codex-cli-task5-fix3-reader-a-019f8284-51b2-7a61-afd5-a78066b65bef,W01-BATCH-035,
PMID:40976096,77d4b19cfe626767730c7b7ffc84a91da1b3f5e6350032f058fa08997592ead1,include_method_source_lead,method_source,I_METHOD_SOURCE,This study develops and independently evaluates interpretable machine-learning models for avian-influenza outbreak warning.,codex-cli-task5-fix3-reader-a-019f8284-51b2-7a61-afd5-a78066b65bef,W01-BATCH-035,
PMID:40979687,91527b6ff575aa260f426e61e7b7c1641ba812ac6fb0151757b073c0b283b2f0,include_applied_seed,applied_seed,I_APPLIED_TRANSFERABLE_DESIGN,This study derives district-specific climate indicators and lagged thresholds for cholera early warning.,codex-cli-task5-fix3-reader-a-019f8284-51b2-7a61-afd5-a78066b65bef,W01-BATCH-035,
PMID:40991673,aff5bdd9bf2a3ae9e033ebce8493202418c01d299f503ec4a8b2b4da22caf59e,include_simulation_or_mechanistic_lead,method_source,I_SIMULATION_MECHANISTIC,"This study evaluates epidemic early-warning statistics analytically, through stochastic simulations, and with COVID-19 data.",codex-cli-task5-fix3-reader-a-019f8284-51b2-7a61-afd5-a78066b65bef,W01-BATCH-035,
PMID:40997659,3ebcbd9f10d8daa4e18d057df6458106ad8f003996375e5df6de02d91ccd8896,include_simulation_or_mechanistic_lead,method_source,I_SIMULATION_MECHANISTIC,This study develops a GLM-GAM reproduction-number estimator and benchmarks it on simulated outbreaks.,codex-cli-task5-fix3-reader-a-019f8284-51b2-7a61-afd5-a78066b65bef,W01-BATCH-035,
PMID:40998432,5b170a0cb998f55882595153fb588d9c1e4b34dcf097c38f34b21ed5721b507e,include_method_source_lead,method_source,I_METHOD_SOURCE,"This study develops, retrospectively validates, and prospectively applies dengue epidemic alert thresholds.",codex-cli-task5-fix3-reader-a-019f8284-51b2-7a61-afd5-a78066b65bef,W01-BATCH-035,
PMID:40999867,9702963f4a639e9e61ecc37614b4c72d2a61d75366e9bf429770f6aaf6f993ce,include_diagnostic_or_correction_lead,guidance,I_DIAGNOSTIC_CORRECTION,This systematic review synthesizes methodological and implementation guidance for climate-informed vector-disease warning systems.,codex-cli-task5-fix3-reader-a-019f8284-51b2-7a61-afd5-a78066b65bef,W01-BATCH-035,
PMID:41017178,cc75b076341f221218c0b28dfd130aa124c6bd413b6329300d519279b4fb2948,include_applied_seed,applied_seed,I_APPLIED_TRANSFERABLE_DESIGN,The record develops unsupervised sepsis phenotypes and examines their reproducibility across multiple independent clinical datasets.,codex-cli-task5-fix4-reader-a-019f8330-bf5c-7c11-ae49-e8daabcce874,W01-BATCH-035,
PMID:41017782,73d4e20a0445cdcb9c7031f89bb3fcf984a71733b7118a5ca29872d529b20e41,include_method_source_lead,method_source,I_METHOD_SOURCE,This study develops and benchmarks a pretrained time-series framework for infectious-disease outbreak warning.,codex-cli-task5-fix3-reader-a-019f8284-51b2-7a61-afd5-a78066b65bef,W01-BATCH-035,
