candidate_key,source_row_sha256,primary_decision,primary_proposed_record_type,primary_reason_code,primary_reason,primary_reviewer,batch_id,retained_candidate_key
PMID:28454044,024a60281aef22d95255ce66ddc21744c9575a6d54480d392d8c0fb6315bc532,include_applied_seed,applied_seed,I_APPLIED_TRANSFERABLE_DESIGN,This interrupted time-series analysis evaluates unintended effects of methadone policy reform on heroin injection and HIV treatment outcomes.,codex-semantic-primary-A2,W01-BATCH-001,
PMID:28501989,7af9963bf4f3d4d7294987f866b19a26ed58a070651b223a7dc7f61217b9d400,include_simulation_or_mechanistic_lead,applied_seed,I_SIMULATION_MECHANISTIC,This mechanistic Candida study examines KIN28-mediated regulation of filamentation-associated expression and biofilm-related pathogenicity.,codex-semantic-primary-A2,W01-BATCH-001,
PMID:28600805,31ea410f3979c955dc89705cc7ba5dba7ac71539d9f07c82d2332a6334d6dffd,include_applied_seed,applied_seed,I_APPLIED_TRANSFERABLE_DESIGN,This outbreak policy evaluation uses segmented negative-binomial interrupted time-series models to assess a drug order's effects on injection-associated infections.,codex-semantic-primary-A2,W01-BATCH-001,
PMID:28607101,49bec1fba722729f3e50780843845108d61caa3e73083d80372d03a2704e81fb,include_simulation_or_mechanistic_lead,applied_seed,I_SIMULATION_MECHANISTIC,This mechanistic study identifies blood components that stimulate or neutralize Streptococcus intermedius intermedilysin activity and pathogenicity.,codex-semantic-primary-A2,W01-BATCH-001,
PMID:28640065,ae8f082dada886520d676f8f73922b09c5c473feaa566c4ba445344ae576242d,include_applied_seed,applied_seed,I_APPLIED_TRANSFERABLE_DESIGN,This controlled interrupted time-series study uses propensity scores and segmented regression to evaluate integrated HIV chronic-care implementation.,codex-semantic-primary-A2,W01-BATCH-001,
PMID:28641373,deea7c5f18f30f1889c79056fa5202c7500209f8adf90ae33f81da983bbc2a9e,include_method_source_lead,method_source,I_METHOD_SOURCE,This systematic review and meta-analysis evaluates whether alternative test-negative control groups alter influenza vaccine-effectiveness estimates.,codex-semantic-primary-A2,W01-BATCH-001,
PMID:28697765,a4f744b930947fa614fd1970daf5ab421bc73dc7bcee016fa860dbfd97c75c4b,include_applied_seed,applied_seed,I_APPLIED_TRANSFERABLE_DESIGN,This national interrupted time-series study evaluates over-the-counter drug deregulation using outpatient respiratory-infection visits as an outcome.,codex-semantic-primary-A2,W01-BATCH-001,
PMID:28806926,4e0c7fab7b50090ac41319e7aa55a1911a50de471147ba0f18c9caef65ae5dea,include_applied_seed,applied_seed,I_APPLIED_TRANSFERABLE_DESIGN,This insurance-data interrupted time-series evaluation examines HPV vaccine-associated direct and herd effects on anogenital wart incidence.,codex-semantic-primary-A2,W01-BATCH-001,
PMID:28829768,693a12d637e11a4c6c98379c7af5eb4a039dc016b25db2810aab356cd278c1e4,exclude,,X_NOT_INFECTIOUS_TRANSFERABLE,This negative-control parental-BMI study concerns offspring metabolic profiles without an infectious-disease application or concrete transfer route.,codex-semantic-primary-A2,W01-BATCH-001,
PMID:28844044,88b9d5a4a4b2a81446292191bcd9afcb18a83402132d28425c0bbc9821857356,include_applied_seed,applied_seed,I_APPLIED_TRANSFERABLE_DESIGN,This interrupted time-series analysis evaluates how successive gonorrhoea treatment guidelines changed adherence and antibiotic selection.,codex-semantic-primary-A2,W01-BATCH-001,
PMID:28855159,0d2fbf06e8c7ba1db31beca591c3ba360b3c00a24b8fc31867d6038dea03dc47,include_diagnostic_or_correction_lead,correction,I_DIAGNOSTIC_CORRECTION,This nationwide cohort uses injury admissions and vaccine-sequence comparisons as negative controls to diagnose healthy-vaccinee bias in nonspecific vaccine effects.,codex-semantic-primary-A2,W01-BATCH-001,
PMID:29020166,f1773bed2a2e041ccace5b7ea53a7fe03aa0e0b0e165bf912f0a2b0ecf7542f1,include_applied_seed,applied_seed,I_APPLIED_TRANSFERABLE_DESIGN,"This quasi-experimental interrupted time-series study assesses sustained educational stewardship effects on antimicrobial use, resistant bloodstream infections, and mortality.",codex-semantic-primary-A2,W01-BATCH-001,
PMID:29020828,4770f9ac7b036f643d119fc4612395d42bbcdad33ce9fc2e23e67c88fc7ca16f,include_applied_seed,applied_seed,I_APPLIED_TRANSFERABLE_DESIGN,This retrospective study uses hysterectomy as a comparison group in difference-in-differences estimation of cesarean antibiotic-prophylaxis timing and surgical infection.,codex-semantic-primary-A2,W01-BATCH-001,
PMID:29025108,d0d7ea85b4b0bfdbf7f5f63a8be078a34396e20120cfc8497eb12faff517c25b,exclude,,X_NOT_INFECTIOUS_TRANSFERABLE,This Mendelian-randomization study concerns lipid levels and macular degeneration without an infectious-disease application or concrete transfer route.,codex-semantic-primary-A2,W01-BATCH-001,
PMID:29029063,5cd855395a7fde00b9c67bc37759bcf6e00f67ce20521d62d238560640e0ddc0,include_applied_seed,applied_seed,I_APPLIED_TRANSFERABLE_DESIGN,This population ecological study uses nonpneumonia admissions as a difference-in-differences control to estimate pneumococcal vaccine program impact.,codex-semantic-primary-A2,W01-BATCH-001,
PMID:29048511,e9089a1227ce89816360ac848543b82e32f1b6807dc4984549dbd9fead4f2447,include_applied_seed,applied_seed,I_APPLIED_TRANSFERABLE_DESIGN,This multicenter interrupted time-series evaluation estimates national antibiotic-guideline implementation effects on pediatric respiratory prescribing.,codex-semantic-primary-A2,W01-BATCH-001,
PMID:29087989,468285a8daa5c2526f6d29212ec690620497f11ff7dec151c1cd5e9aea27c0de,include_applied_seed,applied_seed,I_APPLIED_TRANSFERABLE_DESIGN,This population study estimates direct and indirect childhood vaccination-program effects by modeling counterfactual cause-specific mortality burden.,codex-semantic-primary-A2,W01-BATCH-001,
PMID:29100898,ee9b5ef3a183548e400c587035ebbdb417519d2cd799cb2fefa87f72d07b5c02,include_method_source_lead,method_source,I_METHOD_SOURCE,This systematic review evaluates national and subnational infection-prevention interventions and their quasi-experimental evidence quality for WHO guidance.,codex-semantic-primary-A2,W01-BATCH-001,
PMID:29112066,c3d067c21d1427e0a6085554d3383a2fc95c140a1d7177ff1d74d847392b2630,include_method_source_lead,method_source,I_METHOD_SOURCE,This study emulates a target trial from HIV surveillance data to compare preconception antiretroviral regimens and adverse birth outcomes.,codex-semantic-primary-A2,W01-BATCH-001,
PMID:29161254,2b753f3eb9062906b042efc2c75326718ce815b9afcbdf134218784ad0035386,include_diagnostic_or_correction_lead,correction,I_DIAGNOSTIC_CORRECTION,This large tuberculosis cohort includes myocardial infarction and herpes zoster negative controls to assess residual confounding in lansoprazole associations.,codex-semantic-primary-A2,W01-BATCH-001,
PMID:29182641,14321ef320fe72a8fdcd8e94021e6cd214e657fc923f9c58b8238b0d6486c10e,include_applied_seed,applied_seed,I_APPLIED_TRANSFERABLE_DESIGN,This regression-discontinuity study estimates immediate ART eligibility effects on real-world HIV-care retention around a CD4 threshold.,codex-semantic-primary-A2,W01-BATCH-001,
PMID:29195716,001d5794f69ca2182620da7626b2dcab3b39c250047667c7961486ab96225344,include_applied_seed,applied_seed,I_APPLIED_TRANSFERABLE_DESIGN,This national surveillance study uses segmented Poisson interrupted time-series models to evaluate routine rotavirus-vaccination recommendation effects.,codex-semantic-primary-A2,W01-BATCH-001,
PMID:29238047,0e6c092a33c99c33731de4a7beda35ef0489659ff4fea9b32e11111f257ac661,exclude,,X_NOT_INFECTIOUS_TRANSFERABLE,This mechanistic glioblastoma study investigates oncogenic signaling rather than infectious disease and provides no concrete infectious transfer route.,codex-semantic-primary-A2,W01-BATCH-001,
PMID:29247095,fbfe4cb7ec932658a58d0bc4d566658527342279c7ed2798e27989d1d607e91e,exclude,,X_WRONG_RECORD_TYPE,This record is a protocol for a proposed primary-care HIV-testing implementation study and reports no completed evaluation findings.,codex-semantic-primary-A2,W01-BATCH-001,
PMID:29325870,36ed7d510cf84bb8e0e2cae5f0fe17da2b7b84d99b5b96af82936b701cd46015,include_applied_seed,applied_seed,I_APPLIED_TRANSFERABLE_DESIGN,This interrupted time-series study assesses an infectious-disease specialist stewardship bundle's long-term effects on antifungal use and costs.,codex-semantic-primary-A2,W01-BATCH-001,
PMID:29339298,bd29bfeb5af2c75a1a81d7c8fb13b99efc835e285381efc2c58e83f785d5fa96,include_applied_seed,applied_seed,I_APPLIED_TRANSFERABLE_DESIGN,This controlled interrupted time-series study evaluates audit-and-feedback stewardship in orthopaedics using a non-intervention comparison group.,codex-semantic-primary-A2,W01-BATCH-001,
PMID:29351491,6fcd9f241c30e55e78c5ff03eed7264c8d77ec09bf93f30d8a137defc9a63a29,include_applied_seed,applied_seed,I_APPLIED_TRANSFERABLE_DESIGN,This national surveillance interrupted time-series analysis evaluates pneumococcal conjugate vaccination using control diseases.,codex-semantic-primary-A2,W01-BATCH-001,
PMID:29373391,dd3bcefff2436f93b58265a20957cc4d9dbf4a1835cfafc3321d504416380061,include_applied_seed,applied_seed,I_APPLIED_TRANSFERABLE_DESIGN,This multiclinc interrupted time-series study examines whether integrating HIV care affected diabetes and hypertension care trajectories.,codex-semantic-primary-A2,W01-BATCH-001,
PMID:29375036,f744facf1ab6cbe52b096ca2b6e4cfc39e34ff4e05e6e7ee85905c4a49992514,include_applied_seed,applied_seed,I_APPLIED_TRANSFERABLE_DESIGN,This health-system interrupted time-series study estimates rotavirus vaccine impacts across care settings and socioeconomic strata.,codex-semantic-primary-A2,W01-BATCH-001,
PMID:29410029,312e0c6319fac1cfd1078519af4b2ea77b6a3ac7b72fd259c63d59dd1e58befb,include_applied_seed,applied_seed,I_APPLIED_TRANSFERABLE_DESIGN,"This controlled interrupted time-series analysis assesses long-term ICU antimicrobial-stewardship effects on use, resistance, costs, and clinical outcomes.",codex-semantic-primary-A2,W01-BATCH-001,
PMID:29451925,f70d3307a95590dd6fa00a696f8e627b16d53fff518323bed08bf0233eeddd23,include_applied_seed,applied_seed,I_APPLIED_TRANSFERABLE_DESIGN,This national interrupted time-series study estimates Option B policy effects on early infant HIV test positivity.,codex-semantic-primary-A2,W01-BATCH-001,
PMID:29580304,d52c737f9222ea6ce87b4b5a50b171fc4a36b0f9d140a386542a46e095e448cb,include_applied_seed,applied_seed,I_APPLIED_TRANSFERABLE_DESIGN,This multicomponent interrupted time-series evaluation estimates effects of discontinuing MRSA and VRE contact precautions amid other prevention interventions.,codex-semantic-primary-A2,W01-BATCH-001,
PMID:29584868,0927bdf351037dc0c5eb3e8e7924a6fb4c8073c23295c4f95291c5faec1ea8c7,include_method_source_lead,method_source,I_METHOD_SOURCE,This comparative HIV study contrasts regression discontinuity and inverse-probability-weighted marginal structural models to assess causal robustness.,codex-semantic-primary-A2,W01-BATCH-001,
PMID:29623242,7ec852da9d848b9c50eac56b7850315255fa126bbf2557795be22797c7cf7807,include_applied_seed,applied_seed,I_APPLIED_TRANSFERABLE_DESIGN,This syndromic-surveillance interrupted time-series analysis estimates how an Ebola case changed emergency-department demand and symptom presentations.,codex-semantic-primary-A2,W01-BATCH-001,
PMID:29629663,34d231513658987319d8625e92d872e1fb0c1434196957d238f9bf8b77d1c5ee,include_method_source_lead,method_source,I_METHOD_SOURCE,This HIV study compares conventional and noncompliance-adjusted instrumental-variable analyses to address treatment misclassification.,codex-semantic-primary-A2,W01-BATCH-001,
PMID:29659759,e249212aa267fa469ea62df2f9707c51f8961bb2b3584d3f88abd4c03fceb22c,exclude,,X_DESCRIPTIVE_ONLY,This matched clinical comparison reports Legionella outcomes in HIV-positive and HIV-negative patients without a transferable design contribution beyond ordinary matching.,codex-semantic-primary-A2,W01-BATCH-001,
PMID:29767681,fa34014c1f2868892546691f2ca94bc34558004eccbd969c6029595dd5a3e4b7,include_applied_seed,applied_seed,I_APPLIED_TRANSFERABLE_DESIGN,This regression-discontinuity study estimates guideline-driven tenofovir initiation effects on retention and treatment outcomes in HIV care.,codex-semantic-primary-A2,W01-BATCH-001,
PMID:29844230,fd222a5482df29292489e38a3a275a5bce2bb01399a6905abc6c93a8a0d7bcb0,include_applied_seed,applied_seed,I_APPLIED_TRANSFERABLE_DESIGN,This interrupted time-series study evaluates standardized perioperative urinary-catheter practices using postsurgical urinary tract infection and process measures.,codex-semantic-primary-A2,W01-BATCH-001,
PMID:29866733,a4f4637d1e087a9e1ad00592bd3d0ce4547c414834bffb0f2cede821cac926f8,exclude,,X_WRONG_RECORD_TYPE,This record is a pre-results protocol for evaluating a peripheral intravenous catheter tool and provides no completed infectious-disease findings.,codex-semantic-primary-A2,W01-BATCH-001,
PMID:29870531,1d306c7fb00393fc073b780b0869fba0649682e5558fcb48d4d9d850d44adeb6,include_applied_seed,applied_seed,I_APPLIED_TRANSFERABLE_DESIGN,This regression-discontinuity and instrumental-variable study estimates real-world HIV eligibility-expansion effects on ART initiation and retention.,codex-semantic-primary-A2,W01-BATCH-001,
PMID:29937243,77e325451d907e4552f26c52aa0a37e5f0be107578e097c0babcb42c7a781f9a,include_applied_seed,applied_seed,I_APPLIED_TRANSFERABLE_DESIGN,This national interrupted time-series analysis tests whether rotavirus vaccination changed seizure hospitalization trends in young children.,codex-semantic-primary-A2,W01-BATCH-001,
PMID:29945763,1c1695298cd1fdf12aa4ed8a7215f7dcd3bb7ee653ff162fabcf058b7671fa3c,include_applied_seed,applied_seed,I_APPLIED_TRANSFERABLE_DESIGN,This pediatric test-negative case-control study estimates age-specific and dose-specific quadrivalent influenza vaccine effectiveness.,codex-semantic-primary-A2,W01-BATCH-001,
PMID:29955785,2702fe67bb4114e669e85deac7dc217cb6ce640c71fbb383311ea7421af87ae7,include_applied_seed,applied_seed,I_APPLIED_TRANSFERABLE_DESIGN,This interrupted time-series study evaluates a national financial incentive for reducing antibiotic prescribing for respiratory infections.,codex-semantic-primary-A2,W01-BATCH-001,
PMID:30049623,2240c77e530d4aa1d592cf5507cf79eaefbb1728d28b2fd3ca1a2fd813219b76,include_applied_seed,applied_seed,I_APPLIED_TRANSFERABLE_DESIGN,This nationwide interrupted time-series surveillance study estimates PCV7 and PCV13 effects while detecting serotype replacement in pneumococcal meningitis.,codex-semantic-primary-A2,W01-BATCH-001,
PMID:30051357,573d1b323a9579a045ed1fc825b7cd9397f5c00630bf02917978821cf6313a45,include_applied_seed,applied_seed,I_APPLIED_TRANSFERABLE_DESIGN,This stewardship evaluation uses segmented regression to assess de-escalation guidance in high-risk neutropenia and associated safety outcomes.,codex-semantic-primary-A2,W01-BATCH-001,
PMID:30067408,9fc3c2d1493a1b7698e0b820288bbde818e4b2355c31c5ed6b55bb0314515945,exclude,,X_DESCRIPTIVE_ONLY,This matched HIV cohort estimates mortality associations using standard Cox regression without a distinct transferable design contribution.,codex-semantic-primary-A2,W01-BATCH-001,
PMID:30153786,e36528159e7496e63166d8e70ea03157256845ede26a9471d6b65360628781e6,include_applied_seed,applied_seed,I_APPLIED_TRANSFERABLE_DESIGN,"This ICU interrupted time-series study evaluates chlorhexidine washing against bloodstream infection, culture contamination, resistance acquisition, and C. difficile outcomes.",codex-semantic-primary-A2,W01-BATCH-001,
PMID:30188968,73345fc4a5c65d49949e0e26104b670433cc6e45f059f09898617bbe121f7d27,exclude,,X_NOT_INFECTIOUS_TRANSFERABLE,This study evaluates tax-credit receipt and general child health without an infectious-disease application or concrete infectious transfer route.,codex-semantic-primary-A2,W01-BATCH-001,
PMID:30204855,2a6139470cd50addff35b9b70896cb717aa41cd44c33e15a2a1416c6b3ef9d04,include_diagnostic_or_correction_lead,correction,I_DIAGNOSTIC_CORRECTION,This influenza study uses RSV as a negative-control outcome to support the inference that vaccine effectiveness wanes within a season.,codex-semantic-primary-A2,W01-BATCH-001,
PMID:30218959,c21a26ad8f451b892f40dae9eb09e19910c58cb6fed380913b92bdc9064ad8d9,include_applied_seed,applied_seed,I_APPLIED_TRANSFERABLE_DESIGN,This sepsis cohort uses hospital of admission as an instrumental variable to estimate the relative mortality effects of early goal-directed therapy components.,codex-semantic-primary-A2,W01-BATCH-001,
PMID:30253905,50d26af3f45ec29508c8b9f7e5921691da693e99e726695430b2b5d1cdee90e6,include_applied_seed,applied_seed,I_APPLIED_TRANSFERABLE_DESIGN,This hospital interrupted time-series study evaluates cohorting for prevention of multidrug-resistant bacterial acquisition outside an outbreak.,codex-semantic-primary-A2,W01-BATCH-001,
PMID:30285980,2fd4654dfec4e741a1409b9f6adbceaf824a45b089eabca33bf0738fe9a42f49,include_applied_seed,applied_seed,I_APPLIED_TRANSFERABLE_DESIGN,"This prospective neonatal ICU interrupted time-series study evaluates targeted stewardship effects on antibiotic exposure, resistance, and safety outcomes.",codex-semantic-primary-A2,W01-BATCH-001,
PMID:30334161,7b04e9cdb30922dd815acc79be3367c7c29c09c9bf78d28a89bc97534e96878c,include_applied_seed,applied_seed,I_APPLIED_TRANSFERABLE_DESIGN,This colorectal-surgery study uses difference-in-differences against national trends to evaluate enhanced recovery effects including surgical-site infection.,codex-semantic-primary-A2,W01-BATCH-001,
PMID:30334918,c206ca8415a9f79e658aa85786d2c4d9069d7a414984ccb74e1a89678a75a207,include_method_source_lead,method_source,I_METHOD_SOURCE,This paper evaluates synthetic-control performance under sparse vaccine-impact data and develops an STL-plus-PCA alternative with simulation validation.,codex-semantic-primary-A2,W01-BATCH-001,
PMID:30338170,2c51822a4b492c06aafd3264ecd23e9aaa4c3c7f9a885b8a14f2d0552ff6c2ac,include_applied_seed,applied_seed,I_APPLIED_TRANSFERABLE_DESIGN,This interrupted time-series study stratifies by disaster impact intensity to estimate Hurricane Sandy's disruption of HIV testing.,codex-semantic-primary-A2,W01-BATCH-001,
PMID:30346524,48ab8a11ac86a0ff43da12c82a822ac8fbebf13ff72399b7bdc291247fc70195,include_diagnostic_or_correction_lead,guidance,I_DIAGNOSTIC_CORRECTION,"This review explains strengths, limitations, and appropriate use of quasi-experimental designs for vaccine evaluation.",codex-semantic-primary-A2,W01-BATCH-001,
PMID:30420839,6a176b9e5f7c9fe9ad208aca464944973f29381844594e81f9a9250ee313e75c,include_simulation_or_mechanistic_lead,applied_seed,I_SIMULATION_MECHANISTIC,This mechanistic Pseudomonas study identifies an sRNA that represses RpoS and thereby regulates stress and virulence pathways.,codex-semantic-primary-A2,W01-BATCH-001,
PMID:30457518,4567b07bcb6a917a64f5c85265dce89f96c4ed2ada48b4b4cb249455a4468227,include_applied_seed,applied_seed,I_APPLIED_TRANSFERABLE_DESIGN,This interrupted time-series study uses the rest of New York State as a comparator to evaluate restaurant letter-grade effects on Salmonella infections.,codex-semantic-primary-A2,W01-BATCH-001,
PMID:30475989,63d156a2c125e35d1862b02adcaabd04b55e4798aebdd68933909f26bad2289e,include_method_source_lead,method_source,I_METHOD_SOURCE,This systematic review reanalyzes quasi-experimental infection-control studies as interrupted time series and assesses their methodological quality.,codex-semantic-primary-A2,W01-BATCH-001,
PMID:30584631,a6e294c88e3875bc3d4db7971d7e32cfe2cdf6bc0a855e14ddbbdcb0a8edcf61,include_diagnostic_or_correction_lead,diagnostic,I_DIAGNOSTIC_CORRECTION,This quality-improvement study uses interrupted time series and process-control methods to reduce pediatric blood-culture contamination and unnecessary cultures.,codex-semantic-primary-A2,W01-BATCH-001,
PMID:30590491,9b32c3bab411eec77e70136b8b54253696c680dbf5ca3e888ca06f71ee118c81,include_method_source_lead,method_source,I_METHOD_SOURCE,This systematic review and meta-analysis evaluates interrupted time-series evidence on chickenpox vaccination and population herpes-zoster trends.,codex-semantic-primary-A2,W01-BATCH-001,
PMID:30590539,f6a8544370c8525df71f8676bcddbe2a677f438fe89febe30d1f8c9842a2651c,include_applied_seed,applied_seed,I_APPLIED_TRANSFERABLE_DESIGN,This comparative interrupted time-series analysis evaluates whether adding maternal-child tasks altered HIV community-health-worker service delivery.,codex-semantic-primary-A2,W01-BATCH-001,
PMID:30620515,917b906fa44ab1b23fccecaf39b10cdbc7728d44d393baafd77bb8973b4ee6f5,include_method_source_lead,method_source,I_METHOD_SOURCE,This paper applies regression discontinuity to a population policy and explicitly examines chest infections among the health outcomes potentially affected by household temperature.,codex-semantic-primary-A2,W01-BATCH-001,
PMID:30661838,0eb8973aec689e51da212b8457021e713b4393bbf4a15472a57ae1c93cd0841a,exclude,,X_COMMENTARY_ONLY,This letter provides no abstract or substantive methodological content beyond its title.,codex-semantic-primary-A2,W01-BATCH-001,
PMID:30683242,77a79b9eb93069aec8179105ac40c9e563b898c31b642829d1cb651be95eec34,include_method_source_lead,method_source,I_METHOD_SOURCE,This vaccine-impact study evaluates a synthetic-control approach across socioeconomic strata to estimate PCV effects on childhood pneumonia mortality.,codex-semantic-primary-A2,W01-BATCH-001,
PMID:30689889,f187de5b86846724f219c0e3675706ab0c3b202e7bf63321172d2aa9e9f71545,include_applied_seed,applied_seed,I_APPLIED_TRANSFERABLE_DESIGN,This national interrupted time-series analysis estimates changes in primary-care antibiotic prescribing following England's antimicrobial-resistance strategy.,codex-semantic-primary-A2,W01-BATCH-001,
PMID:30745146,8fcbf011dd5036ed6dd300dc0d8d8d900ea3c6f93ec178a8ae0162d4428156ae,include_method_source_lead,method_source,I_METHOD_SOURCE,This large influenza study applies instrumental-variable Poisson regression to estimate comparative effectiveness of high-dose versus standard-dose vaccination.,codex-semantic-primary-A2,W01-BATCH-001,
PMID:30753368,54190c13c5c49376c603e1645364427170397490eb4291e33dac54cd68ba7769,include_applied_seed,applied_seed,I_APPLIED_TRANSFERABLE_DESIGN,This population surveillance study applies alternative interrupted time-series models to estimate programmatic rotavirus-vaccine impact in Bangladesh.,codex-semantic-primary-A2,W01-BATCH-001,
PMID:30763389,c5d6d4ebb550ee3e7693a3290bacb160c218ef27c967c5aaf9640186d28b2966,include_method_source_lead,method_source,I_METHOD_SOURCE,This multicountry study uses child age at first campaign as an instrument to estimate supplementary immunization activities' effects on routine vaccination.,codex-semantic-primary-A2,W01-BATCH-001,
PMID:30784634,e4c602711c7a308326e6ef949a2ae6083a3c6b821a1bcbc99c56c18dd9c51c39,include_applied_seed,applied_seed,I_APPLIED_TRANSFERABLE_DESIGN,This population-linked interrupted time-series analysis estimates PCV10 effects on radiologically confirmed and clinically defined childhood pneumonia in Kenya.,codex-semantic-primary-A2,W01-BATCH-001,
PMID:30850252,a3326404b6ee319752ae46c45937fba19691b20bb996261763f2ea5e428f0c4e,include_applied_seed,applied_seed,I_APPLIED_TRANSFERABLE_DESIGN,This sequential interrupted time-series study evaluates syndrome-specific stewardship interventions for fluoroquinolone use and resistant pathogen susceptibility.,codex-semantic-primary-A2,W01-BATCH-001,
PMID:30850420,40538d24337e70f43a66ec73a338cb02637207c1e371bd8a466a24220ec1a0d0,exclude,,X_WRONG_RECORD_TYPE,This record is a protocol for a proposed migrant infectious-disease screening evaluation and does not report completed study findings.,codex-semantic-primary-A2,W01-BATCH-001,
