candidate_key,source_row_sha256,final_decision,final_proposed_record_type,final_reason_code,title,year,authors,abstract,search_ids,preliminary_families,source_url,provisional_concept_label,provisional_canonical_name,provisional_family,routing_evidence,routing_status
PMID:33523787,05a71cd897d452fb222f5adb0ac89c5c8bdc1744fe32d940909a63d8848351d1,include_simulation_or_mechanistic_lead,applied_seed,I_SIMULATION_MECHANISTIC,Metapopulation Structure Predicts Population Dynamics in the Cakile maritima-Alternaria brassicicola Host-Pathogen Interaction.,2021,Julien Papaïx; Jeremy J Burdon; Emily Walker; Luke G Barrett; Peter H Thrall,"AbstractIn symbiotic interactions, spatiotemporal variation in the distribution or population dynamics of one species represents spatial and temporal heterogeneity of the landscape for the other. Such interdependent demographic dynamics result in situations where the relative importance of biotic and abiotic factors in determining ecological processes is complicated to decipher. Using a detailed survey of three metapopulations of the succulent plant Cakile maritima and the necrotrophic fungus Alternaria brassicicola located along the southeastern Australian coast, we developed a series of statistical analyses-namely, synchrony analysis, patch occupancy dynamics, and a spatially explicit metapopulation model-to understand how habitat quality, weather conditions, dispersal, and spatial structure determine metapopulation dynamics. Climatic conditions are important drivers, likely explaining the high synchrony among populations. Host availability, landscape features facilitating dispersal, and habitat conditions also impact the occurrence and spread of disease. Overall, we show that the collection of extensive data on host and pathogen population dynamics, in combination with spatially explicit epidemiological modeling, makes it possible to accurately predict disease dynamics-even when there is extreme variability in host population dynamics. Finally, we discuss the importance of genetic information for predicting demographic dynamics in this pathosystem.",SEARCH-20260720-PUBMED-FAMILY-SPATIAL-01,spatial_transmission,https://pubmed.ncbi.nlm.nih.gov/33523787/,metapopulation_models,Metapopulation transmission models,spatial_transmission,title and complete available abstract,pending_independent_semantic_review
PMID:34035424,cd132b2d13e7074416a16667e128f2db3bb87716de6214dddb903b66137d5b4d,include_simulation_or_mechanistic_lead,applied_seed,I_SIMULATION_MECHANISTIC,The dynamics of evolutionary rescue from a novel pathogen threat in a host metapopulation.,2021,Jing Jiao; Nina Fefferman,"When a novel disease strikes a naïve host population, there is evidence that the most immediate response can involve host evolution while the pathogen remains relatively unchanged. When hosts also live in metapopulations, there may be critical differences in the dynamics that emerge from the synergy among evolutionary, ecological, and epidemiological factors. Here we used a Susceptible-Infected-Recovery model to explore how spatial and temporal ecological factors may drive the epidemiological and rapid-evolutionary dynamics of host metapopulations. For simplicity, we assumed two host genotypes: wild type, which has a positive intrinsic growth rate in the absence of disease, and robust type, which is less likely to catch the infection given exposure but has a lower intrinsic growth rate in the absence of infection. We found that the robust-type host would be strongly selected for in the presence of disease when transmission differences between the two types is large. The growth rate of the wild type had dual but opposite effects on host composition: a smaller increase in wild-type growth increased wild-type competition and lead to periodical disease outbreaks over the first generations after pathogen introduction, while larger growth increased disease by providing more susceptibles, which increased robust host density but decreased periodical outbreaks. Increased migration had a similar impact as the increased differential susceptibility, both of which led to an increase in robust hosts and a decrease in periodical outbreaks. Our study provided a comprehensive understanding of the combined effects among migration, disease epidemiology, and host demography on host evolution with an unchanging pathogen. The findings have important implications for wildlife conservation and zoonotic disease control.",SEARCH-20260720-PUBMED-FAMILY-SPATIAL-01,spatial_transmission,https://pubmed.ncbi.nlm.nih.gov/34035424/,metapopulation_models,Metapopulation transmission models,spatial_transmission,title and complete available abstract,pending_independent_semantic_review
PMID:34040209,524318813f117e3a85659e8d476871c41cc6cf83b710e312b13e547d5806e404,include_method_source_lead,method_source,I_METHOD_SOURCE,The universal visitation law of human mobility.,2021,Markus Schläpfer; Lei Dong; Kevin O'Keeffe; Paolo Santi; Michael Szell; Hadrien Salat; Samuel Anklesaria; Mohammad Vazifeh; Carlo Ratti; Geoffrey B West,"Human mobility impacts many aspects of a city, from its spatial structure1-3 to its response to an epidemic4-7. It is also ultimately key to social interactions8, innovation9,10 and productivity11. However, our quantitative understanding of the aggregate movements of individuals remains incomplete. Existing models-such as the gravity law12,13 or the radiation model14-concentrate on the purely spatial dependence of mobility flows and do not capture the varying frequencies of recurrent visits to the same locations. Here we reveal a simple and robust scaling law that captures the temporal and spatial spectrum of population movement on the basis of large-scale mobility data from diverse cities around the globe. According to this law, the number of visitors to any location decreases as the inverse square of the product of their visiting frequency and travel distance. We further show that the spatio-temporal flows to different locations give rise to prominent spatial clusters with an area distribution that follows Zipf's law15. Finally, we build an individual mobility model based on exploration and preferential return to provide a mechanistic explanation for the discovered scaling law and the emerging spatial structure. Our findings corroborate long-standing conjectures in human geography (such as central place theory16 and Weber's theory of emergent optimality10) and allow for predictions of recurrent flows, providing a basis for applications in urban planning, traffic engineering and the mitigation of epidemic diseases.",SEARCH-20260720-PUBMED-VENUE-SPATIAL-01,spatial_transmission,https://pubmed.ncbi.nlm.nih.gov/34040209/,gravity_radiation_mobility_models,"Gravity, radiation, and mobility models",spatial_transmission,title and complete available abstract,pending_independent_semantic_review
PMID:34102084,4c08cdd4510edc5ed289cca083694b0e7f65ab05bda700cf17a5efc5fb7667c2,include_simulation_or_mechanistic_lead,method_source,I_SIMULATION_MECHANISTIC,Inferring environmental transmission using phylodynamics: a case-study using simulated evolution of an enteric pathogen.,2021,Daniel Dawson; David Rasmussen; Xinxia Peng; Cristina Lanzas,"Indirect (environmental) and direct (host-host) transmission pathways cannot easily be distinguished when they co-occur in epidemics, particularly when they occur on similar time scales. Phylodynamic reconstruction is a potential approach to this problem that combines epidemiological information (temporal, spatial information) with pathogen whole-genome sequencing data to infer transmission trees of epidemics. However, factors such as differences in mutation and transmission rates between host and non-host environments may obscure phylogenetic inference from these methods. In this study, we used a network-based transmission model that explicitly models pathogen evolution to simulate epidemics with both direct and indirect transmission. Epidemics were simulated according to factorial combinations of direct/indirect transmission proportions, host mutation rates and conditions of environmental pathogen growth. Transmission trees were then reconstructed using the phylodynamic approach SCOTTI (structured coalescent transmission tree inference) and evaluated. We found that although insufficient diversity sets a lower bound on when accurate phylodynamic inferences can be made, transmission routes and assumed pathogen lifestyle affected pathogen population structure and subsequently influenced both reconstruction success and the likelihood of direct versus indirect pathways being reconstructed. We conclude that prior knowledge of the likely ecology and population structure of pathogens in host and non-host environments is critical to fully using phylodynamic techniques.",SEARCH-20260720-PUBMED-FAMILY-SPATIAL-02,spatial_transmission,https://pubmed.ncbi.nlm.nih.gov/34102084/,contact_network_models,Contact-network transmission models,spatial_transmission,title and complete available abstract,pending_independent_semantic_review
PMID:34559043,5deddf5c2e6e2d7db5bcaba1df8b04c85e2bbf67024daa8f9752957eff72743a,include_method_source_lead,method_source,I_METHOD_SOURCE,Different evolutionary trends form the twilight zone of the bacterial pan-genome.,2021,Gal Horesh; Alyce Taylor-Brown; Stephanie McGimpsey; Florent Lassalle; Jukka Corander; Eva Heinz; Nicholas R Thomson,"The pan-genome is defined as the combined set of all genes in the gene pool of a species. Pan-genome analyses have been very useful in helping to understand different evolutionary dynamics of bacterial species: an open pan-genome often indicates a free-living lifestyle with metabolic versatility, while closed pan-genomes are linked to host-restricted, ecologically specialized bacteria. A detailed understanding of the species pan-genome has also been instrumental in tracking the phylodynamics of emerging drug resistance mechanisms and drug-resistant pathogens. However, current approaches to analyse a species' pan-genome do not take the species population structure into account, nor do they account for the uneven sampling of different lineages, as is commonplace due to over-sampling of clinically relevant representatives. Here we present the application of a population structure-aware approach for classifying genes in a pan-genome based on within-species distribution. We demonstrate our approach on a collection of 7500 Escherichia coli genomes, one of the most-studied bacterial species and used as a model for an open pan-genome. We reveal clearly distinct groups of genes, clustered by different underlying evolutionary dynamics, and provide a more biologically informed and accurate description of the species' pan-genome.",SEARCH-20260720-PUBMED-FAMILY-SPATIAL-02,spatial_transmission,https://pubmed.ncbi.nlm.nih.gov/34559043/,ecological_niche_species_distribution,Ecological-niche and species-distribution models,spatial_transmission,title and complete available abstract,pending_independent_semantic_review
PMID:34695837,25289ce6d7a66e537698f37312577349e797a9df7782df43160349c217c745d5,include_simulation_or_mechanistic_lead,applied_seed,I_SIMULATION_MECHANISTIC,Cryptic transmission of SARS-CoV-2 and the first COVID-19 wave.,2021,Jessica T Davis; Matteo Chinazzi; Nicola Perra; Kunpeng Mu; Ana Pastore Y Piontti; Marco Ajelli; Natalie E Dean; Corrado Gioannini; Maria Litvinova; Stefano Merler; Luca Rossi; Kaiyuan Sun; Xinyue Xiong; Ira M Longini; M Elizabeth Halloran; Cécile Viboud; Alessandro Vespignani,"Considerable uncertainty surrounds the timeline of introductions and onsets of local transmission of severe acute respiratory syndrome coronavirus 2 (SARS-CoV-2) globally1-7. Although a limited number of SARS-CoV-2 introductions were reported in January and February 2020 (refs.8,9), the narrowness of the initial testing criteria, combined with a slow growth in testing capacity and porous travel screening10, left many countries vulnerable to unmitigated, cryptic transmission. Here we use a global metapopulation epidemic model to provide a mechanistic understanding of the early dispersal of infections and the temporal windows of the introduction of SARS-CoV-2 and onset of local transmission in Europe and the USA. We find that community transmission of SARS-CoV-2 was likely to have been present in several areas of Europe and the USA by January 2020, and estimate that by early March, only 1 to 4 in 100 SARS-CoV-2 infections were detected by surveillance systems. The modelling results highlight international travel as the key driver of the introduction of SARS-CoV-2, with possible introductions and transmission events as early as December 2019 to January 2020. We find a heterogeneous geographic distribution of cumulative infection attack rates by 4 July 2020, ranging from 0.78% to 15.2% across US states and 0.19% to 13.2% in European countries. Our approach complements phylogenetic analyses and other surveillance approaches and provides insights that can be used to design innovative, model-driven surveillance systems that guide enhanced testing and response strategies.",SEARCH-20260720-PUBMED-VENUE-SPATIAL-01,spatial_transmission,https://pubmed.ncbi.nlm.nih.gov/34695837/,metapopulation_models,Metapopulation transmission models,spatial_transmission,title and complete available abstract,pending_independent_semantic_review
PMID:34735483,f3b96eb985b3a5b67bb6b6a224bee1fb83c1570883b47b82fc48f3c1b176103b,include_diagnostic_or_correction_lead,diagnostic,I_DIAGNOSTIC_CORRECTION,Based on improved deep convolutional neural network model pneumonia image classification.,2021,Lingzhi Kong; Jinyong Cheng,"Pneumonia remains the leading infectious cause of death in children under the age of five, killing about 700,000 children each year and affecting 7% of the world's population. X-ray images of lung become the key to the diagnosis of this disease, skilled doctors in the diagnosis of a certain degree of subjectivity, if the use of computer-aided medical diagnosis to automatically detect lung abnormalities, will improve the accuracy of diagnosis. This research aims to introduce a deep learning technology based on the combination of Xception neural network and long-term short-term memory (LSTM), which can realize automatic diagnosis of patients with pneumonia in X-ray images. First, the model uses the Xception network to extract the deep features of the data, passes the extracted features to the LSTM, and then the LSTM detects the extracted features, and finally selects the most needed features. Secondly, in the training set samples, the traditional cross-entropy loss cannot more balance the mismatch between categories. Therefore, this research combines Pearson's feature selection ideas, fusion of the correlation between the two loss functions, and optimizes the problem. The experimental results show that the accuracy rate of this paper is 96%, the receiver operator characteristic curve accuracy rate is 99%, the precision rate is 98%, the recall rate is 91%, and the F1 score accuracy rate is 94%. Compared with the existing technical methods, the research has achieved expected results on the currently available datasets. And assist doctors to provide higher reliability in the classification task of childhood pneumonia.",SEARCH-20260720-PUBMED-FAMILY-SPATIAL-01,spatial_transmission,https://pubmed.ncbi.nlm.nih.gov/34735483/,contact_network_models,Contact-network transmission models,spatial_transmission,title and complete available abstract,pending_independent_semantic_review
PMID:34772925,a61e69a95ab9ac7f6264d9782a294e69ab8e738d89a576e9e3a91c609868b35d,include_method_source_lead,method_source,I_METHOD_SOURCE,A Deep Gravity model for mobility flows generation.,2021,Filippo Simini; Gianni Barlacchi; Massimilano Luca; Luca Pappalardo,"The movements of individuals within and among cities influence critical aspects of our society, such as well-being, the spreading of epidemics, and the quality of the environment. When information about mobility flows is not available for a particular region of interest, we must rely on mathematical models to generate them. In this work, we propose Deep Gravity, an effective model to generate flow probabilities that exploits many features (e.g., land use, road network, transport, food, health facilities) extracted from voluntary geographic data, and uses deep neural networks to discover non-linear relationships between those features and mobility flows. Our experiments, conducted on mobility flows in England, Italy, and New York State, show that Deep Gravity achieves a significant increase in performance, especially in densely populated regions of interest, with respect to the classic gravity model and models that do not use deep neural networks or geographic data. Deep Gravity has good generalization capability, generating realistic flows also for geographic areas for which there is no data availability for training. Finally, we show how flows generated by Deep Gravity may be explained in terms of the geographic features and highlight crucial differences among the three considered countries interpreting the model's prediction with explainable AI techniques.",SEARCH-20260720-PUBMED-FAMILY-SPATIAL-01,spatial_transmission,https://pubmed.ncbi.nlm.nih.gov/34772925/,gravity_radiation_mobility_models,"Gravity, radiation, and mobility models",spatial_transmission,title and complete available abstract,pending_independent_semantic_review
PMID:34831960,7b9635700d3d2fa91901a23ea6e4f98d471ccb662bf13f5a3bfe6c5ac7dbbd88,include_diagnostic_or_correction_lead,diagnostic,I_DIAGNOSTIC_CORRECTION,A Hybrid Convolutional Neural Network Model for Diagnosis of COVID-19 Using Chest X-ray Images.,2021,Prabhjot Kaur; Shilpi Harnal; Rajeev Tiwari; Fahd S Alharithi; Ahmed H Almulihi; Irene Delgado Noya; Nitin Goyal,"COVID-19 declared as a pandemic that has a faster rate of infection and has impacted the lives and the country's economy due to forced lockdowns. Its detection using RT-PCR is required long time and due to which its infection has grown exponentially. This creates havoc for the shortage of testing kits in many countries. This work has proposed a new image processing-based technique for the health care systems named ""C19D-Net"", to detect ""COVID-19"" infection from ""Chest X-Ray"" (XR) images, which can help radiologists to improve their accuracy of detection COVID-19. The proposed system extracts deep learning (DL) features by applying the InceptionV4 architecture and Multiclass SVM classifier to classify and detect COVID-19 infection into four different classes. The dataset of 1900 Chest XR images has been collected from two publicly accessible databases. Images are pre-processed with proper scaling and regular feeding to the proposed model for accuracy attainments. Extensive tests are conducted with the proposed model (""C19D-Net"") and it has succeeded to achieve the highest COVID-19 detection accuracy as 96.24% for 4-classes, 95.51% for three-classes, and 98.1% for two-classes. The proposed method has outperformed well in expressions of ""precision"", ""accuracy"", ""F1-score"" and ""recall"" in comparison with most of the recent previously published methods. As a result, for the present situation of COVID-19, the proposed ""C19D-Net"" can be employed in places where test kits are in short supply, to help the radiologists to improve their accuracy of detection of COVID-19 patients through XR-Images.",SEARCH-20260720-PUBMED-FAMILY-SPATIAL-01,spatial_transmission,https://pubmed.ncbi.nlm.nih.gov/34831960/,contact_network_models,Contact-network transmission models,spatial_transmission,title and complete available abstract,pending_independent_semantic_review
PMID:34959547,14ccf967c94593977e27849586dd265b05d40c8c40055c794581e9241d6be248,include_simulation_or_mechanistic_lead,applied_seed,I_SIMULATION_MECHANISTIC,Disruption of Metapopulation Structure Reduces Tasmanian Devil Facial Tumour Disease Spread at the Expense of Abundance and Genetic Diversity.,2021,Rowan Durrant; Rodrigo Hamede; Konstans Wells; Miguel Lurgi,"Metapopulation structure plays a fundamental role in the persistence of wildlife populations. It can also drive the spread of infectious diseases and transmissible cancers such as the Tasmanian devil facial tumour disease (DFTD). While disrupting this structure can reduce disease spread, it can also impair host resilience by disrupting gene flow and colonisation dynamics. Using an individual-based metapopulation model we investigated the synergistic effects of host dispersal, disease transmission rate and inter-individual contact distance for transmission, on the spread and persistence of DFTD from local to regional scales. Disease spread, and the ensuing population declines, are synergistically determined by individuals' dispersal, disease transmission rate and within-population mixing. Transmission rates can be magnified by high dispersal and inter-individual transmission distance. The isolation of local populations effectively reduced metapopulation-level disease prevalence but caused severe declines in metapopulation size and genetic diversity. The relative position of managed (i.e., isolated) local populations had a significant effect on disease prevalence, highlighting the importance of considering metapopulation structure when implementing metapopulation-scale disease control measures. Our findings suggest that population isolation is not an ideal management method for preventing disease spread in species inhabiting already fragmented landscapes, where genetic diversity and extinction risk are already a concern.",SEARCH-20260720-PUBMED-FAMILY-SPATIAL-01,spatial_transmission,https://pubmed.ncbi.nlm.nih.gov/34959547/,metapopulation_models,Metapopulation transmission models,spatial_transmission,title and complete available abstract,pending_independent_semantic_review
PMID:34997974,236f43803dced79d2a4ab9de0c2c77f601e49f182a7e65112aec853ab7e4a44c,include_applied_seed,applied_seed,I_APPLIED_TRANSFERABLE_DESIGN,The relationship between pathogen life-history traits and metapopulation dynamics.,2022,Laura J A van Dijk; Johan Ehrlén; Ayco J M Tack,"Plant pathogen traits, such as transmission mode and overwintering strategy, may have important effects on dispersal and persistence, and drive disease dynamics. Still, we lack insights into how life-history traits influence spatiotemporal disease dynamics. We adopted a multifaceted approach, combining experimental assays, theory and field surveys, to investigate whether information about two pathogen life-history traits - infectivity and overwintering strategy - can predict pathogen metapopulation dynamics in natural systems. For this, we focused on four fungal pathogens (two rust fungi, one chytrid fungus and one smut fungus) on the forest herb Anemone nemorosa. Pathogens infecting new plants mostly via spores (the chytrid and smut fungi) had higher patch occupancies and colonization rates than pathogens causing mainly systemic infections and overwintering in the rhizomes (the two rust fungi). Although the rust fungi more often occupied well-connected plant patches, the chytrid and smut fungi were equally or more common in isolated patches. Host patch size was positively related to patch occupancy and colonization rates for all pathogens. Predicting disease dynamics is crucial for understanding the ecological and evolutionary dynamics of host-pathogen interactions, and to prevent disease outbreaks. Our study shows that combining experiments, theory and field observations is a useful way to predict disease dynamics.",SEARCH-20260720-PUBMED-FAMILY-SPATIAL-01,spatial_transmission,https://pubmed.ncbi.nlm.nih.gov/34997974/,metapopulation_models,Metapopulation transmission models,spatial_transmission,title and complete available abstract,pending_independent_semantic_review
