candidate_key,source_row_sha256,final_decision,final_proposed_record_type,final_reason_code,title,year,authors,abstract,search_ids,preliminary_families,source_url,provisional_concept_label,provisional_canonical_name,provisional_family,routing_evidence,routing_status
PMID:41192916,89c02c8dc867b1b143f464766a6fd25852856f8f419fd71fe3d3eb7772371f00,include_applied_seed,applied_seed,I_APPLIED_TRANSFERABLE_DESIGN,Predicting intramammary infections in non-lactating dairy cows using dairy herd improvement somatic cell count data for developing infection control benchmarks.,2026,Hiroshi Yamamoto; Yoshihiko Sentoku; Hayato Abe; Toshihiro Sasaka; Tomomi Kurumisawa; Kazuhiro Kawai,"This study investigated the relationship between herd average annual somatic cell count (Herd SCC) and epidemiological indicators of intramammary infection (IMI) in the nonlactating period. We also aimed to establish a predictive model and benchmark based on epidemiological indicators of non-lactating IMI (IMI indicators) for a dairy herd in Hokkaido, Japan. Individual SCC data were extracted from 3 years of dairy herd improvement (DHI) data from 3,173 dairy farms in Hokkaido, and three IMI indicators were calculated: first-calving cow infection rate (FCIR) from first-time DHI results, dry cow cure rate (DCR), and dry cow new infection rate (DNIR) based on pre- and postpartum DHI results. A SCC of ≥200,000 cells/mL in individual cows was defined as IMI, and IMI indicators were then calculated. Dairy farms were classified into five levels based on the Herd SCC shown in the DHI data. Significant correlations were observed between Herd SCC and all IMI indicators ( ρ =0.37-0.44). The correlations suggested significant positive relationships between Herd SCC, and average FCIR and average DNIR, respectively, and a significant negative relationship between Herd SCC and average DCR. Generalized linear model analysis confirmed the significance of the correlation between Herd SCC and IMI indicators, even after adjusting for environmental and management factors, such as housing system (P<0.01). By comparing the benchmarks obtained in this study, dairy farmers can achieve IMI control through appropriate management in the non-lactating period based on target values for improvement, depending on Herd SCC.",SEARCH-20260720-PUBMED-FAMILY-SIMULATION-01,simulation_methods,https://pubmed.ncbi.nlm.nih.gov/41192916/,simulation_methodological_evaluation,Other simulation-based methodological evaluation,simulation_methods,title and complete available abstract,pending_independent_semantic_review
PMID:41205330,c4f958136c1f27c805c9aca616d5a68aaca23c0a65cd1c5334dd565c21b533b5,include_diagnostic_or_correction_lead,guidance,I_DIAGNOSTIC_CORRECTION,"Making waves: Moving beyond the 1 in 10,000 benchmark in quantitative microbial risk assessment (QMRA) through evidence-informed risk approaches and systems decision-making.",2026,Kerry A Hamilton; Hunter Quon; Nicholas J Ashbolt; Patrick L Gurian; Eva Reynaert; Charles N Haas; Eberhard Morgenroth; Amanda M Wilson,"Public health decision-making for the management of infectious diseases quantifies human risks, typically segmented by vulnerability groupings to evaluate risk management interventions. While many paradigms are available for evaluating risks and their tradeoffs, relatively few are used in practice. Many sectors such as water reuse rely on benchmark approaches for risk, such as 1 in 10,000 infections per person per year. As risk-risk tradeoffs are increasingly considered in quantitative microbial risk assessments (QMRA), there is a need to broaden acceptability criteria beyond such approaches to consider holistic aspects of decision-making such as broader sustainability and cost impacts, and fairness. Evidence-based benchmarks can be incorporated into a systems approach to risk management by providing a more integrated alternative to strict policy-recommended one-size-fits-all targets. Potential research gaps for both existing and forward-looking metrics of acceptable microbial risk and alternative approaches are identified, with water reuse as a focus area.",SEARCH-20260720-PUBMED-FAMILY-SIMULATION-01,simulation_methods,https://pubmed.ncbi.nlm.nih.gov/41205330/,simulation_methodological_evaluation,Other simulation-based methodological evaluation,simulation_methods,title and complete available abstract,pending_independent_semantic_review
PMID:41210184,02b0d3a84aec3f3dc83aed74a56740e743bd8cc4acdd40d88bbbd997e0ba6ae4,include_simulation_or_mechanistic_lead,method_source,I_SIMULATION_MECHANISTIC,A multi-method study evaluating the inference of compartmental model parameters from a generative agent-based model.,2026,Elizabeth Hunter; Jim Duggan,"Calibrating process models such as compartmental SIR Models to real data can be performed using either optimization or Bayesian techniques. To accurately assess the performance of these methods, synthetic outbreak data can be used. All information about the data generative process is known for synthetic data, while when using real data there are many unknowns such as under-reporting of cases or real parameter values. We propose using an agent-based model to generate synthetic data. Calibrating to synthetic datasets created using different agent contact structures can provide us with information on how changes in contact structures impact SIR model parameters. We compare results for two calibration methods: Nelder-Mead an optimization technique and HMC, a Bayesian technique. The analysis finds that the two calibration methods perform similar in terms of accuracy when looking at the Mean Absolute Error, Mean Absolute Scaled Error, and Relative Root Mean Squared Error. Looking at the model parameters, HMC is better able to capture the ground truth parameters then Nelder-Mead. The results of the calibration additionally show that the effective infectious period is sensitive to the changes in contact patterns and the proportion of susceptible individuals in the population. For choosing a calibration method, if overall accuracy is the desired outcome, either method should perform equally well, however, if the aim is to understand and analyse the model parameters HMC is a better choice. Understanding how the effective parameters such as the infectious period changes as contact patterns and vaccination rates change can provide valuable information in understanding how to interpret parameters calibrated from real world data that captures both isolation and vaccination.",SEARCH-20260720-PUBMED-FAMILY-SIMULATION-01,simulation_methods,https://pubmed.ncbi.nlm.nih.gov/41210184/,synthetic_data_benchmarking,Synthetic-data and benchmark designs,simulation_methods,title and complete available abstract,pending_independent_semantic_review
PMID:41225316,f9d81242f00924c7bc47b3805cc05d18f18a539781f5df85c91b5f123fe87eef,include_simulation_or_mechanistic_lead,method_source,I_SIMULATION_MECHANISTIC,Benefits of group sequential design and sample size re-estimation for randomised controlled trials evaluating the prevention of ventilator-associated pneumonia: a simulation study informed by real world data.,2025,Holly Jackson; Julien Sauser; C H van Werkhoven; Stephan Harbarth; Marlieke E A de Kraker,"Ventilator-associated pneumonia (VAP) is an important healthcare acquired infection, which is associated with high morbidity and mortality. Conducting conventional randomised controlled trials (RCTs) on VAP prevention is often challenging, due to low numbers of eligible patients and events per site, especially for pathogen-specific interventions. We explored how group sequential designs (GSD) and sample size re-estimation (SSR) trial designs could improve RCT efficiency in simulated superiority trials to prevent VAP. Simulations were informed using data from the prospective observational Hospital Network Study - Preparation for a Randomised Evaluation of anti-Pneumonia Strategies (HONEST-PREPS). We tested the impact of different GSD and SSR designs on expected sample size (considering early stopping) and maximum sample size (no early stopping). We varied the type of stopping boundary, number and timepoint of interim analyses, and assumed and true prevention effect. We applied time-to-event analyses, with effect estimates expressed as hazard ratios, for the primary endpoint. The estimated 28-day cumulative incidence of VAP in HONEST-PREPS was 15.5%. For a 30% reduction in VAP (hazard ratio of 0.68), a standard RCT (power 80%) would require a sample size of 1291 patients. For GSD, Pocock boundaries result in a smaller expected sample size (E[N] = 1128), but a larger maximum sample size (max(N) = 1578) than O'Brien Fleming boundaries (E[N] = 1170 and max(N) = 1389), when utilising the optimal placement of a single interim analysis, 48% and 64% of the maximum number of events for Pocock and O'Brien Fleming boundaries, respectively. SSR is more efficient compared to GSD when the incorrect prevention effect is initially used to plan the trial, as it maintains a power closer to the pre-specified desired power without substantial impact on the expected sample size. GSD and SSR are effective adaptive designs, preferable to fixed RCTs in a superiority trial comparing the effectiveness of an investigational intervention with a standard of care in preventing VAP among critically ill, ventilated patients. They can reduce the expected sample size between 9% and 12% and should be considered at the trial design stage.",SEARCH-20260720-PUBMED-FAMILY-SIMULATION-01,simulation_methods,https://pubmed.ncbi.nlm.nih.gov/41225316/,simulation_methodological_evaluation,Other simulation-based methodological evaluation,simulation_methods,title and complete available abstract,pending_independent_semantic_review
PMID:41240960,d74d1640546d36cf3983ed8693737433f1d32ef6f140d1ed34c6993d6a8e166a,include_diagnostic_or_correction_lead,diagnostic,I_DIAGNOSTIC_CORRECTION,"Field evaluation of a rapid antigen test for mpox in the Democratic Republic of the Congo and Uganda: a multicentre, prospective, diagnostic accuracy study.",2026,Barnabas Bakamutumaho; David Lupande Mwenebitu; Winters Muttamba; Ingrid Ampeire; Henry Kyobe Bosa; Esto Bahizire; Bertin Casinga Bisimwa; Andrew Obuku; Misaki Wayengera; Alison Sandeman; Matthew T G Holden; Patrick D M C Katoto; Bruce Kirenga; Deborah A Williamson; Wilber Sabiiti,"Accurate, accessible diagnostic tests are essential for mpox outbreak control, particularly in settings with limited laboratory infrastructure. Antigen-based rapid diagnostic tests (RDTs) offer point-of-care potential, but clinical performance data remain scarce. We assessed a research-use-only RDT for detection of mpox at the point of care in two African countries. This prospective, multicentre, diagnostic accuracy study of the research-use-only NG-Test Monkeypox antigen RDT (NG Biotech, Guipry-Messac, France) was done at 16 sites (hospitals or health-care facilities) in Uganda and DR Congo. We enrolled individuals of any age with clinically suspected mpox. Paired skin lesion swabs were collected from each participant for antigen testing at the point of care and real-time PCR testing at reference laboratories. Diagnostic accuracy of the antigen test was evaluated using PCR as the reference standard. Diagnostic performance metrics were estimated overall and stratified by country, age, and cycle threshold values. Between Jan 29 and April 23, 2025, 645 participants were enrolled, of whom 641 (99%) had valid paired antigen and PCR test results and were included in the analysis. 416 (65%) of 641 participants were PCR positive. Overall RDT sensitivity was 70·4% (293 of 416 [95% CI 65·9-74·6]) and specificity was 89·3% (201 of 225 [84·6-92·7]). Sensitivity was higher in Uganda (195 of 238; 81·9% [95% CI 76·6-86·3]) than in DR Congo (98 of 178; 55·1% [47·7-62·2]) Specificity was 86·5% (90 of 104 [95% CI 78·7-91·8]) in Uganda compared with 91·7% (111 of 121 [85·5-95·5]) in DR Congo. Performance varied by age, viral load, and symptom duration. Although performance of the NG-Test Monkeypox antigen RDT did not fully meet WHO Target Product Profile benchmarks, driven mainly by lower sensitivity in DR Congo, results in Uganda were more encouraging. Testing was successfully done under field conditions, including in areas affected by conflict and displacement. These findings should not be interpreted as supporting immediate field deployment but show the feasibility and current limitations of lesion-based antigen testing and the need for improved, validated assays. Global Virus Network, UK Medical Research Council, and University of St Andrews. For the Swahili and French translations of the abstract see Supplementary Materials section.",SEARCH-20260720-PUBMED-VENUE-SIMULATION-01,simulation_methods,https://pubmed.ncbi.nlm.nih.gov/41240960/,simulation_methodological_evaluation,Other simulation-based methodological evaluation,simulation_methods,title and complete available abstract,pending_independent_semantic_review
PMID:41354985,2960f1a0ceac44215b2e7ed836c3305553beba9ef78bdbc8d5eb5d0e60b2ce7b,include_diagnostic_or_correction_lead,guidance,I_DIAGNOSTIC_CORRECTION,Mapping antimicrobial resistance and healthcare-associated infections indicators for actionable benchmarking: a cross-network overview in a data-driven era.,2025,Rishma Amarsy; Caroline Thomas; Sandra Fournier; Vincent Jarlier; Jérôme Robert,"Antimicrobial resistance (AMR) is a major public health issue that, combined with healthcare-associated infections (HAIs) threaten the quality and safety of hospital care. Monitoring AMR and HAIs is one of the cornerstones of preventing these phenomena with the use of indicators. Various monitoring networks and indicators exist for this type of surveillance, yet the landscape is cluttered with a confusing array of them, making it unclear why so many are used or how they were chosen. We provide a comprehensive overview of the diversity indicators employed in monitoring AMR and HAI from local to international networks. One challenge is the variation in case definitions between networks, which complicates direct comparisons. Standardized infection rates help adjust for confounding factors such as demographics (age, sex) and other infection-related risks, but obtaining such detailed data remains complex. Benchmarking hospital indicators involves comparing performance metrics with those of peer institutions, offering valuable insights to improve care quality, patient safety, and overall healthcare efficiency. However, to drive meaningful improvements, comprehensive feedback must be shared to guide targeted corrective actions.The emergence of health data warehouses (HDWs) and artificial intelligence (AI) provides new opportunities to refine and develop indicators, better addressing the challenges of contemporary healthcare monitoring.",SEARCH-20260720-PUBMED-FAMILY-SIMULATION-01,simulation_methods,https://pubmed.ncbi.nlm.nih.gov/41354985/,simulation_methodological_evaluation,Other simulation-based methodological evaluation,simulation_methods,title and complete available abstract,pending_independent_semantic_review
PMID:41510437,542e598fec031d147a9b7eefe4e75b48838f8d34be7e7815693c7a0ba838c356,include_applied_seed,applied_seed,I_APPLIED_TRANSFERABLE_DESIGN,"Benchmarking Pre-National Action Plan Systemic Antimicrobial Consumption in Tanzania, 1998-2005: A Historical Longitudinal Defined Daily Dose Analysis.",2025,Raphael Z Sangeda; Auleria W Kadinde; Akida Khea; Adam M Fimbo,"Background Antimicrobial consumption (AMC) data in Tanzania prior to the 2017 National Action Plan on Antimicrobial Resistance (NAP-AMR) are scarce, limiting our understanding of historical usage patterns. Objective To establish a national baseline of systemic AMC in Tanzania from 1998 to 2005 using the World Health Organization's Defined Daily Dose (DDD) methodology. Methods A retrospective longitudinal analysis of antimicrobial import records from the Tanzania Medicines and Medical Devices Authority was conducted, expressing consumption as DDD per 1,000 inhabitants per day (DID). Results Between 1998 and 2005, annual AMC ranged from 0.45 to 13.32 DID, predominantly antibacterials (82.6%), with cumulative consumption of 51.9 DID. Oral formulations and Access category antibiotics dominated usage. Conclusion These historical AMC estimates provide a valuable benchmark for contextualizing and informing future antimicrobial stewardship efforts in Tanzania.",SEARCH-20260720-PUBMED-FAMILY-SIMULATION-01,simulation_methods,https://pubmed.ncbi.nlm.nih.gov/41510437/,simulation_methodological_evaluation,Other simulation-based methodological evaluation,simulation_methods,title and complete available abstract,pending_independent_semantic_review
PMID:41540427,88f940a2cb757f240c4c584717840748784e492938f4e15e4d5f0a3e510dda85,include_simulation_or_mechanistic_lead,method_source,I_SIMULATION_MECHANISTIC,Benchmarking Illumina and Oxford Nanopore Technologies (ONT) sequencing platforms for whole genome sequencing of bacterial genomes and use in clinical microbiology.,2026,Srinithi Purushothaman; Tim Roloff; Adrian Egli; Helena Mb Seth-Smith,"In microbial diagnostics, whole-genome sequencing (WGS) is used to address key questions such as species identification, presence of antimicrobial resistance genes (ARGs), virulence genes, and outbreak detection. The choice of sequencing technology is crucial to ensure high-quality data, cost-effectiveness, and efficient reporting times. We aimed to compare Illumina (short-read) and ONT (long-read) sequencing methods for WGS on different bacterial species for base accuracy and reliable taxonomic and ARG identification. We used clinical isolates of ESKAPE pathogens (n = 12) and ATCC strains (n = 8) of varying %G + C. Illumina sequencing was performed on MiSeq (PE150) and ONT sequencing using GridION with R9.4.1 and R10.4.1 flowcells. Base-calling was performed using Guppy, Dorado, and Rerio software. We performed de novo assembly with Unicycler for Illumina and Flye for ONT, and two types of hybrid assemblies, Unicycler and Polypolish. We annotated genomes with Bakta and assessed the quality (QUAST, GTDB-Tk). We identified ARGs (AMRFinderPlus) and plasmids (MOB-suite). We mapped reads and called SNPs using Minimap2, Pilon, vcftools, and Snippy (Illumina). Core genome MLST analysis was conducted with Ridom Seqsphere+. We observed that Illumina sequencing provided consistently high-quality reads (median Q-score 35), whereas for ONT R10.4.1, SUP model showed higher median quality (median Q-score 15.3) compared to R9.4.1 (median Q-score 13.9, SUP model). We observed that Illumina-based assemblies generated fewer genes annotated as disrupted; for ONT assemblies, the base-caller affects assembly annotation accuracy, with High accuracy (HAC) and Super accuracy (SUP) base-calling models perform better than FAST model. ONT assemblies resolved rRNA operons better than Illumina assemblies. Sequencing errors were determined by SNP calling, and varied widely by species, with ONT often generating more sequencing errors compared to Illumina. Hybrid assemblies combine accuracy and completeness effectively. Taxonomic identification and ARG detection were reliable across all methods. Combining Illumina and ONT technologies yielded optimal bacterial genome sequencing results, leveraging the high accuracy of short reads and improved contiguity of ONT long reads. The HAC and SUP ONT models with Dorado notably enhance genome assembly annotation and resolution of complex regions, although species-specific issues, likely due to repeat regions and base modifications, remain challenging even in SUP model with Dorado. Hybrid approaches currently offer the most comprehensive and accurate genome assemblies for clinical microbiology. For reliable cgMLST even using the most recent ONT methods, resolution must be assessed on a species-by-species basis.",SEARCH-20260720-PUBMED-FAMILY-SIMULATION-01,simulation_methods,https://pubmed.ncbi.nlm.nih.gov/41540427/,simulation_methodological_evaluation,Other simulation-based methodological evaluation,simulation_methods,title and complete available abstract,pending_independent_semantic_review
PMID:41704119,0149fba0c8ee111e6018153025a90e70c1b9732a286dde48285f5fac4155d9c2,include_diagnostic_or_correction_lead,reproducibility,I_DIAGNOSTIC_CORRECTION,Azithromycin use for common acute respiratory infections during a Mycoplasma pneumoniae national surge: results from the SHARPS-OP benchmarking collaborative.,2026,Rana E El Feghaly; Matthew P Kronman; Michael J Smith; Sameer J Patel; Rosemary Olivero; Joshua Herigon; Ann Wirtz; Brian R Lee; Sharing Antimicrobial Reports for Pediatric Stewardship Outpatient (SHARPS-OP) Collaborative,,SEARCH-20260720-PUBMED-FAMILY-SIMULATION-01,simulation_methods,https://pubmed.ncbi.nlm.nih.gov/41704119/,simulation_methodological_evaluation,Other simulation-based methodological evaluation,simulation_methods,title and complete available abstract,pending_independent_semantic_review
PMID:41734200,a9387af1bec8ee1c21b62fcbe35b4e9b60cd60c88f672f4524b4800bbfa45785,include_diagnostic_or_correction_lead,reproducibility,I_DIAGNOSTIC_CORRECTION,"Antibiotic stewardship benchmarking-Using the WHO point prevalence survey of antimicrobial prescribing in a Tertiary Care Public Hospital, Karachi.",2026,Ale Zehra; Tehreem Ansari; Syed Shaukat Ali Muttaqi Shah; Beenish Syed; Mehwish Rizvi; Fakhsheena Anjum; Tehrim Fatima; Farah Saeed,"Antimicrobial resistance (AMR) is a global threat, mainly linked to inappropriate use and prescription of antibiotics, Antimicrobial stewardship (AMS) programs have proved to promote responsible antibiotic use and decrease the burden of AMR. The aim of this study is to benchmark antibiotic prescribing patterns and evaluate stewardship practices using the World Health Organization (WHO) Point Prevalence Survey (PPS) methodology in a tertiary care public sector hospital in Karachi. A cross-sectional, prospective PPS was conducted over four weeks in July 2024 at Dow University Hospital, Karachi. The data were extracted from the medical records of the patients using a validated WHO PPS tool by a trained infectious disease physician and pharmacist. All inpatients admitted before or at 8:00 a.m. on survey day, without a planned discharge were included, excluding those from emergency, acute care, day-care surgery, dialysis, and oncology units. Descriptive analysis of the data was performed using Stata version 14. Out of 224 hospitalized patients at the day of survey, 186 inpatients (adults and children across medical, surgical and critical care wards) were included in the study meeting the inclusion criteria. The study included 50.5% male and 49.5% females, having mean age of 45 (±18) years. The point prevalence of antibiotic use was 83.3% (95% CI: 77.5-88.2%). Community-acquired infections 55.5% (95% CI: 48.7-62.1%) were the most common indication of use. Most antibiotics 99.2%, (95% CI: 95.6-99.9%) were prescribed empirically, with predominant parenteral administration 89.2% (95% CI: 84.5-92.9%) and limited Intravenous-to-oral switch 2.9% (95% CI: 1.3-6.2%). Ceftriaxone (18.5%), piperacillin-tazobactam (18.1%), and meropenem (16.2%) were most frequently used antibiotics. According to WHO Access, Watch and Reserve (AWaRe) classification, 80.8% (95% CI: 75.2-85.6%) of antibiotics belonged to the 'Watch' category, 17.3% (95% CI: 12.6-23.2%) to 'Access', and 1.8% (95% CI: 0.7-4.6%) to 'Reserve'. Cultures showed no growth in 64.8% (95% CI: 55.2-73.6%) of cases. Stewardship interventions were found applicable in 55.4% (95% CI: 48.7-62.0%) of prescriptions due to overuse, dosing errors, and absence of antimicrobial guideline in the hospitals. This study demonstrates that antibiotic utilization exceeded global averages, highlighting the urgent need to develop institutional antimicrobial guidelines, enhance stewardship programs, and improve diagnostic stewardship to curb AMR.",SEARCH-20260720-PUBMED-FAMILY-SIMULATION-01,simulation_methods,https://pubmed.ncbi.nlm.nih.gov/41734200/,simulation_methodological_evaluation,Other simulation-based methodological evaluation,simulation_methods,title and complete available abstract,pending_independent_semantic_review
