candidate_key,source_row_sha256,final_decision,final_proposed_record_type,final_reason_code,title,year,authors,abstract,search_ids,preliminary_families,source_url,provisional_concept_label,provisional_canonical_name,provisional_family,routing_evidence,routing_status
PMID:41950444,4a80b1cbba529b6f46f32fb7a0e4c3a00f97661900efb5ad541c639c9c8da2a3,include_simulation_or_mechanistic_lead,applied_seed,I_SIMULATION_MECHANISTIC,Projected Increase in HIV Incidence in 11 States if Ryan White Ends: A Simulation Study.,2026,Melissa Schnure; Ryan Forster; Joyce L Jones; Catherine R Lesko; D Scott Batey; Isolde Butler; Dafina Ward; Karen Musgrove; Keri N Althoff; Mamta K Jain; Kelly A Gebo; David W Dowdy; Maunank Shah; Parastu Kasaie; Anthony T Fojo,"Objectives. To estimate the increase in HIV infections in 11 US states if Ryan White services are interrupted or ended. Methods. We applied a population-level model of HIV transmission to 11 states. We represented the proportion of people with HIV receiving Ryan White AIDS drug assistance, outpatient health services, or support services, and simulated a loss of suppression in each category if services permanently end or return after delays of 1.5 or 3.5 years. Results. Cessation of Ryan White services in 2025 was projected to result in 69 695 additional infections from 2025 to 2030 (95% credible interval [CrI] = 18 943, 123 628), 68% more (95% CrI = 18%, 118%) than if Ryan White were continued. Temporary interruptions of 1.5 and 3.5 years resulted in 26 951 (95% CrI = 7341, 47 534) and 53 594 (95% CrI = 14 645, 94 860) additional infections, respectively. Excess infections varied across states, from a 45% increase in Texas to 126% in Missouri. Conclusions. Projected increases in HIV infections because of disruptions of Ryan White services threaten the progress made in curtailing the US HIV epidemic, illustrating the critical role Ryan White plays in preventing HIV transmission. (Am J Public Health. 2026;116(5):732-735. https://doi.org/10.2105/AJPH.2025.308409).",SEARCH-20260720-PUBMED-FAMILY-SIMULATION-01,simulation_methods,https://pubmed.ncbi.nlm.nih.gov/41950444/,simulation_methodological_evaluation,Other simulation-based methodological evaluation,simulation_methods,title and complete available abstract,pending_independent_semantic_review
PMID:42022232,bc218fc6fea174bf8ce10e2ea01e9de67a7e0dcde185ea19cd9841721e9524cb,include_simulation_or_mechanistic_lead,applied_seed,I_SIMULATION_MECHANISTIC,Optimal cervical cancer screening strategies for unvaccinated and HPV-vaccinated cohorts in the United States: a comprehensive comparative modeling analysis.,2026,Daniël D de Bondt; Kate T Simms; Emi Naslazi; James Killen; Jane J Kim; Jan A C Hontelez; Emily A Burger; Mary Caroline Regan; Megan A Smith; Stephen Sy; Karen Canfell; Inge M C M de Kok,"Adult women in the United States (US) currently comprise a mix of birth cohorts with different human papillomavirus (HPV) vaccination uptake and thus markedly different risks of cervical cancer, while cervical screening recommendations do not currently reflect these differences. We used comparative modeling to determine the optimal screening protocols for these cohorts. We used three independent models calibrated to US data to simulate three birth cohorts: unvaccinated females born in 1980, females born in 1993 (predominantly offered bivalent/quadrivalent HPV vaccines), and females born in 2003 (predominantly offered nonavalent HPV vaccine). We considered primary cytology, primary HPV testing, and co-testing, and varied the starting age (21-30 years) and screening frequency (three- to ten-yearly), resulting in 92 strategies. Strategies that were on the cost-effectiveness frontier for at least one model and were associated with incremental cost-effectiveness ratios between US$50,000 and US$200,000 per life-year gained were considered optimal; we compared health outcomes, colposcopies, and precancer treatments for these strategies to those estimated under current guidelines. For all three birth cohorts, optimal screening strategies involved primary HPV testing and decreasing the screening intervals, i.e., five-yearly from age 25 years for the unvaccinated birth cohort, eight-yearly from age 25 for the 1993 cohort, and 10-yearly from age 27 for the 2003 cohort. Primary HPV screening is the optimal approach regardless of vaccine protection exposure but US cervical cancer screening intervals should be extended for vaccinated cohorts to maintain cost-effectiveness. This would reduce harms while remaining more effective than current guidelines in pre-vaccine cohorts. US National Cancer Institute.",SEARCH-20260720-PUBMED-FAMILY-SIMULATION-02,simulation_methods,https://pubmed.ncbi.nlm.nih.gov/42022232/,simulation_methodological_evaluation,Other simulation-based methodological evaluation,simulation_methods,title and complete available abstract,pending_independent_semantic_review
PMID:42037378,db61476b67e4ae01e1f9f36625846f0945d289a0127b13ffd762418d0407c4dd,include_diagnostic_or_correction_lead,reproducibility,I_DIAGNOSTIC_CORRECTION,Reproducibility crisis in isothermal amplification: lessons from benchmarking LAMP assays.,2026,Lena Piglmann; Lena Campostrini; Regina Sommer; Alexander K T Kirschner; Rudolf Krska; Andreas H Farnleitner; Claudia Kolm; Georg H Reischer,"The number of published isothermal amplification assays has increased substantially in recent years. Unfortunately, no harmonized guidelines, such as the Minimum Information for Publication of Quantitative Real-Time PCR Experiments guidelines, exist for publishing these methods, often resulting in incomplete reporting of assay composition and performance. In this study, we systematically evaluated nine published loop-mediated isothermal amplification (LAMP) assays for the detection of Pseudomonas aeruginosa. We aimed to assess whether publications provide (i) sufficient information on assay composition to allow implementation and reproduction and (ii) robust data on assay performance to evaluate their applicability. Assays were screened for basic functionality, analytical specificity, sensitivity, and limit of detection (LOD) in head-to-head experiments with qPCR. Four assays lacked essential composition details, and almost all did not report DNA concentrations or replicate numbers. Only six assays consistently amplified target DNA. Analytical specificity testing with 19 non-target strains contradicted previously reported 100% specificity, with only 3 maintaining specificity above 90% in our evaluation. Sensitivity testing with 13 P. aeruginosa strains confirmed 100% sensitivity for two assays. However, LOD experiments revealed significantly higher values than originally reported, with qPCR outperforming all LAMP assays. These findings highlight substantial discrepancies between published data and real-world assay performance. The absence of standardized formats, consistent units, and complete methodological details undermines replicability. Although this study focused on P. aeruginosa, the identified issues are widely relevant across different microbial targets. We advocate for increased publication standards and quality controls to ensure transparency, utility, and comparability of isothermal amplification assays and to support their translation into clinical and environmental applications.IMPORTANCEOver the past decade, numerous isothermal amplification-based assays for the detection of pathogens or health-relevant microorganisms have been proposed, each claiming progress from the state-of-the-art and applicability to both clinical specimens and/or environmental samples. However, many published assays lack essential methodological details, and reported performance metrics are often inconsistent or incomparable. Using Pseudomonas aeruginosa as a representative model organism, we set out to test whether all details required for implementing assays were provided by original publications and if important assay characteristics were reproducible. The results of this systemic benchmarking of nine published loop-mediated isothermal amplification assays revealed major discrepancies between reported and experimentally measured performance in terms of specificity, sensitivity, and limit of detection. By highlighting the crucial elements that need to be reported, this work aims to improve the transparency, reproducibility, and overall quality of isothermal amplification assays, fostering their broader application across different research settings.",SEARCH-20260720-PUBMED-FAMILY-SIMULATION-01,simulation_methods,https://pubmed.ncbi.nlm.nih.gov/42037378/,simulation_methodological_evaluation,Other simulation-based methodological evaluation,simulation_methods,title and complete available abstract,pending_independent_semantic_review
PMID:42044724,b484e13bef719b8e2ae121321ee3970c142d2e89383613b07a1b85b2a86c8512,include_applied_seed,applied_seed,I_APPLIED_TRANSFERABLE_DESIGN,Benchmarking long-acting injectable antiretroviral therapy against real-world oral antiretroviral therapy in southern China: a matching-adjusted indirect comparison of global trial data.,2026,Hongyu Chen; Weichao Wang; Run Chen; Hang Chen; Yingming Wang; Ticheng Xiao; Zhi Lei; Yumei Fan; Xiaoxue Chen; Lan Jiang; Yanhua Chen; Ailing Li; Song Fan,"Long-acting injectable (LAI) antiretroviral efficacy derives largely from Western-centric trials, yet its translation to China's centralized public health model remains unknown. We addressed this gap by benchmarking global trial data against real-world evidence from Southern China. We performed a systematic review and meta-analysis (PROSPERO CRD420251249065) of RCTs comparing LAI versus standard oral therapy (SOT), followed by MAIC using individual patient data from a Chinese cohort stratified into virologically unsuppressed (n = 2590) and suppressed (n = 3123) subgroups, reweighted to match baseline characteristics of 11 LAI arms and 9 oral arms from RCTs. The primary outcome was virological suppression (<50 copies/mL). Meta-analysis of nine head-to-head RCTs (n = 3208) confirmed LAI-oral equivalence (pooled RR 0.996, 95% CI 0.974-1.017). MAIC benchmarking revealed heterogeneity: LAI trial outcomes exceeded weighted local oral rates in 10/11 comparisons (e.g. RD -7.94%, P < 0.05) and were lower only in TALENT (RD +34.35%, P < 0.05). Trial oral arms also exceeded local rates in 8/9 comparisons (all except TALENT). Larger divergences occurred in trials with lower demographic overlap. Aggregate trial equivalence belies context-dependent divergence upon local projection, with outcome differences varying by patient demographics and local therapy. These findings favour tailored implementation over universal extrapolation of trial results.",SEARCH-20260720-PUBMED-FAMILY-SIMULATION-01,simulation_methods,https://pubmed.ncbi.nlm.nih.gov/42044724/,simulation_methodological_evaluation,Other simulation-based methodological evaluation,simulation_methods,title and complete available abstract,pending_independent_semantic_review
PMID:42105210,ee01d4ca9bed6b7847e13a0611012f57df24db43370b1abbea4094156d8294cc,include_diagnostic_or_correction_lead,reproducibility,I_DIAGNOSTIC_CORRECTION,Protein language model embeddings improve HIV drug resistance prediction: a comprehensive benchmark with attention-based interpretability.,2026,Hayden Farquhar,"Accurate prediction of HIV drug resistance from viral sequences is critical for optimizing antiretroviral therapy. Traditional machine-learning approaches using binary mutation encoding achieve strong accuracy but may fail to capture epistatic interactions and structural features relevant to resistance mechanisms. Protein language models (PLMs) offer learned representations encoding evolutionary and structural information, but have not been systematically benchmarked for HIV resistance prediction across the modern antiretroviral drug set. We evaluated ESM-2 (650 M parameters) with attention-weighted pooling for predicting resistance to 18 drugs across three classes (protease inhibitors, NRTIs, NNRTIs) on the Stanford HIVDB dataset (n = 6308 sequences). Attention-weighted ESM-2 embeddings significantly outperformed XGBoost baselines with binary mutation encoding (mean AUC 0.968 versus 0.955, P = .0017), with gains across 15 of 18 drugs and the largest improvements for drugs with complex resistance patterns. Attention weights showed 2.48-fold enrichment at known drug-resistance-mutation positions (P < .05 for 63% of drugs; NRTIs strongest at 4.20-fold). External validation on a 20% holdout showed minimal degradation (AUC 0.934). Benchmarking against ESM C 600M and ESM-1v confirmed performance is robust to PLM choice (mean AUC 0.942-0.946 across backbones). Performance was maintained across HIV-1 subtypes (B 0.924; B-divergent 0.900; non-B 0.884) and a temporal holdout (AUC 0.930). Source code is available at https://github.com/hayden-farquhar/HIV-ESM-2 under an MIT license and archived at https://doi.org/10.5281/zenodo.19466629. Stanford HIVDB genotype-phenotype data are publicly available at https://hivdb.stanford.edu/.",SEARCH-20260720-PUBMED-FAMILY-SIMULATION-01,simulation_methods,https://pubmed.ncbi.nlm.nih.gov/42105210/,simulation_methodological_evaluation,Other simulation-based methodological evaluation,simulation_methods,title and complete available abstract,pending_independent_semantic_review
PMID:42136784,1d356616dbe1b7c65f6cfb8702737b18aa134dbc9446591a4b5aa24d506db19f,include_applied_seed,applied_seed,I_APPLIED_TRANSFERABLE_DESIGN,Benchmarking surgical infections: A five years NSQIP-based analysis of postoperative infectious morbidity in general surgery at a tertiary care hospital in Pakistan.,2026,Narmeen Asif; Nargis Maqbool; Abdul Rehman Alvi,"Surgical site infections (SSIs) remain a leading cause of postoperative morbidity in low- and middle-income countries (LMICs). This study evaluates five years trends in postoperative infectious complications in general surgery using American College of Surgeons NSQIP data from a tertiary care hospital in Pakistan. Retrospective analysis of 2,650 consecutive adult patients undergoing general surgical procedures from January 2020 to December 2024 at the Department of General Surgery, Aga Khan University Hospital, Karachi. Standard NSQIP variables and risk-adjusted outcomes were examined. Predictors of SSI were identified using multivariable logistic regression, and institutional performance was benchmarked via observed-to-expected (O/E) ratios. The overall SSI rate was 8.0% (superficial, 4.9%; deep, 0.3%; organ/space, 2.8%), with the highest rates following hepatopancreaticobiliary (19.6%), colorectal (18.3%), and small-bowel procedures. Independent predictors of SSI were open surgical approach (OR 3.42, 95% CI 2.16-5.43), operative time >120 minutes (OR 2.76, 95% CI 1.94-3.91), ASA class III-IV (OR 1.61, 95% CI 1.15-2.24), and diabetes mellitus (OR 1.47, 95% CI 1.03-2.11). The annual SSI rate declined significantly from 9.1% in 2020 to 6.2% in 2024 (p=0.031), and overall 30-day morbidity fell from 10.7% to 6.9% (p<0.001). Risk-adjusted morbidity improved from an O/E ratio of 1.09 in 2020 to 0.76 in 2024 (better than expected), while mortality O/E remained near 1.0 throughout. Despite initially elevated SSI rates compared with international NSQIP benchmarks, sustained participation in NSQIP was associated with significant reductions in infectious morbidity and achievement of better-than-expected overall outcomes. Expansion of minimally invasive surgery and reduction in operative time represent key opportunities for further improvement in LMIC settings.",SEARCH-20260720-PUBMED-FAMILY-SIMULATION-01,simulation_methods,https://pubmed.ncbi.nlm.nih.gov/42136784/,simulation_methodological_evaluation,Other simulation-based methodological evaluation,simulation_methods,title and complete available abstract,pending_independent_semantic_review
PMID:42154467,06d1417c807bb13a3ae984ecd39bece81f4949b624defcb8db7bfffd9bd52535,include_diagnostic_or_correction_lead,reproducibility,I_DIAGNOSTIC_CORRECTION,Achievable Benchmarks of Care in Pediatric Emergency Departments.,2026,Elizabeth R Alpern; Sriram Ramgopal; Cody S Olsen; Norma-Jean E Simon; James M Chamberlain; Evaline Alessandrini; Lynn Babcock; Lalit Bajaj; Cara Elsholz; Alexander Rogers; Bashar Shihabuddin; Leah Tzimenatos; Patrick S Walsh; Joseph J Zorc; Lawrence Cook; Robert W Grundmeier; PECARN Registry Study Group,"Achievable benchmarks of care (ABCs) are a process by which performance is anchored on a select high-achieving group. ABCs can motivate systemic quality improvement toward realistically achievable goals. The establishment of multisite ABCs in pediatric emergency medicine has been limited. To report ABCs for pediatric emergency care management (encounters with asthma, infections, or pain), readiness (vital measurement, timeliness, and throughput), and quality (return visits). This cross-sectional study analyzed visits at 12 emergency department (9 pediatric emergency departments [EDs] and 3 affiliate community sites) from January 1, 2017, to December 31, 2024, in the Pediatric Emergency Care Applied Research Network (PECARN) Registry. Data were analyzed from August 2025 to March 2026. An ABC was calculated for each performance measure and derived from the 10% of visits attended to by the highest-performing clinicians both within individual sites and in the database overall using the pared mean method. ABCs for each performance measure are described at the network and site level by year and overall. A total of 5 302 587 visits (median [IQR] patient age, 5.1 [1.8-11.0] years; 52.6% male patients) were included, of which 4 364 658 were quaternary pediatric ED visits and 937 929 were to affiliate community sites. Quality metrics varied across network sites and settings, with ranges of 56.8% to 99.3% for vital sign documentation, 61.4% to 92.6% for 2-point pain reduction for encounters with long bone fractures, and 93.1% to 99.2% for systemic corticosteroids given for visits with asthma exacerbation. Return visit with admission rate and antibiotic stewardship metrics had minimal variability across sites and care settings. There was significant ABC variability in throughput metrics (time-to-clinician and length of stay) across sites and pediatric ED vs affiliate setting. Overall, throughput metrics worsened over the study period. Performance measures more within clinicians' locus of control (care of encounters with asthma, pain reduction in encounters for long bone fractures) had wider variation between the site's mean performance and ABC, indicating practice variation within the sites. This cross-sectional study from 12 EDs established ABCs for pediatric care management using electronic health record data. These can be used to compare quality outcomes of pediatric emergency care and provide benchmarking relevant to settings that care for children.",SEARCH-20260720-PUBMED-FAMILY-SIMULATION-01,simulation_methods,https://pubmed.ncbi.nlm.nih.gov/42154467/,simulation_methodological_evaluation,Other simulation-based methodological evaluation,simulation_methods,title and complete available abstract,pending_independent_semantic_review
PMID:42177302,5cc2b960cd99323f0623fac82a4568b3db5bb54f811cf1fe0881c84661e7db04,include_diagnostic_or_correction_lead,reproducibility,I_DIAGNOSTIC_CORRECTION,SurgWound-Bench: a benchmark for surgical wound diagnosis.,2026,Jiahao Xu; Changchang Yin; Odysseas P Chatzipanagiotou; Diamantis I Tsilimigras; Kevin Clear; Bingsheng Yao; Weidan Cao; Dakuo Wang; Timothy M Pawlik; Ping Zhang,"Surgical site infection (SSI) is one of the most common and costly healthcare-associated infections, and surgical wound care remains a significant challenge for preventing SSIs and improving patient outcomes. Although deep learning has been explored for preliminary surgical wound screening, progress is limited by data privacy concerns and the high cost of expert annotation. Consequently, no publicly available dataset or benchmark currently covers diverse surgical wound types, hindering the development of open-source surgical wound screening tools. To address this gap: (1) we present SurgWound, the first open-source dataset featuring diverse surgical wound types. It contains 686 surgical wound images annotated by three professional surgeons with eight fine-grained clinical attributes. (2) Based on SurgWound, we introduce the first benchmark for surgical wound diagnosis, which includes visual question answering (VQA) and report generation tasks for comprehensive evaluation. (3) Furthermore, we propose a three-stage learning framework, WoundQwen, for surgical wound diagnosis. The first stage predicts detailed wound characteristics using multiple MLLMs. The second stage uses these predictions as additional knowledge to assess infection risk and clinical urgency. The third stage integrates the diagnostic results to produce a comprehensive report. Our dataset and code are publicly available.",SEARCH-20260720-PUBMED-FAMILY-SIMULATION-01|SEARCH-20260720-PUBMED-VENUE-SIMULATION-01,simulation_methods,https://pubmed.ncbi.nlm.nih.gov/42177302/,simulation_methodological_evaluation,Other simulation-based methodological evaluation,simulation_methods,title and complete available abstract,pending_independent_semantic_review
PMID:42204343,30c2601c16003b1455f92f2e01e0d84bdf1885a623d50dde948fd281e6468bc1,include_simulation_or_mechanistic_lead,method_source,I_SIMULATION_MECHANISTIC,A deep mutational scanning-informed protein language model predicts SARS-CoV-2 evolution dynamics with spatiotemporal resolution.,2026,Sijie Yang; Xiaowei Luo; Jiejian Luo; Fanchong Jian; Yunlong Cao,"Early identification of emerging dominant variants of pathogens such as SARS-CoV-2 is important for effective public health responses, yet existing approaches are not feasible for real-time surveillance. Here we introduce DeepCoV (DMS-Empowered Evolution Prediction of CoronaVirus), a deep-learning framework for the dynamic identification of emerging variants with high potential to become prevalent at spatiotemporal resolution. It integrates deep mutational scanning (DMS)-derived mutation phenotypes, evolutionary sequence data and epidemiological surveillance data reflecting human immune pressures. Benchmarked against logistic regression-based methods and representative deep-learning approaches in simulated retrospective surveillance scenarios, DeepCoV accurately forecasts the dominance of recently circulating lineages a month in advance, achieving a 90% reduction in false discovery rate while capturing temporal and geographic dynamics of variant spread and reconstructing their regional prevalence trajectories. It also identified mutational hotspots of Omicron-derived backbones in silico, revealing convergent evolution trends. This provides a scalable framework for timely identification of immune-evasive variants and critical mutations, providing actionable insights.",SEARCH-20260720-PUBMED-VENUE-SIMULATION-01,simulation_methods,https://pubmed.ncbi.nlm.nih.gov/42204343/,simulation_methodological_evaluation,Other simulation-based methodological evaluation,simulation_methods,title and complete available abstract,pending_independent_semantic_review
