candidate_key,source_row_sha256,final_decision,final_proposed_record_type,final_reason_code,title,year,authors,abstract,search_ids,preliminary_families,source_url,provisional_concept_label,provisional_canonical_name,provisional_family,routing_evidence,routing_status
PMID:33392142,8be9097fe58977d3ce3ea49b77f64e031e4e97956a85800ee00389f85f92a6c9,include_applied_seed,applied_seed,I_APPLIED_TRANSFERABLE_DESIGN,"Impact of the Healthcare System, Macro Indicator, General Mandatory Quarantine, and Mask Obligation on COVID-19 Cases and Death in Six Latin American Countries: An Interrupted Time Series Study.",2020,Adriana Poppe,"Background: Different coping strategies have been implemented by various governments worldwide to address the emerging health crisis of COVID-19. While most developed countries count on supporting healthcare and social systems, developing countries face additional challenges due to low macro indicators. The implementation of measurements such as quarantine are shown to be successful to flatten the curve of infection and death. In this context, it is important to test whether those measurements have an impact on the distribution of cases of COVID-19 in developing countries that face additional challenges such as lack of social security due to informal employment. A country comparison for Colombia, Costa Rica, Peru, Ecuador, Mexico, and Chile has therefore been conducted. Method: The healthcare systems and macro indicator as well as the distribution of death due to COVID-19 per thousand inhabitants are compared descriptively. Using Multiple Interrupted Time Series Analysis with synthetic control units the impact of the General Mandatory Quarantine in Colombia, Peru, and Ecuador as well as the impact of Mask Obligation in public in Colombia and Chile have been tested. Results: No clear impact of the poverty headcount ratio at the national poverty line and urban population on the percentage of death within the confirmed cases has been found. The out-of-pocked spending within health expenditure as a barrier in access to healthcare can be considered as a determinant of death within the confirmed cases of COVID-19. The implementation of a general mandatory quarantine did not show a curve-flattening effect in Ecuador and Peru but did so in Colombia. The implementation of Mask obligation in public spaced showed positive impact on the distribution of confirmed case in both countries tested. Conclusion: The implementation of a general mandatory quarantine does not guarantee the curve-flattening effect. Various macro indicators should therefore always be considered while analyzing the effect of policies.",SEARCH-20260720-PUBMED-FAMILY-CAUSAL-01,causal_policy,https://pubmed.ncbi.nlm.nih.gov/33392142/,interrupted_time_series,Interrupted time series and segmented regression,causal_policy,title and complete available abstract,pending_independent_semantic_review
PMID:33518465,65646333949bd55ebd111dcab1c830748c1f31ec9f821854ffbc1682a3847402,include_applied_seed,applied_seed,I_APPLIED_TRANSFERABLE_DESIGN,Revaccination with measles-mumps-rubella vaccine and hospitalization for infection in Denmark and Sweden - An interrupted time-series analysis.,2022,Signe Sørup; Hélène Englund; Ida Laake; Heta Nieminen; Lise Gehrt; Berit Feiring; Lill Trogstad; Adam Roth; Christine Stabell Benn,"In a previous cohort study of 4-year-old Danish children, revaccination with the live measles-mumps-rubella vaccine (MMR) was associated with a 16% reduction in the rate of hospitalization lasting two days or longer for non-measles-mumps-rubella infections. To examine if the introduction of revaccination with MMR at 4 years of age in Denmark (spring 2008) and at 7-9 years of age in Sweden (autumn 2009), at a time when there was virtually no measles, mumps or rubella cases, was associated with a reduction in the rate of hospitalization-for-infection lasting two days or longer at the population level. We included 4-year-olds in Denmark and 7-9-year-olds in Sweden. We obtained the number of hospitalization-for-infection lasting two days or longer from nationwide hospital registers. Person-years at risk were approximated from population statistics for each season and year. We performed an interrupted time series analysis using Poisson regression to estimate the change in hospitalization incidence rates following the introduction of MMR revaccination, adjusting for seasonality. We also performed analyses with control series (3-year-olds in Denmark and 4-year-olds in Sweden). Comparing the incidence of hospitalization-for-infection lasting two days or longer after the introduction of MMR revaccination with the expected level without an introduction of MMR revaccination resulted in an incidence rate ratio of 1.07 (95% confidence interval [CI] = 0.89-1.28) for 4-year-olds in Denmark and 0.89 (95% CI = 0.77-1.02) for 7-9-year-olds in Sweden in analyses without controls. Analyses with controls gave similar results. This population-level study of the introduction of MMR revaccination in Denmark and Sweden had inadequate power to confirm or refute the findings from an individual-level Danish study of an association between MMR revaccination and a lower incidence rate of hospitalization-for-infection lasting two days or longer.",SEARCH-20260720-PUBMED-FAMILY-CAUSAL-01,causal_policy,https://pubmed.ncbi.nlm.nih.gov/33518465/,interrupted_time_series,Interrupted time series and segmented regression,causal_policy,title and complete available abstract,pending_independent_semantic_review
PMID:33591995,c77e56878dc4237cc864498200a56ddfd0760c5132396603ca1951de6fcf7e3a,include_applied_seed,applied_seed,I_APPLIED_TRANSFERABLE_DESIGN,"Estimated impact of the pneumococcal conjugate vaccine on pneumonia mortality in South Africa, 1999 through 2016: An ecological modelling study.",2021,Jackie Kleynhans; Stefano Tempia; Kayoko Shioda; Anne von Gottberg; Daniel M Weinberger; Cheryl Cohen,"Data on the national-level impact of pneumococcal conjugate vaccine (PCV) introduction on mortality are lacking from Africa. PCV was introduced in South Africa in 2009. We estimated the impact of PCV introduction on all-cause pneumonia mortality in South Africa, while controlling for changes in mortality due to other interventions. We used national death registration data in South Africa from 1999 to 2016 to assess the impact of PCV introduction on all-cause pneumonia mortality in all ages, with the exclusion of infants aged <1 month. We created a composite (synthetic) control using Bayesian variable selection of nondiarrheal, nonpneumonia, and nonpneumococcal deaths to estimate the number of expected all-cause pneumonia deaths in the absence of PCV introduction post 2009. We compared all-cause pneumonia deaths from the death registry to the expected deaths in 2012 to 2016. We also estimated the number of prevented deaths during 2009 to 2016. Of the 9,324,638 deaths reported in South Africa from 1999 to 2016, 12·6% were pneumonia-related. Compared to number of deaths expected, we estimated a 33% (95% credible interval (CrI) 26% to 43%), 23% (95%CrI 17% to 29%), 25% (95%CrI 19% to 32%), and 23% (95%CrI 11% to 32%) reduction in pneumonia mortality in children aged 1 to 11 months, 1 to 4 years, 5 to 7 years, and 8 to 18 years in 2012 to 2016, respectively. In total, an estimated 18,422 (95%CrI 12,388 to 26,978) pneumonia-related deaths were prevented from 2009 to 2016 in children aged <19 years. No declines were estimated observed among adults following PCV introduction. This study was mainly limited by coding errors in original data that could have led to a lower impact estimate, and unmeasured factors could also have confounded estimates. This study found that the introduction of PCV was associated with substantial reduction in all-cause pneumonia deaths in children aged 1 month to <19 years. The model predicted an effect of PCV in age groups who were eligible for vaccination (1 months to 4 years), and an indirect effect in those too old (8 to 18 years) to be vaccinated. These findings support sustaining pneumococcal vaccination to reduce pneumonia-related mortality in children.",SEARCH-20260720-PUBMED-VENUE-CAUSAL-01,causal_policy,https://pubmed.ncbi.nlm.nih.gov/33591995/,quasi_experimental_policy_evaluation,Other quasi-experimental policy-evaluation designs,causal_policy,title and complete available abstract,pending_independent_semantic_review
PMID:33980858,10b67d0f34606ea9a690e8295c3c20bc52520edb9062612ac64e092323302475,include_simulation_or_mechanistic_lead,method_source,I_SIMULATION_MECHANISTIC,The epidemicity index of recurrent SARS-CoV-2 infections.,2021,Lorenzo Mari; Renato Casagrandi; Enrico Bertuzzo; Damiano Pasetto; Stefano Miccoli; Andrea Rinaldo; Marino Gatto,"Several indices can predict the long-term fate of emerging infectious diseases and the effect of their containment measures, including a variety of reproduction numbers (e.g. [Formula: see text]). Other indices evaluate the potential for transient increases of epidemics eventually doomed to disappearance, based on generalized reactivity analysis. They identify conditions for perturbations to a stable disease-free equilibrium ([Formula: see text]) to grow, possibly causing significant damage. Here, we introduce the epidemicity index e0, a threshold-type indicator: if e0 > 0, initial foci may cause infection peaks even if [Formula: see text]. Therefore, effective containment measures should achieve a negative epidemicity index. We use spatially explicit models to rank containment measures for projected evolutions of the ongoing pandemic in Italy. There, we show that, while the effective reproduction number was below one for a sizable timespan, epidemicity remained positive, allowing recurrent infection flare-ups well before the major epidemic rebounding observed in the fall.",SEARCH-20260720-PUBMED-FAMILY-CAUSAL-02,causal_policy,https://pubmed.ncbi.nlm.nih.gov/33980858/,quasi_experimental_policy_evaluation,Other quasi-experimental policy-evaluation designs,causal_policy,title and complete available abstract,pending_independent_semantic_review
PMID:34180960,cf63b5041d573ebb512354c9acfca784a1eff50390049f4c7d3c0cab76d2ca3d,include_diagnostic_or_correction_lead,guidance,I_DIAGNOSTIC_CORRECTION,Impact Evaluation of Coronavirus Disease 2019 Policy: A Guide to Common Design Issues.,2021,Noah A Haber; Emma Clarke-Deelder; Joshua A Salomon; Avi Feller; Elizabeth A Stuart,"Policy responses to coronavirus disease 2019 (COVID-19), particularly those related to nonpharmaceutical interventions, are unprecedented in scale and scope. However, evaluations of policy impacts require a complex combination of circumstance, study design, data, statistics, and analysis. Beyond the issues that are faced for any policy, evaluation of COVID-19 policies is complicated by additional challenges related to infectious disease dynamics and a multiplicity of interventions. The methods needed for policy-level impact evaluation are not often used or taught in epidemiology, and they differ in important ways that may not be obvious. Methodological complications of policy evaluations can make it difficult for decision-makers and researchers to synthesize and evaluate the strength of the evidence in COVID-19 health policy papers. Here we 1) introduce the basic suite of policy-impact evaluation designs for observational data, including cross-sectional analyses, pre-/post- analyses, interrupted time-series analysis, and difference-in-differences analysis; 2) demonstrate key ways in which the requirements and assumptions underlying these designs are often violated in the context of COVID-19; and 3) provide decision-makers and reviewers with a conceptual and graphical guide to identifying these key violations. Our overall goal is to help epidemiologists, policy-makers, journal editors, journalists, researchers, and other research consumers understand and weigh the strengths and limitations of evidence.",SEARCH-20260720-PUBMED-VENUE-CAUSAL-01,causal_policy,https://pubmed.ncbi.nlm.nih.gov/34180960/,interrupted_time_series,Interrupted time series and segmented regression,causal_policy,title and complete available abstract,pending_independent_semantic_review
PMID:35384900,c4abda9b447b665a7181d89d24e7283ceddffeae9e804495fb8de7d0126efe38,include_method_source_lead,method_source,I_METHOD_SOURCE,Use of Recently Vaccinated Individuals to Detect Bias in Test-Negative Case-Control Studies of COVID-19 Vaccine Effectiveness.,2022,Matt D T Hitchings; Joseph A Lewnard; Natalie E Dean; Albert I Ko; Otavio T Ranzani; Jason R Andrews; Derek A T Cummings,"Postauthorization observational studies play a key role in understanding COVID-19 vaccine effectiveness following the demonstration of efficacy in clinical trials. Although bias due to confounding, selection bias, and misclassification can be mitigated through careful study design, unmeasured confounding is likely to remain in these observational studies. Phase III trials of COVID-19 vaccines have shown that protection from vaccination does not occur immediately, meaning that COVID-19 risk should be similar in recently vaccinated and unvaccinated individuals, in the absence of confounding or other bias. Several studies have used the estimated effectiveness among recently vaccinated individuals as a negative control exposure to detect bias in vaccine effectiveness estimates. In this paper, we introduce a theoretical framework to describe the interpretation of such a bias indicator in test-negative studies, and outline strong assumptions that would allow vaccine effectiveness among recently vaccinated individuals to serve as a negative control exposure.",SEARCH-20260720-PUBMED-VENUE-CAUSAL-01,causal_policy,https://pubmed.ncbi.nlm.nih.gov/35384900/,negative_controls,Negative-control designs,causal_policy,title and complete available abstract,pending_independent_semantic_review
PMID:35867698,b04b221e688755cab4736f9832c55cd9de367d8d3c48f6f1bd10f20ae97dedd0,include_applied_seed,applied_seed,I_APPLIED_TRANSFERABLE_DESIGN,"Sustained Within-season Vaccine Effectiveness Against Influenza-associated Hospitalization in Children: Evidence From the New Vaccine Surveillance Network, 2015-2016 Through 2019-2020.",2023,Leila C Sahni; Eric A Naioti; Samantha M Olson; Angela P Campbell; Marian G Michaels; John V Williams; Mary Allen Staat; Elizabeth P Schlaudecker; Monica M McNeal; Natasha B Halasa; Laura S Stewart; James D Chappell; Janet A Englund; Eileen J Klein; Peter G Szilagyi; Geoffrey A Weinberg; Christopher J Harrison; Rangaraj Selvarangan; Jennifer E Schuster; Parvin H Azimi; Monica N Singer; Vasanthi Avadhanula; Pedro A Piedra; Flor M Munoz; Manish M Patel; Julie A Boom,"Adult studies have demonstrated within-season declines in influenza vaccine effectiveness (VE); data in children are limited. We conducted a prospective, test-negative study of children 6 months through 17 years hospitalized with acute respiratory illness at 7 pediatric medical centers during the 2015-2016 through 2019-2020 influenza seasons. Case-patients were children with an influenza-positive molecular test matched by illness onset to influenza-negative control-patients. We estimated VE [100% × (1 - odds ratio)] by comparing the odds of receipt of ≥1 dose of influenza vaccine ≥14 days before illness onset among influenza-positive children to influenza-negative children. Changes in VE over time between vaccination date and illness onset date were estimated using multivariable logistic regression. Of 8430 children, 4653 (55%) received ≥1 dose of influenza vaccine. On average, 48% were vaccinated through October and 85% through December each season. Influenza vaccine receipt was lower in case-patients than control-patients (39% vs 57%, P < .001); overall VE against hospitalization was 53% (95% confidence interval [CI]: 46, 60%). Pooling data across 5 seasons, the odds of influenza-associated hospitalization increased 4.2% (-3.2%, 12.2%) per month since vaccination, with an average VE decrease of 1.9% per month (n = 4000, P = .275). Odds of hospitalization increased 2.9% (95% CI: -5.4%, 11.8%) and 9.6% (95% CI: -7.0%, 29.1%) per month in children ≤8 years (n = 3084) and 9-17 years (n = 916), respectively. These findings were not statistically significant. We observed minimal, not statistically significant within-season declines in VE. Vaccination following current Advisory Committee on Immunization Practices (ACIP) guidelines for timing of vaccine receipt remains the best strategy for preventing influenza-associated hospitalizations in children.",SEARCH-20260720-PUBMED-VENUE-CAUSAL-01,causal_policy,https://pubmed.ncbi.nlm.nih.gov/35867698/,negative_controls,Negative-control designs,causal_policy,title and complete available abstract,pending_independent_semantic_review
PMID:36127816,cd4511c95c95ed4471afbfc12ce0cb301fb6666896dccf8d13d3eb98715aa9d2,include_applied_seed,applied_seed,I_APPLIED_TRANSFERABLE_DESIGN,Effects of the different periods and magnitude of COVID-19 infection spread on cancer operations: Interrupted time series analysis of medical claims data.,2023,Natsue Kashiwagura; Fuyuhiko Motoi; Upul Cooray; Ryu Fukase; Yukiko Katayama; Ken Osaka; Masayasu Murakami; Takaaki Ikeda,"No clear evidence exists regarding the effects of the different periods and magnitude of spread of the COVID-19 infection on cancer treatments. This study investigated the effects of the different periods and magnitude of COVID-19 infection spread on in-hospital cancer operations. Medical claims data from 17 hospitals where in-hospital operations for patients with malignant neoplasms were performed between 1 April 2017 and 31 March 2021 in Yamagata were extracted and analyzed. The critical time points as exposure used to evaluate the impact of different COVID-19 infection spread periods on cancer operations were (1) April 2020 (emergency declaration introduced by the government) and (2) December 2020 (the second wave). From April to November 2020 and December 2020 to March 21, the number of confirmed COVID-19 cases was 130 and 840, respectively. The 17 hospitals were classified into intervention or control groups based on whether in-hospital treatments for patients with COVID-19 were provided. The interrupted time series analysis reported that the difference in the trend of pre-COVID-19 and postsecond wave (March 2020 to December 2020) periods was statistically significant between groups, with 50.67 fewer operations (95% confidence interval [CI] = 12.19-89.15) performed per month in the intervention group compared with the control group. Moreover, the immediate change in the number of operations in April 2020 (beginning of the first wave) was statistically significant between groups, with 80.14 operations (95% CI = 39.62-120.67) less immediately after the first wave in the intervention group compared with the control group. Our findings suggest that a statement of emergency by the government and the COVID-19 infection spread are both associated with the number of cancer operations performed in the Yamagata prefecture during the COVID-19 pandemic.",SEARCH-20260720-PUBMED-FAMILY-CAUSAL-01,causal_policy,https://pubmed.ncbi.nlm.nih.gov/36127816/,interrupted_time_series,Interrupted time series and segmented regression,causal_policy,title and complete available abstract,pending_independent_semantic_review
PMID:36177866,7a70eaac4efb1ef48d931566dbb562451b975698b6f56f5f93019a7ab9b4bcc5,include_applied_seed,applied_seed,I_APPLIED_TRANSFERABLE_DESIGN,"Can high COVID-19 vaccination rates in adults help protect unvaccinated children? Evidence from a unique mass vaccination campaign, Schwaz/Austria, March 2021.",2022,Hannes Winner; Janine Kimpel; Florian Krammer; Dorothee von Laer; Jörg Paetzold,"BackgroundAfter an outbreak of the SARS-CoV-2 Beta variant in the district of Schwaz/Austria, vaccination with Comirnaty vaccine (BNT162b2 mRNA, BioNTech-Pfizer) had been offered to all adult inhabitants (≥ 16 years) in March 2021. This made Schwaz one of the most vaccinated regions in Europe at that time (70% of the adult population took up the offer). In contrast, all other Austrian districts remained with low vaccine coverage.AimWe studied whether this rapid mass vaccination campaign provided indirect protection to unvaccinated individuals such as children (< 16 years) living in the same district.MethodsTo study the effect of the campaign we used two complementary approaches. We compared infection rates among the population of children (< 16 years) in Schwaz with (i) the child population from similar districts (using the synthetic control method), and (ii) with the child population from municipalities along the border of Schwaz not included in the campaign (using an event study approach).ResultsBefore the campaign, we observed very similar infection spread across the cohort of children in Schwaz and the control regions. After the campaign, we found a significant reduction of new cases among children of -64.5% (95%-CI: -82.0 to -30.2%) relative to adjacent border municipalities (using the event study model). Employing the synthetic control method, we observed a significant reduction of -42.8% in the same cohort.ConclusionOur results constitute novel evidence of an indirect protection effect from a group of vaccinated individuals to an unvaccinated group.",SEARCH-20260720-PUBMED-VENUE-CAUSAL-01,causal_policy,https://pubmed.ncbi.nlm.nih.gov/36177866/,difference_in_differences_event_study,Legacy difference-in-differences and event-study designs,causal_policy,title and complete available abstract,pending_independent_semantic_review
PMID:36322837,7fcdf4a4ef2ce2c06fdb9fc5219f56ae4b81455daf7703ae61ae6f2e375d9d18,include_applied_seed,applied_seed,I_APPLIED_TRANSFERABLE_DESIGN,Covid-19 Vaccine Protection among Children and Adolescents in Qatar.,2022,Hiam Chemaitelly; Sawsan AlMukdad; Houssein H Ayoub; Heba N Altarawneh; Peter Coyle; Patrick Tang; Hadi M Yassine; Hebah A Al-Khatib; Maria K Smatti; Mohammad R Hasan; Zaina Al-Kanaani; Einas Al-Kuwari; Andrew Jeremijenko; Anvar H Kaleeckal; Ali N Latif; Riyazuddin M Shaik; Hanan F Abdul-Rahim; Gheyath K Nasrallah; Mohamed G Al-Kuwari; Hamad E Al-Romaihi; Adeel A Butt; Mohamed H Al-Thani; Abdullatif Al-Khal; Roberto Bertollini; Laith J Abu-Raddad,"The BNT162b2 vaccine against coronavirus disease 2019 (Covid-19) has been authorized for use in children 5 to 11 years of age and adolescents 12 to 17 years of age but in different antigen doses. We assessed the real-world effectiveness of the BNT162b2 vaccine against infection with severe acute respiratory syndrome coronavirus 2 (SARS-CoV-2) among children and adolescents in Qatar. To compare the incidence of SARS-CoV-2 infection in the national cohort of vaccinated participants with the incidence in the national cohort of unvaccinated participants, we conducted three matched, retrospective, target-trial, cohort studies - one assessing data obtained from children 5 to 11 years of age after the B.1.1.529 (omicron) variant became prevalent and two assessing data from adolescents 12 to 17 years of age before the emergence of the omicron variant (pre-omicron study) and after the omicron variant became prevalent. Associations were estimated with the use of Cox proportional-hazards regression models. Among children, the overall effectiveness of the 10-μg primary vaccine series against infection with the omicron variant was 25.7% (95% confidence interval [CI], 10.0 to 38.6). Effectiveness was highest (49.6%; 95% CI, 28.5 to 64.5) right after receipt of the second dose but waned rapidly thereafter and was negligible after 3 months. Effectiveness was 46.3% (95% CI, 21.5 to 63.3) among children 5 to 7 years of age and 16.6% (95% CI, -4.2 to 33.2) among those 8 to 11 years of age. Among adolescents, the overall effectiveness of the 30-μg primary vaccine series against infection with the omicron variant was 30.6% (95% CI, 26.9 to 34.1), but many adolescents had been vaccinated months earlier. Effectiveness waned over time since receipt of the second dose. Effectiveness was 35.6% (95% CI, 31.2 to 39.6) among adolescents 12 to 14 years of age and 20.9% (95% CI, 13.8 to 27.4) among those 15 to 17 years of age. In the pre-omicron study, the overall effectiveness of the 30-μg primary vaccine series against SARS-CoV-2 infection among adolescents was 87.6% (95% CI, 84.0 to 90.4) and waned relatively slowly after receipt of the second dose. Vaccination in children was associated with modest, rapidly waning protection against omicron infection. Vaccination in adolescents was associated with stronger, more durable protection, perhaps because of the larger antigen dose. (Funded by Weill Cornell Medicine-Qatar and others.).",SEARCH-20260720-PUBMED-VENUE-CAUSAL-01,causal_policy,https://pubmed.ncbi.nlm.nih.gov/36322837/,quasi_experimental_policy_evaluation,Other quasi-experimental policy-evaluation designs,causal_policy,title and complete available abstract,pending_independent_semantic_review
