candidate_key,source_row_sha256,final_decision,final_proposed_record_type,final_reason_code,title,year,authors,abstract,search_ids,preliminary_families,source_url,provisional_concept_label,provisional_canonical_name,provisional_family,routing_evidence,routing_status
PMID:36641124,bc56089e06fc91e04e6d83899dbc1e32eda464feaf2ddacd8ea59c206e34c289,include_method_source_lead,method_source,I_METHOD_SOURCE,Development and validation of a convolutional neural network model for diagnosing Helicobacter pylori infections with endoscopic images: a multicenter study.,2023,Ji Yeon Seo; Hotak Hong; Wi-Sun Ryu; Dongmin Kim; Jaeyoung Chun; Min-Sun Kwak,"Insufficient validation limits the generalizability of deep learning in diagnosing Helicobacter pylori infection with endoscopic images. The aim of this study was to develop a deep learning model for the diagnosis of H pylori infection using endoscopic images and validate the model with internal and external datasets. A convolutional neural network (CNN) model was developed based on a training dataset comprising 13,403 endoscopic images from 952 patients who underwent endoscopy at Seoul National University Hospital Gangnam Center. Internal validation was performed using a separate dataset comprised of images of 411 individuals of Korean descent and 131 of non-Korean descent. External validation was performed with the images of 160 patients in Gangnam Severance Hospital. Gradient-weighted class activation mapping was performed to visually explain the model. In predicting H pylori ever-infected status, the sensitivity, specificity, and accuracy of internal validation for people of Korean descent were .96 (95% confidence interval [CI], .93-.98), .90 (95% CI, .85-.95), and .94 (95% CI, .91-.96), respectively. In the internal validation for people of non-Korean descent, the sensitivity, specificity, and accuracy in predicting H pylori ever-infected status were .92 (95% CI, .86-.98), .79 (95% CI, .67-.91), and .88 (95% CI, .82-.93), respectively. In the external validation cohort, sensitivity, specificity, and accuracy were .86 (95% CI, .80-.93), .88 (95% CI, .79-.96), and .87 (95% CI, .82-.92), respectively, when performing 2-group categorization. Gradient-weighted class activation mapping showed that the CNN model captured the characteristic findings of each group. This CNN model for diagnosing H pylori infection showed good overall performance in internal and external validation datasets, particularly in categorizing patients into the never- versus ever-infected groups.",SEARCH-20260720-PUBMED-FAMILY-SPATIAL-01,spatial_transmission,https://pubmed.ncbi.nlm.nih.gov/36641124/,contact_network_models,Contact-network transmission models,spatial_transmission,title and complete available abstract,pending_independent_semantic_review
PMID:36756067,a13ec02624d8e0c830ba9f59efab939b92d93bbf3ca8c0003efe176f0b5e835a,include_applied_seed,applied_seed,I_APPLIED_TRANSFERABLE_DESIGN,Animal movement and associated infectious disease risk in a metapopulation.,2023,Daniella J Dekelaita; Clinton W Epps; David W German; Jenny G Powers; Ben J Gonzales; Regina K Abella-Vu; Neal W Darby; Debra L Hughson; Kelley M Stewart,"Animal movements among habitat patches or populations are important for maintaining long-term genetic and demographic viability, but connectivity may also facilitate disease spread and persistence. Understanding factors that influence animal movements is critical to understanding potential transmission risk and persistence of communicable disease in spatially structured systems. We evaluated effects of sex, age and Mycoplasma ovipneumoniae infection status at capture on intermountain movements and seasonal movement rates observed in desert bighorn sheep (Ovis canadensis nelsoni) using global positioning system collar data from 135 individuals (27 males, 108 females) in 14 populations between 2013 and 2018, following a pneumonia outbreak linked to the pathogen M. ovipneumoniae in the Mojave Desert, California, USA. Based on logistic regression analysis, intermountain movements were influenced by sex, age and most notably, infection status at capture: males, older animals and uninfected individuals were most likely to make such movements. Based on multiple linear regression analysis, females that tested positive for M. ovipneumoniae at capture also had lower mean daily movement rates that were further influenced by season. Our study provides empirical evidence of a pathogenic infection decreasing an individual's future mobility, presumably limiting that pathogen's ability to spread, and ultimately influencing transmission risk within a spatially structured system.",SEARCH-20260720-PUBMED-FAMILY-SPATIAL-01,spatial_transmission,https://pubmed.ncbi.nlm.nih.gov/36756067/,metapopulation_models,Metapopulation transmission models,spatial_transmission,title and complete available abstract,pending_independent_semantic_review
PMID:37069555,b0267d3197a9d7539bcd9d88564c703e1c8ea35e69f1a8717a7e94729449e408,include_diagnostic_or_correction_lead,diagnostic,I_DIAGNOSTIC_CORRECTION,Rapid identification of carbapenem-resistant Klebsiella pneumoniae based on matrix-assisted laser desorption ionization time-of-flight mass spectrometry and an artificial neural network model.,2023,Yu-Ming Zhang; Mei-Fen Tsao; Ching-Yu Chang; Kuan-Ting Lin; Joseph Jordan Keller; Hsiu-Chen Lin,"Carbapenem-resistant Klebsiella pneumoniae (CRKP) is a clinically critical pathogen that causes severe infection. Due to improper antibiotic administration, the prevalence of CRKP infection has been increasing considerably. In recent years, the utilization of matrix-assisted laser desorption ionization time-of-flight mass spectrometry (MALDI-TOF MS) has enabled the identification of bacterial isolates at the families and species level. Moreover, machine learning (ML) classifiers based on MALDI-TOF MS have been recently considered a novel method to detect clinical antimicrobial-resistant pathogens. A total of 2683 isolates (369 CRKP cases and 2314 carbapenem-susceptible Klebsiella pneumoniae [CSKP]) collected in the clinical laboratories of Taipei Medical University Hospital (TMUH) were included in this study, and 80% of data was split into the training data set that were submitted for the ML model. The remaining 20% of data was used as the independent data set for external validation. In this study, we established an artificial neural network (ANN) model to analyze all potential peaks on mass spectrum simultaneously. Our artificial neural network model for detecting CRKP isolates showed the best performance of area under the receiver operating characteristic curve (AUROC = 0.91) and of area under precision-recall curve (AUPRC = 0.90). Furthermore, we proposed the top 15 potential biomarkers in probable CRKP isolates at 2480, 4967, 12,362, 12,506, 12,855, 14,790, 15,730, 16,176, 16,218, 16,758, 16,919, 17,091, 18,142, 18,998, and 19,095 Da. Compared with the prior MALDI-TOF and machine learning studies of CRKP, the amount of data in our study was more sufficient and allowing us to conduct external validation. With better generalization abilities, our artificial neural network model can serve as a reliable screening tool for CRKP isolates in clinical practice. Integrating our model into the current workflow of clinical laboratories can assist the rapid identification of CRKP before the completion of traditional antimicrobial susceptibility testing. The combination of MADLI-TOF MS and machine learning techniques can support physicians in selecting suitable antibiotics, which has the potential to enhance the patients' outcomes and lower the prevalence of antimicrobial resistance.",SEARCH-20260720-PUBMED-FAMILY-SPATIAL-01,spatial_transmission,https://pubmed.ncbi.nlm.nih.gov/37069555/,contact_network_models,Contact-network transmission models,spatial_transmission,title and complete available abstract,pending_independent_semantic_review
PMID:37153208,c78d36b1856dfdcfe1f42cc0832647f669483207cfe0a4f10ae7f7cfb4f2290b,include_applied_seed,applied_seed,I_APPLIED_TRANSFERABLE_DESIGN,Impacts of Daily Travel by Distances on the Spread of COVID-19: An Artificial Neural Network Model.,2023,Dothang Truong; My D Truong,"The continued spread of COVID-19 poses significant threats to the safety of the community. Since it is still uncertain when the pandemic will end, it is vital to understand the factors contributing to new cases of COVID-19, especially from the transportation perspective. This paper examines the effect of the United States residents' daily trips by distances on the spread of COVID-19 in the community. The artificial neural network method is used to construct and test the predictive model using data collected from two sources: Bureau of Transportation Statistics and the COVID-19 Tracking Project. The dataset uses ten daily travel variables by distances and new tests from March to September 2020, with a sample size of 10,914. The results indicate the importance of daily trips at different distances in predicting the spread of COVID-19. More specifically, trips shorter than 3 mi and trips between 250 and 500 mi contribute most to predicting daily new cases of COVID-19. Additionally, daily new tests and trips between 10 and 25 mi are among the variables with the lowest effects. This study's findings can help governmental authorities evaluate the risk of COVID-19 infection based on residents' daily travel behaviors and form necessary strategies to mitigate the risks. The developed neural network can be used to predict the infection rate and construct various scenarios for risk assessment and control.",SEARCH-20260720-PUBMED-FAMILY-SPATIAL-01,spatial_transmission,https://pubmed.ncbi.nlm.nih.gov/37153208/,contact_network_models,Contact-network transmission models,spatial_transmission,title and complete available abstract,pending_independent_semantic_review
PMID:37231011,d7d40a4e287da913db04d043b9abff9e5e877cf0f59cc1cd8c370c75274d331d,include_simulation_or_mechanistic_lead,method_source,I_SIMULATION_MECHANISTIC,Genetic determination of regional connectivity in modelling the spread of COVID-19 outbreak for more efficient mitigation strategies.,2023,Leonidas Salichos; Jonathan Warrell; Hannah Cevasco; Alvin Chung; Mark Gerstein,"For the COVID-19 pandemic, viral transmission has been documented in many historical and geographical contexts. Nevertheless, few studies have explicitly modeled the spatiotemporal flow based on genetic sequences, to develop mitigation strategies. Additionally, thousands of SARS-CoV-2 genomes have been sequenced with associated records, potentially providing a rich source for such spatiotemporal analysis, an unprecedented amount during a single outbreak. Here, in a case study of seven states, we model the first wave of the outbreak by determining regional connectivity from phylogenetic sequence information (i.e. ""genetic connectivity""), in addition to traditional epidemiologic and demographic parameters. Our study shows nearly all of the initial outbreak can be traced to a few lineages, rather than disconnected outbreaks, indicative of a mostly continuous initial viral flow. While the geographic distance from hotspots is initially important in the modeling, genetic connectivity becomes increasingly significant later in the first wave. Moreover, our model predicts that isolated local strategies (e.g. relying on herd immunity) can negatively impact neighboring regions, suggesting more efficient mitigation is possible with unified, cross-border interventions. Finally, our results suggest that a few targeted interventions based on connectivity can have an effect similar to that of an overall lockdown. They also suggest that while successful lockdowns are very effective in mitigating an outbreak, less disciplined lockdowns quickly decrease in effectiveness. Our study provides a framework for combining phylodynamic and computational methods to identify targeted interventions.",SEARCH-20260720-PUBMED-FAMILY-SPATIAL-02,spatial_transmission,https://pubmed.ncbi.nlm.nih.gov/37231011/,descriptive_spatial_clustering,Descriptive spatial and space-time clustering,spatial_transmission,title and complete available abstract,pending_independent_semantic_review
PMID:37392149,99b452e83ab1e11a92eabc9b7163759ba6551b4014ce287a6a7c8bd59df15a63,include_simulation_or_mechanistic_lead,method_source,I_SIMULATION_MECHANISTIC,Estimating contact network properties by integrating multiple data sources associated with infectious diseases.,2023,Ravi Goyal; Nicole Carnegie; Sally Slipher; Philip Turk; Susan J Little; Victor De Gruttola,"To effectively mitigate the spread of communicable diseases, it is necessary to understand the interactions that enable disease transmission among individuals in a population; we refer to the set of these interactions as a contact network. The structure of the contact network can have profound effects on both the spread of infectious diseases and the effectiveness of control programs. Therefore, understanding the contact network permits more efficient use of resources. Measuring the structure of the network, however, is a challenging problem. We present a Bayesian approach to integrate multiple data sources associated with the transmission of infectious diseases to more precisely and accurately estimate important properties of the contact network. An important aspect of the approach is the use of the congruence class models for networks. We conduct simulation studies modeling pathogens resembling SARS-CoV-2 and HIV to assess the method; subsequently, we apply our approach to HIV data from the University of California San Diego Primary Infection Resource Consortium. Based on simulation studies, we demonstrate that the integration of epidemiological and viral genetic data with risk behavior survey data can lead to large decreases in mean squared error (MSE) in contact network estimates compared to estimates based strictly on risk behavior information. This decrease in MSE is present even in settings where the risk behavior surveys contain measurement error. Through these simulations, we also highlight certain settings where the approach does not improve MSE.",SEARCH-20260720-PUBMED-FAMILY-SPATIAL-02,spatial_transmission,https://pubmed.ncbi.nlm.nih.gov/37392149/,contact_network_models,Contact-network transmission models,spatial_transmission,title and complete available abstract,pending_independent_semantic_review
PMID:38300809,2a67a358d968f9ebfbcdc23c80f9047eab2fa08e9ee7978bd75482106ee84242,include_simulation_or_mechanistic_lead,applied_seed,I_SIMULATION_MECHANISTIC,Effect of unequal vaccination coverage and migration on long-term pathogen evolution in a metapopulation.,2024,Alicia Walter; Sylvain Gandon; Sébastien Lion,"Worldwide inequalities in vaccine availability are expected to affect the spread and spatial distribution of infectious diseases. It is unclear, however, how spatial variation in vaccination coverage can affect the long-term evolution of pathogens. Here we use an analytical model and numerical simulations to analyse the influence of different imperfect vaccines on the potential evolution of pathogen virulence in a two-population model where vaccination coverage varies between populations. We focus on four vaccines, with different modes of action on the life cycle of a pathogen infecting two host populations coupled by migration. We show that, for vaccines that reduce infection risk or transmissibility, spatial heterogeneity has little effect on pathogen prevalence and host mortality, and no effect on the evolution of pathogen virulence. In contrast, vaccines that reduce pathogen virulence can select for more virulent pathogens and may lead to the coexistence of different pathogen strains, depending on the degree of spatial heterogeneity in the metapopulation. This heterogeneity is driven by two parameters: pathogen migration and the difference in the vaccination rate between the two populations. We show that vaccines that only reduce pathogen virulence select mainly for a single pathogen strategy in the long term, while vaccines that reduce both transmission and virulence can favor the coexistence of two pathogen genotypes. We discuss the implications and potential extensions of our analysis.",SEARCH-20260720-PUBMED-FAMILY-SPATIAL-01,spatial_transmission,https://pubmed.ncbi.nlm.nih.gov/38300809/,metapopulation_models,Metapopulation transmission models,spatial_transmission,title and complete available abstract,pending_independent_semantic_review
PMID:38424479,619495a08f96851d93cbb0daaebe5a94cb8c02a220e2f02bc7a9045abc042ee8,include_applied_seed,applied_seed,I_APPLIED_TRANSFERABLE_DESIGN,"The origin, dissemination, and molecular networks of HIV-1 CRF65_cpx strain in Hainan Island, China.",2024,Dee Yu; Kaokao Zhu; Mu Li; Fei Zhang; Yuan Yang; Chunyun Lu; Shanmei Zhong; Cai Qin; Yanan Lan; Jipeng Yu; Jindong Ding Petersen; Junjun Jiang; Hao Liang; Li Ye; Bingyu Liang,"HIV-1 CRF65_cpx strain carries drug-resistant mutations, which raises concerns about its potential for causing virologic failure. The CRF65_cpx ranks as the fourth most prevalent on Hainan Island, China. However, the origin and molecular epidemiology of CRF65_cpx strains in this area remain unclear. This study aims to estimate the spatial origins and dissemination patterns of HIV-1 CRF65_cpx in this specific region. Between 2018 and 2021, a total of 58 pol sequences of the CRF65_cpx were collected from HIV-positive patients on Hainan Island. The available CRF65_cpx pol sequences from public databases were compiled. The HIV-TRACE tool was used to construct transmission networks. The evolutionary history of the introduction and dissemination of HIV-1 CRF65_cpx on Hainan Island were analyzed using phylogenetic analysis and the Bayesian coalescent-based approach. Among the 58 participants, 89.66% were men who have sex with men (MSM). The median age was 25 years, and 43.10% of the individuals had a college degree or above. The results indicated that 39 (67.24%) sequences were interconnected within a single transmission network. A consistent expansion was evident from 2019 to 2021, with an incremental annual addition of four sequences into the networks. Phylodynamic analyses showed that the CRF65_cpx on Hainan Island originated from Beijing (Bayes factor, BF = 17.4), with transmission among MSM on Hainan Island in 2013.2 (95%HPD: 2012.4, 2019.5), subsequently leading to an outbreak. Haikou was the local center of the CRF65_cpx epidemic. This strain propagated from Haikou to other locations, including Sanya (BF > 1000), Danzhou (BF = 299.3), Chengmai (BF = 27.0) and Tunchang (BF = 16.3). The analyses of the viral migration patterns between age subgroups and risk subgroups revealed that the viral migration directions were from ""25-40 years old"" to ""17-24 years old"" (BF = 14.6) and to ""over 40 years old"" (BF = 17.6), and from MSM to heterosexuals (BF > 1000) on Hainan Island. Our analyses elucidate the transmission dynamics of CRF65_cpx strain on Hainan Island. Haikou is identified as the potential hotspot for CRF65_cpx transmission, with middle-aged MSM identified as the key population. These findings suggest that targeted interventions in hotspots and key populations may be more effective in controlling the HIV epidemic.",SEARCH-20260720-PUBMED-FAMILY-SPATIAL-02,spatial_transmission,https://pubmed.ncbi.nlm.nih.gov/38424479/,descriptive_spatial_clustering,Descriptive spatial and space-time clustering,spatial_transmission,title and complete available abstract,pending_independent_semantic_review
PMID:38647091,1a7fc01fdc8203048ee64d73220c16af613009ceaf88940184078f0dc57253e9,include_applied_seed,applied_seed,I_APPLIED_TRANSFERABLE_DESIGN,Development of a network model to implement the HPV vaccination coverage.,2024,Giovanni Guarducci; Marinella Chiti; Dimitri Carlo Fattore; Raffaele Caldararo; Gabriele Messina; Paolo Filidei; Nicola Nante,"The vaccination coverage of a population is the usual indicator of the effectiveness of vaccination strategies. The study aims to evaluate the effectiveness of an organizational and communication network to implement Human Papilloma Virus (HPV) vaccination coverage both in males and females in the Center Tuscany Local Health Authority. Experimental study. In January 2022, a retrospective study was conducted on anti-HPV vaccine coverage (full cycle), of those born from 2007 to 2010, in the Empoli Territorial Area of Florence (240 thousand inhabitants) under the Center Tuscany Local Health Authority. In February 2022, a project (meetings with general practitioners and pediatricians, communication through local media, increased opening hours of vaccination clinics and continuous monitoring of vaccination status) started to recover the females and males non-compliant; in the first five months, in addition to guaranteeing the offer to the reference cohort, it aimed to recover the 2007, 2008 and 2009 cohorts, while in the following six months the anti-HPV vaccine offer was expanded for the 2010 cohort. In January 2022, for all cohorts the average total coverages were 49.2% (49.1% for females and 49.5% for males), while in December 2022 they were 63.9% (65.8% for females and 62.3% for males). Coverage increased by 15.6% (+14.2% for females and +16.8% for males) for the 2007 birth cohort, by 22.3% (+20.6% for females and +23.7% for males) for the 2008 cohort and by 20.9% (+31.4% for females and +10.6% for males) for the 2009 cohort. This model in force in the whole Center Tuscany Local Health Authority for a few years and already activated in the previous Local Health Authority of Empoli, now called Empoli Territorial Area, has allowed to implement the Human Papilloma Virus vaccine coverage for both genders.",SEARCH-20260720-PUBMED-FAMILY-SPATIAL-01,spatial_transmission,https://pubmed.ncbi.nlm.nih.gov/38647091/,contact_network_models,Contact-network transmission models,spatial_transmission,title and complete available abstract,pending_independent_semantic_review
PMID:38667832,23c2fa15cdedab321665af7ac8dfd091eae3891de00c2d6a3587abbc538d94ec,include_simulation_or_mechanistic_lead,method_source,I_SIMULATION_MECHANISTIC,MPSTAN: Metapopulation-Based Spatio-Temporal Attention Network for Epidemic Forecasting.,2024,Junkai Mao; Yuexing Han; Bing Wang,"Accurate epidemic forecasting plays a vital role for governments to develop effective prevention measures for suppressing epidemics. Most of the present spatio-temporal models cannot provide a general framework for stable and accurate forecasting of epidemics with diverse evolutionary trends. Incorporating epidemiological domain knowledge ranging from single-patch to multi-patch into neural networks is expected to improve forecasting accuracy. However, relying solely on single-patch knowledge neglects inter-patch interactions, while constructing multi-patch knowledge is challenging without population mobility data. To address the aforementioned problems, we propose a novel hybrid model called metapopulation-based spatio-temporal attention network (MPSTAN). This model aims to improve the accuracy of epidemic forecasting by incorporating multi-patch epidemiological knowledge into a spatio-temporal model and adaptively defining inter-patch interactions. Moreover, we incorporate inter-patch epidemiological knowledge into both model construction and the loss function to help the model learn epidemic transmission dynamics. Extensive experiments conducted on two representative datasets with different epidemiological evolution trends demonstrate that our proposed model outperforms the baselines and provides more accurate and stable short- and long-term forecasting. We confirm the effectiveness of domain knowledge in the learning model and investigate the impact of different ways of integrating domain knowledge on forecasting. We observe that using domain knowledge in both model construction and the loss function leads to more efficient forecasting, and selecting appropriate domain knowledge can improve accuracy further.",SEARCH-20260720-PUBMED-FAMILY-SPATIAL-01,spatial_transmission,https://pubmed.ncbi.nlm.nih.gov/38667832/,metapopulation_models,Metapopulation transmission models,spatial_transmission,title and complete available abstract,pending_independent_semantic_review
