candidate_key,source_row_sha256,final_decision,final_proposed_record_type,final_reason_code,title,year,authors,abstract,search_ids,preliminary_families,source_url,provisional_concept_label,provisional_canonical_name,provisional_family,routing_evidence,routing_status
PMID:27818787,dc1d4e54274b22859967125b12dd3e28f911dd558f0125466ef9e522d37032a9,include_simulation_or_mechanistic_lead,method_source,I_SIMULATION_MECHANISTIC,Reconstructing contact network parameters from viral phylogenies.,2016,Rosemary M McCloskey; Richard H Liang; Art F Y Poon,"Models of the spread of disease in a population often make the simplifying assumption that the population is homogeneously mixed, or is divided into homogeneously mixed compartments. However, human populations have complex structures formed by social contacts, which can have a significant influence on the rate of epidemic spread. Contact network models capture this structure by explicitly representing each contact which could possibly lead to a transmission. We developed a method based on approximate Bayesian computation (ABC), a likelihood-free inference strategy, for estimating structural parameters of the contact network underlying an observed viral phylogeny. The method combines adaptive sequential Monte Carlo for ABC, Gillespie simulation for propagating epidemics though networks, and a kernel-based tree similarity score. We used the method to fit the Barabási-Albert network model to simulated transmission trees, and also applied it to viral phylogenies estimated from ten published HIV sequence datasets. This model incorporates a feature called preferential attachment (PA), whereby individuals with more existing contacts accumulate new contacts at a higher rate. On simulated data, we found that the strength of PA and the number of infected nodes in the network can often be accurately estimated. On the other hand, the mean degree of the network, as well as the total number of nodes, was not estimable with ABC. We observed sub-linear PA power in all datasets, as well as higher PA power in networks of injection drug users. These results underscore the importance of considering contact structures when performing phylodynamic inference. Our method offers the potential to quantitatively investigate the contact network structure underlying viral epidemics.",SEARCH-20260720-PUBMED-FAMILY-SPATIAL-02,spatial_transmission,https://pubmed.ncbi.nlm.nih.gov/27818787/,contact_network_models,Contact-network transmission models,spatial_transmission,title and complete available abstract,pending_independent_semantic_review
PMID:28350852,5a8dcdda8fc580a1ab65fc50fa7b24dc8ec60c45fd9837576a43c60f3d7a5f92,include_method_source_lead,method_source,I_METHOD_SOURCE,Phylodynamics on local sexual contact networks.,2017,David A Rasmussen; Roger Kouyos; Huldrych F Günthard; Tanja Stadler,"Phylodynamic models are widely used in infectious disease epidemiology to infer the dynamics and structure of pathogen populations. However, these models generally assume that individual hosts contact one another at random, ignoring the fact that many pathogens spread through highly structured contact networks. We present a new framework for phylodynamics on local contact networks based on pairwise epidemiological models that track the status of pairs of nodes in the network rather than just individuals. Shifting our focus from individuals to pairs leads naturally to coalescent models that describe how lineages move through networks and the rate at which lineages coalesce. These pairwise coalescent models not only consider how network structure directly shapes pathogen phylogenies, but also how the relationship between phylogenies and contact networks changes depending on epidemic dynamics and the fraction of infected hosts sampled. By considering pathogen phylogenies in a probabilistic framework, these coalescent models can also be used to estimate the statistical properties of contact networks directly from phylogenies using likelihood-based inference. We use this framework to explore how much information phylogenies retain about the underlying structure of contact networks and to infer the structure of a sexual contact network underlying a large HIV-1 sub-epidemic in Switzerland.",SEARCH-20260720-PUBMED-FAMILY-SPATIAL-02,spatial_transmission,https://pubmed.ncbi.nlm.nih.gov/28350852/,contact_network_models,Contact-network transmission models,spatial_transmission,title and complete available abstract,pending_independent_semantic_review
PMID:28361266,a4f657f0e753f7a80df90cc1fe29633abe1ed07b51ccdd2b98c1976ea3b580d3,include_applied_seed,applied_seed,I_APPLIED_TRANSFERABLE_DESIGN,Genomic Epidemiology and Management of Salmonella in Island Ecosystems Used for Takahe Conservation.,2017,Zoë L Grange; Patrick J Biggs; Shanna P Rose; Brett D Gartrell; Nicola J Nelson; Nigel P French,"Translocation and isolation of threatened wildlife in new environments may have unforeseen consequences on pathogen transmission and evolution in host populations. Disease threats associated with intensive conservation management of wildlife remain speculative without gaining an understanding of pathogen dynamics in meta-populations and how location attributes may determine pathogen prevalence. We determined the prevalence and population structure of an opportunistic pathogen, Salmonella, in geographically isolated translocated sub-populations of an endangered New Zealand flightless bird, the takahe (Porphyrio hochstetteri). Out of the nine sub-populations tested, Salmonella was only isolated from takahe living on one private island. The apparent prevalence of Salmonella in takahe on the private island was 32% (95% CI 13-57%), with two serotypes, Salmonella Mississippi and Salmonella houtenae 40:gt-, identified. Epidemiological investigation of reservoirs on the private island and another island occupied by takahe identified environmental and reptile sources of S. Mississippi and S. houtenae 40:gt- on the private island. Single nucleotide polymorphism analysis of core genomes revealed low-level diversity among isolates belonging to the same serotype and little differentiation according to host and environmental source. The pattern observed may be representative of transmission between sympatric hosts and environmental sources, the presence of a common unsampled source, and/or evidence of a recent introduction into the ecosystem. This study highlights how genomic epidemiology can be used to ascertain and understand disease dynamics to inform the management of disease threats in endangered wildlife populations.",SEARCH-20260720-PUBMED-FAMILY-SPATIAL-01,spatial_transmission,https://pubmed.ncbi.nlm.nih.gov/28361266/,metapopulation_models,Metapopulation transmission models,spatial_transmission,title and complete available abstract,pending_independent_semantic_review
PMID:28659596,147e47f33a2652cfd511203a8d9257d158b7f502821a1049d978672f48cb08e9,include_applied_seed,applied_seed,I_APPLIED_TRANSFERABLE_DESIGN,Novel approaches for Spatial and Molecular Surveillance of Porcine Reproductive and Respiratory Syndrome Virus (PRRSv) in the United States.,2017,Moh A Alkhamis; Andreia G Arruda; Robert B Morrison; Andres M Perez,"The US swine industry has been impaired over the last 25 years by the far-reaching financial losses caused by the porcine reproductive and respiratory syndrome (PRRS). Here, we explored the relations between the spatial risk of PRRS outbreaks and its phylodynamic history in the U.S during 1998-2016 using ORF5 sequences collected from swine farms in the Midwest region. We used maximum entropy and Bayesian phylodynamic models to generate risk maps for PRRS outbreaks and reconstructed the evolutionary history of three selected phylogenetic clades (A, B and C). High-risk areas for PRRS were best-predicted by pig density and climate seasonality and included Minnesota, Iowa and South Dakota. Phylodynamic models demonstrated that the geographical spread of the three clades followed a heterogeneous spatial diffusion process. Furthermore, PRRS viruses were characterized by typical seasonality in their population size. However, endemic strains were characterized by a substantially slower population growth and evolutionary rates, as well as smaller spatial dispersal rates when compared to emerging strains. We demonstrated the prospects of combining inferences derived from two unique analytical methods to inform decisions related to risk-based interventions of an important pathogen affecting one of the largest food animal industries in the world.",SEARCH-20260720-PUBMED-FAMILY-SPATIAL-02,spatial_transmission,https://pubmed.ncbi.nlm.nih.gov/28659596/,ecological_niche_species_distribution,Ecological-niche and species-distribution models,spatial_transmission,title and complete available abstract,pending_independent_semantic_review
PMID:29080613,192a3f06fb9c7bd06dff85c6f51e92bb3fe88a1df03c812c8dd9d319fc0f44c7,include_applied_seed,applied_seed,I_APPLIED_TRANSFERABLE_DESIGN,"Phylogeography, genetic variability and structure of Acanthamoeba metapopulations in Iran inferred by 18S ribosomal RNA sequences: A systematic review and meta-analysis.",2017,Adel Spotin; Hamid Reza Moslemzadeh; Mahmoud Mahami-Oskouei; Ehsan Ahmadpour; Maryam Niyyati; Seyed Hossein Hejazi; Fatemeh Memari; Jafar Noori,"To verify phylogeography and genetic structure of Acanthamoeba populations among the Iranian clinical isolates and natural/artificial environments distributed in various regions of the country. We searched electronic databases including Medline, PubMed, Science Direct, Scopus and Google Scholar from 2005 to 2016. To explore the genetic variability of Acanthamoeba sp, 205 sequences were retrieved from keratitis patients, immunosuppressed cases and environmental sources as of various geographies of Iran. T4 genotype was the predominant strain in Iran, and the rare genotypes belonged to T2, T3, T5 (Acanthamoeba lenticulata), T6, T9, T11, T13 and T15 (Acanthamoeba jacobsi). A total of 47 unique haplotypes of T4 were identified. A parsimonious network of the sequence haplotypes demonstrated star-like feature containing haplogroups IR6 (34.1%) and IR7 (31.2%) as the most common haplotypes. In accordance with the analysis of molecular variance, the high value of haplotype diversity (0.612-0.848) of Acanthamoeba T4 represented genetic variability within populations. Neutrality indices of the 18S ribosomal RNA demonstrated negative values in all populations which represented a considerable divergence from neutrality. The majority of genetic diversity belonged to the infected contact lens and dust samples in immunodeficiency and ophthalmology wards, which indicated potential routes for exposure to a pathogenic Acanthamoeba sp. in at-risk individuals. A pairwise fixation index (FST) was from low to high values (0.02433-0.41892). The statistically FST points out that T4 is genetically differentiated between north-west, north-south and central-south metapopulations, but not differentiated between west-central, west-south, central-south, and north-central isolates. An occurrence of IR6 and IR7 displays that possibly a gene flow of Acanthamoeba T4 occurred after the founder effect or bottleneck experience through ecological changes or host mobility. This is the first systematic review and meta-analysis providing new approaches into gene migration and transmission patterns of Acanthamoeba sp, and targeting at the high-risk individuals/sources among the various regions of Iran.",SEARCH-20260720-PUBMED-FAMILY-SPATIAL-01,spatial_transmission,https://pubmed.ncbi.nlm.nih.gov/29080613/,metapopulation_models,Metapopulation transmission models,spatial_transmission,title and complete available abstract,pending_independent_semantic_review
PMID:29497439,3ff773108aaf10ce4f203074095099b962582276ae458d5775fcfa0ea07b486a,include_applied_seed,applied_seed,I_APPLIED_TRANSFERABLE_DESIGN,Human-Mediated Gene Flow Contributes to Metapopulation Genetic Structure of the Pathogenic Fungus Alternaria alternata from Potato.,2018,Jing-Wen Meng; Dun-Chun He; Wen Zhu; Li-Na Yang; E-Jiao Wu; Jia-Hui Xie; Li-Ping Shang; Jiasui Zhan,"Metapopulation structure generated by recurrent extinctions and recolonizations plays an important role in the evolution of species but is rarely considered in agricultural systems. In this study, generation and mechanism of metapopulation structure were investigated by microsatellite assaying 725 isolates of Alternaria alternata sampled from potato hosts at 16 locations across China. We found a single major cluster, no isolate-geography associations and no bottlenecks in the A. alternata isolates, suggesting a metapopulation genetic structure of the pathogen. We also found weak isolation-by-distance, lower among than within cropping region population differentiation, concordant moving directions of potato products and net gene flow and the highest gene diversity in the region with the most potato imports. These results indicate that in addition to natural dispersal, human-mediated gene flow also contributes to the generation and dynamics of the metapopulation genetic structure of A. alternata in China. Metapopulation structure increases the adaptive capacity of the plant pathogen as a result of enhanced genetic variation and reduced population fragmentation. Consequently, rigid quarantine regulations may be required to reduce population connectivity and the evolutionary potential of A. alternata and other pathogens with a similar population dynamics for a sustainable plant disease management.",SEARCH-20260720-PUBMED-FAMILY-SPATIAL-01,spatial_transmission,https://pubmed.ncbi.nlm.nih.gov/29497439/,metapopulation_models,Metapopulation transmission models,spatial_transmission,title and complete available abstract,pending_independent_semantic_review
PMID:30053314,39e60c65ffe0f3ed9e2357c398124947f06f2da22b3b5e2e94d8e8f7b9293d73,include_simulation_or_mechanistic_lead,applied_seed,I_SIMULATION_MECHANISTIC,Children Are Exposed to Fecal Contamination via Multiple Interconnected Pathways: A Network Model for Exposure Assessment.,2018,Yuke Wang; Christine L Moe; Peter F M Teunis,"In recent decades, quantitative microbial risk assessment (QMRA) has been widely used to assess exposure to fecal microbes and associated health risks. In this study, a multipathway exposure assessment model was developed to evaluate exposure to fecal microbes for children under 5 in highly contaminated urban environments. Children had contact with various environmental compartments. The contamination levels of these compartments were estimated from fecal indicator counts in the environmental samples. Structured observations of child behavior (including activities, locations, and time) were used to model behavioral sequences as a dynamic network. The exposure model combines behavior sequences with environmental contamination, using additional exposure factors when needed, to estimate the number of fecal microbes transferred from environmental sources to human oral ingestion. As fecal exposure in a highly contaminated urban environment consists of contributions from multiple pathways, it is imperative to study their relative importance. The model helps us better understand the characteristics of the exposure pathways that may be driven by variation in contamination and by variable behavior, like hygiene and high-risk activities. Importantly, the model also allows prediction of the quantitative effects of an intervention-the expected reduction in exposure due to infrastructural or behavioral changes-by means of scenario studies. Based on experience with this exposure model, we make specific recommendations for additional studies of child behavior and exposure factors in order to fill critical information gaps and improve the model structure and assumptions.",SEARCH-20260720-PUBMED-FAMILY-SPATIAL-01,spatial_transmission,https://pubmed.ncbi.nlm.nih.gov/30053314/,contact_network_models,Contact-network transmission models,spatial_transmission,title and complete available abstract,pending_independent_semantic_review
PMID:30185544,d153f5b16d518bf3f3fcac01caa2ddcc0c3527d5c669cee7d85e8551a341108d,include_simulation_or_mechanistic_lead,method_source,I_SIMULATION_MECHANISTIC,Detection of HIV transmission clusters from phylogenetic trees using a multi-state birth-death model.,2018,Joëlle Barido-Sottani; Timothy G Vaughan; Tanja Stadler,"HIV patients form clusters in HIV transmission networks. Accurate identification of these transmission clusters is essential to effectively target public health interventions. One reason for clustering is that the underlying contact network contains many local communities. We present a new maximum-likelihood method for identifying transmission clusters caused by community structure, based on phylogenetic trees. The method employs a multi-state birth-death (MSBD) model which detects changes in transmission rate, which are interpreted as the introduction of the epidemic into a new susceptible community, i.e. the formation of a new cluster. We show that the MSBD method is able to reliably infer the clusters and the transmission parameters from a pathogen phylogeny based on our simulations. In contrast to existing cutpoint-based methods for cluster identification, our method does not require that clusters be monophyletic nor is it dependent on the selection of a difficult-to-interpret cutpoint parameter. We present an application of our method to data from the Swiss HIV Cohort Study. The method is available as an easy-to-use R package.",SEARCH-20260720-PUBMED-FAMILY-SPATIAL-02,spatial_transmission,https://pubmed.ncbi.nlm.nih.gov/30185544/,contact_network_models,Contact-network transmission models,spatial_transmission,title and complete available abstract,pending_independent_semantic_review
PMID:30286095,21a98581d88596ad25856f5d69fb00066abb5a7aaca1ff9bc26b1a3b3fac7a85,include_applied_seed,applied_seed,I_APPLIED_TRANSFERABLE_DESIGN,Inter- and intra-host sequence diversity reveal the emergence of viral variants during an overwintering epidemic caused by dengue virus serotype 2 in southern Taiwan.,2018,Hui-Ying Ko; Yao-Tsun Li; Day-Yu Chao; Yun-Cheng Chang; Zheng-Rong T Li; Melody Wang; Chuan-Liang Kao; Tzai-Hung Wen; Pei-Yun Shu; Gwong-Jen J Chang; Chwan-Chuen King,"Purifying selection during dengue viral infection has been suggested as the driving force of viral evolution and the higher complexity of the intra-host quasi-species is thought to offer an adaptive advantage for arboviruses as they cycle between arthropod and vertebrate hosts. However, very few studies have been performed to investigate the viral genetic changes within (intra-host) and between (inter-host) humans in a spatio-temporal scale. Viruses of different serotypes from various countries imported to Taiwan cause annual outbreaks. During 2001-2003, two consecutive outbreaks were caused by dengue virus serotype 2 (DENV-2) and resulted in a larger-scale epidemic with more severe dengue cases in the following year. Phylogenetic analyses showed that the viruses from both events were similar and related to the 2001 DENV-2 isolate from the Philippines. We comprehensively analyzed viral sequences from representative dengue patients and identified three consensus genetic variants, group Ia, Ib and II, with different spatio-temporal population dynamics. The phylodynamic analysis suggested group Ib variants, characterized by lower genetic diversity, transmission rate, and intra-host variant numbers, might play the role of maintenance variants. The residential locations among the patients infected by group Ib variants were in the outer rim of case clusters throughout the 2001-2003 period whereas group Ia and II variants were located in the centers of case clusters, suggesting that group Ib viruses might serve as ""sheltered overwintering"" variants in an undefined ecological niche. Further deep sequencing of the viral envelope (E) gene directly from individual patient serum samples confirmed the emergence of variants belonging to three quasi-species (group Ia, Ib, and II) and the ancestral role of the viral variants in the latter phase of the 2001 outbreak contributed to the later, larger-scale epidemic beginning in 2002. These findings enhanced our understanding of increasing epidemic severity over time in the same epidemic area. It also highlights the importance of combining phylodynamic and deep sequencing analysis as surveillance tools for detecting dynamic changes in viral variants, particularly searching for and monitoring any specific viral subpopulation. Such subpopulations might have selection advantages in both fitness and transmissibility leading to increased epidemic severity.",SEARCH-20260720-PUBMED-FAMILY-SPATIAL-02,spatial_transmission,https://pubmed.ncbi.nlm.nih.gov/30286095/,ecological_niche_species_distribution,Ecological-niche and species-distribution models,spatial_transmission,title and complete available abstract,pending_independent_semantic_review
PMID:30541438,4af3603862a53d483419577a37bb780ad6aed7978e44b30a31410093aef6b4ef,include_method_source_lead,method_source,I_METHOD_SOURCE,A nearest-neighbors network model for sequence data reveals new insight into genotype distribution of a pathogen.,2018,Helen N Catanese; Kelly A Brayton; Assefaw H Gebremedhin,"Sequence similarity networks are useful for classifying and characterizing biologically important proteins. Threshold-based approaches to similarity network construction using exact distance measures are prohibitively slow to compute and rely on the difficult task of selecting an appropriate threshold, while similarity networks based on approximate distance calculations compromise useful structural information. We present an alternative network representation for a set of sequence data that overcomes these drawbacks. In our model, called the Directed Weighted All Nearest Neighbors (DiWANN) network, each sequence is represented by a node and is connected via a directed edge to only the closest sequence, or sequences in the case of ties, in the dataset. Our contributions span several aspects. Specifically, we: (i) Apply an all nearest neighbors network model to protein sequence data from three different applications and examine the structural properties of the networks; (ii) Compare the model against threshold-based networks to validate their semantic equivalence, and demonstrate the relative advantages the model offers; (iii) Demonstrate the model's resilience to missing sequences; and (iv) Develop an efficient algorithm for constructing a DiWANN network from a set of sequences. We find that the DiWANN network representation attains similar semantic properties to threshold-based graphs, while avoiding weaknesses of both high and low threshold graphs. Additionally, we find that approximate distance networks, using BLAST bitscores in place of exact edit distances, can cause significant loss of structural information. We show that the proposed DiWANN network construction algorithm provides a fourfold speedup over a standard threshold based approach to network construction. We also identify a relationship between the centrality of a sequence in a similarity network of an Anaplasma marginale short sequence repeat dataset and how broadly that sequence is dispersed geographically. We demonstrate that using approximate distance measures to rapidly construct similarity networks may lead to significant deficiencies in the structure of that network in terms centrality and clustering analyses. We present a new network representation that maintains the structural semantics of threshold-based networks while increasing connectedness, and an algorithm for constructing the network using exact distance measures in a fraction of the time it would take to build a threshold-based equivalent.",SEARCH-20260720-PUBMED-FAMILY-SPATIAL-01,spatial_transmission,https://pubmed.ncbi.nlm.nih.gov/30541438/,contact_network_models,Contact-network transmission models,spatial_transmission,title and complete available abstract,pending_independent_semantic_review
